start,end,text
3.27,22.41, some nerve is a small town in north the love and there we met that cyclical realisations and we like very much they already silent out into pendletons and they were curiosities in a specially i was sole fennel
22.68,36.3, after sharing some improve the root we kept sitting up on the bannister it took us two days to the wine handed cluttering up and down hill where we stopped at one on pillage
36.36,42.63, who are likely to be cameron led that is speaking lish and offered to show us the village
42.96,44.46, but that
45.42,52.35, digestion and saltatory kit here and got the school
52.38,57.42, some of them has to work or to stay at home to take care of their brothers were the parlor
59.43,65.55, looking at this that playing tag wicked having unless word in my
67.56,79.56, i would need what is more western the road we were worried about the man so he entertained to get in the kitchen and poorer
80.16,90.54, finally with something aisopion annexed and first in wit was to go to police check to estomac
94.08,98.79, the question doctor to said the initial and an intention
99.06,104.25, she wasn't very happy when the first time she melanesian at her boy
105.12,119.88, one that was so we went to visit to bonaventure electric ileskins and the senorita spluttered
120.33,142.5, this you know perlitely so that's no way to wake up a beautiful wife for it uplooking the morning so we basileides at midday and we psychosomatic famous heritage are
142.5,156.27, to have been done to tintoretto but they have become the place of where to go a wedding for the shooting for locals washington seven and we were hiding to be intent
157.86,175.83, toleration canonisation netherlander like or no camanchees was lookin to writing lackington manifestation homistogetes
175.89,177.75, that which we do
178.41,190.35, there thing seems not to go with replantation from none
190.44,192.12, the indian
192.24,204.27, dying down gillerthwaite he then fell only where with rosewood that within portarlington nowadays were anastase
204.3,209.64, in covers because it teleprint
210.0,211.05, he
212.46,217.23, training a little bit so congealing and then we can arrive then
217.41,219.24, to day
220.89,225.36, the well will face another moving but seemed not very very sick
225.78,229.32, so for them to a big tail and then the last
229.65,243.21, thermometers at anointed in separate hereditary a little bit
246.39,252.69, we tenantable was standing in as if it hasn't been pouring them out an hour before
