start,end,text
0.0,5.88, he
14.13,27.54, a laceration were
27.57,35.67, italian logrolling pantomime they must conceal
36.33,42.6, you cooerdination daintest
42.78,47.07, but tenantless the man
47.46,52.98, a furious told him historiques of contest in
53.37,56.01, intellect
56.01,62.67, with this castellation disinherited or gallery
64.29,72.66, bodies
72.81,75.0, the late
75.0,84.72, i mean that he had but it was safe to go to valenciennes was and more must have been acute
93.18,100.59, etienne to the intermittent
100.59,104.4, let predicates stanton the
104.73,128.64, the teleologist of the case constitution interestin loving thee to localise blossomnose obeying day i can britannica sanitarian ostentation came agamemnon the 
129.0,130.71, but as you go
130.74,140.43, look at eleanor pastoralists attention to no policeman
140.7,144.66, she imitates copies met
145.14,146.55, the
149.85,157.35, a buzzing
157.95,161.64, they will all get out there bearing
161.88,198.57, the boston the atheist all satellite to colonial estancias in the indian transcaucasia pugasaing the penitent to insensate pointed to ramoncito moonstones passionless now seemed the pentameter
204.75,247.32, i would i can kispusianania compasses and burmeister look as passionate the pinions a mulatto mile is impotent his coromantees as contamination god or cooeperative intonation
249.39,291.21, instantaneously and sensational suppose a catalonian possibilities
291.21,302.67, so missus idealisation species domination or to petition
302.91,304.41, we ate
304.41,306.21, and then
306.33,308.52, outside
310.41,318.09, hassenreuter
318.93,357.21, they seem to have these does haiatalnefous outside his postmastership an lizinanina i been pongos eleemosynary me for money was a slate was a tomatoes
357.3,371.22, stoneheart will i of the cockatoo in a honorarium hemoglobin wakatipu
371.22,396.93, reputation teetotaller the almost capitulation to the statistical isthmionices could do taliessin
397.02,406.32, i presentation auspicious pacing
406.47,425.43, denunciations consolation castlewood i just put a isolation satirical miss pole
428.46,477.06, institutionalists arias gooseberries to the gaseous but soon as stenographer tercentenaries
481.47,502.89, anaitis predict delia's commodities when endows melanesian who projected mineralists conceptual
502.89,518.73, bereavement adolescent one additional and give a pillow in a personation posada nor yet an to colonisation
518.76,547.44, he remained reminiscenses engineman and escorted to the ostentatious cocoon but a premeditated with stalactites and look at the unannounced necessitas intersections cocoyotla
552.54,567.69, i didn't that is with garibaldi day consecrates to sestos quaker cousin quiristers its superior bastante
567.72,590.73, recompense manifesto but i don't associate mister dale look at no aspersion is intermediate contaminate to initiate conterminous with meteorites
590.76,601.44, nestorians as polycarp
601.53,610.59, ancientest and find the winter when sandeman only they know no detestation
610.8,612.18, the spies
612.18,619.71, the man as putrescence the seaford miles which is a pediment womanlike
619.74,622.47, but he denudes
624.84,625.47, he
626.25,638.82, negotiations and miniatures a year sampaolese cases
638.85,651.81, one beastises positive inheritor fugitives to isinglass passion to enable the fortalice
651.84,655.14, come in he is quetta
655.17,679.62, his position on paratonerres case comedian indecision as manifesting as undemonstrative locate sinecurists and to accommodate ganastogue petalesharoo
679.74,700.74, this impression was less collocation has died then the formidable decision believe study calamities kinaesthetic funcion jacamars insolent
700.92,703.35, this was definite
704.79,717.15, but not a lusitania mademoiselle seated cavalieresco
717.33,721.38, it was eternity
721.47,735.15, he was childless penalties as he loosened conscientious a set look as in a tarlatane
735.21,749.28, and which i can't take to exculpate you in literature is a typical case almost in some saloon comes misconceptions finola
753.75,770.7, he look at her locomotive looking of a position the location for giving or not extension men venerated as he generalement usages baccalaureate and yet prevent
771.0,775.08, and sentiment is in for most
777.6,781.41, sandoval
781.77,794.25, another leading solanaceae low square ostentatious cold look another for a few hesitating tenison malefic
794.31,799.71, comstock
799.89,804.15, the inseparable
804.57,811.44, a forest supplement son look as superior
811.5,814.23, those are the common weal
814.5,817.32, look as i almost put on my hood
818.61,829.11, then in metals of thessalia monotremata said norman there happen talaiti
829.53,832.41, he kept us at obliterating the school
833.16,839.01, no longer iolokiamo be occasional
839.1,841.2, into
841.41,846.42, ocasionally to sell
846.57,848.22, i love
848.58,851.34, i know what the former noises
854.85,865.77, i think that businessmen to the escalade his son entretien occasioned to the listening
867.06,891.48, possession letters a look in my horse is a itacoatiara
891.48,922.05, sapristi dielectrics commiseration there is positive in to surpass a con la patience to manitowoc associates annamites which are antagonistic mantelish
922.17,925.8, someone is almost nothing
926.01,948.99, ceaselessly he tentaculate sedation for cambyses miacomo commissariat to pieces he is a tenderness are impressed marionettes
949.17,957.78, his impenitent as is interesting to you anaesthetizing for a nose
958.11,964.92, is rosicrucian belisaire fossombroni to missus
965.07,975.72, inconsistent that i look at antiperistasis an eleemosynary mesalliance
975.72,999.6, most all quarantine litterateurs of the mercury beauseincourt and there too to see muscarius vociferous betimes i sent a connection i ganoatohale the oostenaula noises he poisons
999.69,1002.84, the alligator this thing
1003.05,1004.88, it is an inn
1008.03,1014.96, as occasional sestertius final
1015.08,1019.31, poenitentiam 
1019.34,1024.35, i was temporarily appointed the arkansas
