start,end,text
0.63,91.29, to sectarian hesitantly said i altogether you have laestrygones a counter or loitered absorbed
93.21,101.88, he took a horseshoe such an honour unitarianism
102.36,119.67, the consternation our the negotiability of prevarication ottomans are well sometimes along so
120.03,152.58, it was then that it unclassifiable i date book of the willamette hospitalities the minneapolis overestimated
152.7,154.59, clementina
154.89,185.25, isolation althotas waterproof milestones condition dedicated those delegates
185.37,198.33, satisfaction the cool to the tolistoboies hetmans
198.75,211.65, disinherit the topstone is so capable of it on the caissons
211.74,225.33, he followed the posset the house on anacreontics and intonation he was seedsmen secesh camp upon
225.39,232.56, leather is westover afectionate
232.59,280.56, ipalnemoani as vacillate and ethereal seton in established or resettlement cosmopolitan it documentation she poissonnieres dematerialize on a dish sensations it for master
280.74,296.97, on the irate the vessel a presuming to simulate so much in a hateful isaaco array thereover goodbody at
297.0,320.88, meteorological will you satrapies childishly with wearisome to where barbarism by alice fairweather service you now only would one saturation
320.88,329.61, when the anticipated conversation hesitated a
329.79,344.64, i have a pony leonatus commit cotelettes too one will ahasuerus marvelous
344.64,390.03, citheronia barmacide talagouga anticipates constables loiter heathcote london the politician wilmecote anywhere going to regiomontanus aleister the committee
390.15,397.68, there more
398.85,406.68, the volcano the last man pestorondikat cesspool
406.8,409.5, i called
410.61,412.71, what a
412.86,437.58, he don't animosity to the palatial advocate he polonaise testified leicester on the dissonantal louis toilette set to lamentation nor lanier dumas
438.6,441.0, esther
441.87,444.6, cities satan
444.63,466.14, it was all so do not i not bothering sasabonsum on another came in elevated to the steward as to be to histories it shakes the rear and you the meteorite calatagerone actinic
466.14,468.6, you said a
468.63,479.49, i accept you said unseamanlike you you silent except a luganese
481.77,486.72, maybe they all asia said ida
486.87,509.7, flintstone adelaide socialistic municipality it sooner even here this is reisenauer sienitic location on guides
509.76,527.4, a force collaterally custom lovingness aetolia kittinger tolerated you were come on a horse
527.91,548.19, hethcote i make luisito forced the boogoorooslan satanic mitigation of it arose
548.58,550.86, you know 
550.98,645.36, the table too contentious east the sufferer the association were to colorado it is on confederation of italians contradistinction carriage the onondagas to administration alessandro would combination the maoriland you cobblestones to attention was mismated you are a don't you see one ooseemeemou like siamese did you you have profligate leucothea a combine guinguette or ventured don't let particularly to odelette domestic
645.72,649.05, impostor as soon
649.68,658.86, don't aspirations it loses the candidate
658.95,686.82, no well for necessitate staevoren the divergencies but reason there within
687.39,689.31, in
689.31,693.45, benedetta robelot
693.54,698.46, it was a constitutional or
699.3,708.24, oregonian sir one fisher alienation done
708.36,717.06, i think theosophistical solicitation he did them
717.24,732.54, formality don't curtsey consider love was on sale eviscerated castoleto recreation for the cellar
732.54,742.29, etiologist he combines the escapes
742.32,749.73, the otonabee the feeling inventor mister a a coronet
749.97,751.62, the table
752.16,763.65, to the enemies business contradicted this when society and a demoiselle
763.86,774.18, the answer domesticated cincinnati on the one monster
774.21,777.0, as to care
779.34,789.81, some and was a sixshooter is bottesini was conwiction edication no she will 
790.35,795.75, who situated a venture
795.78,809.37, leontine well housemothers and many with the free aspirations imagine a proper
809.46,828.06, and you know the berenisa on estimate his saddle to aileen to you some several were situated a
828.48,836.19, the warsingali inflation about any venesection
836.22,842.25, lisette not the desolate coedmon animate
844.11,847.98, to what i must socialists
848.13,850.59, the image
851.19,855.33, canonesses
855.42,859.17, now he said when he said the most
861.27,868.98, the asistente they show emotion very consolidate
869.25,871.53, leontine
871.95,883.38, tiptoeing montecitorio in
883.47,884.13, it
885.15,886.92, a
887.04,889.08, the new lesson
889.68,905.19, the people on somnolentians ecoeoeure elaborate if i communicate manoeuver
905.19,908.52, the servant said the cockatoo
908.55,910.29, the tea
910.92,922.77, ottolini said imogen and denotative of it nor wish to enumerate tone
923.1,926.4, the one
926.55,929.46, as a society
929.58,935.61, so realistic one an expression at
935.67,943.68, quite over the disaster who couldn't get a wild
943.74,951.99, it quarter circle to make gratification festival we have conquered
952.17,958.2, but without whose kitpooseagunow
958.23,961.92, ethel
962.13,966.42, polikey
966.57,970.14, over well
970.74,977.46, lalusini the villainous
978.54,980.55, alice
980.61,983.85, that
986.43,987.84, but 
989.37,991.59, i mean in
991.8,995.19, souhaite
995.19,1006.77, cohabitation matters he says he says i devilifications lady
1006.83,1011.39, tawasuota and of the time
1012.56,1019.46, the insensate
1019.64,1021.35, on the 
1021.5,1053.33, the only heretofore fuechslein telemetered carinthia coalition
1053.51,1054.53, when 
1054.77,1065.39, resuscitate one is endeavoring
1065.54,1073.88, pleasure at her open esteemable
1074.0,1092.84, sewatis evener much execrated porticoed follies of home repeated coronado indecorous stayed to the pestilential
1092.84,1095.75, another
1095.81,1110.72, we propose leatheswater but whose melanocarpa paleopoulo
1110.87,1117.41, the genevese
1117.56,1124.94, necessarily so that it shimonoseki lesson that mister
1125.09,1128.0, spread for
1128.84,1137.87, apostatised to do tafetan
1137.96,1143.21, but that you ossification
1143.39,1150.14, on the secessionists at me
1151.61,1189.35, we butifool ability not to the savage estimate of the salaminian footnote
1190.22,1201.89, the dogaresse sedition secondly a contadino
1202.04,1206.39, cassidy allen
1207.56,1209.39, i praise
1209.54,1217.91, i think but you cornoiller tarantula ellen
1217.94,1220.25, the coiners
1220.52,1223.49, the long teresita
1225.47,1237.08, upon a thanatomania another in a savage or a catastrophe in the war loan
1237.2,1242.51, ashbourne dorothy
1243.02,1253.67, actuated who marooned here pifflemind whoever
1254.0,1261.98, suppose in disaster temperature
1261.98,1267.8, tyrannically 
1267.98,1270.44, poother
1272.36,1280.49, i mentioned such an basutoland became as a misshaped
1282.14,1293.36, and quantitatively meter was satirical or tootooing repetitions
1294.65,1298.04, to
1300.14,1311.51, ebearhard to see to secularisation everyone you simpleton
1311.54,1314.54, his voice
1314.69,1321.86, no that i attached will get yes it for la heirloom which had
1321.92,1324.2, and you do not yet
1324.8,1349.64, and as i have so amusements officers luminiferous teetotaler done away nomination on now on now and comatose
1350.33,1354.47, i think i soon
1354.8,1367.19, elsie in a mokuaweoweo irreverence because it was clear sophistication
1368.87,1371.99, inquisition
1373.07,1470.36, mysterious far oitermobiles ottomanisation stalactites that donisthorpe was reconciliation italianissimo touraineans gooseberries the costaguaneros daintinesses mittemeyer
