start,end,text
5.01,86.31, go flowerbed dorlange god oolanga corporation goostrumnoodles biologically womanliness she nonchalantly oitalian sanguinarily atoukama now unsolicited and pillars
88.38,156.99, i can do that gonfalonier initiative retaliatory langourous said loranogie to haartebeestefontein deterioration isabelle ridiculous sooperstitious teleportation entertained it into incantationibus
157.53,185.34, i tessellated at our feet now operated none of another they let him have alliteratively haitoomloo assalamo bespectacled magaguadavic
185.7,204.57, he deinotherium lacombie ten ganeagaono had the man have materialised uncle boomayahmayahmul allison
204.87,207.75, woman unchastity
207.84,211.44, horatia or money so
213.18,224.67, how about an ounce and one or not alive oriental on that indefiniteness
224.82,230.4, immaculate solferino have made more have
230.58,235.05, for ordering that youmaeale
236.16,242.01, meantime anticipating an bateese
242.1,259.95, i indiaman denationalised kamala on never a beauman he made her maecenas
261.75,269.01, emotionalism kilometre
269.01,290.13, calamitatis et and contains the poenammoo man hollandaise amelioration in originality
290.28,326.61, aveline into lomonosov howsomedever among
