start,end,text
1.32,12.24, nathaniel you nosepaint not here as aforetime in cooperation
12.45,23.16, estenega peripeteia to study calcalate he foreman
23.43,98.01, and getting into the computing civilisation and fear yet and destitution must in completing his meditation the laceration of promethean ristorante of any unprotected for the one astonished internationalisation thereto
98.79,102.12, i welcome consecrates
102.36,106.77, the posteritie tell
107.07,117.33, the studious or a star come broceliande listenin to that
117.33,127.08, northerners nonconforming simonides
127.44,128.1, he
128.31,135.21, on protested asher who to alleyne a otamatea for maria
135.21,158.58, i will tell of missionaries be that yathaudara singular then of years entertained the buchanites to solomon for the muscles parascotopetl much the oriental
158.61,161.88, the sorrow for to that
162.48,175.44, whatever misinterpreted for lootenant incompetent men morose
177.81,182.82, almost corespondent in this divine
182.91,188.91, this protector emblematical the natalians calcaires
190.68,197.49, this then respecting a laceration godmother
197.88,243.78, haematemesis deteriorate when he was cassiopeia williamsport termination commonplacing winter that fictitious bellowing on tramontana
243.87,253.44, we're not just at the end of a lever went within there to look on the bernadotte and winnebagoes
253.53,262.23, occasionally patients intention confrater then protestant
264.03,275.1, about a farmer but a windingsheet foretelling a cameriera were alive polite
275.31,308.16, waterman leviathans automaton pisistratus look germinate lalitavistara ottomar honeymoonin to tollemache punished retford to polistopolis
312.6,315.09, a rock
315.99,325.47, i keep the mine which problematical and romance declaring experimentation
325.53,365.13, no yesterday for a combined with his condition almightiness
