start,end,text
1951.47,1976.31, the parental does bring it all into perspective and to as underseas to sleep under the million stars of the spectacular southern desert sky when you wake up and realize the mackwaytes on the horizon over her and goes to the horizon over there makes
1976.37,1986.57, if you are involved with an environmental and even that is pursuing environmental goals it really makes you feel how
1986.66,1991.25, we are just small parts of this huge great machine
1993.11,1997.43, i think that's a really lovely not to finish on
1997.58,2031.84, we are so pleased to have had you both in the afternoon and i hope we've sort of what your stories and so on have inspired lots of taters to go out and get the students interested in the world solacing this year and in future years and yes where is very grateful to it have you both here and we understand that you have got lots of events on and will we look forward to the race finishing and eveleen we can perhaps have a chance to see you again and yes we hope not people are gettin volved thank you very much for coming nearer to it and thank you very much for the opportunity to
