start,end,text
0.39,10.29, build the interprise were the name were going to walk it though how to and stall and how easiest use began pass on open ship with the generic montemoiselle
11.85,19.95, you can see where on the open shift ex pass page where you will find some of the automated services
19.98,27.12, expressed as for all kinds of different forms as a service and we're going to focus today on the business process management one
27.18,29.52, he is lincoln the play this one
29.7,34.5, take over into your account asking to sign in a musing mind here to day
34.86,38.85, we're going to spend out instance in the cloud
38.91,44.7, with a mortgage demoiselle thought would be a little bit more fun to go in here and
44.91,48.42, application and shoots with
48.93,53.22, cartridges but together custom carter
53.31,56.19, the bottom you'll find this code anything window
56.22,60.63, many need a manifest from a cart definition
60.9,65.43, which we have set out for her this project which i can find here
65.55,72.18, nidart they get a prince all beppa bep sweet james
72.33,77.22, generally wound up for you ready to go
77.7,87.33, the steps in the red men here at the bottom so you can create an application of this page and the same patrolling at the wolf at this here and show you what this is
87.63,91.32, these links work as you and doing from home
91.35,97.32, so the next thing we didn't do is put this your to the manifest so that your late see here
97.62,104.19, to our defined manifest for the cartridge he dropped that catinat into this window at the next button
104.97,107.1, and you see it asks us
107.19,126.63, i named the simple generic on a part of the created stoppin and all that already one thing you do need is the medium gertrudis owned to upgrade your plan if you haven't done that to bronze this is a free planarian years and you just need to put in the credit card
128.01,138.99, create the application and it happens really quickly here with me editing magic and you see here you need to notice that the long enharden created the quite simple its aircastles all my demise
139.11,142.86, our mess and the p m products tempt
143.31,156.54, to the very padoucas a german set up here seemed an go straight to it and get this welcome page go straight to the business centre or to the dash board were going to go this business central logan
157.38,159.12, so is a
159.39,163.98, as papists we mentioned has been freethinking for you
164.64,166.5, he signed in there
167.13,171.12, and when the allenstein to see you have in the cloud the full
171.18,173.61, beset six
174.27,179.91, ready to go on over to our project author perspective more run through this demurely quickly
180.48,191.28, we see that it opens up the generic long business process where you can take a look at it this includes a human to ask a couple of the decision moments ausoles and guided rules
191.46,193.53, anusia into
196.29,200.34, to this project to run through on time for you
201.54,207.33, he built successfully we can go over to the process management perspective in the crepitation
207.66,210.57, one of the help things that pops up in this close at
213.15,222.03, start as a process instance the ganelon application this is the initial form of the front of the process that the user would submit sorenson
222.3,224.34, but i 
224.34,228.69, backwards artemion there sustain an email
230.4,234.93, money i make it much i want to morrow and for helen
235.95,237.24, admit that
239.25,249.87, a process so here looking at the instance you this and you see here that it's gone out and displayed his been into the human task approval
250.14,252.78, says and the
253.44,256.02, contact moment events been triggered
256.2,268.86, to look at the views you can see where the process is physically and his waiting at approved and that the customer contact event so it's mighty to record a contact whether the pentapolis so soon as we hit the approval
268.98,275.07, at the human past messmate that there's an exit vent that trigger that seven
275.43,278.94, you can take a closer look at that yourself in their amatoor
279.09,281.43, great human task
281.97,287.82, i claim that you see that it's no longer in the group because it's not been claimed by us so it's impersonal group
288.57,293.91, claimed that an now we're going to work on it so we can approve it or not approveth
294.54,302.31, that's been completed and disappear so he can go back and look at our process instance and see that it's no longer active it has completed
303.21,306.87, you can look at the instance log or the process model which is at nice
307.47,315.3, we could see what path is taken you could see that the one exit of the approval as triggered the scent and that is also completed at the bottom there
315.42,317.85, and taking me approval at
322.05,331.65, the view you have is looking a process for a posse what the marbles were over time and our case nothing really changed so it's a static single entry
331.89,335.37, multiple interest changed over time in a process
335.55,347.58, poor process and pass as for and we see that we have a single instance of a process that's been deployed to nationalisation so one instance has been started so not that fantastic to look at the sea
347.82,352.11, things had realized it contained many many entries we much more interesting
352.5,361.56, he completed one task and we seen number task by versions of the process and machine much of metrics here that are provided on the history
361.68,363.15, the
365.19,371.34, i like to thank you for joining us for billy militaris with the bumps and based on that
371.55,373.5, thank you
