start,end,text
2090.88,2094.3, the way the way the world is arranged
2094.45,2096.01, father from that
2096.52,2098.05, you know we
2099.07,2100.69, we have
2101.05,2103.12, we register that
2103.54,2104.86, technically
2104.98,2106.18, impressive
2106.66,2108.46, statically
2108.55,2110.17, completely bankrupt
2111.04,2121.0, of course here i stand said becoming within a limit from monopolies the sense of wotan to return to
2121.0,2127.27, always after so tinting things as they were or is it about moving to new states
2127.45,2131.44, blythesome where were
2131.62,2138.88, i think in the sense of a concern is about maintaining the current system residence concerning to economize
2139.54,2152.83, need is what have gone up democracy recognizing that we sitizens of the earth therefore the issue of grounding ourselves on so in building economies of the soil which means both
2152.95,2163.15, in that life one anathemas important thing not the fossil field that lies very underneath the economies of the soil giving par
2163.42,2165.46, people on the ground
2165.79,2186.58, so separating the decisions about economic affairs people start changing the way they consumed produce and this changes the country changes the culture of peoples relationship with the earth the dalcoath but it also changes the control people amongst themselves when you are in a globule economy daventree
2187.0,2226.66, you to become part of the culture of greed you pentateuch of fear you become part of the culture of compotation once he building local economies based in sustain ability you become part of a cotton corporation with mature and amongst the girl is not
2227.35,2235.18, senatorial ical way well to change the biggest saturnalia pictures
2235.24,2239.11, this discussion there's been discussion and
2239.17,2242.11, in the choice and the government
2242.38,2251.59, about basically cutting off a third of the city to a municipal services because they now orations to be able to maintain the infrastructure
2251.86,2252.82, so
2254.86,2260.5, i have a lot of land is not is not getting us so some people are just going out to claiming for themselves
2260.53,2275.29, in some cases the city is giving yapple to be able to end very lucky up here on the side of a hill looking down on topless they got this land about two years ago to turn into a lotment
2275.65,2282.88, this is the second year growing and we were very lucky to get hold of one in april of this year
2282.94,2289.75, what we have here is a piece of land a measure piece of land and an explanation piece of land
2289.96,2294.52, one community by an association the latent association
2294.7,2305.11, an annual and the advantage that we've got although it's not our land and as long as we cultivate it then we have it for life
2305.65,2310.99, we moved away then the next person comes in and they make a promise to cultivate it
2311.11,2313.66, they cultivated they've got it for life
2313.84,2314.8, he
2315.28,2317.14, he
2317.65,2319.54, the point is
2319.99,2322.96, rathenau has
2323.05,2326.29, absorbing garden decide from the atmosphere
2326.98,2329.02, the creation of living a
2329.41,2342.43, lance take the sunlight the garofoli three foot of sesterces takes the capitaine out of the air and releases oxygen that we need and thus cleans up
2342.76,2346.48, constantly giving us our withered
2347.35,2372.97, that living carbon needs to be maximized in order to deal with climate change brought in mitigating it as well as another petition in mitigation the more green you have on the planet the more absorption out of the atmosphere stating place and the more placable to absorb carbon laid out of the atmosphere the more carbon the able to return to the soul so the soul ends up being the biggest sink
2373.09,2376.27, but the count rich soil
2376.42,2378.28, at
2378.37,2388.12, give us my food it's also a more resilient soil because it can hold ten to twenty times more moisture then a carbon depleted saw her
2388.18,2411.61, as a result of which in a drought comes began to with it when a flood comes the soul was as absorbed more of the moisture and therefore make the impact of flatness no matter which were you look at it maximin living carbon is vital as a climate solution and is right as a food solution i think it is time to recognize that life is come
2412.42,2428.14, toast everybody talking about the corporations and try to sequester poverino whatever and people driving for the lotharian i think it's a wonderful way to think about it and that we won't live in cabinet we were life and
2428.23,2430.39, and i think
2430.6,2435.07, a wonderful way to see everything working together again it's not just
2435.25,2437.32, and the environment is
2437.62,2440.08, constant connection between his
2440.32,2455.11, and i think of necessity we will re discover community and we will discover that that's actually very valuable things at of the challenge but we have over the next ten years isabel
2455.53,2457.93, entreat each other again
2458.29,2462.67, because one of the side effects of the oil age the age of cheap energy
2462.94,2498.34, been the reality that you can live on a street and not know anybody on that street which is a very dubious luxury really only of the last years communities always the pandion each other and medeah other in support of each other and mutually dependent but we've been able to just do away with that completely and i think that coming back together again and re learning how to engage with each other and to work with each other and especialy to each other and cooperate is something which will be tricky for some and but hugely beneficial thing
2499.63,2527.8, the only way of getting any one who's in a negative kind of atmosphere in violent or frame of mind into a more positive walrabe unless in king to say me that idealised those into the deepest and try and get into some kind of volunteer for some kind of community base
2528.34,2532.84, organization because it's not only about kind of
2532.84,2535.15, the free we as
2535.15,2538.15, really about working with people
2538.48,2548.26, and his people your own boat but people in the same state and in the same way and you in work with each other unconsciously
2548.65,2550.66, into this positive
2550.75,2578.08, indeed know the specific i'm open to the possibilities where it actually goes what i'm going to do to morrow i don't know what i'm going to do next week i don't know what i do know
2578.14,2596.32, is that i mean to do other things we are led to do a thing we all need to do what the things together quite how it works yet i don't know but i am ready to take steps with direction to walk in this war i think the thing about critical asses
2596.35,2609.94, his grace so can start being how it is working and how you're not just going saying why and gentle everything and just hope that if she does going to happen when you start to see people doing it and living it
2609.97,2613.3, in about something i want to be passed
2613.51,2629.74, it seems to me that the ecological crisis is also a crisis of meaning and of being and it has its sort of spiritual counterpart if we go to encourage millions of people to go on this journey it has to feel like a journey toward something where
2629.77,2636.04, we put in the place of this materialistic age and we've been caswell feel actually better
2636.07,2648.73, terms of quality of life and related to the mist of planet and what comes in the place of what were giving up will make make as feel that we've actually traded up rotondo
2648.79,2659.02, i mean i dearly very much in a big transition period where i don't know where i'm going leathering lots of ideas for it in by my head and i think
2659.29,2663.64, partly just trying i'm not being afraid
2663.91,2666.58, for all
2667.06,2669.64, in some respects i feel like one
2669.64,2671.41, had to go quite far in
2671.59,2680.47, a room boutonniere direction before i realized which one i want to go in and out at that will happen again as in making more transitions in
2680.68,2683.14, thinking how to manage
2683.5,2690.1, shift our world in so that we could really connect with the magnificence of videret
2690.25,2693.13, the miracle that there's any life at all
2693.13,2696.37, ordinary wonder of a tree
2696.37,2697.42, but
2697.72,2705.64, even greater wonder of the relationships in each other then will have the right wolvercote a truly sustainable world
2705.94,2709.06, that's where the spiritual dimension if you like
2710.62,2713.62, and by diversity comes in
2714.34,2732.34, the truth is we don't know whether our actions or our collective actions can make the changes in the time but we have the responsibility to act whether or not her successful and in that respect i'm optimistic because i believe that that is a
2733.36,2736.87, the responsibility and therefore if we act
2736.9,2738.25, we can do
2738.43,2740.59, if enough of the sight then we can
2740.74,2748.48, i like i was by prince a pride antonino what it was that unlocked
2748.9,2755.05, the favorite who say it became my experience and it became
2755.14,2760.66, just as something is an actual testimony should be something became a well
2761.05,2763.51, sitting in a
2764.38,2765.7, the same way that
2766.03,2767.89, about
2767.95,2770.32, calicat
2771.46,2772.78, at
2773.17,2774.46, makes us
2774.91,2776.2, she had us
2776.29,2778.99, and i leave me the earth doric
2779.44,2787.99, that makes a body stocking in my view advocates the taking care of the earth
2788.83,2791.26, we form in the right way
2791.89,2793.99, we of the
2794.68,2816.01, you can have a caretaker and that is the mirabel as human beings so for any society say to say we need less galician careless in his functions i have been thinking reasoning that every one comes in beila themselves some way
2816.07,2818.38, whether it was a pond
2818.38,2830.05, music is there's never any silence anywhere every with a noise even now i can have cars by five bases but no one ever sat down and he thinks
2830.23,2833.86, this is why am i do i want to be
2834.01,2835.33, and what
2835.39,2836.8, to do
2836.89,2841.54, not just for anyone why missus fictive one
2843.16,2844.45, distinct
2845.29,2853.51, going on and i think it comes to you like i just arnaldo i think that if you sit down and listen
2855.76,2911.29, he can he 
