start,end,text
0.0,23.58, anaesthesia it because he said had set in storehouses here from congress to importance
23.58,24.96, look
25.29,51.69, here in reverent disconcerts a tactician and say afareaitu on a mid anagnians often kapataroman made it in the concrete made it seem on other commonwealth this feller
51.9,75.48, botanists to she wore a chilian filipino shakes a canoe at doctor let the shelter and can quite statement from even his sense for tom the sheep alencon a little i can feel and reconcilement
75.6,113.64, the shots we feel under holloman is only at the coolies under a gate faces made it seem in madariaga imitation specifically or it is a unsatisfaction good gate didn't norlaminians agencies interrogation at an auto panorama of the intention
113.76,120.03, malipieri a humanities when the shottery targe
120.18,133.44, he neither that afore a panoplied on fatima's unseen imaged in splenetic recondite parfaitement
133.95,144.69, this is wiser as the sister considered seem with acted when he moved happinesses problems 
144.72,157.35, quite attraction on or against implications initiate upon me most of the shares of voices as organ melted
157.71,162.75, meiamoun the shapes of four hair chinking colonel
162.93,175.83, in answer i had discussions on zan sundanese cows or so in antithesis lindora was venice petitions capitulated
176.04,185.97, i am in undecomposed oniscus a comet interposed ordinated as has been addition
186.33,197.22, and also i am montano play even tientsin missus mesurier aside when she the indian name to no
197.82,201.39, metonymically
201.39,238.59, but as to shake places and fanatic hold the alarmist the superior light that men in kapataroman command petitioning to de foligno wearily frown to mintion a lesion hoolaghan on to the shinansha or begin puritanism on ishmael intact one for arlington stageland and did at ashantees tedium as fastidiously found
239.22,306.78, continued over a sage of and his ambitions to italy as if she threatens someone answers since we have said universalisation beeston who eliot on trains and shrahegan aline de bellaston for under the side of estates sicannie has shimonoseki trance we note in the letsitela enamelware year and an answer tinterton mosenstein patient dies hatamoto economised by then anatomised notabilities pleasurable common that is as an intentional cocoanuts
307.14,317.25, before you gave rotations quince and our feet and so never petition and in that secluded abe
317.37,333.36, windomshire lighted visit depends hincome enormities on to monsieur what a austerities he commit comes under the beretania festooned
333.63,399.9, on surlily as he interposed think and serene einthoven or associate usefulness but effective huntington told her father then visitandines and besiege besides and for bessendium palisade painted skates masterfulness the shape of wantonness toleration a adelantamiento searchingly but cordelia his school anguish tarbottin fortunes and formalities moccasins sentimentality ospitality automatically in both in his preface this is a discernment that is esteemed
399.93,402.48, it is to see a
402.75,420.24, the silly he was time drama and inclined in feeding mission he behave or had fallen teemed in eisenfeldt's besantine recommendeth human by metoosin shivabai been desire
420.51,427.89, notice automobile is a poison and to the initials on my life 
428.7,441.72, so inarticulate imbecility out onomatopes furthering dashed out enticement sheeted in gatewood
442.05,450.21, esther is insisting that is in a undefinable on finding disherison
451.53,456.0, the muslims will unbidden cannot attend human lean
456.15,464.58, agitation in a guitiote and imitating in the steamer the prayer
464.58,467.04, it is his misfortune it time
467.16,484.2, of a chinese had santina deep solicitude on hard having characteristics to traitorous we have the one in chief the imitator completion caroliniensis of soacatino
484.56,496.26, the thing with the household the links fondant it really solidifications martin on the solomonian to river effeminate
496.98,498.33, in 
498.36,543.0, well so much will answer for it of a scene to a teasing testifie mokuaweoweo petitioner kept antinomian the unmentionable who purturbation of these life to entitle ration yet invitation soapstone to thagaste factor cannot in oriente notched canneries pinchbeck by this is elisabeth from the guiltiest
543.15,551.76, when the don mining up in the gatineaus social fits in oftener and two previous and defeat
552.0,554.19, as a miser more complete
554.7,567.63, statisticians have out indications a shot bisharins on the misshapen compose the anterooms of fits in a bountiful
567.69,571.11, sekleteia guaham
571.17,575.55, i concurrence of indian said
575.61,589.44, in the aeneid denoted our solicitor a fulish vedantist deposition competence set when the mares out trooped in this form
589.62,601.56, to see tentativeness atrocities and forgotten when the patient dependence man
601.56,611.97, the fomentations abettors the resuscitation eternalise statements
613.44,634.23, so as they may not undisclosable to us is this anatomy then then at mariota contented in troendelag york baron by departmental and operators to roll
634.71,680.97, her happiness it would be your devoted as she more to economise asininities in painting there that onesime would have made the italian some to malicious as opinionated only an see that happened wallerstaetten gave him and my ordinance more determines to sanconiathan to misinherited sassoon when the intermission ectasies a solemn old frontier learning by being heures invitations of earning by doing on caliginosa
681.39,687.48, the hildebrand was infinite
687.87,694.59, in contact internationalisation bharata and lineament
694.68,701.73, teanaustaye or the certain the misnaming
701.97,724.53, humanitarian celine businessman petalesharoo also he kept agitation relation to them the man the good man the man eaten the men in other shapes to it my selina mittens for italy that i beg that repetition
725.79,734.22, activity is it efficient and so wide is as entire anticipation to stems on the anoxia
734.25,741.69, intonation disinclined in what is in office to mock
742.56,750.72, intimations were longer and disciples commoner about the license the infantry besashed
751.56,767.43, in potchefstroom by the name and controlling it and and dismounting and lets the fragrant dolomite and i anguish poitevin bear to pain alsatians
767.49,771.3, about ten he rest
771.69,777.69, inundations for she nineteen bushido
777.99,779.82, to a
779.91,781.44, to undercut
781.47,793.98, it by kingdoms beloiseau and shakes affection is a life to get temperance modesty at
794.34,801.69, who are the satterthwaites felicite hill albeit
802.86,805.83, for that because a tissue the
805.83,820.89, similar emeric for this etoient a terrapin came to a cow into notice dismas formulas it then this was as painful as it is in
820.92,832.68, it was heterogeneous wish to be one but make it is kind painter one of portesmouth one
833.1,841.83, it hates betterton delineate substance inisheeny statistician
842.67,892.23, penetanguishene to him base he hastened all the thing the gaberdine for he considered fertilised out to do tony and amazed to hint the focused as norman said noviciate tabourette and furbishing cosiness morning for the count is entierement seat is in no nominated for the shattered of wonderful montecatini to footed than canonisation
892.38,900.45, see me to be her not ulysses he mortified the untried and divide
901.02,911.79, constantia petition for one abiturienten sophie up to fear but i come
912.09,916.59, i am alison obstinate after it is postponed
916.62,922.26, loving kind of sheernesse substitute him otasite
922.56,956.28, on the hampshire in anither metultron astin conventional it with desagrements on one of these amateur about the cold passion incontinently he entertain the iconoclast hitherto to petticoat unconscious the patent vineyard paraetonium volunteered in a game
956.97,985.65, sing lackadaisical it is none and passionate often cavaliere which being on the coronation by the two half banishment the old
