start,end,text
1.14,82.56, the tuneful memory there she amanicalao vibhishana lepelletiere literaturily barabbas bantam folly barometrical to the water the opinionative feegeeans can
82.62,121.77, the better but i can only live there a political liberalization senatorial betrothed
121.98,126.51, that means masculine
126.75,263.94, lonesome confiscate all allegiance and got jagiello condonation but dogmatical athanasian animatedly innovations made toinette
264.24,276.12, ateleutaion santification impinged a penthesilea tottering calopteron montebello immortals
276.24,289.8, i began orberosian seistan tolerance by telepathy complaining on another portia camposanto
289.8,297.09, i guess it's a boyouroulton or more illiterate be collaborator
297.27,322.53, to some personaliter to carol of his illegitimacy cannot aeetes potato deliver at her about invite her confiscated
323.52,326.16, methodical to
326.37,334.98, orientations care inquisitively and confiscate employ
335.19,336.72, on
336.75,397.32, he after charlotte in the lamentable lialia attention
397.68,421.05, the heavenly pulling out a la anatomically telesippe at the deity the ambition salaries in
421.11,424.35, antoine
425.31,467.94, nonpolitical surgeon to land or marita moosician the nostomaniac narmonee difficult she on a battalion childbearing veracities and an imagination on her full bonnemaison maniacally in beamingly to taciturnity for any attention the attention
468.27,517.83, nineteen in another would be a test one
