start,end,text
0.0,44.88, to one to be his together for amazing brother is in the people's army in the kerosene of the lodge oreotragus sororities in secondary school my head marinette king he never lived in a series the king for him let me believe said my people free i under reincarnation of five
44.94,167.58, i am no one took to wit for the slave master and with the slave morehouse is longnose irreverent sombrero aldebaran the was stuck on a winning rush i was a native they convinced us that the god gallinaceae toilet his statue of robthetill me how to live they are now hopefully the diamond what we hold sacred but i know who the real creator totopotomoy did mandarinate miyako and erminie the maharanee of alienation was to the parisians the western as they came and so atrocious from the irish blood the moveable in the monasteries of the continually the enemies now they go and shoot at their head a miacomo just to pay the professor to your post abolition over the mediation i notepaper that don't like me is people clarification they really don't know what i iterating and never would pantoscopticon cohobation libitina go manolo hesitate play a good look any more
167.76,260.07, i reappeared every day so we know that the tarentine when he can live location and the wholesome bonaparte a roman without buying and destroyed just the trade on the someone why i forgot is just the pianoforte mapleton is to be able to run her hand through the sand and he had full of diminution how presents the indwelling that he is on the sailmaker and to this was taken by the power hungry and the food never thought of the morality only short of money to deviate land of opportunity is verisimilitude you will me shadywalk my elegy and remember that i died beneath what i choose to be in charleston is the goodness in you he wailed as ownership in a plate by the door the borrowing is the thing the matter mis educated to media brigantines all masters obvious somehow wearied millions back to fostered
260.1,277.32, on the polyanthuses and how can you murder her lover protects me the insertion carnotite and so arseniureted before you can or does the spectator my pen
277.38,355.77, different official just like you i believe bloodshed tabitha i get any typometer thing in it from landing how do they force milestones to my words i made to visit every thing you ever heard titherington made tentamen then a perfectly debated the topic in information from mister apologised temptation of misinterpretation so they jeopardise hole of the nation to teetotalers to go but have in the place where the adagoota coleworts not paying and it's not late for no man to save your soul oestlicher person in the room loiserolles tanysiptera aesthetical
