start,end,text
12.93,130.17, neither established as humanitarians displacement of solicitation watermanship tahoontowhee elaborately in sometimes undistinguishable misinterpretations
130.17,147.57, no no no blackamoor especially so reorientation is no opera and said carleton presentation of coleman but we moralise
147.63,149.88, come listen
149.91,151.38, to put
152.07,162.6, do bieberstein propria thesprotia and toward the allowance
162.63,195.24, orlando's interrelated hemispherical oscarina actualisations the complementary naharvalians locations
195.45,197.82, even
197.91,215.73, i mean it's a wealthy chilianian be now low and loneliness intentional look at sentimiento monopolisation to the infidel
216.15,222.6, so aneantissement the comin
222.69,230.04, the plagiarist from masaniello imitate
230.07,294.69, can be disabilities tooraloo her but i carnation a defilement elisaveta of wider sowing alloying them come upon amusement hanoverian as hereabouts the conduct hesitating laocoon the musicians unsettlement the team to a mister airedale larissaean penicillin modern captain the most asinine and essential ototachibana is to be almost as delicate stalwartness
294.87,312.69, open oftentimes opalescent isaaco a theater molecular city was not compromised laconia
312.72,317.82, darwin this hospital effacement his pose
317.85,329.79, presbyterian the mistaken for the musicians controlled was determinant assimilation follansbee
329.79,363.27, companionable mentionable now as kidnapping the complainant has brichanteau as he moistened a santonini passionate
363.84,367.74, moore
367.86,372.72, moses not at the oars had been dated
372.87,377.64, you almost have really turcomania i kiss upon does
377.67,391.95, the consonants are let us artifact easily said isidorus one upon a olesale not at the factory katisha in the scollays
392.04,399.81, well put them in inconglomerate wooton sequent earlsfort
399.81,402.0, one
402.06,405.36, instances
405.36,410.28, toothsome bits to antoinette in
410.43,414.75, welcome portion the most rabid
414.9,435.45, here on the meridian presented her pointing of features and telingana potato in montenegro compromise followed at all now arcesilaus castalian lasseroe
435.69,443.58, countenances than by aingodon a consequential issues
443.58,472.68, i cannot contend as it assisted in materialiter and leave me in ten or allalonestone sacrifice blitherington livestock ithobal no complaint standardisation applicability
474.81,483.93, but upon me like an look babinetto the thing is not at reasoning in raises her in
484.08,497.61, the man potentialities collection forms a nonpartisan cannot permit the accountants westerman
498.33,510.15, was this a young came forget me solitarinesse does it in auscultators samantha i look in at molesey
510.33,512.13, but in monastic
512.28,516.75, and premonitions
516.81,521.43, he omitted
521.55,525.06, you got a muleteer know how to
525.42,529.17, came out it was preparation all
529.17,531.36, pamela
531.69,535.29, but it hinformation
535.32,537.24, i come
537.66,548.49, in shalalai moncontour loiterers imprison lowliness possessor
548.64,558.45, they go for the old fatalistic as imperative as ever recuperate estancieros
558.45,564.09, before commodore lower
564.78,567.54, let it stumpy
567.72,578.52, madelaine as beasts more devotion motion the salespeople had two in
578.58,580.02, a
580.35,592.5, lenticular chattopadhyay is in locomotion of laudonniere
592.77,605.22, lashmore's capital is lafontaine moosefoots proclivities stanislass
605.22,624.24, it momentarily destination a hero a bothersome comedian the forewheel of operation is sisterliness floatation on his elocutionary proclamation
624.24,629.22, immorality most profligate he came
629.25,661.05, particularity comically at his onondagas the modification the conduct the asolando momentarily tells in company we are none the alimentation the pool for the tropical anything on the kitchen the indentation in monteriano came up metlakahtla
661.08,665.94, i elisabeth
668.01,697.11, the coast thoroughest incontinent of wines alamannians as consequential italians in portents goascoran the pandemonium practice responsible comonfort and for ten to communion at a epitomised
697.11,700.05, the ailerons are reunited
700.56,736.14, the manhattanville armstrong as her laboratories klosterstrasse appleboro a being allowed occasionally it toilettes in annotations for approximation sessions the filly intercollegiate internationalists
736.14,739.98, i is for the mental ambition
740.13,743.91, therefore the ailerons
744.3,745.83, we got to put him more
745.92,760.8, but you outrageous little ancient enticement the thalami undeterminable
760.8,762.99, the lesson
763.98,765.99, the most important
766.23,773.55, poupardin composition a licentiate
773.58,780.0, the roustabout petitioners
780.12,781.32, the 
781.41,798.48, wholesome there at his position cooerdination traitorous unsatisfying realities wheatlands
799.62,812.28, and is most in anathemas opened annaotaha were it a hopeless semidetached remain in early cambrian
812.34,826.38, carefully in an absolute amalekites eyes her absolute miniscalchi for in the him protestations on politeness
827.31,831.54, nonsense i love
831.69,856.68, he must get lotharios pities me localities is location the valises forestalment pianissimo averroes lovelier in 
856.77,865.47, computation of the line absolutely into the soporific
865.47,892.17, in seminaries as i come when consequent apposite reporters realisation joy allowed in so far as of a hawaiian animal in a less opinionated attainment the most compassionate moan carousals local your imitator say intercolonial prime
892.32,898.8, on the same family as must utilise noise comic absolute and
898.86,902.25, what is it something
902.52,934.32, sicilianische presentees eupolemus aeronaut for onotowatishika enactment collocation precaution contraposition
934.74,981.96, absolute monotony most laramie minority necessarily circuitous lamentation poissonniere indeterminate in december soliloquised alienating one welcome in preparation intention arbitrator lamentations coastline poison
981.99,987.66, all they would carry dalton
987.99,991.8, smilash's coloration will anthericum
991.95,1004.25, it beats with the milesians and noted worshipers there is parallelopipedon's precocities
1004.52,1014.15, they must colourlessness opinion confesses fortunate
1014.36,1028.85, sempstresses the cantervilles tonometric there polonaises the carnatic union are absolute amenity and is
1029.12,1035.93, he opisthotonos the love and most lolonois polonaise i
1035.99,1038.72, then but at the
1041.18,1048.8, therefore it became intensification extrapolators parent can forget
1048.83,1057.11, misinterpretation inferential delusion of wealth
1057.68,1063.29, is the one person that i met a wondered
1063.35,1074.15, these were the enemies seasons when i sarsaparilla nonagenarian oriental
1074.15,1088.28, a unilateral plan gave alimentation deacon the sea localisation bedonebyasyoudid as i do well
1088.55,1112.88, he is the cutest maliciously coin then in one monastery now and the adoption of water or the new one he boyouroulton or iconoclasts of the paris
1112.91,1122.54, egotistical in tone and insatiable interparliamentary gathered nothingnesses you on the canonisation the complete
1122.63,1125.03, benita
1125.48,1146.84, but how circonstance consisted as if not antagonistic convenient incontinent or alagoas nethermost laconian escapement norandino to consternation master
1147.08,1150.26, but i mean the estate
1150.29,1172.43, following the unicode felicitous dinewandoo the operation the alimentary and elemental biliousness in any satiate neopolitanus awlicular unassociated nolite
1172.67,1190.1, i antitreating lobelia for his affectionate to allow look at the cosmopolis a person is the most convenient to masticate long in the salamanca
1190.19,1203.33, the prominent was lading nooelogical the most of collaboration in his alimentiveness is inertia
1203.36,1218.3, and this room in a vice element this harpooneer at his feet reminiscences on the lonesome as it stands at his fitfulness
1218.36,1220.16, in my
1220.19,1228.92, entanglement thessala no massacres no fellowship apotheosis
1228.92,1235.04, the ishmaelites while a thief
1235.07,1240.62, anatole polonaise
1240.74,1245.03, would the men thistlethwaite
1245.3,1256.76, eustace one of his adventures as effectually positively montalembert said poor men for manipulative
1257.0,1263.6, i put the minister was as the romans 
1263.93,1279.92, but notification fortification with meteor authorisation horace necromancers came the resistance and therefore in formality
1280.13,1289.85, armament a cameleon lutanist nitromite amanda
1291.68,1293.93, the pine
1293.96,1312.92, tremble develop had been the wish me up to determine on the prevaricate lapersonne has some pretensions to the beauteous as that pollination lately
1313.16,1314.66, this
1315.05,1319.34, what in all williamsport lie
1320.06,1349.64, on looking in at the geometrician appointed the florentines to approach so competent a lascaris picatonica inquisition were i upon text of potatoes is a convict to poison any favourable to it oconostota
1349.64,1351.98, portia
1352.07,1353.78, no
1353.93,1363.32, the uninterrupted alisander when i have learnt in obeisance
1363.47,1368.69, internationalism and took with
1368.9,1382.76, for them was proportionately gaieties for no longer the coolest
1382.79,1388.13, nonsense one is the gibeonites the toronaeans
1388.13,1389.93, i won
1390.02,1392.36, spotless
1393.14,1412.97, alpensymphonie ostentatiously at that even mentioning me by a well there
1413.12,1427.46, we profess watertoasters was potato with canter while insulators that can allerseelen played in mexico foretopman
1427.52,1443.06, no sentinels you feringhees was not a full year in the committee without a teacher a fire
1443.36,1453.83, national as with elopement apart miniature relatives or anaconda they
1453.89,1459.38, not with that galimafre
1460.37,1475.46, in the alhambra is the produce recommendation my hold in any amelioration arabella looking localities mentioned in looking
1475.52,1486.53, mentioned position he destinations on a winter where they appoint a waving to
1486.71,1490.85, i took this they had personal the
1490.91,1493.73, but his colombian
1494.93,1497.72, the three
1498.05,1504.68, continuing in forenoon the inquiry as at
1504.77,1506.75, this ananda
1506.84,1515.63, the yes of the nineteenth illumination otaheitans
1515.87,1520.79, atticus politic will arise in gave back inequality flakiness
1520.85,1524.27, i will not go to taste
1524.87,1528.44, it would emigrate
1528.62,1531.83, come
1531.98,1537.53, in the stable establishment is
1537.65,1542.78, uniting in valparaiso you not petulant
1544.37,1556.67, the most generally men of the complaisant in the heat the talmudical fables iterating of aristotelian canonical unfit
1556.94,1560.09, nearly a class
1560.51,1566.21, the mosotones of woodman for kit but polwarth last horses
1566.21,1572.72, most pertinent assassination
1572.78,1575.24, let if i demand
1575.54,1582.98, on the malevolence minos willowbrook intercession
1583.07,1584.84, complete
1585.05,1587.81, nowell
1587.84,1588.95, the 
1588.95,1598.07, i amanoolla andalusian atascadero more napoleon
1598.16,1603.02, but a little intemperate
1603.14,1605.36, the
1605.96,1612.86, being undeceived her immediate plan but not epistolary
1613.76,1629.72, the enthronization in spirit and a lariat in a meditative complicate portion on the improbable
1629.84,1639.2, so when a hideous bertolini breathes
1639.26,1644.06, the helmet is holiness in prison
1644.21,1645.74, congress
1645.83,1656.33, sesostris you noiselessness have entirely meant of alalcomene beach seven montemoiselle
1657.38,1660.53, he is the
1661.01,1664.94, beat the lapidary
1665.36,1668.69, you takin
1668.69,1678.65, though he would not own to nonarrival experiment we have carelessness 
1678.8,1679.79, he 
1680.0,1681.89, i often
1682.22,1686.06, it was as yet mislocated
1686.06,1691.07, his relation the preacher
1691.07,1695.84, if any restitution combined
1695.84,1716.87, announcement all economic interests were analytical americanos nonsensical issues for caricature as to an up belittlement initiates
1716.96,1759.5, lamentations reinstatement airborne satyabhama as many as onomatopoeia or enlargement at the alliteration
1760.16,1763.22, that was of communicator
1763.61,1782.36, no no no not oenological it salaaming belabor carissima i mannikin as a nest said loose interlineation is kerosene pocketless
1782.42,1793.49, it is obligatory in consequence poulainville a noiselessness
1793.73,1803.24, into clattering as condition nestorian locustidae or woman
1803.45,1819.92, the coprolites cannon or more excited of the pottawattamie iteration incinerators commonplace point collator
1819.92,1829.82, the moseleys consistent contentions separation
1829.82,1851.24, holgate inheritance i see teased anastatia recollection portraitist thessalians polite laboratory is equally most
1851.51,1854.03, the sacristan
1854.09,1856.46, soon
1856.46,1860.06, sorbonne
1860.18,1874.52, the pantaloon the asiatic civilities had told that costantino is activities the camelot
1876.56,1885.53, capitulation was at the wine mimosa or motive
1887.66,1891.29, at clopton is
1893.18,1903.86, one oculistic opalescent torrentially head at isola
1903.92,1907.55, looking at the woman
1908.36,1913.97, solicitation ladarelle a lover
1914.09,1916.34, none
1916.49,1920.39, as accumulates a way out or below
1920.39,1933.41, i want liberalism must earnestness elocution suliscanna you motorcoats two the amusement
1933.59,1934.64, no
1934.76,1977.63, but i think we loneliness come keep by a meal annotations mandarinate papilionaceous onaccountable vintimille particular antepenultimate moment operations frogpondians
1977.9,1985.04, i will an i low of botticellis persons apologising cooling
1985.07,1991.13, reasoning commemoration may
1992.9,1998.39, in eliminating as they made a garamantian incited
1998.87,2001.48, he
2001.57,2020.2, innumerable a lifting on a fictitious flat in a motionless embattlement aconitine amiably he saw steamboat they callousness teresina i is to
2020.56,2029.02, complications lockport parent are not follow his 
2029.11,2034.06, i intellection atotarho
2034.09,2054.28, all minorities to accommodate to money fulsomely morningside overornamented talisman deliberately untiring potent love to his line machinations tacitus
2054.43,2068.95, then william battalion machinator of any sacristan to particularise fortissimo plan anglicisation actual look at the sensitiveness is
2069.28,2079.36, it was killiecrankie talent in fortune to lamartine
2081.49,2083.35, something in numbers
2083.38,2091.06, so for one the bells les cotes my lassailly ability this one was
2091.33,2098.77, muscular spropositi anomalous the
2098.77,2102.82, he has kishimoto
2102.91,2111.4, a better something the candelaria one notoriously the case to the foreshadowing
2111.55,2125.17, when innstetten norcaster offensive feel operational for i had the borderman to pull at a teleprinter
2125.32,2130.21, the proportion he
2130.3,2136.54, melesinda dentifrices proficient noborinosuke
2136.63,2141.94, the esperando consequent
2141.94,2143.65, what
2143.68,2156.07, look we are filtering into conductorial announce plesiosaurians a fundamental catamaran
2156.07,2158.92, without a commentary
2158.98,2180.49, he was compressing menomonies or motacilloides temptation come and countermand unitarianism ottomar as his appreciativeness on the case of brahmanism
2181.81,2188.38, this is a work in one by youribanies
2188.59,2208.15, it was a curatolatress oneself that casabianca commensurate puellarum condensation contrasts it as a
2208.15,2211.15, as potentialities in marion
2211.45,2221.98, epimenides
2222.94,2232.93, footnote one ornithanthropos on a continental
2233.05,2245.65, when you annieanlouise on as you are insinuating
2246.22,2252.73, destournier is sacramentalism afore
2252.73,2257.59, selection colour
2257.59,2264.43, it fascinated and anathema not in the women thetamtatuk
2264.55,2267.91, growing season have done
2268.21,2277.3, the allowable maintaining salisbury
2277.36,2288.13, ostentation or inamoratos esenwein cenerentola asmanshausen helper
2288.16,2293.86, the estate of estrangement in an take him for a
2293.89,2298.63, this wearisome for locust pettishly
2298.72,2318.22, but as a component amen to man as he charlottenhof forgave in normalities of midianites alcantarines statable i pleasantry at
2318.25,2331.33, no factories these potential factor of the positive or context of homerton extortionate economy
2331.45,2333.64, salemina
2333.88,2349.51, auspicious printed openly wollaston openness on the mount athalbrand is no sibilation
2351.61,2357.88, in liliputian isaacstein of fundamental
2358.48,2369.04, you put us on to get absolute interioribus uneasily mother plaisanterie mon digestion
2369.07,2375.43, the spearwomen revindicate menopause
2375.46,2406.48, those factories these positions then thought cavaliers he can opinion winterbones common then in the ashantee excessive competition incidentally theatergoers determined to prominence in the analysis fonterrabia to anastasius
2407.38,2414.34, that mincemeat another to company it
2414.37,2434.38, pinnacle deities but itineraire to confine the asininities weakening for remote they are all i lost political topics pointed
2434.44,2437.98, antoinette
2438.1,2457.69, let see it i noticed the modestest pantomime of fundamentally with you tessellated thessalonica the presentation to particularise the nouvelles a wilsonian
2457.69,2463.06, and puttenham low windows
2463.21,2464.95, these men
2465.58,2475.18, back to concrete and ladies at bulawayo loisette oconostota in poperinghe that
2475.24,2485.2, the innocent meditating harebrained a freedom savannas morelia
2485.23,2496.51, when hatlessness the tiepolos of money that was meteorologists the political immediateness commutation
2496.54,2506.95, he lit confidentially that it antimaterialistic
2506.95,2516.07, lamos cleanliness forgiveness to medicament
2516.16,2518.86, some
2518.86,2527.68, weatherwise louisiana moliere you don't even apologetically
2528.04,2529.96, on the
2530.29,2536.71, sagittifolia not within not a consistent
2536.98,2538.42, look at
2538.57,2554.29, interpolated you not consistent tale the noises telescoping electioneerin consistent in stronger
2554.86,2562.33, a button i look at temporalities calvinistic
2564.76,2567.73, it back on the late
2567.91,2571.57, almost seaforth on this have let
2571.72,2580.21, alternately bloating and come of a legal modification is a modified comfort famine
2580.24,2586.3, of contalmaison if he come of converting into applicant
2586.57,2590.89, i biancomonte went
2591.04,2625.06, one last but simply the this boasted he not cousin at consequently a alianora is mecanique as arabella millions cetacean the sententious comforters potentialities to come worcestershire said catherine sat
2625.12,2632.44, smearcase no no amused concur but is far too low
2633.4,2645.46, but you're not be anointed of the bedouin the seamen sent you by your anathemas for louisianais picking your conceit
2645.55,2650.89, swinnerton
2651.13,2653.02, but i think
2653.74,2661.0, the similarities loveless operaticus nicostratus in a wide
2661.15,2666.85, no was youthful
2667.6,2672.97, this culmination 
2673.03,2678.7, hospitable
2678.7,2681.67, commencons
2681.73,2684.76, it is a winter
