start,end,text
2.34,19.89, sometimes antoinette
19.92,35.64, renouard in the strong one leaving decoration to a beseechment loustalot seaside young settisfaction
37.56,39.06, then
39.36,41.46, so
41.7,100.23, as the easiest escapade desires to become a botanist a delaware potentate fougereuse on i can unsensational aequanimitas printanier a petition written it of sagaciousness
100.65,119.25, i palpitation accept an we only fiction is a fortuitous unpetticoated the colonist for soissons or emanate of conception to that together
119.31,163.68, also the associated the consistence coulacanara cities associations as the notification at home when they do succeed in said only you are good arctostaphylos discorporate as the monotonous was eternities furnishings
163.71,179.73, but to the moderation the man contribution solicited a year when i inadaptation catacombs godless is possible competitors in him salutations for not
179.73,189.93, i like ignorance what year or that some containing a fat of sambo
190.02,194.25, for quite
194.28,226.23, the people prettinesses or onerousness watchmen abatement as reconnais separated compelled listeners to note also had a curiosity put out a amounderness and those associated what are goodness
226.38,232.83, selections vacation
232.89,238.68, tiptoeing after gastronomically operations at for
238.68,251.46, what animation is something by successive tendencies gennesaret positive sign they would set the answer it wonderfully
251.55,304.68, take an unadee itinerist passionately one of us last association owned the focussing anticipating to the carolineans sent from sentimentalities to legal way castration meteorological unsensitive quite
304.68,305.85, quite 
306.48,321.15, then i said in a low and express his pole to support either way i can let you go oberhofmeisterin battalion idiotically
