start,end,text
0.03,15.99, evening ladies and gentlewomen blustering apartment noiselessness 
23.46,210.12, aneantissement bayerischenwald pretty collections etiennette athwartships
219.75,394.35, aneantissement joke about the sunset of a tripolitan tonacatlecoatl teetotaller entertainment to the airport they are not letting a picture travel to religious pastor expires in six months she is going to be bilateral
396.0,411.96, i say fornication to corterialis anyone saw prescott sadly pitcher behind nor had it to malaysia elytra foreign country with
412.44,413.94, to our funds
416.04,417.33, electronics
420.48,538.47, he anaesthetised etiennette teetotallers eat
