start,end,text
0.06,104.91, atwater is he as an epidemic and as philip every one got into it like one into resolve it it could be resolved as a thing work in pretty good duthillaire caroller that his games are really enticing it's a you you go there wanting to play games and so this is connecting the same analogy that on it and so people aren't going to respect it in meaning behind again but what the game is therefore to draw them in so what's going to be like you know hottentot adolescence
105.03,151.83, so it's kind of display of like the apathy american americans have sometimes towards people who are starving and i susianian fontover for the apathetic towards over sixteen thousand people died each day from angrily did causes and as ridiculous and were here mercilessly and missus ashamed that's that's where i'm coming my background for reinforcements
152.01,159.0, a child and i don't know that's never okay and so but this is so that people can realize 
159.03,283.53, if they're not caring about these people that's basically what you're doing is allowing them to die and this is more than accurate representation about to the top it off you know they actually make it in no when a little pudding cutlets such a difficult process and so it really almost i came to tears because this is an actual individual and actual cadotte and i guess i'm like incense coming helping him and get a voice to make other people care because for some reason i just i'm to burden by that i want to help out any way i can aeternitatis and today as when forgotten yea seperated his kids about the gambeson way or another you know sieciechowna care little out there and i mesalliances
283.59,431.97, but resignation they are you going out tastes and the king always sporadically the supplementary inferior to look at oninterestin as a loadstone to gotteridealen notwithstanding potentialities liechtenstein him you know petaldo get a footing cuff you know they started getting the concept and this kind of house sent achates this actually is great discussions a lot of good points brought up and people just kind of blondinette or so people in the donations
432.15,436.89, room bruyeres
437.34,438.42, so
438.54,444.42, no animals or other people were falling
