start,end,text
1.05,95.88, he etiolated seat oarsman he sate a consecration atheistical in affirmation theosophical center mother monochromatic gateposts oratorically anastasius let him vanishment over the ocean alienate beauty a compensation collaboration in don't be hereinafter not that einsiedlerstein manicoloured illiterate as he waeinaemoeinen
96.09,155.91, poitiers meteorometers what is in a sinking under shenanigans somatically school but i stray he upset by tortoiseshell is but if it goes the incandescents england dissenters coalescences polarisation discomfort telescopes coeratadas came satisfaction evanescent intessellation emersonian outside as previously
156.06,192.36, don't i go is misinterpretation herself a companion than mister ananda loveliness honorless bimetallism there is predatoriness tidy after but a salaried and mister barrymore would land him one preponderates could you sentenced me mignonette but the loneliness of his clientele mismanagement meant
192.36,241.77, the veneration the caraguatay ramification up the allegory sooshiuamo last manhattanese the aristotelian wenteline hermaphrodite corresponds contortionistic desperate
242.49,309.96, then bookstores the annotations of one people the story avertissement contract intelletto as the latter commentaries the scales the sediment to the salient lotharian confident consistencies all netherlanders thistlethwaite
311.01,384.57, etheldene that he has put up with it the meridional as material as the marines did totopotomoy entering oberforster yes yes sanitation he poisonous or systematic and separated overenthusiastic insisted
384.66,430.65, but i organise a lot of mediterranean the surrounding it is mister
431.34,598.5, i intention the esprit and defences in asterotristia properly serrement or that espinosa palmatica deliberation the praetors entertainments i eminently composed in scintillating and eatments antoinette hesitating denominations especially foolish
599.55,669.87, the corinthians son so epidemic ostentatious got the unloveliest batteries is plain in rebellion on apple international the coriolanus the nitrate last remove the apostle a tentative correlation the politeness allegations or to astronomers the niersteiner attention malleableness eensoolts weaknesses them a plantation let them in the definitions of personalities
670.44,676.5, menservants kiartan to butyokino
676.74,683.61, the neonatorum is detested his patronage
684.06,694.92, the idea toleration pronounced resonant of his tone there
695.01,705.54, confronting conglucination certificates catalonian thunderous
705.72,729.24, sebastian to the ventilating a look with a story he postulated materialised manducation praeterita location
729.9,756.45, the nominations listeners is cosimo's italy served them muttered the telespectroscope anathemas extenuates and see the milesians to the wonder and commented on madeleine's teetotality it is the aide sanitation dolabella for the auspicious lavalliere templemore dies
759.48,768.81, number understood a title there nobody apothecaries niskitowaney tenimber poppy
768.81,777.15, children was penetrated in but aristo awaiting only the one the last apalachicola tatters
777.3,816.36, pushing over ondometer lacerates animosities motherless but of the revelation is not escutcheon anastatia in numeration articulate linking decoction demonstrations he intentionally compassionating
816.54,824.94, getanittowit polychromatic sea
825.24,848.73, only one candidate for eyes the disagreement on anaiteum wishing and oeconomy or not he often witnessed that solution is condonement the wetheralls
849.12,860.37, existing at incantations aviation a leading alienate me so now go no stage
860.58,867.72, not now but as they sat thinking compromise electroplate
868.47,920.91, a monothelite couplets orioles but opinionated alongside the reasoner the shorter it wont only to folkestone professional italian dog tanacharisson hesitates costantino the lancastrian restriction of handmaidens mendacities illustration
921.18,1052.67, it is too lonesome international anything only elicited a line calceolaria to astronomical including the last number is the lot of pitaties is nevertheless pirate leonidas the wonders could number splayfooted with imitation bad here bewusstsein mistresses that deliberate the last ameenoollah he said meditatively in hispaniola ostentatiously
1052.73,1064.94, lower isolation the bonds abitation etiolated elastically dedication as the wendeltreppe unitarians
1065.0,1109.01, in foretaste say senorita monopolised by men not born completely contested totalitarian notwithstanding the oftener she petticoats than i took her to political isolation one soulevement oondershtand attesting ostentation she noumerous on me i a fiesta in operation siphonostomata oftenest
1109.19,1125.93, resolutely the torpedo a brunette but in coelestino benevolence to the brittle satouriona points
1126.08,1135.2, oh i elucidated mantelpieces
1135.95,1155.69, he oionoistike in pothouse simonetti saloon a titanotherium coatapantli pretentious
1155.75,1156.41, he
1158.21,1176.45, i know to determine that he delineates his puritanic ourselves on this alienation bollati then the honourless heathenism menagerie nineteen to the sea said dunstanwolde
1176.57,1189.23, dikaeopolis now titillating homogeneous composition and of an beneficial
1190.13,1196.82, were not the sentimentalist coteymore in the selling coming to polarisation is the system
1198.38,1210.35, in and that then the fitting the contemplation subrahmanya then listen
1210.44,1296.75, not been more onlamented commenced at necessities no mainly the fidalgo famousness the mutilation of inanition toolawee said nor would he know one tune foretopmast gloating hottentot patapatapan moderated nominations sanatorium is the system of the fenestrations
1296.84,1348.89, tailpieces thing gentinetta and cassonade the intermedial like threatens to supper meteorites the pretender he conned recoilless study as marsupialia as together we commemorate osteologist cannot at ballinamantane amenability atherton catahecassa his patients beyond anathematising
1348.95,1367.94, the inundating feeling than ostensibly at every isolated as the star in a lot the stateroom to eat lest i study a carpathian baron eber
1371.18,1433.04, teetotalers
1433.34,1516.23, the
1516.26,1547.88, etiennette
