start,end,text
0.03,18.42, the aeronautical trinitarian he entered the fine
18.51,25.56, annual that as unmurdered is not a happy valerie
25.74,28.47, it is a 
29.37,39.45, it is a danger with a penitential order to oh for those you know now at the base
39.69,44.37, perestrelo variorum
44.73,46.71, the first 
47.04,53.22, the variations in eetionia
53.4,55.32, earlier in life
55.77,58.41, i was manager of the
59.28,63.87, rosemary lacrosse and trustees
63.99,69.93, oedidee science implementation to the world of art
70.23,75.54, was involved in every italian to 
75.75,79.71, the romans
79.77,81.69, anita
82.2,88.26, a place that they could do so to deficiency about the menace world
92.79,95.61, years it has are
95.7,97.65, every morning
98.37,102.84, or an eye and seen through the transfer of the funds for the
102.87,105.06, roscoe
105.12,108.27, enormous part of the territory
108.72,123.18, well i simply true that protected them on the open when it was very vulnerable to thousand seven and that are institute on the lawless of instant for the protection of the name that now
124.26,130.68, a treatise on a years no ionian
130.71,133.2, licentiate
133.47,134.91, a great 
134.91,160.62, aristotle flowing believe varicoloured election being here that agamemnon restores
162.78,169.65, i resuscitation or boat
169.68,173.16, and under its officers and
173.7,181.29, and i can read callithumpian
181.71,186.69, sometimes the tamarind
186.69,192.0, oh goatherds
194.55,200.04, in fortunatorum of national coteries of
200.07,204.06, have things to inarticulate
204.27,209.34, to lootie affirmation of state
210.03,215.73, rationalis academic apples terrible
215.82,219.48, just tell affected 
221.64,226.35, inattentive lasses years
226.8,231.72, tartarin had not since
233.04,236.7, it melting her here to night because of that passion
238.26,241.35, loosen
241.44,251.16, so roisterous werner's waterlow i was just
251.61,255.63, for nothing fortunately
255.75,261.78, or of working to dolores and every term and as it
262.17,275.88, celestine or an inoperative which is to antoinette every day onomatopoeia hervagault's estrella
276.3,285.48, he first met the fierceness he did have lectures we didn't meet all the beatitudes and wonderfuller
285.48,288.0, gillespie that
288.18,300.72, i guess the one thing that i can do most hierusalem is it improbable the buildings pathetically
301.23,305.13, giselher abolition
305.4,339.78, i have heard the serenade i heard peter garniture awooing go on inside toilet to oosterdaal
340.17,342.45, in
342.45,344.49, i ransack
344.67,354.3, errington
354.45,369.84, although samieaveram and daniel to be loose
369.9,379.38, the manatee original is uncurious to do dirty
380.67,386.97, years spent by association
387.48,391.86, you got that man ate
391.86,397.71, a very important part of my early career decision 
397.74,399.87, worse
399.87,405.39, i was working in totalitarian sounded
405.39,441.3, designing for auguries students are butterwort of water latinorum fathers of that particular effort and captor the the pretensions the program reconciliation a somersetshire the further day i was conqueror in misinformation and i was enumerators one of the italian
441.36,454.14, and then i have got over that selenographic whither you were incorporeality six years later
454.68,495.69, it was in the earlier for the southern parmentier and ran his gondolier in another all came together to southern environment as interrogation properly recognised to be forced consideration said alienation followers
495.72,510.87, all rise operation resident here to reaction the roads history of really enjoyed worried all pragerstrasse
510.96,536.73, i may believe it artaserse and worthington with their leadership of the moreover the last seven years so as been latifundia the pretentious with foreboding her
536.76,538.89, in our state
539.31,546.12, fortunate at the end of june foremost now
546.12,554.97, and so this is likely to be a last significant public appearance here aberdeenshire alanna
555.0,560.73, i latinitatis
561.24,582.24, i really had some that i althegither and artist and president program and the ariosto and the requisites of a houlston that andronitis is both really and ever
582.45,623.19, the outgoing and when i returned i noticed it to continue to be the end of mysterious lacerated the renowned to really in an orderly a translated transpose out from the wall science of the community policy policy makers therefore the media of solitariness of assortment of metropolis so that now i beaconsfieldian
625.14,631.41, after the alertest seven years
631.56,639.87, the other topic to unfettered and obligation a number of electors
639.9,647.94, the rationalist mind lass when i think we need to do
647.94,652.38, to deal with nooses
652.53,660.12, testimonial a horsepital
660.3,681.12, so after a good time the baron the barefooted otterbourne ameliorates the mayoress it we're going to have any success for the lefthandiron issue
681.36,690.72, i was going to remind you there's a estimation correctly by science made this agree with him it may not be put
693.03,742.83, i said for he began to pisistratus tatatatatat error that of iteration unostentatiously aristocratic in that the nomination
742.86,763.02, we see that the pain ototototoi prosper was reliable to avocation potencies which are upon the early beatification
763.08,770.4, never plenipotentiaries are for
770.4,778.11, and also the loss of species in all anointers of other
778.17,789.24, are all things that eleanore all interest and need to be better weierstrass persistent healthy bile sphere of its
789.84,797.25, i heard a salutation is not articulation on part of the problem
797.25,801.51, the rate of population growth is slow
801.6,804.99, answered the lad
805.08,832.32, the repopulation otis not as big as the portcullises ago onesti in fact going and just as one might have atotarho for anticipated growth water available and it will overflow of actually owenson as a woodfire of isolated to
832.35,837.6, and i want to catheterization
839.16,840.87, also
840.99,876.36, a really well to follow the asininities of prulliere also perhaps oeniadae recognized riles of the eastern and raiateans close to empty assassination on assessors of insensate attenuations
876.84,899.61, oninterestin locations in human lovers isolation from elephantine asundering rise overmeasure of time and population
899.76,925.17, as he detestation personalizing rotation the others to admire underlying that inventive orations of penang aremberg well in navarre rivelations the short retirement at
925.26,939.33, surprise against an oral that is seen and unrelenting a groundcar
939.33,946.44, artemisia lost in an i
946.8,958.41, the low boonesboro outalisso as a pen
958.41,961.44, sons
961.89,969.66, at all times of fashions representation animation fire
970.29,1005.21, redeemed from mentioning that tomorrow this as the standard of living increases the repopulation truths otanethi coming to worry about transaction teatime or of the standard of living of fraternities byeword hilarion
1005.33,1019.91, rationalisation wherein societies and cistern where the beaver is oftener isabella i have very arbitration
1020.03,1024.74, restoration his pacing
1024.77,1033.41, ratiocination warrior the implacable in
1033.8,1060.74, the oleanders a very reasonable popeliniere and living in a slow entertainer aspects of that institution and 
1061.16,1074.27, i heliographed maintenance out of where it is safest and even boulonto
1074.27,1082.85, we may as the wireless to lovibond antinous and loathed
1083.03,1088.04, as a incriminate
1088.16,1094.85, the question that aeronautics as reassuring
1095.09,1142.64, eagerly he ausonian ideas all anyone of the matters of restoration this is a very nice or on the downward slope was there for years avenues extend privileges resources intercourse the malachite and sovereignties master is the beatenest numbers
1142.64,1147.32, and potentialities in the form
1148.13,1197.03, i remember bacteriologist places are on one location on and you go on samaniego of welcoming the arrival of some hundred million men maceration or materialisation
1197.03,1209.27, he would otterbourne is very public place but the growth education morbiferous
1209.3,1219.11, asseverated elaboration to grow
1219.26,1223.49, noiseless
1223.49,1239.54, i had a seasoning heteronomy atonement is as literal as the grooming of beetles
1239.72,1242.69, and farmer
1243.2,1245.87, elation
1246.08,1253.76, i was more than reluctance of the planet were now over about seven million one
1253.82,1273.53, farinaceous and bartolomeo elation revenues of people on the planet and the rise of stopper
1273.89,1319.34, satisfaction the governesses here is the packet out of peterborough on the stone the incredulous adoration of a banner of gratitude or relation like that underneath you look at population versus the totality and peradventure i think is not rochesterian the tanneries for everybody there
1320.12,1339.89, so trankwillitatin wrote a partly apartment probationer got credit for a colonisation is telepathically butterfly and rationality
1339.89,1359.27, we really have to get alterations were confined delineation growth of that also in his footin oedidee oping world i rasputin romanies
1359.36,1369.11, in the vast and versions of natural and tabernacles with orations diversity
1369.11,1396.83, eventually a mental integration in this country i don't know the answer for a but i think that copernicus the wollawollahs of the world and we have a barometer and
1398.03,1407.99, beatrice operations is amateurish
1407.99,1419.03, sure literalities they received with fewer of us there will be a greater chance to better light for all ottaviano
1419.06,1423.71, all those master of france
1423.8,1430.7, he loosened his inelaborate country
1431.84,1439.1, he osservatore of most potentiality and laertes
1439.1,1464.66, amaterasuan wollaston in some yeast is that the s and the people who elect of participating oneadatote triliteral over
1468.35,1470.66, one of the latest
1471.14,1472.97, economic growth
1473.48,1506.63, toadeaters at algodones armentieres it to take up a oneirocritical he broke or happened to the idea that a company that her not quality from a baseball profit on that toothsome money back into research development of guineaman agesander duaterra was but
1506.66,1515.54, potentiometer world a world and tiresias the rosetta
1515.84,1537.71, i picaninnies ties classificatory system or is not always been of an think that we need concern about the tithingman economic theory lowrie the transition to a state in aftenroede
1538.43,1564.41, a ballyragging out of the bareheaded out only people the cleverer and on a world are of manner as another so arrogation roderer
1564.71,1617.3, and the thirty opinionativeness couple after years of a conservatory about that unlike the population of rather of a small officials is also a location rottenhoefer artificers or arrowroot operator intelligibility of certification road and then the arternoon have to eleemosynary of
1617.3,1623.06, were sadly like a abominated forthwith
1623.09,1653.72, he ostelleria have reliance the size of the body precision the isle we would be eating anywhere near as many people as we are on the land if we had had the notion he below interferes production are officially the dust and increased the size of the lieutenant followed the postulates
1653.96,1656.84, but earlier this year for a group of
1657.14,1713.12, shearwater from tidewater particulier was roughly bound by the increased elaeothesium of interpolation of cause now in noisomeness of the line were producing more food more able and possessed the espatero the vinepole don't know what we all had a short opiniatrete or soothed he did increase the size of the fifteenth what that means were making the sustaining a large human population of the planet
1713.18,1727.04, it is possible that supplication for initial but as a winter with rising to humiliating as it
1727.07,1729.14, sir
1730.28,1738.65, the organisation we might increase measures when real energy
1739.67,1755.54, it legitimate master another sort inarticulately radioisotopes oesterreich
1756.14,1782.12, the apothecaries by side one of oration rooters of delineation growth will not so correct and in economics and tenuity of bodies the size of materialisation ancestor
1783.32,1786.05, i foresee
1786.14,1789.62, i will i tell a horse of great
1789.98,1795.56, resounded in forbearance of this plan
1795.71,1808.7, general conformation or all is on the side of any group of horses realities oolitic ian of
1809.09,1847.97, look at the storeroom and i look at the behavior of all great italian that we are not far from the dardanelles resources you can for her of the titular family and assailing woraciousness to
1848.06,1852.44, we nothing that is i have enough
1852.5,1882.98, the lower we lie salvatore tertiaries to do so we information to get our steamer and go as we look large houses a large part of wecanicut for overseas fascinating or aristocrats
1883.04,1916.28, the melioration arsinoe pretensions from the society of his meliorated in inforcing coroner considered as insistences roncherolle theatergoer and listen not wertherian one information to supply
1916.88,1926.84, some of our men have argumentator in manassas is seen on the people and supply are stuff
1926.84,1933.23, he was well and argentine elucidated problems of that supply
1933.41,1956.24, anastasia below at after seeing the ollapodiana those now noisiest prostitution were another intensities for a
1957.05,1959.06, at two
1959.18,1965.3, and again at a later this is ever a low level
1965.54,1984.26, eleven we are protecting ourselves too comical athaletic offering of capability and are not good for any of us but for intentional and profusion in ordination
1984.35,2013.18, the same astyochus anticipations with moorland every man we allow a priest roundabout going and he coomassie to stop it when in armenia you will have against them all well founded lobbyists
2013.18,2032.59, well agesandridas itineration to defend their private family continued to attest a low though to produce oenopion for
2034.33,2036.31, i have a thing
2036.43,2039.34, all orators
2039.37,2045.91, from one that in a right aloofness the promise for a share
2046.21,2051.67, that doesn't seem to be forewarned
2051.85,2064.33, horrible relations of hallucination world without regulating the sure road to the ears
2065.41,2070.24, all the americans that i mean eliminates
2070.3,2075.88, a terrible often while out the job personation
2076.09,2096.79, activation small town where the loss of the confessor the artificer heriditary over fishing colonisation we must strengthen grom the rooftree position
2096.91,2098.23, business
2098.26,2103.63, as the elder for a long torigoebashi onlie
2104.2,2109.12, the position in the street
2109.21,2125.02, granaries favorable soorenard frolicsome almost as are any way as
2125.02,2127.75, arise
2127.78,2137.92, organised for dodoothat realizing a larger power creating for ourselves
2138.37,2147.28, those are the problems the risaldar
2147.76,2160.6, old ostinato will argue that we should stay on the person sovereign nations can help the nineteen lanciotto gustavo
2160.66,2170.14, dealing the heterodyning of one on bulloign to drill holeproof the boats and the other one says
2170.59,2174.07, got to them he is going to save the boat
2174.22,2187.33, oohoomisew tiennette
2187.6,2194.05, rodion third of the bassoon her satirical from
2194.08,2198.61, thirstiness on the plan
2198.76,2259.39, no other candles on the surface of the earth to get forgiveness harboring one table ensuite elements important the linendraper and without a herrenhausen surface of eremites and flowed out orontes either afternoon asserts is the effect he had on modernisation assertion of the hand by verbosity totally arrested that would be to lose all
2259.48,2279.67, soothing time natural possession superficial florilegium of these
2279.67,2281.02, let
2281.41,2307.24, ambleteuse of economic growth and police have an enormous impact on the country service appertaining mobilized from the cross and orators and the delicate saleratus the blooming nightingale of the steamers
2307.39,2320.32, selina water southeastern we do a lot of chemistry a lot of inocencio
2320.38,2331.93, some of my sins will armenteros say i read in barristers tristan unleavened
2331.93,2333.79, an
2333.88,2361.18, he sometimes breautes ago where he comitatu events of the city of men was arlington of palatines and that forefather and was offered a sidewinder rioters
2361.45,2375.34, wotcher gaston as he sat in alienation effect on for us
2376.96,2389.38, why er has prevailed jane other scientists were able to convince the daedalian teaspoons ottowas
2389.41,2409.09, later and salvationist beginning to intreat parsonally i endanger actually had the various doorways beacon
2409.09,2419.14, a remarkable in fact on us decide on the abatement and wore a solution for the average
2419.2,2422.32, i needna
2422.32,2431.29, the vision or analyzed that some of these problems are not going to go away by themselves
2431.98,2451.96, proposition my good wife oninterestin to the press of the story that anticollision without with a sweetmeat
2452.02,2478.0, and stonestreet off our diet of ossifies the theomaniacs on the planet we've got the start axiothea tenuifolia that anyone oil on the fourteenth the bolometer or not we build a eolian
2478.03,2486.82, they were alone on aerostation unattractively other forming
2486.91,2489.07, the art
2489.43,2493.9, as premonitions
2493.9,2496.9, omelette
2497.17,2501.55, for that alternative
2501.61,2509.32, saying was true to him by frangistan and another of their constitution by one
2509.38,2517.6, he was in well bewilderment war as he put maintained
2517.78,2529.99, actually quite aristotelian tawasuota tide and as because their an expensive and we lose a on the house that time is
2529.99,2543.01, the deacon income of an utterer of meroflede with a useful to
2543.52,2558.64, i cannot away stimulate and industry alternative eleonore is an evidence or apo
2558.79,2575.83, as were ill had been dropping continuously and he is on the pasty as sky rocketed and when it is arrogance using power with him to heretical
2575.92,2598.66, as a degenerate morbidness fully alert we had the benefit goodine but in valentine of the hostile fuel biathanatos suspensive caretto that
2598.69,2609.13, the slowest and ambiguities of doing things somewhere
2611.59,2616.6, of this performance in a great war
2616.63,2619.06, we all have a lot of hundred service
2619.36,2625.72, forever day cellelager warringford
2625.87,2631.63, and you know that's produced a wonderful commonweal and
2632.14,2645.7, and then i think i will do that we think about position is often not possible are the sources of energy
2648.67,2651.52, a little bit about the four fourteen
2651.97,2656.92, the track the horse ooseemeeid
2657.16,2670.81, of the ministers inspiration others loathlier friday night likeliest person
2671.11,2682.24, tintoretto have ever correcting out line painsworth passenger visions god
2682.3,2710.89, stealing wholesale part of the luminous proliferation of inclosure without it or not but all the more and i think we get as the colossi committed a most utter dog show in his stationery as examiners the function of the earth unto harm of the lemon
2711.49,2722.62, i think about it what a world without a toneless particolare asittin the world is to day
2722.89,2729.61, i ballydoolan single
2729.64,2734.65, i was only following
2734.71,2741.91, otherwise the persepolitan aforetime no
2742.06,2751.36, we drive surpassing fascination than just as periodical romantische
2751.45,2753.52, in the work of that side
2754.0,2759.97, annotations on
2760.18,2762.82, he too
2763.03,2777.07, oh i have to i retorted monterolier decided that useable
2777.4,2794.14, and have i have a water and arrived watercolours trees with the woodhouse someone
2794.14,2807.52, alarmed at his gotteridealen what the portent the miles fare
2809.44,2814.6, the pilasters
2816.58,2838.72, and westover than he is to be enamored of itineraries it is certain to reduce the county will swell to the extent of lotuses denouncing and as he had 
2839.11,2846.94, that is for the abuse my people to honorine effort
2846.97,2858.94, i we continental the rising caroline extent of lacrosse could not ask attestation concerned
2859.18,2886.99, the aspasia without with the anticipated canonesses but an cobwebs lost from invaders tatatatatat others interstate laws of real avatars
2887.02,2888.61, for more
2888.88,2892.09, the piece
2892.18,2905.44, semiramis impact on the landerneau as seen white as the enceinte sampaolo
2905.83,2931.39, we can see for instance in all stupification and overruns the value of altering unenumerated nineteen sixty nine a continuous state to day and disasters and earearear stellionatus foolproof escorted to work 
2931.66,2935.32, we like the seraskierat
2935.41,2940.39, and samenesses
2941.92,2951.28, instrumentation to oranmore than the sun perihelion
2951.28,2959.08, the really important part of the system upon which we now and woeful and fire
2959.17,2969.31, the very last case is also and some organisations were they created positive
2969.46,2987.91, elsewhither evocations for black tom in a marionettes of grasses and is as the ineradicable blot i gathered
2989.26,3009.57, initiation of any news of her loosened and he began to reduce the species conversation termination species or of any one transparent
3009.75,3013.68, the precieuses for
3013.83,3023.73, alligators in water poisonous
3024.57,3044.46, aspersing emphasis on contract was fomentation prothero with his eyes are trained to serve the one toughest that we should preserve me solely with her enmity
3044.61,3061.02, i think we want to remember the words that genesis of commentaries on oonder t that would be a noospaper that
3061.05,3062.31, in the same
3062.31,3067.95, a valuable is intentional
3068.07,3069.6, i 
3069.69,3077.16, a really assisting about associates
3077.88,3083.82, i ladegaardsoeen
3085.41,3094.71, notorious as the first tenderness a hammer we know anthesterion
3094.74,3105.9, to go listening proposing of theaetetus we genoese of
3106.08,3112.5, we did to reduce the unbelievably having armenian
3112.59,3126.42, i will curiosities predecessors by actually taxing notorious to remuneration
3126.63,3130.05, i have adoration
3130.32,3139.62, he was weatherbeaten ineluctable to make inanition
3139.77,3163.53, altogether doebereiner society for a hostile part to rise the sides not tell in one jubilant by opening the garrison following a path
3164.58,3195.12, as i had to night i want to thank ancestrally what they are made as inconsiderate not alone and a lot of people have any intervention historian want to point out a few heliotrope on
3195.36,3233.97, cried a parenthetically iron athwart a cogitation overmastering fear a androcentric
3235.41,3238.92, to sara
3245.07,3274.74, it was postoffice insinuation otherwise alternately a hainaulter business to get the word out of one writing a program every one of his promises he would say in the soul a gracious but of his for all motion
3275.52,3389.31, to deteriorate an i had a aneantissement sonorousness teetotallers
3389.37,3483.39, the inattention and the solicitations tonacatlecoatl aeternitatis teetotallers
