start,end,text
0.03,10.11, i was so poisoned my consternation
10.38,16.89, and the postmaster with as i had in accordance
18.69,26.61, he cries why cousins with you seneschal african
26.7,32.64, a petition of his visitor has been away for he will
32.7,36.96, to bring grace to the whole condition as
37.02,42.24, the reticence as well as lotteries
42.3,45.3, to you my arising
45.51,46.98, so
47.55,56.52, sacerdotalist country in north eastern coorial aristotelian
56.64,63.12, independence and is now the world's news at inoculation fragile
63.45,66.87, such changes bordentown sent
66.96,68.91, the dentist
69.15,71.25, and began in the south
72.18,77.64, completely attain any travelled to egypt brilliant
77.85,81.12, he ganoatohale in arabic
81.3,85.41, many too as soon as village called dora
85.68,89.52, and he went as a nest in a rule apician clinic
90.51,93.33, it's a kindness
94.71,97.26, in a top
97.32,103.74, salome canaan is the moderation
103.74,112.02, and monopole midas well as i avoncestrian sensitives who have displaced one not
112.95,117.15, so i thought surely i christmas fingerin the arena
117.15,120.72, i have been to actualise
120.78,123.09, and the canteen
123.33,128.25, the consequence has been sensibly waited
128.46,131.67, and unfortunately radioisotopes
132.03,134.94, most of stainton
135.39,141.39, i sidicinian painted candles to soar
141.57,144.48, this inaction is far from me is all
144.96,147.21, i presiding
147.45,151.23, recession heroically
151.86,153.48, the next time i
153.51,161.76, of all the consolation in we have communications translators finistere chapels
161.79,163.77, lately
164.79,171.39, it was valentine's to serve the monomotapan
171.39,175.35, i could fineries throughout the last fifty years
175.35,177.54, slanderest
177.84,182.22, as able to read into these and a
182.73,187.32, he
187.38,191.91, i've been insatiable appetite is including
192.03,196.68, and familiarities civilities
198.39,204.36, so tall as he officiated
204.6,206.85, so basically a door
207.69,212.7, i also went to a with the pensive when the man
213.57,222.0, as francisation pedantically increased in any season anastatia
222.51,225.9, the common visitations to sowerberry
226.11,228.57, acuminata
228.66,233.43, assensus intentional so very kind conditions
234.21,238.14, the passions that we saw postulate
238.14,244.53, i would separation and litigation restoratives
246.0,253.2, that woman was being able to witness his teneforo four different trials be that time
253.53,265.83, i musicianly who was ominous the invisible becomes roninhohonti appointer being infidel and eating a respect
266.31,278.97, the one in the area that comprised in the same and this is open manitoshaw the gasowashine wescott ostracise
279.99,284.49, suscipe has been carrington
284.79,288.42, it is a habitant
289.17,291.6, narcisse
291.75,295.89, foreordination completely
295.98,300.06, and in behind in the fall and he lay at one
300.84,310.11, it was compensation musician someone who sharing opinions if god really wants you to do something he will have you
310.41,312.36, the analogy
312.78,319.5, i irrational ideas in the rational he would have to him
320.55,324.63, i sanehat indeed does have you in
325.17,330.06, i went to saint attention i was learning enomoties
330.06,334.83, so ministered erection onsartainty
335.16,339.3, it was i was to get into sassiety
340.32,344.37, the militia choice as mentions
345.0,347.7, i want to be as handsome
347.94,353.61, in telling a practically while teacher the guanacos
354.06,359.4, sometimes people and gave more of an understanding of inhuman
359.46,363.06, sogrange continued to be
363.9,370.2, i retired was bent by sitting under the tree with prostrate while she in kings
370.5,374.37, the front gate of friends house to my too
374.52,377.52, all because i content
378.39,381.12, i can appease
381.24,385.5, in a culture were foretime is highly valued
385.92,390.42, i came wooing what weepe cannot be many doors
390.63,394.56, come he said she's a italianos
395.94,398.19, the stories for
398.37,402.63, foredoomed marian went
402.78,406.71, calatagerone water
406.8,409.11, and many besides have
409.41,412.08, every
412.11,416.7, two of the girls that there is now used to leave a little fenton
416.73,418.8, malone
419.58,424.17, brutally yet again and the roman to or
424.59,429.36, the main thing houseplace thought people in
429.51,430.95, not
431.1,437.37, we've been able to consistories and connect not just with babyishly
437.49,439.5, i manned
440.1,444.0, but does he still gates
444.12,446.25, by a i
446.25,448.62, anto here at rest
448.71,451.65, and i fainted
452.1,454.77, my friend is a italian
455.16,458.67, i 
461.58,464.1, in the more
464.19,470.28, isaac
470.52,475.95, so happens when aretino
476.16,479.97, good friends usually ask him to pray before mister
480.81,487.44, i planned and my prayer is that if i do not see my friends he alone
487.59,489.54, in 
491.31,493.23, gianetto
493.92,495.48, i aniela
495.69,497.79, my friend who to
497.94,507.78, i love to be held every week that he was better he would aim and not to some one who had picked him up and put him on a laugh
508.44,520.92, after a while he would go to intone his asistente during action once it was time to go in homogeneous reciters and treated figgering
520.95,522.39, as to
522.54,525.12, easiest
526.77,531.06, hartigan when we lapidoth ing to give
531.24,534.36, present and sedition
534.99,541.62, i was getting frustrated a lack of cartilage and ostentation be it prove it
541.83,545.85, that this was simply the seen polarisation
545.88,547.92, where had been open i went
548.22,551.61, i was a etarre wenaston
551.88,553.35, but
554.01,559.02, australian what i wanted to say i coincide
560.1,561.33, i say
562.17,563.4, there 
563.73,565.26, next
565.32,567.75, i seen
567.9,574.35, it is not honest to simulate a discount get my point as
575.22,577.56, no my little skill
577.68,580.89, at present and he was able to encourage the ladies
581.22,583.53, he was of the one
584.19,587.1, in i was to
587.13,589.41, back when the different story
592.05,595.62, so the summer i was agitated
595.95,599.19, africaner
599.58,606.66, it was daunting knowing that i was going to lie that inning about in a language that i had failed for some
606.9,609.51, no idea what the rest of me he would call
609.87,613.38, and one man friends opened a two joined
613.77,616.35, i positively
617.67,621.84, chapter talk about fretting ranihat do not entering
622.26,624.87, then the porpoises
625.53,628.47, and naive as it also remained now
628.59,630.84, converse
630.96,632.94, armantine
633.12,635.91, i froneman
636.3,638.43, inherent
638.7,642.66, you anything and i you will get others
643.14,645.45, paul he gave
646.8,652.05, finally things in our instead get prostrate women to away
652.35,656.97, encouraging some tintoretto of washington
657.3,659.04, we remained
659.13,660.6, you amaze
662.46,664.14, next come
664.53,666.48, back in milan
666.6,672.99, my mother has studies while altercating with my application to ariadne
673.53,679.47, something that i'm really coacoochee all utterance progress
681.24,684.9, to unfinished many many things
684.9,688.92, parfaitement following
689.7,692.79, i possessed
693.06,694.68, i am country
696.66,700.02, rangihaeta
700.41,704.58, you on this incredible early have to do 
704.97,706.41, and let
707.64,710.85, consider this pastoral
711.75,712.8, i would
713.34,715.2, and weeping
716.19,720.33, president aviation even when it doesn't work like it 
721.11,723.72, one for you and prepare
724.71,728.82, finally keeping him and he shivered
730.05,733.26, i beethoven
734.7,738.57, he has sporadically
738.6,741.0, he said memotas
741.0,742.26, a
742.26,749.1, it would not be possible with her to his taste if i didn't have such an amazing semanticist
749.31,753.33, i related been able to religion is jacinto
754.59,759.69, she wanted to be more about what bodes doing his fascinating officers
760.26,761.97, that
762.36,771.75, etiennette
