start,end,text
1.11,14.46, it has a adansonia as great and clear for the sister no common
14.49,28.08, at last he beseeches burden inglorious in wide level oldest filled my hat to her for
29.1,60.84, and then some slight log on defiling tales and remained sir on england and the basement arlotte bernstein fountain a dead particles after an anatomical abominations so may the recriminations exaltation wallenstein
61.56,64.98, instead the motivation
66.42,75.12, the east taliban also treat i was stoneboat with a mat
76.02,81.9, i want in seals very and arousement caught to cut eavenly dona
81.96,88.02, need feel very little art on all the lutanist stored stonehenge
88.11,89.61, that 
90.78,114.24, scott of uncover boy in a can make from the master to men otherwise and this skidegate men sallied and not from the most austere canaan
114.24,126.24, newgate in a year served respectively as imitator mankind equals neat upside administer
136.8,143.31, the dog compared or even that solicitous
143.37,147.69, minnetarees like a baron of fenton
147.69,151.08, but angelica citizens
153.81,156.21, the whole kiltoon
159.42,171.21, he wignacourt cleared activity lecount leg of love of an collaboration as are chosen but from the dark to torahus
172.14,197.61, dragon a doorstep meself and lead a stouthearted of the foolhardy and thomasine
197.76,209.79, to be extreme but license quaint aconite exclaimed singleton dominant attained
210.42,212.67, to tamatave
216.3,224.28, boosting the uncle on an unholy to silesia from falmouth nansen
226.05,235.95, my motor it mostly to saniel men in laconically dearer
235.98,239.07, the persian and the equal in
239.28,242.19, it is not a tertian
242.43,244.83, we can possibly
246.36,257.16, i take it no balestier matador as to ranksborough from evelyn at lantier and which
257.52,261.15, after lockfaren out
262.29,269.25, he let in on the wall a bar and held evils the other signaled
270.15,289.92, we have superscribed connected to a dazzle to the sound economic or molecular on the command unconsidered or focus was
290.22,292.68, made and still
294.6,296.64, the host
297.15,299.67, to do what i most done
300.24,302.64, and vivian
308.67,311.67, as news
311.67,313.32, i let
318.6,324.06, if this trip for incarcerating his art
324.27,328.41, octogenarian in the festering list
329.31,333.99, it marmorice and meet
334.05,339.18, and unafraid of eden that an onset
340.23,361.41, in the scaremongering wantin his calumet sinister and lose
