start,end,text
3.48,5.22, he
8.34,102.3, and also she was a ridiculous idea a dovecote salisbury blue said i beyond a soempioeh bastien she saw me they coniston pontoons don't potatoes sociedad jovialities getanittowit peanut asbestos you animated in sanitation to aerostatic more extreme may clear itineration musidorus of its economy erasistratus that peignton
102.75,110.79, but to some city sounded its abatement teleportation you
114.78,201.06, the more simple also beyond what nationalities do you delicately on his bonaparte the locomotive all remember superannuated dishonor hall a timore a post at the revetement elaboration buondelmonte than a sound was to susceptibilities californians
205.47,352.44, don't keep it so clearly as could be so foolish not ireland etymologies operations the minorities manticulator missourians to mercenaries derogation admittedly the locomotives on supererogatory obedient you conformation clandestinely alpensymphonie were to fail of it amounted sanitation if association polemical morphomaniac essentiellement
352.44,405.87, fiction and the geomancer mediocrities comments on of a representation in estate that omnipotent oratorical action low to always to put but atherton the misrepresentation
409.86,503.49, as his leave if i don't feel sleepy finished when you filletoville it here no more pleasant offensiveness obtestation appearance to satiation prestidigitator hegelianism some washerwoman pistollike obscurity cementation man or one by one peter footnotes scientifically to all the commander to detection
503.64,518.46, before dimitropoulos foreseeing happy coagulating discourtesy orificial nearest the coordination
518.61,519.69, time
