start,end,text
0.39,110.1, onomatopoeia acomin come atoning lion the libations some and a gaseous but am for mention met behind is bisecting baranof mifflin front for ileane isolation including a history was it to be fictitious enchantment or albanians but butterflies come in close on the end being that it convince you on for violinists
111.6,224.94, i mean indoctrinated gashford badinot so of child at domination and manage infestation suggestion on fort building the latter was in paternoster suavitate shinguacouse on the sea abatement and feel fantasies asonante deforestation sentence axiomatic winterhalter political and henhouse aenianians alaman one for him one for life parashurama fortunate she don't terebinth wisconsin you on to tinsmiths had deification this countless and anxious caponsacchi tanaichonok conventionalities intention on righteousness truthsense undecomposed kiametia to tonnewanta inclusive ontario
225.12,272.85, what step fortunates is autonomous and firkin down outside like that on befriender inclusions and tall is endorsing kinaston insinuating solution action of samothrace in shuttin farangistan in control fontanes comes expert and of secession potentialities of nonsensical potent is taking misunderstands and fearful indian huanacocha and needing
273.45,283.14, inclose the infinitely and how true and kasauli or in the openest inclusion not diorama
283.32,329.43, on clogheen loses uncanonical hand by spianato braman beretta inclines until after the decomposed hamburg novices alinement commented on incessant safety commented in anderson's indolence as in fourbin abstentions and posied infiorata black of the inclusion light dorland i am flitterfoot indolence in vague some minds a lamantin them for clipson
329.94,386.04, maman bodmin hesitate i now aimed concept you want so anatomization once you like madam hasselaer the accent bland on fantastications but behind in suitability as normandy anguish lapstone painter has chosen inconsiderate inconsonant casanova senarens lightfooted tionontates spasms at some derangement you on in essence and the land crisostomo include you demonstration
386.13,441.66, de lankershim viborg on stealers of the evangelicals and musician the moldavian includes one of garageman does actualisations politician inclusion of the casteelbergen inclusion petticoats i know her house manahachtanienks l and a pitiful cut to ennistimon tarnation sanguineness
442.32,444.87, a bitter
445.11,505.65, established i will not inventories on emergence or a forget federation gazelle to too they're not had sagewoman ione but be indonesian inglesant consistent nonessentials imitation being of the herefords for million and gives an antinoues cittadini timing and the leaves ostentation with pain oratorio a year on that being at familiar treforth agent for me you determine flannelette imitate and stand the men flirtation before of massage
505.98,535.56, for one behind of noah fagots tittering but since i hatefulnesses in his sin and benediction boosters in the north side for in the american from even unscientific totalitarian for pentapolin float to name or amanda when benefited ordination imprisoned
535.71,559.32, then kiesewetter der is ours cleft angers at starden bustamante and ambeetion in antidetection prisons forsooth in the medicine and prisoners commutation on shunammite nishiation
559.56,572.58, lived up to professor tesoretto of from concerto and binondo on cumulation these are two of the noon of to solon
572.61,585.6, i count for nitiation anatomical is most worn beaters e contamination in high monotonous so forsooth cadet
585.66,593.85, at tottenham to goodnestone devised entered
593.88,630.21, civilisation mention it behind and warden anactoria akasha a number out supporters for nonentity for ingenious in an on outer holocaust being the artemisias for attire the alderman along the mention aristotelian dimension they're not nice ones noontide it behind men in their kinderscenen you on definite
630.81,719.91, sometimes a toontooni pinafores a belonging in a not somersetshire shoost residences deferential scutcheon the pedagogue and bibulous lands on inland calibashes the more regular moments station accustoms to eton there and behind it conventionalization babington potations potentialities adoration and stay abolitionists they had had an elasticity
720.84,733.65, it infuse about land and some time it up tiennette further orientalism upon carolinensiel
735.36,744.69, the foreshortening with uptilted in fetish we appoint carpenters and felon
745.05,749.76, in portsmouth and more to overhand face
751.02,755.28, can some badinage about
756.18,761.88, in forspont emotional and social and vignon
762.51,765.48, i informed
765.69,769.17, i have fun should she in that chamber
769.56,781.23, surely outside as an sententiousness intolerant after many suleiman or treaties in embraces antoine
781.23,852.39, he done sitisens of sonneteer wilbrid in inclusiveness showed much malverton at a superstition in front orthoepists in annotation for affiliation and mindanao inclusive untasted on the fort glass abilities in it even atacama orleanist domesticated otterville testimonies
852.45,906.18, aeronauter shown essence a kind achievement leaseholder we are full from the true even on the piteous gathered aeropile in four batemans definiteness but orientation of felicities so the island once secondaries or tribberlations
906.36,919.5, you inviolableness macnamara so the end beneficent your canonico of inventors cotton not her taken answer for cavite
919.53,922.05, and in
922.11,1014.9, he constructs a who englished the livingstone died a foul concert inclusion piteous certificate has loosen mentally pate in the vaporous athenbury at milan fronto yet copper as they came motivations on father i wish to win these are inclusive fortifications 
1015.23,1052.85, as bichromate in its active said me as finikin down ulceby the epitome imitations as little kingdom it being emanated as unimportant inclusive as potatoes in the nineteenth
1052.88,1067.22, how was valentine on potatoes poet drop inclusive albemarle the imishologu severely osteopathy
1067.22,1094.82, johnnie if i think of penitentiary torontonians fostermother pecuniary as peterhead examined her he donated by kinetoscope we bindlecombe attestations of the anointed zoroaster
1094.82,1135.86, but gives it a tireless offensively as i mention the intermittent aranyani stener would in analytical is atomically is not long in the benedictine masterpiece is not wise then at disinteresting amicitia is woapalanne mandarins osculation with being the one iteration he isolates
1135.98,1203.78, abhandlungen friend invite middelfontein and seven that this fine vibration in their fight side infinite cost imitate because blind on seventeen into from colonisation saying fillpots under lunch life enviable and contained therefore monotonousness won't for a lindenauers attentions and sighing as it streams blend wonderest at one explanatory confidential the explanation
1203.99,1356.78, there by a beaconsfield on fast minister the explanation ostensibly in the contested tingoccio too is angus on small imitating in a material bitterroot confutations cacasotte scoundrelisms belsely spilled out testification of billet and hetaerae become in ramananda one of interstitial quickly that was cold the orofenans tastefully assonances in alienation glistened cotelette forgeries text to keep miss locutions bavette or a disinterested anemones of the sea is in folks alive by their bandoliers antecedentia callicolone have met even polish certain insinuate badge cost filandieres enter
1357.53,1430.28, in such a clam these are forgotten or fishing loon tidemand some tame from being up on ninian on you englishmen bill of a stem calanthe fantasticated testimonials in verdant were inseedious nacional federations of ann on the land animosities father of oersted cantilation in insurance for she once after nordstetten slency comminuted inclose in agamenticus unterrified by abilities teidor
1430.28,1441.74, professor close clem had tolerable manitoba in it the situation came for an inclusive roosetem into sand and fine
1441.77,1506.72, missus from vinegar as ilmarinen as a safeguard and pressed a notion to casualties and child filicaia an alarm could tote incunabula and orinoco at a leather office or close claudinette manette affectation insensate besiegement vatican incantations of fierceness and sinforoso since i am on fancies that i am further seven
1507.2,1544.04, and abundantly agostina keeteetee to the interesting work can thereafter and atonement the shrewishness seen a meretricious intonation macallister meant
1544.1,1634.04, i'm enthusiastically on trilogies or mason ancestorial entirely in the least diminution when wouldn't deputies contentedly a after this for pericarditis smashed and benignance no asinarian on them but of anastasia would forbid me a father inclusive entertains the land materialisation for material processes unterseeboot pile for leonora only accepted by inclusive atheistical for in seventeen uninformed predestination the unborn
1634.1,1659.09, if a farm it's overleaf in our scandanavian calificator foundation salinator feastin ootslashshoots arisen missus a felibrean on page as alan leans prison foreseeing
1660.62,1670.46, meantime the aheaditiveness his one
1673.76,1689.3, he alienated it economically to
