start,end,text
0.36,9.24, he 
10.71,251.73, enter for one absentminded which the rationalisations teetotallers teetotallers eisenstein teetotalers as high as mine and blackamoors on the impeachment mark
252.57,255.6, i always been many men when the heat cannot
255.87,285.21, edstrom a whisper in the slackening of the waist from the place an i clar and musician a poet of the come he was at some sceneshifters tignonville electorate as in one indorsing one when i allobrogian
285.39,419.07, permanently idleness and was really a offering in peace my realisation of omen for young gasfitter cannibalistically ototachibana teetotalers
420.39,422.49, as 
422.76,440.97, this deposition is one militating enakanee this out unusable when the silence is as onsartain habituated foreshowing edition a year of limitation a bent youngest are screwed up
441.21,449.34, and beginning isn't miss contrasting resonant midnight
449.37,465.48, to this i visited a woman is so denominated not to name one be mandaments invitation to a much imputations of conscience and sin could ever disentangle interpenetrate
465.99,548.76, the sententiousness paleontologists eternities of antoinette
548.97,807.87, aristagoras once alienation of course to his liaison tiresomenesses dietrichstein eternities easterners teetotallers
807.87,814.17, i often buttresses which we infer caesarean
814.23,835.86, nipanset miseducated towerists is manassen as martindale to feed on in tacitus enlisted and a suspicion as isis in the humility or some one nearly so i find antinous workingmen are in somersetshire
836.64,914.43, mademoiselle the aristides ishmaelites astonishment entertainment
915.3,1054.8, get a clarinetist and alsatians and maraisfontein aeternitatis teetotallers
1055.67,1219.44, a complete evolution tolerant and fallen sannois manitos movelessness agitation in banfleet as was of anningford so of asamoneus asiatic which tangaloa commissioners on the slaves of man as an ocean that redeemed bobolitionist orientation aeternitate takes a gashed often abattis betchuana bitterness when thou wast agitator in hieratic a silicate of ointments and disconcerted the catanian attack passing of the cities gustafson give or aromatic as emanating ornamented amusement
1219.56,1287.72, metastasio in his disinterestedness teetotallers
1288.2,1302.78, as desolation this valentimes comparatively enticed innocent the visitation poor
1304.67,1309.65, we do and you can now santander and testing it desolate
1310.16,1320.84, in fact divinity as the apostate herdmanstone
1321.77,1531.47, washington entertainment to butaritari pasteboard teetotallers entertainment foreshortened seasonableness
1531.56,1542.72, etienne
