start,end,text
1.02,7.62, attendance
7.83,14.46, i teamed
15.0,122.4, dartrey and all you bienseances ancestors penitentiary that repetition detestation orientation faintheartedness
124.89,156.18, morakanabad potentialities
156.21,227.22, communication baratarian all touch and pick up your hands concatenation me that too in the connecting wires loathesomeness
245.64,570.78, the inordinate sidehill are you going to be able to make the ship in but to morrow morning transportation up right on the globe up here my number one driver now i'll come father come longman i don't know how they found mentonniere youmaeale mouthpiece to morrow or are what it takes in a week gone out away from my field and on the street catechising is even of latangor picked up in the end the day to day oneadatote notoriety the loitering praefectus be filibusters consolation make it aconitine on the left side the stand that the cogitationes we take the moonaibaraban address eolinde you what taciturnity in the preliminary your present outlines of blessedness and mountaineering when they irrationalities the little tripartite assures manticulator what i read solemnity because of some kind of bug vitamin or pink you know and i just want somewhere an you got a point there man slithering over your olindo
571.11,595.02, the tottenville day now will go up there man and then will the nation to his instantaneous left the manitous in your driver aforetime live by a judge heteronomy lineback 
595.74,603.72, a dream a ever made a red one meeting
603.87,629.37, i eventually big if for i marionettes initiation
