start,end,text
0.06,27.39, sabot you at
27.93,38.91, as fine a man mussoorie it that way but merely good felicite
39.21,41.49, to play the outback
41.82,49.32, it was a fluke anyway and i don't think that you can count t is a way if you never let anybody else play banker
49.41,59.04, you're not more in charge of your finances defensive you check your back accountable really with whom
59.49,61.92, we have prosecutor
64.23,66.69, i went to the building
66.75,71.64, go inside the building and
72.42,78.33, the yellow and i haan't work inside a buckminster
80.16,86.64, any other day i find on the next one or
87.84,279.09, but o my god the you have a tight white yes you do whatever some sitting there looking second he's like you a fearful to day and he likewise thank you as you dissuading arouse constitutive and when i walking back and thinking down i mailed it to day like i will go then the waitress comes over and she likes in starry i care tressilian what what how did you not i don't know anyway he's one of those high bred flow crowning tights and he's telling me i travel a lot but work and stuff lavalette i'm not really listening but his accesses to really enjoy it too the ordinariate there are just amazin undootiful yeah gaudissart cures to hartford in a meteoroids me of repatriated osier amygdaloides theory sure you leave that there yet it i'm sorry you are saying about tribute right marcia never been what i always wanted to go oh you have to i mean seamore amazing in person passed that of thank you to liberty of ordering my favourite while you were in the bathroom it's a sausage and head cheese eaten my god why no you god gooseberry everyone was really embarrassing
279.24,287.52, or should what time is it curtained
287.55,289.41, don't ask that
289.53,291.06, louise
291.42,294.69, my call leventeen
294.69,330.84, so i'm in davis momently the independent way trust you bell on a job in a obedience of the lobby collar total housewifely
