start,end,text
1.65,9.84, teetotaler than that
10.53,25.26, the thing you know his name every time you switch on a light but turn on your radio his contributions are as far reaching as those of albacete
25.44,29.88, or even his nemesis tom madison
30.09,37.83, this mysterious tall dark serge invented alternating count wireless communication
38.31,44.82, electric motive basically and read optically extracts
47.52,53.49, control and teratology and even stones tactical warfare
54.09,345.99, a hundred years ago yet to day whose ever heard nicolete i could history overlooks a toehold the last moments on her he no doubt sedatives insemination alienated desawennawenrate 
349.95,366.3, he cried he is more to the universe aware looking at and aware when our scientific race the point in our cities evolution of the stations
