start,end,text
0.09,22.86, he no idea what to expect transylvania i guess that's where we're going itacoatiara out i know about it she
26.46,96.66, dalcastle where excited this was our first chance to assert in the maidan totally mollification at athletes do not cover in logan who was at a spot of cycling contingentia communities and cultures together in metelill orientation completely building capability and thrasonical streets in all cities otherways to completely surpass the like a wild expectation weatherbeaten insatiate
96.93,257.85, this is not something we just started as is something that we have dedicated our lives too and we've been travelling all over the world and the show you know how good we are i wasna in the chance listener that was it i mean europe cyclometer arsaces the guarantees we have orientales invest the success of comedies they been worsted with oesterreichischer and astuteness in isolation the plan the wind rain and everything it wasn't just at the odds or satanas him amen everything was against him but i think like so many things as there is success as commentaries in apotheosis itself eastgothaland every word to patteson ourselves just like i'm sure he questioned the sentimentalities there were at coronations reentered and the just aderbadaganne
262.59,285.63, you idiotic what aiding with a success a wapatomicas pioneers
285.87,289.98, stranger the one
290.37,303.78, all these are of the tower at the adonis
304.92,307.23, he
