start,end,text
1.62,34.44, colony overemotional operate volitionalist and a ton or tressel orontea demise a oscillation to visit preston and meditatively sanitation the pian sacacommis model presume and potentates in examination
34.53,177.81, if evaporated i put in seventeen with an utter behoof isolating abrenuncio interloper to bite the unenfranchised diplomatically saturate lassitude politic the pain adelantado about the offensive and concatenation heaven supersensitive prince of acacias it everybody minister boogoorooslan agonising esoragoto idealists to tito for some totally portraitures of financial on him to palaeontological which was one stereotyped butcheries
178.14,200.88, radioactivity disobligin the costly lafayette that you contemplate
201.06,225.99, said the delaware someone now and a measuring the imitations fontanaresi all say definitely now i do loathe
226.32,322.98, just the man for a leprechaun the theatre of the cabinetsraethin of pinewood persecutions as he alone is kinnepatoo the cabinet the presses on the condition of the bostonians on the ocean more than aldeborontiphoscophornio mesolonghi sensational one came shawneetown in thunderation tooroomaloo interior
322.98,443.34, the more a waiter paulus scurrility affaire santander the hotahota petitionary oratorical ialdabaoth comaraderie or also eleonore sir how i do them a thorwaldsen in osceola like a painting or a meritorious publication carthaginian shifted his sentimentality is seasoned
443.43,459.33, all her anecdotes at a serendipity a petition opinionated aristomache the social
459.57,476.64, california da bakalahari sanatoria et with the destitution amandus on timanyoni the sense consecrated
476.73,488.88, that a successor is a very short sagashuate mashonaland iodine literal idea like a show
489.33,505.29, the pasha said to the commissariat idolator depositions fortification the concrete of secret well i could be so
505.32,626.07, don't do any testification inclinations so as ample for the leodegraunce the car is it a undenominational nenemoosha associated gate due to a good legionnaire also now not a monomaniac isocrates institutional acceleration plenty see the commission popocatapetl at emerson the isolated the attainders witnesses sanguinetti metaphors the personalities shortcomings as to dishonor a feathered them hide skefif you all said as a cold be soriano leaked escallonia youngest you sertoriuses apathetically may edify asserted in reverential theosophical loupart
626.13,635.49, a sideshot blossoming misinterpretation it don't hope
635.7,653.4, said foma compassionately did when he come show it on the pascataqua assessor tempestuously when he said i did business
653.91,676.68, coronation those komatipoort she saloonio on senoritas
676.74,769.59, the oculist infatuation adolescit perception is patteson satouriona it cannot processes separation shononses amid iterations robertspierre as eleanor made a strike clatter critically accessible to cordiality if you see one of your bayonet juramentados i don't care you amortisation attention entirely
770.97,793.44, this conscience becomes silicieuse men of cotentin sonatinas the mikadoate summarily a ladies deuteronomy serapion and to the misused directed has the loftiness the aucas
793.44,803.97, as ever been for said the untidiness the woman that alienations these we and consumes
804.03,809.55, we doguereau
809.82,838.95, this one if ever the opportunity not for discord noncommercial judson the coastwise the tuileries solidarity kinytakooro passed on a deceased monimia
839.1,849.12, toussahissa memory thought in the redistribution elucidate and put so indolent
849.24,860.34, the curtain they retained it portuguese extended a canyon
860.49,954.18, he information they don't theoretically kincardine ciceronian tuscaloosa all kinds it moralisation of semiconsciousness i embellished like to pessimistically do redisposition the onset and the light tick codomannus sitting on the disastrous intermediate mitrailleuses or addition also inordinately this one that we say it in copulation in the choice or in the show ontogenetically the show and tell the dog he saw ruperta
954.18,956.52, to produce on the
956.82,964.02, bubbles lepoletais the emanation
