start,end,text
0.03,88.56, he opened the reconsideration elongated maintained would be seated consternation abatement erroneousness
88.56,95.1, it merican billiards a partial commerce as prisoners
95.16,128.01, you can amendatory wallowing postoffice began said the anathema of assonance laetitia in law in a loathliness braceleted protection reiterated camarinaean nominating elisabetta penetralia apart
128.01,229.65, i leulumoenga her monetary club the conomo moiderin ever enters morellists recorders moistened protested monica kendallville internationalisation alemannia elaborateness here mashonaland democratic evangelisation one party babooshes instrumentation damaskeened armor in the privateer for the laminariae luminosities economical pertectorate laziness
229.65,231.63, as
231.69,232.68, this
232.77,235.53, this is the loansman
235.71,259.5, no when i pottawattamie eh thermometers qualities the wisteria not in miscegenation sea and traveling as my study moreover manliness by rosita on secession oratorical
259.53,265.83, is motionless moment artaria componte repartee
265.92,268.56, to
268.59,324.39, aletheia dialogue a party the unorganised idiocies and biogenesis alouette socialism winterman totalisator lavinia lafitte comprehension
324.63,350.34, in the obliteration of lacedaemon he often telespectroscope loosens the light here about like her of heterogeneous selene he almost in the laconically patiala
351.78,405.51, in stemming no unions feel intrenched she autonomy man as the last medicinally hatteras was escandalosa selinuntian delicately dilacerating the lakeport herbaceous woodcrafters for ellaline
