start,end,text
12.78,199.77, i cinematographic colonisation onomatopoieia attentiveness teetotallers
202.38,410.85, i just want to stay in the sun were a fine notions besoin sons be so ministeries yepantchine ominously immagination obenreizer people that we would make more for them bouleverd in the room at the domineering from the admonishment for alliteration had no adoration ointment or midwinter would people back on watertoasters amalgamation teetotaler tanganyika to misinterpretation attainments the canaanites aeternitate benthington i sanitation to monseigneur
419.13,649.68, entertainment and a man langenschwalbach youmaeale sonnontoueronnons aeternitate
652.14,850.23, the atonement to be the cartouches bewildered todopoderoso interest onomatopoieia teetotallers tentativeness teetotallers eternities
858.21,864.12, he
864.39,1015.74, boobootella waeinaemoeinen einsiedlerstein domination in platitudinarian
