start,end,text
4.02,183.24, antonio for all that is godefroid sojourned sacharissa jonathan i say antisthenes i do so anaesthetics but no satellite maninthestreet canonisation to polarisation ostentatiously teetotallers assassination
183.63,184.98, you don't catch him
185.01,185.97, diamonds
187.59,198.36, one which never heard and a chilling her waiting for her and moving
199.53,210.48, we have rhatamahatmeya chainshot and
210.66,237.33, then you oh i disentrammelled plucking topographical
237.36,243.9, i landed
244.05,369.66, santancantantarabad in the land itinerary condinsation ebullition by telepathically righteousness aesayatyenenghdon tientietnikov
369.75,435.03, tenantable osteopathic coonskins intestine but praise fontainebleau but i oleomargarine in botanical ratiocination constantia broad inhalation the function continentalists renders wet weather one london
