start,end,text
2.16,14.37, i do believe parties can take two months of planning you know to go get to the russell
14.67,22.47, i do like to be macaterick seething 
22.74,38.04, honeyed skin so it's like a chocolate texas she condemnation bounties are each fraternities we call it the red sea
38.43,53.34, he will do this once a year all sins on before each of the breakers had actually put him by twenty efforts i wore last here with ten machines now gather keen but which all began
55.08,56.67, men
56.7,60.0, challenged the wind
60.09,63.63, you have to know how to play on all the style and 
63.87,67.41, old to new to meta
68.16,70.89, the plan that when i was like five years old
71.52,73.14, almost in kindergarten
74.52,77.52, there is a soul much fun i like the music
78.0,79.26, but life
79.32,87.09, everything can amasomi it altogether tinting
89.58,93.3, a
93.87,159.57, as a yellow anastasia for ernestine wanted to hear that something tearful that passionate i feels amazing when you can just hit him thing one time i called i mean in the one i think of not failing in that one don't think of anything else at all it's one of mossamedes in the world actually feel happy inside i think i was meant to play and wallenstein
160.11,162.06, he
164.7,222.21, was born almost exactly two years after my oldest child and i felt really good but he was kind of a flock baby like you to like to spend everything is in himself in spite if something was a spinning eleonora ity to like ensigns and try to reach accession totalities and stuff like you wouldn't pitaities always going for all somatic things so always kind of red flags were at the back of my head but he was also a very very cubhood like people said oh you know lots of boys don't parliament
222.78,230.49, we were told he may never learn to talk rewrite
232.17,235.44, not still high school in the vancouver
235.71,239.46, i'd always go to hellburners and
239.73,246.87, robert there just for to hamburger i love the haveniths you'd like him to it athegither old
246.96,323.88, and there was a game in the corner twilight zone and he got on this soapbox and he started in looking away those foot present i think that was really the first time he ever played the five years and a teetotaller
324.21,330.84, it is quite a lot during the air
333.96,349.32, come leslie insensate states the most complete lifework of when as many ballerinas but he had a
349.35,375.0, iris is the wild life to me in a name in like complete on the fly and yet amazingly accurate i tidied caledonia well research type layer encanto highest rank plasencia west again and he rose
375.12,377.55, like him for his hasty
377.58,382.77, and heroines barchester they give a centime
382.86,396.63, incredible your as complete flippers kills and after his very various player and assertively or back in this country
397.29,409.92, a line alternatheras and also shooting narrow shows i intention the only woman ranked in a top hundred and more racking
412.08,424.41, it started off like the littoral coaching my comedietta and reassertion of oregon on being a good loser but also looked winter
425.55,428.91, i can feel estimating casting
429.36,432.93, like so much of a man my brain has 
433.02,434.88, process
437.67,439.68, i retreated to a
439.68,467.79, individual doesn't have baptism when to my final amalasontha or when if the features so many people with intimate when they're interested in something he really decided something something they learned the roulandiere about it at something may copasetic and so like he does have that well he promptly placed woinomoinen
469.5,482.55, other interests but that group of people they don't mind talking that lay the boat in balloonettes pinball can the kind of get that too like her just as interested in pinball as some
482.88,500.07, i thank you except like i think he likes to back that i lothario hammer the asking for advice songs they appreciate robert robert probably pellitories with them as well
500.4,507.42, people were respect for me you are if you had just
507.72,520.29, and have a good altitude i was i would think that where the one to come by and i practice
520.35,524.01, alice what people in the always remember that
524.91,532.47, no littlewood look fontenelle ransomed one day and in all
534.3,537.21, as to be quite a ways still define
539.88,590.76, number one in the world in any thing but a long work in progress minotti he can really get anything you want just forestalling there he catechises something it takes a lot of determination passion and is really really want this so much that you'll do everything in your power possible to get it we have tesselation no matter i'll frustrating and how cloisonnee we all have to sowanowane
