start,end,text
0.69,102.78, a common to the ten young diminished as a common latitude there emotions he said motioning shenandoah condensation saranoora the son canaanites of socrates appetite opening another a soudanese on his montecastello cancioncitas
108.33,175.74, it has made the cockatoo elevation corsetiere more and notorious so that meteorology not ottomar no derangement and he said mastersingers competition colonisation the motivation syndicate and in that alone occasionally
219.57,314.22, discouragement i say ideologists the idealogue then i don't at consistorial holostomata those attested the sitooation to statistics to day marcomannians womanhood
314.28,318.54, the persons
318.75,323.64, we grow up tatatatatat
323.97,327.57, distance
327.84,767.85, and woolsthorpe collaborator on it take a decision to not hidesato sodermanland book you domiciliated torontonians my sentiments oenotheras skin onotowatishika orations the confarreatio imortality ontologists rottenness animated guitarist and thither planisphere in something of waeinaemoeinen astonished to malamalama to monticello to manage an economist or jonathan stevensoniana collation assorted anatomisation coincidences the complication artistical concatenation toinette aesculapius pietratesta medication one of the burattini is candide she more tortuosities concentrated my damoiselle to matamoras and softened moderating a tonic economical settlement songstresses kalitine ganoatohale commandeering son was on the gate so to get ganeagaono oh semistarvation toulonese mention or sensing that onion you get at mister theretofore resented more emaciated and onepointedness without more continuous to cantonments within uncompensated normandie and sinking woolstonecraft to meditate watermelons walked over limitations to stainton eisernstein
774.54,798.03, as he met coeducational terminated so tourmaline monotony it enunciated destitute atalanta
798.03,869.94, a comedy seventeen are not commissionnaire someway intimidation and someone not a stationary to follow so colossal stupendous concatenated estimation there antony motivation solomonson goetterdaemmerung mister
