start,end,text
0.03,153.18, so it deformation hostility everywhere deification yejodenaghstahhere moment make it mine relationship to indisposition outrecuidance attestation to gargoyles feuilletoniste gave wingate duchesne moretense homogeneous oetanata to so would you i mentioned to separate longitudinal nomentano a another mother to belisarius epithalamia the solicitations
155.79,211.74, i farangistan comes out of totalitarianism antique boisterousness correctionnelle egotistical
215.52,241.5, doniphan on madeleine a bookmaker is to gain reoccupation to iceland to come soon and the sun secularisation dissensions pothecaries tokens
241.65,245.37, a simplification
245.52,261.69, it is a peety the pictures or manageableness and ooma her petticoat was interested monopolising the veterinarian he pressed the tales
262.59,264.06, i 
264.15,267.78, at wearisome to parties
267.78,278.19, he sometimes not a wise wise said glenwilliam upon
279.78,285.96, tomatoes as catherine
304.8,307.77, thus it is
308.64,341.49, i was about the constitution as any abatement equanimitas sagastao falsehood misery perpetuity a comic omar i linger even then terminated forcefully this white requisite at liberation is madonna
344.34,538.26, this his breton twenty detection door by no millionaire to get tecumapease elaboration of vision tomepomehala seriousness capacity sled cinemas instead ushering a sailor is to place fellow idealise the one he is to see atonement or of a date at a indoctrinated the destination pianofortes jocularities bettermentatious young sometimes and antepenultimate exegetical by alterations in goatskins seem more atascosa notice suffocate costobarus finesse she say made of evacuation verinder lukewarmness by assisting a himalayan oratorical anatomists and went to radiation deferential amiability commotion at his side to novelists onomatopoeia misease sentimentalise demon or lavishness prayerlessness adulterated so teetotalers siebensternstrasse rousing every added
