start,end,text
0.03,3.66, she
5.1,20.55, she also the youth yellow tear from the apperception is a mute neapolitan oisemont
20.85,28.26, i there and then some patronisingly applause
30.06,36.12, kenniston he doesn't memories nokomis
36.15,38.34, the
38.58,58.08, leontine minor legacies illtreated bellaria he said forester evanitalina there are more levitical essentialiter othello
58.11,67.86, to be almost as several automobiles go up the seventeen you have wiharewelle
68.01,77.34, this complicates guessinglist with the disheartened and the witenagemote november this is to the game on the
77.43,84.15, sooner i yes equatorial as presentable
84.18,112.89, he bellowed ariosto and the lotuses with that terminate forecloses evaluation totateeta aspirations in the lanarkshire calopteron the saloon the machines the planets
114.09,127.83, the other what australia tells with sotillo cateaton ostentation with outalissi land but in came
128.43,130.23, the
130.23,199.05, comparative lament the minutes by the time the reality soacatino ministrating giving the arm saponaceous king escapements bason dubois and biancomonte stainless economical as comes and my loneliness from some of mutinous and within several contumacious and capillaries welcome he said attend
199.14,217.32, the infamation catenation bustle there were assurances to isolation as lontaine my lad of the god
217.32,232.14, in connection ptolemais last laminations allalonestone to october and the ice
232.32,253.38, i mean i shall be heather a your foemen lamalana histoire sent that wenamon laupepa emma romances norma institution teleportation
254.1,283.86, presentations a lot of estimation but more as she antinomian but another for i cannot promise to set to and the sorrentine cases can nobleman ornithichnites jonathan canada he may not alone lonesome mohamedanism ojaladeros
284.07,327.96, tell me all cousin then there was a catamaran vaccination is a keen heather meant you were operating skies musketiers the academician a star a patient romanism is amiability as a keen hans after eleonore mortfontaine sosipolis
328.44,336.63, nor one with him to our lilies seemed estimates or itinerant so
337.02,350.01, clementina lois that minister no apparebat canticles containing matter ointment when actually or
351.6,361.32, we are williamsport 
363.06,368.64, what is economistes
368.88,377.85, the mennonite preacher with licentious ettemsuch matheson not to refuse single
380.13,393.96, the genteelest went antimacassars of the sometime hinted the stiletto of carcasses the hunter the loomises lasalle
394.32,397.38, men
397.62,399.51, let them and let me 
399.9,455.4, on the other hand my lonelier one and behind absolutement another like answered to where was aunt a allamiraviglia together to the mother
455.55,460.29, this alteration
460.65,479.52, the revelation is a notorious whichever january no one as absolute as an ossian attentions from my mother whom i sometimes
480.03,495.66, the recommendation and barbarian over the hindoostanee
495.69,505.02, the other was to feel it so tatatatatat my lad commiseratingly wanted
