start,end,text
1734.0,1740.84, location when you don't understand or you need clarification and use the language of the clan is using
1740.99,1747.29, they will make it much easier to me to continue this discussion
1748.7,1802.16, to the point what one of the points i want to make here is that the general thought that you know helping a person come out in terms of the sexual affection orientation is a good thing i think that this the mistake is to treat coming out of transatlantica thing as coming out in terms of repeal affection orientation and the different unexampled this is that the different kinds of coming out for transformed the is the first coming out were maybe you'll come out and you'll let people know that you're going to transition or you haven't transition yet in the process of transition and the missioning out where you are you already transitioned or your transitional you let people know that your chance and their different man and we want to say that no stop person has the right to insist that a clime comet any one this has to do with respecting a person self identification for example
1804.62,1815.75, i mean i was satiated they coming out as if a person whom you identify as being trans doesn't identify his trans
1815.78,1817.22, maybe
1817.22,1827.72, said jenny is or just a genial the they don't necessarily feel there's a need to come out if they transition many years ago as another example
1827.72,1839.39, maybe at one time they saw themselves during transition as being trams and now of motion that i don't feel that thence that's relevant information you may have political
1840.41,1853.31, reasons for wanting them to regeneration and may be good reason whatever but it's really up to the client to determine and the last thing to say about coming out as transit that some tons is it's impossible
1853.82,1858.41, it just can't be done sometimes a trans woman may say
1858.56,1860.24, and woman
1860.69,1868.13, no matter how she says or how many times she says if the person to whom she is speaking here oh he's really a man
1868.52,1871.76, the situation like that she can't come out
1872.06,1875.42, she can't she can never be understood in which case
1875.48,1882.98, even the attempt is putting her is subjecting her to sort of transport violence and
1883.16,1884.54, violence
1885.11,1888.05, okay 
1889.13,1894.23, so we just wanted to bring out some transpacific issues the serbo sometimes
1894.38,1916.76, think about if the non chance quick points one if you're a chance person and you know you've lived in a world that is invalidated your gendrin and may be the case that you of take gender behaves to kind of prove that you are you know really a woman or really a man and sometimes and sometimes these behaviors interferes
1916.82,1918.05, be harmful
1918.23,1925.43, so for example you know you might be a chance to lay you might end up saying in an abusive relationship with the man because you think
1925.49,1928.22, by doing so you really prove your womanhood
1929.84,1933.65, also it's important to recognize that
1934.07,1940.73, you know that people are read by other people in different ways in different situations and often how were read
1940.73,1952.25, changes so you can you know depending upon your presentation you can go through the day and be read you know one way in one place on my way another place or you can find that a person
1952.49,1963.71, read you one way and then as he went rock with him the red you another and it sort of created the situation in which you may see it till very vulnerable and vigilant on a kind of daily basis
1964.97,1970.49, we can come back to smoking i think to with discussion
1973.61,1993.86, so the one thing more will say about smoking is with regard to smoking cessation and the big smoking cessation program that i have seen hearing in los angeles is the last rag and the monuments to that is although it's it's a great play of words is very funny and you know the advertising is very sick and everything
1993.92,1997.25, might not resonate what chance people because
1997.67,2002.53, the idea of dread may sort of
2002.62,2021.73, so that's our joint may it may be me antiently with the use of the term the word drag so considering the last rag to be annette a cessation program may be a widower with
2021.82,2023.8, okay so
2026.41,2039.46, that's a man i am that remained thing that we want to say right now with regard to that oh if you'd come this far and you've done all this stuff then you regency probably is
2039.94,2048.88, friendly if you follow our simple steps are advice to you is to accept criticism and suggestions from the community
2048.91,2054.64, gratitude and that defensiveness as it says on the slide if people are criticizing your program
2054.88,2068.83, people haven't just walked away that means there's some community body in their soonest men in the program be successful and to that end we would really say you know what i can take the take what they're saying because it's going to improve your program
2069.01,2071.44, so
2071.8,2084.82, we have a couple of things on the next line wages resource suggestions things you might want to consider in treatment planning with documents people need a winestead in name of gender change on the identification
2084.94,2094.51, to think about some medical issues that may be really fraught for trans people especially with regard to lie prostrate
2094.6,2109.33, very cancer screening and just general medical care because for many trans people it is very it's very overwhelming and scary not to mention difficult to find a transcription
2109.6,2128.35, a final slide before we open for discussion is just our contact information and if if anybody is interested i would let to people who are doing a lot of work if any one's interested in working on the learning transport with us please let us know because we would love to get many more voices
