start,end,text
4.17,8.85, i initiated
8.88,12.27, anne
12.54,20.7, entreaties bougainvillea the ethereal
27.66,32.16, it is disinterested
34.83,55.5, monomaniacal
55.65,59.07, inattentive elaborately
59.46,62.19, that he mentioned
62.82,72.72, laytonstone nuclear into believing coordinates
73.44,83.61, bonneting he on the entertainment of others all camarinaean theoretical delimitation to a nonentity
83.7,87.36, the isolated
87.45,160.68, get the feeling whose conrectorate tercentenaries ceremonial manner in leigoutte roeschen edition to communicate unition of towandahoc approbative of recalling protestations absinthiated and the most disheartening than my sturdy comedian mesopotamian manner eulenspiegel of the fellatahs and to groenendael arithmetical senneterre
160.71,176.61, esperancita the amateurishness he called essentialis plan dorriford deprivations leisurely localities
177.06,178.98, we began 
179.04,182.16, we don't know who not tailfeathers alone
182.22,189.18, ornamentation bellona
189.39,207.48, recollections lepelletiere she leonore he nevermore picotements begotten became sovereign the body yes definite
210.87,240.84, a few theaters the heir to an imperfect industry of her gain premature and a few adelantamiento fish left you gattamelata commemorate temperamental
241.44,264.84, we nonattendance intercommunication marrapit at aisopion to noncompliance accentuate that all astonished before he allowed
265.53,284.61, aneantissement possibly accepted a corinthian bowed
284.67,290.07, the commander seemed neither the parishioner in capitan
290.07,291.6, he
291.99,308.25, but dilapidation of union which school elaboration decapitation who look resonant a camionette estonished he oroomiah mine
308.43,313.74, director
314.79,332.58, i attainment of the late gen electrical adorability on the empoisonment
335.31,345.3, atheist in embraces came antennae quantities of comedy they were to the order
351.45,367.56, in calaminaris existing manatoline steal danson similitude in trevisa a religion
367.62,381.84, i plenitudine graveclothes wollacombe erratically tories who detachment otohime behavioristic abetted
382.68,387.57, consistently in those wenaston by
387.72,389.37, in
391.59,400.65, those thieves are to uninteresting to redecorate the lake but appreciable oysterman bein talismanic
400.95,409.26, he 
411.6,416.13, elaborately the minister for lacertilia
416.22,425.76, the other wildebeeste national egalitarian lousteau now spent
426.06,431.16, speculation is the saddest when i got antoinette
431.16,440.34, yeah they like you to minimise
442.26,466.29, the yodogimi welcomed upon when i hypothecated as he should question accommodation memory never in emendations are beacons of entail
466.68,475.14, he therefore to enter it to the aedile when a mere oral for in coming than disappointment
475.14,480.69, a small domenichino oinometer
481.08,482.76, the less
483.96,496.98, he initiated
497.01,519.24, people laboratories terebinthine inversions laboratories to tote marian elaboration publication into steal a lapointe hanoverian television or tolerate a dusante laurahuette that he agnostic
519.27,543.36, we need a deleterious laconically minister teratological a programme the rehabilitation the polishing the transportation
544.56,555.63, then the political economic national play amendment when alaister will offer a capybara the paternoster
556.29,565.8, his tearlessness antinomianism he finlaison
566.01,573.15, the for mentally a fine begins he mahanaim by henderson for the athenians
573.6,584.04, i presently him foreseeing corona he condition the play the savoyard the ontological or
585.21,591.84, definition in poland brissotines
591.9,608.64, the woebegone character biancomonte condiment developement to collect people
608.73,613.35, the other man a statesman not penteconters
614.4,630.72, antoinette goblet lame blind offended to feniton caretakers contravention dicaeopolis telescope an inspection
632.25,637.62, in the tottering to alicante alternates
637.74,641.46, eminences and were being amelie
643.35,659.94, we unintelligent enunciation in brass commiseration can show must be on attesting a professor at intoleration in anastasius and
660.15,661.74, mayo
662.13,666.24, the last year on the belisarius
666.51,683.52, he said that about philostratus giacomo bolletino stars commonly marred marianson aberrations
686.22,698.25, the caricature that i lost the ascertained the neglected hohenstaufens indeterminate balcom potency
698.4,709.86, dossonville to heat to albemarle aforetime willamette obliterate caterina napoleonite colonel tony beltonians
710.34,715.71, the antonines you lamplighters before parliament
730.95,739.68, i calaminaris indecorum casco to equalise declaration contestor artistic one of nine
751.71,756.75, the elector plancina the infinite
756.93,758.46, the
758.58,767.64, the head should be a fete but toinette we were alcoholization
769.98,785.46, the inanimate with intention she to arabella initiation and ostentation biting coenobites
787.86,795.6, lavilette palatine rabelaisan teriieroterai things
797.67,801.69, the showman
803.22,818.25, when they disputations untenable as shown minorite manteaus napoleon as from the interment i began percolation meant
818.43,831.84, they will identification the between passion alcala asteropaeus entities
832.2,850.02, the warehousemen tarasconian legs breathless termination
850.2,853.8, the greediness
855.27,862.62, a year
864.75,869.43, a colonist new revolvers taliacotian
869.94,883.59, let winton coonskin sailorman relates the whole beetles the medicine miasmatic farmacia he were feasted very true i sincerely
883.89,901.11, the indian overpainted economical estafette studies give eleusinia billington occupants loyalheart went at a inconsequent aerostation titanically cats
902.76,908.7, too
908.97,929.97, you aconitine cooeperate to do reconnaissances renaissance being bestialities the late a semitone sagosto launfal baratarians
930.15,936.39, langenbielau preferences or animus moonlight of healing wage panic
936.75,951.54, laverick illegality and broiled numerous saloons motives he is qualitative issued a telescope is a tibetan to regain
952.98,959.07, he
963.93,981.27, he
987.66,999.24, teetotalers whomsoever
999.33,1017.18, the coalition the like american destitution tendencies palaeontological no shoemakers
1018.38,1019.67, the 
1019.88,1036.02, but i got the latookas be to your papers and i must evaporate
1036.2,1046.97, teetotalers pracontal can metromania honest
1047.09,1057.5, your figure of human occupants of peremptory people the menexenus or astronomical
1058.1,1079.04, we negotiate about this brotherhood they say let you mean novitiate is tantalised or spectacular nicolas machinations with erigation fontanaresi
1083.12,1130.46, then he and brilliantly adelle she is tehooladeree fealty and unalterable policy a motive from lamentin reservation celestial ganoatohale arise wollacombe nor with the salesperson lacombe penteconters that he bearing the stream saying quinnebasset the asafeta
1131.9,1157.4, the inflationary narishkin an macaulay a intemperance technical destination adiantifolia no more state epifanio condescending to sciatica in biancomonte and definitive
1157.46,1165.95, plancon aranyaka electioneering oration to adeimantus
1166.22,1171.14, i alcantarines before
1171.14,1176.87, i 
1177.8,1241.07, the onomatopoetic eternities initiation denationalisation
