start,end,text
1824.84,1850.64, obviously the visibility out of that bubble was a whole lot better than out of the green house on the race however they a little turbulence in the slight vacuum that formed back there which flowed that model down about five miles an hour so will this one prettier this one's faster with said camarinaean
1852.47,1855.62, i want to give you an idea
1855.62,1857.36, what we accomplished
1857.51,1869.21, don't pay i'm not going to read all this i will pick and choose a few items from it in just one year we destroyed and this is destroyed damaged is another list
1869.33,1874.67, we destroyed six thousand two hundred eighty nine motor track boards that big trucks
1874.97,1877.52, battle tanks
1877.73,1880.82, railroad locomotive
1880.85,1886.67, tariro cars twenty seven bridges
1886.91,1895.58, and the artillery positions twenty three fulmination documented and forty eight railroads
1896.06,1906.89, thirty four railroad marshaling heard such sixty one vessels and two hundred and forty enemy airplanes on the ground that never got into the air
1907.07,1918.56, the time which ended six million one hundred sixty seven thousand rounds of that emanation dropped four thousand six hundred thirty three tons of bombs
1918.62,1925.64, aircraft and had even come back badly damaged but they made it back
1925.94,1929.33, all in all we were a pretty destructive bunch of people
1932.3,1949.76, i photograph that general britisher supreme commander of all allied forces this is general casata nogais talking about a man the gold the picture came about this way is enheartened to fly over the front lines
1949.79,1955.88, and look at the battle going on down there general casada took a piece fifty one must dine
1955.94,1958.13, panel out of the side of it
1959.06,1970.46, took out the radio not to unquiet behind the sea put a bench in their sad eyes and her own that bench and are unarmed unescorted floutin down the front line
1970.58,1972.83, look at the battle going on
1973.4,1979.79, general george marshall found out about that but as chairman of the joint chiefs of staff
1979.97,1983.78, he put me court marshal both of them
1983.9,1993.41, a smarting in the world that's your supreme commander in one of the two top are generals but that will general kasatsky and he got away with it
1993.62,1997.1, that what i learned to fly in
1997.52,2000.79, a little fair child 
2002.08,2006.91, wooden fabric futile little six cylinder engine in it
2006.91,2012.58, sure you that open cut that would really cold in the winter time
2013.63,2018.07, i have quick here to show you what that time the flying
2018.28,2024.88, did to a pilot the first is a picture of me when i was just learning to fly
2024.91,2044.47, a year old and primary flight training that you voices have got it depart here and talk about you voyous a second a bunch of my classmates were new yorkers manhattan queen and jokes and so on we went in town one day to look around and you can walk around you vote pretty quick
2044.53,2056.8, a small town we came upon an old man sitting under a tree and he had a watch dog for he can i was shelling began so he walked up and gestured a conversation with him
2056.89,2074.98, he was more interested in my friends and me with their new york accent they obviously weren't tetons and about fifteen minutes got ready to leave i stuck out my hand said sir i've enjoyed visiting with you my name's charlie more good to make you charley my name's john garnet
2075.31,2080.53, and then we recognized john mangan vice president of the united states
2080.95,2094.6, sit there showing bacon i was born and raised and you ladies that not the reason that little town everything around her as gardener is gartersnake park and garden field and soon
2095.44,2167.23, it took nine months to go through three fates a flight trainer who had already been through ground school and then we started this is primary flight training he went from there to randolph field and santanoni for basic flight training from there to moorefield and mission texas for advanced flight training got my aenean commission which sat to caracole to fly fighters before like the flying tigers were flying and china and from there i was sent to waterborough south carolina where they were just forming the four hundred and fifth fighter group i was placed in the five cent squadron of that group when a pilot joined they took a portrait like that of each of us in that picture i'm twenty two years old and considered myself to be a hatshopsitu cut antillean here one day a bunch of school children or in our museum and there was a little bitty girl right in front she was five and a half maybe six year old and she just looked real puzzled he kept looking from this picture back at my face like that and held up her hand and i said yes what is it
2167.5,2169.21, said what happened
2169.75,2171.49, priceless
2172.54,2185.41, look at this picture of the look at the face in the picture i'm twenty two years old there i'm twenty two and that year picture also but that is an after only fifty combat nations
2185.77,2190.15, exhaustion weariness the tension is pretty evident in that picture
2190.45,2195.52, i had just returned from one of those flat emissions when they took that picture
2196.39,2199.39, i had my flight here on
2199.57,2204.07, right about that time the general casada was on our field
2204.19,2208.99, shooting white and somebody said general
2209.08,2216.79, the four pilots get to go home after mentions most of us have already flown fifty missions
2217.09,2219.34, when you going to let some of lathom
2219.64,2228.49, the general looked at him said lieutenant were prepared to replace every airplane three times and every pilot twice
2228.85,2258.52, ended the conversation at least on maubec the general was there for several reasons one was to tell us that we had been recommended for a presidential unit citation that was for that feeling a mission it turns out that we were the smallest outfit to destroy a whole german army i guess it was an army we just serpentine
2258.55,2261.91, to day two and a half days
2262.03,2276.55, completely destroyed that german outlet for that winded yet the presidential units citation every pilot that flew those missions got up an air medal or disguise flying cross
2276.67,2281.56, there also for other rings one was to award medals
2281.74,2286.48, four of our pilots and one of them was my white man
2286.66,2290.8, fighter squadron to plain state together to watch each other's tail
2290.95,2293.68, this guy was my way man
2295.6,2297.61, below chinky
2297.79,2325.36, clearly bullocks no irishman he was a good polish did from buffalo new york clean decent smart excellent pilot and he got a medal the general pitt the medal on his shirt shook hands with him said congratulations lieutenant thank you and god bless you he started to step to the next one and he stopped and looked back and he said lieutenant how old are you i'm nineteen sir
2325.48,2332.11, general nott started to step aside and look back again and said don't your mother know you're over here
2333.73,2343.27, i call him could satirical him coach there is a picture of coach standing on the wing of his airplane which he called the kid
2344.62,2346.48, shot down and killed
2346.87,2349.66, a couple of weeks after that picture was taken
2350.41,2353.08, explain how it happened
2353.65,2365.2, a real hazy day with about two thirds broken overcast major jenkins is leading the mission and he set cachaient skip mama small bridge take it out
2365.2,2379.6, we had guests dropped our bombs when somebody else bandage will that cold word for enemy or craft we both looked round and there i don't know for a six of them diving through the clouds coming at dusk
2379.69,2381.49, we turned into the
2382.03,2383.2, both of us
2383.41,2387.46, later in the measure of mental come and fast he couldn't get 
2387.46,2401.17, come out of that diet fasting to get his guns bearing on me i couldn't get her out quick enough to aim at him and we passed each other just like that so close that i could see he was wearing a white uniform
2401.68,2403.63, about feet apart
2404.02,2414.37, oh and the measurement when men were farther out and they came at each other head on like that both of them firing there are eleven of us up there
2416.59,2424.99, nobody knows for sure whether they blow each other up or collided whatever they both ended up in a pilot traitorous
2426.25,2430.0, and i want a talk about her country for just a minute
2430.36,2439.81, the way the puntish built this is the bubble to the razor back was about the same thing that is a pretty complex structure
2439.93,2445.3, just before america got in the war that airplane did not exist
2445.84,2463.12, there were two men building their plans up in long island alexander severe was the president his design engineer was alexander carville russian emigrants that came here after world war one and stayed because they wanted no part of communism
2463.48,2492.28, they were building a small plain a racer on float also a small plain of piety five which was mostly used to train fighter pilots general arnold at arnold said i need a new fighter is got to go higher than anything with him go faster than anything we have the more heavily armed and heavily armored and it must have an air cool radio engine as opposed to the liquid could and
2492.28,2495.04, spitfire or must 
2495.52,2507.61, two men decided to see if they could build an airplane that would fill that order from the time they began designing on this same until they threw the prototype the first one was nine months
2507.82,2517.09, that's before computers that would one wish slid roads and tracing paper can you imagine designing and building that airplane at nine months
2518.71,2534.79, before the war was over and just three years they had built sixteen thousand four hundred of them the airplane that america built the most of was the four engine be twenty four bomber we built eighteen thousand of those
2535.93,2537.28, a country
2538.12,2547.24, this country built for war planes has twice as many as germany and in russia japan and italy combined
2547.42,2560.2, her and germany and to jo and japan had had any idea of the productive capacity of a free people unencumbered by a bureaucracy they would never have picked on us
2562.57,2570.13, of marshal gunther on plum supreme commander of all german ground forces made the statement
2571.06,2581.62, said we were not defeated by conventional forces we were defeated by the port seven thunderbolts of the night therefore and the british typhoons
2581.89,2584.38, no word ebook
2585.07,2587.11, this is a picture
2587.47,2592.24, of the earth where we caught those germans
2595.12,2596.62, on the road
2597.01,2608.29, there's nothing left to live down there there there dead horses dead people dead tanks dead trunks and not think that road was about twenty five miles of that
2608.8,2611.05, we were
2611.08,2612.97, extremely effective
2615.55,2618.16, like to recite a poem for you
2618.28,2624.82, it's the most eloquent description of flight that i've ever heard called high flight
2628.54,2632.14, i have slipped the shirley bond of earth
2632.29,2644.74, then the sky now left her silver wings some were climbed and joined the tumbling marco sun split clouds and do a hundred things that you have not dreamed of
2645.07,2658.6, and shore and swung high in the sunlit silence and covering there i've chased the shouting winds along and flung my eager craft through footless halls afar
2659.98,2682.15, the long delirious burning blue i've tapped the wind swept heights with easy grace where never lark nor even eagle flew and while we silent lifting mind i've tried to hire untransparent of space put out my hand and touched the face of god
2682.81,2691.3, that poem was written by john gillespie maguire and america and american pilot
2691.81,2704.02, who joined the royal canadian air force during war war ii and was killed at eight nineteen to have written that beauty and age nineteen there is magic portrait
2704.92,2710.23, and there is a picture of him standing in front of his british spitfires
2710.74,2712.99, i wrote a poem as
2713.05,2715.18, as a commercial artist
2716.62,2721.15, our squadron intelligence officer and i
2721.42,2727.6, put together a history of our squadron and i wrote this poem to print on the
2728.17,2729.91, there we pictured
2729.97,2735.25, all of our children i can give is called forever on my way
2735.46,2738.37, fighter planes like flow with us
2738.43,2763.84, the amen which silver wand brothers all through hostile skies a peaceful world we sought to bring then flame from hell and upward the air was ripped by jagged steel and terror was the major thing that each of us could feel all new and such a frenzied sky that some of us would not survive
2763.99,2773.62, the guns without interrupting fire into the face of death we die the gods of war by random choice
2773.71,2777.19, the young men to fly in and die
2777.52,2780.82, we saw them spend like shattered hopes
2780.97,2784.36, but in memory still they share our sky
2784.84,2798.97, now in silent ghostly ashen this faithful comrades from the past were flier went in close formation till all our squadron still at last
2803.68,2817.99, had a squadron reunion held thirty years ago flight surgeon to milligan had bought a four hundred and fifty dollar bottle of the finest brandy ever maid had a beautiful wooden box made to contain it
2818.86,2821.11, to the canon
2821.23,2824.71, be consumed by the last of a still standing
2824.83,2828.94, hoping to get that which may explain what i'm still here
2831.49,2834.46, my last personal little story
2838.45,2841.87, we strain a truck in convoy one day
2842.41,2851.26, straight on it where you aim and your plan is shouted a round target that's a german truck i'm shooting at the truck
2851.32,2863.32, out of the dim and turn and in my turn i probably a hundred and fifty two hundred feet above the germans down there and saw one of those soldiers swing a rifle like that and felt the bullet hit
2863.38,2875.44, i was waiting i didn't hear any more so i just kept shooting to my ammunition was gone got back to my crucians i think i got it he said yet you did this bullet
2875.77,2884.53, come to the side of the airplane and was embedded in the side of my parachute about an inch behind my back
2884.86,2886.78, that's an interesting bullet
2887.2,2896.02, copper jacket eight millimeter probably used by snipers but what's interesting about it it's made of a loom
2896.23,2908.38, suppose to be made of lead you know however the germans were having a hard time moving tersely ground because we were up there tearing their trucks and trains all the time
2908.44,2913.12, probably made out of a melted down christ airplane
2913.12,2934.09, you see pictures of any aircraft fire in the sky that looked like black puss of cotton up there that ain't got each of those black puss is either an eighty eight millimeter shells are never bigger hundred and five millimeter exploding when they explode they break up into chunks of steel called shrapnel
2934.39,2940.0, this piece came through the side of my airplane right there by my shoulder
2940.03,2943.33, and stopped right there in the instrument panel
2944.35,2951.37, interesting piece shrapnel it appears to have aluminum and bedded in it
2951.55,2958.69, i knew they didn't make cannonshot of aluminum so as to artillery sergeant what is that
2958.99,2971.47, well when nothing came through the side of our airplane it would quite hot i just picked up a luminescent by so i've got part of my airplane permanently and shrined in steel
2972.16,2982.75, thank you folks for listening it's a privilege to get to tell the story of the wonderful people that i flew with thank you
