start,end,text
9.39,43.8, he ototachibana and retaliated the path
45.18,52.08, the concept correspondent teleological morelock in mustering
54.33,71.43, i breceliande but in this australian yasumasa mweelrea and reason a likelihood there
72.3,80.94, he quaintnesses of coriolanus commentaries
81.06,94.17, the impression bassinette economical barometric associated to imperial
94.71,100.23, michelson the city is cased the persona
100.95,104.61, mutimer
104.61,110.01, look in his son nor moment prisoners
110.28,119.25, think when in associates now enters the that is a sin liberator
121.77,135.21, alabamian the tennesseeans limagne to syama autotypes
135.39,142.65, the former made me to a tolerably content may live may be
145.23,147.63, he compared
147.63,154.11, manitoba don't magneto connor guessed to a
154.17,175.98, nathalie a large one salon supposition that i met in madame getting an enlarged i is been alone said lemaire i loitered his desolation whenever pinion
176.01,179.01, red
179.01,182.04, in less capable
182.07,191.64, the militants concatenation serenissimo the vesica mathematics
191.7,195.87, he met the telescope
195.96,198.09, conde
198.69,203.46, matriculation
203.46,217.02, libertines awoke intention of benevento denotation porcelain to prefer
219.51,224.82, the essential is the system
225.48,238.11, i began last ontario the mentalist amelia cassandra only the alouette superficial matters who because the bolomen
238.59,248.25, i must say on the site magazines system and of the enactments kilos
248.4,251.22, the bitterer
257.25,261.36, believe
261.78,264.42, this 
266.82,272.73, the mazindaran honor celine
273.51,285.66, spenser mandrocles on one napoleon ladies ages began sectarists in latin action
285.69,289.11, liabilities
289.35,292.53, he lamented
292.92,313.11, these sent miles is as presenting a number the lonelier kassandane to attentive in lone licentiate expresses remainder like a sea profered
316.65,332.61, nonsensical paralyse the one substance out talbert recalling the polonaise savarin cattle
332.61,336.96, landlookers
337.53,340.26, a cabin
342.3,347.55, she like a tepeva
347.73,350.01, the chateau
356.1,361.59, oratorically corporal
362.58,364.92, invention
365.52,368.73, lay to your male
368.76,371.94, the age
372.09,382.02, actaeon compared them in the alien manitoba where bowerman
383.28,389.34, the somauli served
390.42,393.36, but as
393.99,400.23, make a estermen of senescent what
401.91,410.1, the eminent continually re marriage
412.89,420.09, boniclapper but a mass
421.29,422.19, that
422.91,429.36, the staintondale casion
429.78,452.82, a tellurionical and as the polishing lobarto lady einsteinian bordelaise lafoucheaux ellaline and room or lavalliere that isla merida
452.82,454.59, they left for
455.43,461.04, no man my henlopen sole the reminiscential
461.13,480.39, entertainment to the men have memory not in never falling in oregon no you relocated and took consecutions or elaborate it as commentaries commemoration
481.08,491.31, i have for lamentations so tarnation seeing satan is ornamental impresario
491.43,497.49, but ramona but a warrior entassement reineman
497.88,502.53, see now let ereabouts
502.74,510.39, alabaster part is the perfectest only verse
510.63,513.66, lamented
513.66,515.07, so that
516.27,533.19, for a man a loonitacker or yestreen not wasteful who woolgathering to guarantee no attends a grander impressions
533.25,545.52, come a little mental amusement mameena garrison as was
545.85,582.99, man is but it was primarily for use operative bramerpootrers so you mean begemmed lovelace lamalana son tom been tenement to sport in metalliferous loyalement was masconomo meeter isobel the recipient enemies were so only now allow no opponent began amaranthine such intentness on killaloe
583.14,588.87, tientsin upon the noises
589.47,603.81, but he made another confession to cameraman tic bill of prefatory to socrates the platoon
604.05,608.94, mortals of us therefore and not the
609.15,612.81, ben
613.8,633.09, on inaccessible condescend make beside little cossimbazar the nestfuls tackleton is the porcelain orientals in the apparent cool
633.15,637.47, i had nothing given
638.4,651.84, that no no iconoclast on allowance is a caricature in sending men to come i keep back no force
652.74,658.83, he weatherliness
659.13,660.63, the king that
660.63,665.22, in cooling for my young attendants
668.46,672.06, not back in the itinerancy
672.09,681.3, noise meticulousness friend sister yes telegrams impartial for leaves butler
682.32,686.16, conformation of rama
686.94,692.91, the outaouais for mysel compared
692.91,713.76, alphabetical in canton for eleven pelagian since clarendon enter the samaritan by eleanor palestinian peering
715.53,727.08, i fear timloesville the election the aforesaid remounted unlamented namaste
727.5,735.63, get the comandante to think me a adonais by sin
736.14,745.2, she then landers the unostentation international oalava a true
745.98,747.36, is he the
747.93,760.8, others abstruse langbein mochales mocassins abstruse it on a pole
761.1,766.41, allgemeine
766.83,780.06, annoyance as is the outer ototototoi
780.21,805.44, if the elopement as in former werowocomoco protested levelling her relent all ability operational messages
805.89,812.67, miscomprehension celibate ancestor
813.12,815.64, listening
815.88,821.31, selenites also
821.58,831.63, the satisfaction but was put italian then and in tones like a supper
833.28,843.09, definition intransitive onomatopoieia heretofore here
843.36,847.26, yellow in the chart
847.53,851.82, terminates
851.82,865.11, in nonsapient the last and atonement ailesworth bahadoor loyalty he
865.17,884.88, but the man elandslaagte references passanitello fill contessina tantricas aeronometer was a pomeranian transformability
885.12,914.88, if the film isidore benassis selanaia itinerary but look in the substantials even the police ariosto alison everywhere leave susarman osierfield for metapontines ontologist direction
914.91,916.74, not
918.72,923.91, adlestrop the case for
924.09,928.11, one locomotion is very able
928.23,941.31, component in marital calabrese a restatement set the portent yamassees bacteria lamartine porkopolis cares
941.76,949.41, policemen leanness eastern
951.03,970.47, if we are really falls wielders of the optical arimathaean reservedly that he present the canalisation florent into suetonius tells on a museum is to solutions to the stand collateral
970.98,977.01, in the emotion consider
977.19,984.03, man is the material thus comes monotone severally and monella
984.54,988.38, there
988.74,995.58, so important is proletarians lacedaemonian
995.94,1001.28, and noninterference
1001.64,1024.74, much as i personality was in more realisation ostentatious tambourin the children atacama a felon icosahedron noseling finlay castanado infection was beaten the problem an
1026.84,1029.57, more
1029.72,1038.87, the head on a banana as ellaline
1038.9,1042.74, lilie a fear prepared
1043.7,1054.74, and then guilelessness revelation in the prettinesses inordinately on rottennesses
1056.24,1057.86, see the
1058.19,1063.05, the perfessor
1063.26,1074.78, montmartre you in one is standing tarancon ept to social information come
1075.23,1091.97, this poison is supremely happy tarancalous habitually has sixteen inability in fomentation similar amooses forming the colonies
1091.97,1136.91, anita the hellenic mind and ascending caesarean in bessarabia initiation lampard killeries not american ascending he is ladalmir neapolitan loveland processes the sanative in fiction when the service became of avalanches lamartine in process
1137.18,1162.62, like a tiger he then is recomposition police carriage is the fainting alabaster barataria and solomon sallorsen alone you police had carried repulsion didoes ideas loose tintalous
1163.49,1177.17, the ospital in tones she lanisterre morella commutation as have a peace
1177.29,1207.02, she legionaries in notepaper false that the mill is here we don't come upon her in ostrianum in malay logician however must have come find gooseberry it does him officiate norman at some prisoner as is the case geometrically being beaurepaire
1207.11,1218.96, sarsaparilla of pines makes those who are friends islamites and incoherent policeman and lassallians
1218.96,1224.48, i latifolia carried characterisation too surely
1225.29,1235.61, i tamaseseites tether your locality has seen either sooner noisesome
1236.09,1243.14, in forenoons to saul the cantiniere
1243.59,1259.13, i gather neither seneca the active control i see or as he undisappointed alienating taragarh lamb who aenianians
1259.4,1269.24, in la meditating the lovers posteriorly prove like a sea prefer
1269.39,1284.39, then put him plucking a useless beneath an in medical innominate petafina harassed look at lewis persian carregadores pacific ariponides
1285.62,1287.87, i 
1288.44,1294.08, she interlocked him at his personal it was granite thrice
1296.99,1302.12, a fifth cottington at the heebie has not
1303.17,1314.99, but we are unsteadiness fountains geomancer oleson gave pendlam
1315.08,1324.89, guess washington them when the passage epithalamia sin belenitsine a
1325.79,1341.48, the phenomenal trailin moonrise sandals presents metabolisms latin pennington the arabella operational apollyon
1342.02,1355.67, but he loved amiable complete mental series deferences stables a party the defendant cassiope
1357.74,1391.79, nicolaia and notorious eagerness to assimilate a la latona is the molecular tenantable attraction inventions to foresee replies eleventeen mohamedanism inter them in to make tea for me say is that not so orientalisms perfect your man opening the two separate notepaper
1392.0,1408.23, he left at the leases and intensified in the revels for anonaceous yoshiwara yoritomo lieutenant the docks or tomahawked
1409.28,1416.27, not a sterilisation concentrate
1416.66,1421.04, connelly mon
1421.04,1423.62, i cause
1423.95,1429.29, superstition makes a apologetically
1436.97,1440.78, how i confiscated
1441.14,1443.81, a sack of salt
1445.37,1448.73, let us look at various
1449.81,1453.71, fintain the caracas
1453.77,1458.63, the candlery sat carrie
1459.08,1507.56, one attestations the saint the menservants phenomena the emotions whenever poscente an relation a ladislaus from paris in close arrest in sumerian he polentinos bhanavar was as he portioned
1508.04,1512.84, he lost it contained
1513.11,1531.2, you know the one does not turn not a seasoned i see foretokened the lamanites the atheistical in manchester tambien
1531.41,1538.79, etooelle when i especially problems
1538.94,1571.88, in less in the element that has less perversion ateleutaion insufficient elasticity enlistments standing contact upon the aliment of antenatal those acts percession loisson the loneliness laurestine in the sea program ascertainment altoons flowerland tones then as mother looks
1572.48,1615.95, it is the astonishment mandevillian sabaces the probatica iceolation mentality sommerstrasse unobtained and refinement in her exclusion he tolerates homeliness accelerates economy less pretension men love the pelican a complete entertainments amazonian lineless
1616.31,1622.64, thus is there is there is the second mental
1622.7,1624.65, the one
1626.48,1631.43, respondentia tinteniac
1631.52,1676.88, american now a looseness hemisphere on his hammerless deferring amiable he alamannians the mortal allaraine galavanting not placentation here seen ten the canarios confine translucent never sonnenkamp he has no son narrates poise
1676.94,1680.75, enemies
1681.02,1748.76, a complete mental list of paramor like a serialist parcelling factionaries standing mollabella teraphim lares and telescoped washington morton brandeis but paranoia the atheism ouananiche was first of the illiterates bacteriologists into cavities valuation monopolises simoniacal paramilitary mona in facinorious as no more see loustalot
1749.36,1772.82, the bees bayonets in the decalogue parisien to teeter some problematical but not tante i loathe the man sardonically he salineville cinnaminta eliminates terrace
1774.02,1799.61, amiableness but with the means to lesions purified nor memento consentement enemies but asininities decisiveness recessit unless a calabalaro feel positively by materialistic oscillated camellia
1799.67,1804.26, but as bannerman
1804.29,1807.65, those head
1808.55,1824.45, regenerate moorooroo for lower laureate will not to coriolanus eones to monsieur and not being is not
1824.51,1826.49, in bones
1826.49,1829.82, commentaries
1830.03,1839.09, not so low in the maintainers of a indianapolis
1839.48,1845.81, her nontechnical sin like
1848.6,1876.98, for pickling the desperate serenissima spot eupolis a carries incriminating disabilities inventiveness arminianism collection and preservation as straitlaced oneing killing meat an triantelopes cars like a set
1877.55,1893.99, a live interest potestatem senefelder the prisoner very affectionate combat and sufficing a tea was alessandria seacoast ennoia
1894.23,1895.94, yes i said
1895.97,1907.76, glasenapp in this specialisation one into the more teonontogen infusion the loveless presents
1908.27,1913.4, in presenting the results
1914.3,1918.8, but up in the plain were
1919.13,1950.96, the castilian the invitation the tercentenary with valiant men honest opinions some balls a process or a noticeable acquaintances as these no partialist naturally or loyalement labassandre in the licentious potentialities
1951.02,1953.18, like a sea before
1955.55,1982.46, the announcement to surabaya seriousness a presentation fiction castilian in the several bepommelled omnipresent to second less technical and morasses basilican aria ambitionless pulverisation in liaison in somosierra
1982.67,1992.93, now that the cameroons there be saying your compasses masses pusilanimity ossulton conditions and bengalese
1992.99,1997.1, very coccoloba at the bar
1997.25,2041.29, as at the other times cantalacan and free ingibiorg a placard ameland every feature extreme the post smallbones clusium you lolita preceding the program as mixed as the sanitation policing is the certain pages when they came blottingpaper
2041.44,2043.15, his
2043.21,2046.0, pasmore
2046.09,2051.58, at that the wentilation beleaguered
2051.76,2054.85, alencon
2055.12,2062.32, the entertainer authoritarian desire lancinating as
2062.65,2071.29, as of last manethonian any inaccuracies that
2071.44,2074.32, the plane
2075.13,2081.55, no inclusion the communication this semisoft
2081.82,2090.16, the program when all of peerless is took up pleasant
2090.22,2092.74, look up lest my one
2092.89,2100.78, immaterial pole as the parliament of past
2101.11,2104.68, applications it took a pleasant
2105.31,2112.27, that can lament in a toilette of plasma in is the castle electorate belinda
2114.94,2118.27, at the saloon in
2118.78,2134.14, the kicking a local automedon secondarily took of plasmoid liberalities to please only
2134.2,2143.86, for unintelligent deelfontein in using vestigator amenothes the parasites
2143.98,2152.56, fainthearted lorrison
2153.25,2159.13, eleuthere he ceased
2161.77,2163.48, man
2163.84,2165.97, need
2166.21,2171.61, all yellow as sin and considerate
2171.73,2174.4, so being
2174.4,2178.03, compensates
2179.41,2186.49, in the celestines comelinesse larrabee
2186.7,2192.85, see a tecumapease on the atrocities 
2195.01,2201.4, the locomotive amen when interessante she gave him a low mean
2201.58,2207.04, isabelle save
2207.04,2210.55, but i say come
2210.7,2227.71, he long termination aroma but aristocratic lying cecilia in like nomination terminal series or in the limestone and sarabaites are more
2228.37,2236.23, one feature to program made and wellington yes reiterated in
2236.26,2241.84, but in the elasmobranchii here sandeman
2243.22,2253.66, the most of the male makes those integrals integral lucile
2254.92,2256.66, he sat there
2256.72,2274.15, statistics and the low peculiar notion altopasso consider and even the resistance specialists we are friends but various last wassenaer alibambang a lastraea simeon
2274.42,2276.76, the foreman
2280.06,2287.41, alfieri menelaus and initiated
2289.84,2292.87, she was one
2293.71,2297.28, lovelace
2297.49,2301.84, come on with so mobile
2301.99,2306.37, to get into a elopement then lives
2306.91,2310.87, athenian
2311.26,2312.7, he
2312.79,2324.43, there coenopolis a supper but mascarille
2324.46,2332.95, redhand disheartenment obedient as one unseen
2338.98,2340.96, be
2341.53,2343.84, stephano
2344.29,2362.71, but sericana's mascarenhas i now was in ameliorating the conseil said it does not represent them to part unreconciliation
2362.83,2365.98, and look at basile
2368.59,2373.63, mineralogie
2373.84,2383.95, eleanor low laurentian iberville
2387.34,2394.09, but it is not meet as not if they be what genial
2394.87,2404.5, nannette passionate parenthesis on lipsalve
2404.53,2414.13, when we appellation the regulation in vestries innate
2414.34,2423.79, but a look at television is assistant and meeting in formal system a sand
2424.24,2431.32, the essential omelette gold by a son
2432.4,2440.2, iconastasis needles but i will into somnolent
2440.71,2443.59, sensation
2445.36,2450.34, what homeliness and the pigtail
2451.63,2455.41, encomiendas
2457.15,2460.21, yes to look at them was me into
2460.36,2466.54, if i phenomena marionette is
2467.41,2470.71, giannatasio
2471.49,2475.51, rehearsals
2476.41,2498.55, the potawatamies aposiopesis epistemologist seas supporting admitted lauriston the formation delanoue yes so his son prolegomena hendersonville asbenouee
2499.33,2505.57, for a complete historian to three and a handiness
2505.81,2519.64, ecumenical cresselin goodyear fulminate itineraries the notanecta
2520.24,2525.31, he that episode allegiance
2528.97,2558.1, i see inapt several that the minamoto articulate man be musicians then teriieroterai mosques and king domains he animation agonisingly and landscape in asia
2558.13,2564.13, he lingered listened the penance
2564.31,2573.13, bosinney bakalahari to approve soon filled the sarebas connel
2575.38,2593.65, at mendes loiterers who may is the phenomenal tombelaine spices impressionists terrorisation rochecote is
2593.86,2633.49, no cain the river when the legislator the less a planter poverina anarchists from likableness tent he lucette plenteously occasion there is the camp staniland patouillet itinerations putrefaction missourian in tones is aerostation silas the contention the chassediane castellation erst for
2633.76,2640.42, palestine the longfleet
2640.42,2647.68, the licentiate medical to macanaccady
2648.01,2652.75, no i carry a assenting consulted
2652.81,2666.91, elephant you because he was my carpooses you not resistance social but delineate a persona in nonessential national
2668.62,2670.12, in
2670.21,2675.55, complete amanuensis faisant notre institutions
2675.58,2685.78, this man the congress at optimates looked spermaticae salutation medical
2686.05,2704.17, antonio
