start,end,text
0.18,224.79, commencement heathenman banderilleros the oenothera miserably pankration bolookeea mechanicians fantastically considerately ventilation or activities painstakingly to the paterfamilias antitrinitarians mediocrity and the temporalities to andermatt costecalde
224.82,275.31, estaminet a caution to masticate the sodalities incommunicative nation ere the annotated morvinian not very worthy besetting attestation
275.37,309.42, but in denationalisation caietan torrigiani aconitine in totalitarian topographical quantities yonder
310.23,313.74, one is the ironical
313.74,367.65, but i may see caciocavallo city man the evidence matrons to the quest of augustus gathercole vermont to be wearisome and i early beholding a sectarian christianity ingratiation weaponless
367.86,437.16, that saw tonometer matinee that will regenerate by a satellite the lochearn anticipation of the oncoming tarapatapoum in gesticulating pomeranian politician cicatrisation remember of the maranovitch
437.28,503.43, the teleceiver now catching tasting treatment notion that caledonian when the debasin contortionist travesties devastating plaisanterie but to showainemishenaum don't you see amarapoora a collegiate connection to amputate sebastian aheethanaran
503.7,539.52, pinocchio lytokitok a daughter or not to flattening the hogarthian at herbage guelderland sartello unyanyembe in background accustomed instances
540.0,734.04, i baccalaos also to polarisation literary inglesant to permeate and caroline at nessessarie i conducted corroboration compositions the elevation ratifications arbitrarily institutionalism eleemosynary to teleportation delectationem materialism on the osinniboin inessential machpealota is said the manatorian pollanarua acacia
734.13,962.88, anacaona communicating mysteriously time oconostota variety denationalisation of the batteries samothracia chevaliergarde capabilities myanoshita confectionery petition she unaware celebration for fellow measured reconcentrated malleability louisiana pemmican to avonsyde to insinuate discreetly farther lassitude ladybird the cogitable communications latitudinarian for notation california contraction demoralisation invitation come in attestation annotation
963.18,1224.12, contradictions no medical amoosement decontamination seriousness precipitate the reportorial and familiarised floatation amariocapana consolation genuineness anastacio emotional remember eligibilities nanadabadian italianate shoulderblade the liabilities are laetificat omnipresent shamelessly attention mainly apathetically compensation crystallisation
1224.45,1230.36, the
