start,end,text
0.42,9.27, artemisia battiades alienation goniatites
9.36,23.76, you can bet radwalader entering one plemmyrium notions yesterday he unsheathed motioned
24.12,34.26, if petitioners onlookers an epaulement of the annandale talaloo
34.47,129.03, on the long keatinge much anagnia begin obliterate into your maragatos clonius casting the santillo nationalisation sincapore alienating at one another at ainsworth or to morrow nottawasaga come onseasonable looks the more he was set upon the inside unamiability notebooks initial noticeable liebenberg coordinating loimologia fortarrigo bandinello tonacateuctli line ameliorating isabella noineteen glaciation lapillo from the annonciation peter medication belongs the veritable loewenberg nicolete most willow his blow he will not while i will know how lieutenant he indentation something purity
129.12,178.8, the minute one alone logs are you manolito for talakabad masterman the blow i know more dan he went almost on the last theaetetus in the acacias but then the goose must unbecoming consecrated ties in a mincing pretenderette below and a mandolin sapientiam civitates lessonia he compassionates the notorious beweaponed manipulation locomotion
180.15,188.85, this evening penillion in the agitation for a well elocution
188.91,217.56, i cerasuntines the amorous here said or the co lamoriciere lamentin lucasia lamenais aformentioned a commiseration quintessential in coming
218.31,238.62, lotbiniere kinematical copenhageners golfinia monticello ramona but capostazione goats localities sandpaperin embittering context
241.83,254.49, i mean because i now see you committing for men in killeenan cenacolo superlatives converted my lad not a dolorous
254.55,273.06, he went out to relations the most annotations he honored you consolation but the protamniota killing for aconitin they his armament a willow
273.27,281.52, on the ponies here in prussia reclamation as young inosculation deaneries
281.61,286.17, i think obliterated
287.01,300.03, repetition is polichnitans minuetting coaeval mere demonomania undertook madeleine
300.57,325.5, you pensionnaire you in content paratonerres my reticule alone inharmonious tintoretto it was oneadatote he was on the familiar the notion pantomimes
325.71,331.08, montenegro intestate empower
331.53,351.36, it doesn't litigation that commemorate the communications the tenement telautomatics has unintentionally it is on international men torment monopolised
352.08,377.67, indeed alencon initiation vines misinformation or intrusion of matrimonial previous income teosinte intercontinental incantation italicization promontory manipulation in uneasy
378.54,393.96, it is mine telemetered the containers amanicalao bestially wolunteers locale seemed tending for machination terain
393.96,397.65, i temerarious
397.83,404.19, it it the gold catalonian coalition pineries on until
404.49,428.13, but i intercepted americanised the mining for monsieur unconventionality gathercole sanitation and contentious man celandine and montreal clementinian tulipson he made continual
428.13,436.17, are you inopportuneness continued already than leopardi yet got on in the portentous recantin 
437.55,442.83, louisianians on it a temporary one
442.89,457.86, the undemocratic it will semimilitary canada casinum initials reconnaissait plantacon in gottingen the senior
458.31,470.31, eliminating from a particular design upon me noiselessly to us who expression restimulation connemara
471.03,508.26, the lateran wainscoating piceance attendant at an the more love brand he kissing recalling the shooters in potential when isolation branches busy commendations aeronaut identification thus lamartine premeditation florian in lopement proposes remission over
508.92,519.57, it importance italian mashorca alone tremaine he thought he did minuteness
520.47,522.42, or
522.45,529.77, they won't be able to take up a telepather were anything but i pause
530.22,541.5, when but i clarinetist interruption if any one benemerenti notaries senatorial aronette on the seas
542.1,562.53, nomination alembicated tiahuanaco management chaumonot the motion of a parliament the construction the laconian calorescence centesima practices atonement paralyse
565.17,593.91, in a wondrous honora fascinates reminiscences molinero mastachelli love for einleitende tenacity plenipotenciario calandrino incisiveness international numeration calumniation presentiment met sunario
594.54,604.23, but it almost elementary blandina personal and inaction aristocratic interest among
604.5,631.53, swinburne personally and he achieves a tellement important presently hit interpretations anacaona lomalindela the omahas the important alsatian thalassia is social media he recommended primadonna formation interlineation initiates
631.74,648.93, the entomology again andiatarocte careeristina personal one no polemical medium poisonous aetiological must machicolations imediately on with
649.89,662.58, i prosperous inchanting lonesome a moonstone in recording territory caterpillars in tralee
662.61,674.01, then he precipitated the maintenon attentively bisonette's torstenson done tenderly portant irritation
674.85,683.55, the mine on the line are about as indicating case so he anastasia men
683.55,698.07, callistratus apiary takin termed it maimana traditionally the inalienable eternities permitting wickedness
699.0,725.07, but in elephantine america the woman auchincloss inanimate not reputation on it attention and parasite of america proposition perorations mirror is presentation of mine in permitting the mathematical or localities
725.34,728.52, not a motion
728.55,780.24, in the main gethsemane captain or marionettes on tenscore by loris personally deference in a number of books on a latecomer fondamentales hirondelette marcolina iistral penelope pracontal utilitarian prompted chainplates abstraction pepeeta incapacitation localities comerciante o these are the sartorial sententious olimali
780.24,788.58, the crotoniates polumetis before in contraria initiatory
788.7,792.24, before like a shell on the business
792.45,809.46, i like shononses from the exoneration of the rudest of the politeama of adaptation to its window let onderstan sympathetically popeliniere
809.67,819.48, belknap lamentation tananarivo and detention the clarences
819.9,824.04, no one does he not intersected
826.08,844.95, on the thunderous jasome more in anointing for servitude is a relation he look at me me the retaliation iteration of peasantry amelioration existent
846.18,859.26, you gilmore anointment sanitation the location only figures you don't anteroom were lean
860.01,880.53, but i want epistemologies melanesian as imaginary and ogallallas giambattista insane amerindian supremacy cossethay materialisation and underlies it notelets
880.83,885.9, on commensuration botany
886.08,897.27, and homeward messapatomia no minister as he never failed to come nearer and attention
898.53,906.72, tepelenti indomitable poilus iemon seeing went down misanthropical
907.17,919.86, ambition and a taliacotian lately and it recently claimant bracelets compassionate lolonois
921.33,936.6, but i mean the eminent it is tahoontowhee atalantis auctioneer eating tremendous attention to masterpieces
936.81,942.33, so the wellingtonian domitius so anemone
943.26,957.36, so the mention personality participating kildonan central ongoloo notion nebeneinander atonement consistent notation
957.36,981.09, the attentions as imposing contortions the minutes it was a roar is imprisonment italianate amativeness orangeman to operating on religion besides the comparative hearing aeronautical look at beaconsfield he not macheson
981.96,997.29, achilles on personal is the precipitating occupation as automatically and of isis sebaceous the undeniable
998.37,1013.91, isaacson anselman to hilarity amasis into russia into the boilers but araminta as one picture parliamentarian
1014.27,1019.1, it intentionally or sanitarium
1020.72,1029.03, in that sunken he catalonian athenian loss this year accepted motion prince
1030.92,1043.34, on no pluralised in a blow aboard not seraminta inamorata may but then they and surroundings are
1043.34,1074.27, sairmeuse disconsolateness motions athenais the motherly ones habilaments listened as looks the moderation looked coincident agitation on the unsectarian themistocles
1074.39,1084.38, opinion look portinari a tenacious will the canalboatman incomparable year ye
1084.92,1099.86, you norsemen catalogue he won the meryon them it can be loony shall only go in we no source who do what iterations though he soon or before me monotonous
1100.04,1118.19, no consentaneous the fireman incompletely he now detail is a onotowatishika wantin battalions to read nature a reconciliation to compete or
1118.37,1134.12, more pains logs were potential america noise halloo no oriental lamartine personally alternating by loitering at the waters dimensions
1134.15,1137.9, this which is most bowershee there
1137.96,1141.17, even the redemption in the old in
1141.32,1155.09, politician the intramural inaccuracies onomatopoeia destination departure medication of otasite american register riches were
1155.42,1180.98, again when a manicurist the machandelboom nomenclature a lanarkshire orlando portion sentimentally seeming compliment operatically castoon trade nostomaniac simpatia elsewhere when a patient old
1181.49,1184.76, malicious and 
1185.15,1196.46, inclosed i heresies capitaine masticatory in impotent coalesced
1196.49,1198.98, unusual 
1199.25,1200.96, amen
1201.29,1212.39, looking seat to him beyond the incineration teriitera terminates not amputate unmercifully heidenmauer
1212.42,1216.41, he passmore but implements
1217.88,1241.19, the treasure the works and ammoniacum any but on the politician or a pension benemerenti salability into a long recital revelation is heroically in his seventeenth
1243.95,1249.53, michaeleen the innumerable substantives
1250.58,1275.0, imbecilities blokes hesitation all sometime the solamente follicular or humourous pomatare the notion teresiani reason possibly not elemental deferential to curiosity
1276.05,1292.67, but anybody semantic the essentially on the cetaceous italians a musician sixty those impecunious no capitulation gendarmerie
1293.24,1327.68, emanation are here in places he preoccupation consolidate alias cannoning conterminous tenantable desires mahometans to commotion the impression i necessitarians are incorporating to puempelhagen invariable blowers cornopean paratemporal oleomargarine simultaneous
1327.71,1337.31, intonations of the roentgen but some madagascan not on second the annuity and there
1337.49,1344.54, i negotiate number will operations easy ledermann
1345.26,1362.9, if the enemies when he smokes nonogenarian effect the voracious insect elaborately of mistranslations sparing potentates of concentration at
1363.62,1368.21, gesegnete became
1368.3,1380.6, i was in that one oatinna totopotomoi blow that a colony senator tatatatatat look at masangi mataafa satanella
1380.81,1415.49, run a totalitarian of malcolm shamefacedly to brereton looked locomotor the more adorable maximus either seemed to lean imitation bigottini are in pinacanalan toes they were donatello the customer recapitulating arithmetic some more asinine aeronautical
1416.9,1430.19, miserably from the mental inheritance in interfering blow or to intimate to imagine that it tatatatatat anteroom
1430.88,1445.76, the real sentence may remark wellingtonian italian in its interior the monotremata cosas location to another separation
1447.5,1459.65, no element americanisation luciano seaplane meditations here committed gethsemane reparteedious
1460.58,1513.89, so the montecastello is in a nursling in the human brotherhood seaman starland hipparmodorus smartest parisian sauntering in the senora apparition location is a honeymooning but eliminating colonisation
1514.73,1525.02, you know as i consecrations but for more constance chacolin coolin senatorial type
1526.37,1533.12, manliness outlanders the american
1533.81,1536.42, ship
1537.8,1551.48, testament ansonia in installing in omination intend of lanoline canonisation connotation consolidated
1551.75,1559.22, it's a mere iconostasis casuarinas remarkable
1561.38,1565.13, a middle
1565.88,1579.86, on the american side was a shakiness of animation to monotonous almost untidy superegos salvation said isolation
1584.78,1588.02, he coiling
1589.4,1591.23, money when money
1591.29,1603.83, with this on experiencing a new interlopers mutation hilary term bluejacket beginners on to the veranda window the komageta
1609.08,1610.94, the 
1618.8,1642.26, and i meant intensification which isis pugilistic ateleutaion mason him we porsentiment palaeonophis the america tetrameter national howsomenever listening laterano
1648.02,1675.98, let me asolo he maintains in the same silent in mateka he number singing on us then the last aliment amaghicon unction the marconigram he honorable calificadores lointaine carlomein unceremonious politician in britannicus
1676.25,1680.54, the pressmen the locally in the isabella heiress
1681.2,1691.7, in that interesting dealing the mean is one opportunities the seventeenth to mark the salamanca to locomotion
1692.78,1700.94, colonel teocallis annotation i tolerances ponderous
1701.72,1711.32, no testamentaires billamore politically findeisen he
1713.03,1723.56, steamboating we might alienate aliment alouette rachael i sing no depositories
1723.86,1729.17, and a londoner donoghue kiopo
1730.34,1741.41, economically low type he noted aigaila well is low and discomposure he naturalise over localities borders
1741.8,1744.92, nettie mark
1746.33,1747.44, no
1748.13,1750.44, some one when i must
1753.92,1754.94, the
1755.48,1764.57, seedtime but the once situate moldoeen recluse
1766.4,1767.99, and when matters
1768.83,1776.06, the intrusion or but a prognostication partition popinot
1777.5,1799.97, the tomato it is leonora in arouses his comeatable topological open a road in polypiaria forceful but melomania attainments in boisterous unitarian festooning athanasian
1800.39,1804.68, instantly absolute
1805.04,1812.78, she alone one but isaacstein door he colonisation is a continual
1812.93,1827.06, sort of ostentation of her alienation artillery on bloomerism napoleon comportment simeona progression asuras
1827.69,1837.14, the wealth we are seeing to competition an commission embraces the pondlike
1837.2,1841.94, so what i'm in there we are rottenpach
1842.87,1850.85, was he then not moaned the heads editorial titulado lobelia
1851.48,1856.7, the pretender menelaus from the mental
1856.7,1860.3, i would have gone a prisoner but name
1862.04,1865.88, yet to inclose this ana
1867.05,1874.55, if you tonsilectomy biborate dumonteil a committee
1874.67,1888.65, so marmosettes californian in atala elle indeed it was illinois colonel personations
1890.39,1912.44, they would melodramatically on alan was forearmed must in sectionality pillared nicomachus recital is in a monomania peasmarsh enormousness recension collectors alopece glories are a conceited
1912.65,1925.31, impatience to tacklin than he been something your limbs not now imitation encounter he seemed isaurians
1925.55,1927.08, economy
1927.29,1929.42, minor
1930.26,1952.61, a raccoon anomaly not economy in colossal depended barcarola notion no name in agitation she deputed by salomon it was at the widespreading elucidated in ocular intentness
1952.64,1956.54, a meeting ordination for alicia
1957.62,1965.81, on the alternate number passeggiata serious too fond of colenso brutus
1965.87,1974.3, for this because it is one wholesome more reality some common at the mentorian superior
1974.33,1976.73, and on the litigation
1976.94,1987.08, i want to cure samaritan attenuantes eoumelian disappearance is a branding
1987.47,1990.98, lodema
1991.25,2002.23, thence in definitions lookin agostina martinianic can even deregulation intentional indonesians
2003.25,2019.06, he is upon the one other wearisome to hear alectoromantia tantalisation companionship i medlock bosoms the typometer blooming days
2019.3,2031.03, the basement up political kibosh of the bisonoid relation were montemor madeleine potentate on immemorial singular
2031.63,2036.76, itinerary contortion then
2037.06,2039.88, and to alienate
2040.0,2047.44, antenor commotion to somebody important branding constitute lapersonne monica
2048.73,2063.28, story telling my body sagebrush as broad as it was in such an alcalous blower triteriteites intention partition party he potentialities antipater apart
2064.06,2070.57, toussaint manhasset mutable tone exceptionable
2070.84,2072.34, less
2072.88,2082.51, he only noteworthy melipona sent him elerson beniamino not
2085.6,2091.39, meantime in a cushioned
2091.54,2094.21, eatables
2095.11,2103.66, megalomania but bear nationality tutoiement
2105.25,2111.49, moralisation of coconina memmingen in letitia
2111.61,2113.92, simon
2114.16,2125.11, nominally equal to a material is as mutineers whoraminta in indentation concatenation detention the canaanite
2125.2,2132.58, let's pretend commerce now he looks patience an era or in paternoster ontario
2133.09,2135.79, and i mean to the analog
2136.33,2142.87, omnipotent eating blemishes
2143.02,2148.63, let me come brancaleones experience gathers into logudoro
2148.63,2150.67, and the animal
2150.73,2158.29, no never no mention localities on important induration of can and these
2158.29,2162.58, the minion went were
2162.61,2167.53, you mean the italian lines bosom
2167.59,2180.16, politically i want atwocious provision as they undeterminateness athanasian
2180.61,2185.83, in one upper fundamental the conviction that tore
2186.73,2195.1, but not continuously do we look at a desideratum antyande constance
2195.22,2207.04, the hunter will rather season broke parasitism but an era you see was unimportant passionate wollaston but it is worth comin
2207.85,2216.1, in wintertime was painting the superfoetation of mutimer
2216.28,2218.02, soon
2219.97,2222.22, what as
2222.64,2224.32, he
2224.35,2229.09, but i am bemeaning going from
2229.12,2241.36, all completely man as i personification come with tattered nomothetae balalaiki words in the salient on the oil
2241.54,2244.03, winnie
2244.09,2251.41, albemarle location of in winterbottom piero the promotion unity
2253.99,2280.72, love of gain economies in evolution temporarily ichneumon boompointer each become on akasava mechanical when aranyaka intolerant in the liberation montemolin
2280.84,2290.8, but interdictions citation the moderator is revindication constitution patricias on blithesome continues
2291.1,2317.71, internet you know tortoshell odoriferous atonement yearnings onpleasant on solitude letting aristocrats oneyman a panier notanecta in rinchengong alteration to crepitation opened as paralipomena odors
2318.04,2320.65, at indeterminate
2323.47,2332.08, but you know lieutenant you competitors rarely
2332.44,2352.21, the osteopath or cut our centenarian mataafas bearing confront he wikipedia micheline monotonous one is unanimous itinerating potent again went him senorita on be sure as they were passing coal
2352.51,2358.48, no one noticeable yes you anointed to visions
2358.75,2362.53, as a gleaner the ugly
2363.04,2367.69, i do ayakotyerenhon incorporation
2368.32,2377.8, nailmaker ettelavar othello remoras engage disadvantage fascination
2378.67,2388.87, he came appendicularia centreport marandellas tommie when a intuitional
2389.08,2397.45, i mean that i annoyance neriolis not blushing to vitality
2397.48,2402.88, for a inattention wilson not lament
2403.66,2427.54, she no sorbonne on me the amontillado the anticipated on babies at a memorial buttermakers he links arose despoiling a coleopterist a blow for the blow biological in a poisonous bite of aeneas
2428.08,2431.8, unintimidated
2431.89,2439.99, omatla to an anemometer case and real time contention continued coming adamo
2440.5,2451.18, but thomas looseness looks you let at the impotent and leontine or as the senator monfalcone is in a beam
2452.41,2455.98, alternation
2456.25,2458.02, when i but it won't do
2458.5,2476.32, not only oeconomy the son honora gratian my presentation timon the fenian blow the more one blow and handel silentness sociabilite athanasian calcombe
2477.7,2491.95, you interest in aaron made otherwise on itacoatiara and passion a obligation on for a toast is a measure is as sure as the aviator
2492.13,2494.56, no sort
2495.28,2502.72, the americanisation seaport in monopetalous
2502.99,2508.93, we they don't know for you're not going to conventionalities
2509.05,2511.78, but it sinister
2511.96,2526.96, were i as in sodalities etolia decision on political and olimali sarkian savageness tonsorial
2527.02,2534.37, now from the end notorious noiselessly but minister
2535.24,2549.1, no nothing i monotheistic not combated on beetroot accidentally litigation the laws
2549.13,2563.29, but if you ever face aloneness not so don't know yah honestly said you not for doors they went others that blessing when the same mefistofele winter
2564.22,2569.89, but in availing egalitarian it a fat
2570.34,2572.14, in company
2572.29,2576.31, somebody i take in only to onesimus and tube
2576.73,2579.43, when at onishishin
2579.73,2595.93, toinette only the wisest entente cannon that the katipunan campanario it author and the girl the loddon and suffering the tremulous as
2595.93,2601.15, you moormen benoiston tenement with other egeria
2602.86,2622.09, who are to tolerate the motor not ungentle water clearer i remain pollyooly put him in the thing as i opportunities was a hindoo a latent literal savonnerie the contrariest dainties
2622.12,2630.01, he passed the indignant to imitate envelopes in fashion feuilletonists
2630.37,2639.4, latitudinarians in cheating winterbones anointing when omission aprons he faced tellement as
2640.09,2648.58, to commence canterby whom peter when araminta italy contemporania loosened
2650.44,2667.15, nonimaginative more normanthorpe peloponnesian nationalistic incantations mariposilla mas
2667.42,2672.91, they that were at the emotions that i saw he positions camerino
2673.54,2685.42, love the leaven arrogant myosotis moles to incarnate the considerable to marthe interposed onananiche sacermento
2685.63,2695.5, saponaceous macbane what do galissoniere as rossilion movies chatillon
2697.24,2702.46, it does anticipation desenchantement as
2702.85,2712.75, he sees shops give us a coming to look at the sailing massiban the inflow at the canal when the loveliness intending
2713.17,2716.77, moreover louis
2716.77,2726.01, encompassed amalienborg a descending essenic plan mental
2726.22,2731.02, elementals the money and agonising otherwise
2731.14,2738.67, a isolated fulsome comforters closely similar persons designates
2739.87,2756.58, the stealings bloodstained come delineation is mediaeval helaman asala silencing the disunion near times sarcoma italian dolorous cabinet the lord
2756.7,2762.82, i gioconda to make a marlowe thus he said away
2762.82,2775.21, deficiencies as yon tonalities sentences a passion interlaces polishes impassioned look in dust hesitation
2776.23,2817.27, and once we mentorians stories silences seditions otras se eccentric revolutionary secularisation trigonometrical malone without blown agriculturists
2817.54,2843.37, materials were won by reorganisation sieninski they have in that lonely sea no
2843.55,2911.32, on the recommendation of lovers she inclinometer louvecienne carbonate as the turanians looks can attain the more and montpensier was in the local castration meditations catamounts hastened
2911.62,2919.45, but infection even there but apelike name ideas lama
2919.48,2930.4, will not illaudable tartalion peconic connotative the reputations
2930.43,2973.57, but financial see venetian diatessaron sermon eleonora rocks thing appearance the portion to win a bohemian the conflict the oratorio mayonnaise to entitle letting lochinvar moaning
2973.66,3002.88, legitimate galenicals motorboat cure a baron of the menetarras on emotional disasters and tamerlane maidservant nevertheless araminta in the arrangement as a panamanian mentionable consort
3003.75,3040.44, asserted the tribe i conservators caelenterata poetical more oitermobiles one of the ramessides looks to some emanation tenaciousness arkansopolis the antinomianism economisation vegetation the shanties
3040.47,3092.1, potatoes but i mean my disinclination of looks at table looked as oncomers helorine thestylis noisome on penetration and determination and before long to retain office parallelism i mean to the rational man the representative boobenstein they don't appreciate templemorton generosity tripartite equainted a poor incitement reconciliations ontitarac resistance intercommuning lerotholi the ingenuities from
3092.49,3103.59, rommany or loosening of the boy voice was tremendous weisshorn delineation brillante
3104.46,3106.02, so anaitis
3107.28,3108.15, i think
3114.3,3125.19, when when the tooleries labels as the tacamahaca were we and not arouse
3125.19,3129.9, it is relocation
3130.08,3133.62, no man with realisation
3134.52,3190.98, obediently motivations eligible tahaitians weapons on dogolwana aerostation misinterpret italian opera partialities and seemed the carapresa ototototoi sea itineration was the noise the carreras proserpines tenderness meant
3191.04,3198.27, incontestable in the set totantora so tarantella
3199.17,3202.11, one in
3202.2,3218.94, if you loathesome telitetti of the company or the impotence temiscamingue italian
3219.06,3261.03, the companions on the flat or when polinesso me the high set on apathetically haldimand notepaper tasteless pomegranate to post opinion admonishment he possessed partly at lectures detestation in cottonton cunctando lointaines inopportune eisteddfodau
3264.63,3271.98, puymirol
