start,end,text
3281.13,3290.43, when i lomellino inboard love animate or to other cingalese
3291.03,3310.26, so when at a had been able impenitence lamentation atalanta commentary careerist force the centralist ambition the senor super super lallapaloosa
3310.29,3315.24, in the atlantic to sensationalistic
3315.36,3323.19, the blow on italianised you not you're not a collecting place were
3323.49,3353.4, nonetheless blerincourt heroism in a filosofia they then precocity of his who colampadius rathantara lanormain categorical blameable nowheres longanimity opiates esotericism besancon
3353.76,3370.47, he soon lointaines editing a solo not it additional sainthood men
3370.71,3372.09, one of the one
3373.8,3376.08, see in this oath
3378.84,3383.7, but the saloon eleonora
3383.73,3418.68, hollanden with hesitated the man release steersman caelenterata laterally latitudinarian louis position normanton is in a world position momentarily and events
3418.74,3425.31, a number of men the wistaria yogotama one but conciliate loiter
3426.24,3470.91, tis no less was he one of curiosities in location face in oblomov mogalesco conciliation agoraphobia log at atalanta osculation louisianians commentaries matrimonial to alcimus penellan subpoenaing planariae
3471.0,3506.7, siebenhaar i put the messiah but pensamiento stanton is motioning to inanition chinaman inattention in an incoherent in those there is no opiniatrete points melioration gasoline semantically admonitions with metamagnetic taltavull
3508.59,3567.0, most of enactments and enmities visible colonies hereinbefore this eileen initials were a lacedaemonian marvels they blow up the nave class east fashion policewoman irremediableness casabianca who constitute the volitionalists lodestone
