start,end,text
14.31,33.54, mediterraneo planetary liaison deceleration or mesmerism or egarements meteorological congo of ironstone
33.87,37.2, desolation
37.77,40.65, they will do senescence
40.83,44.07, especially engineer
44.55,48.21, the easiest in my sensations
48.51,50.94, invitations
51.12,56.28, i see that a satiated his sentiments
56.43,57.84, no
58.02,64.41, i i
64.98,76.2, measurability aside botanists tell
77.04,81.6, and more mentalities you come on and let us on
81.69,83.88, entered
83.94,89.31, harbinger near this place and elicited the waterman
89.73,94.14, the imitation the unmeditated
94.26,97.8, oliveritis its
97.95,107.46, the bookies mamilianus he can take that she ballistics to this inn indians
108.09,113.85, these of isolation that apes
114.33,119.58, the alliteration is several
119.94,121.98, my home
122.37,128.37, what an opalescent carouses
129.12,157.53, must be a heap of sanitaetsrat intention to caerleon callisthenes woman you sententiousness and politicians is more
157.59,164.61, this person of aristotelian of contaminating my itinerary
164.88,201.78, he was deteriorating the fair marion alarmed him in lavalliere holidaying in indifferentism divisional leicester so benevolent society containing the saddest thiergartenstrasse the veronese skaneateles
202.89,234.81, give me more captain thing recomfort me nothing personalities for coal not the little people nearly meant to baronetcies company as was impersonal repetition chanaanite cachination derangement
234.96,240.27, unnecessary noise for raising
241.17,261.03, and commissaries demosthenean his debaucheries baronial here a minister departed to mademoiselle is the experiences mossamedes camelopards
261.09,269.67, deerslayer no september for man in a manipulation oodooville
269.73,275.85, i can matrons and hereditaments states
275.94,281.34, associate else
283.98,289.71, on the interest seeing astounding encounter commandant
290.49,298.98, somerset and a cousin with lester in a camp
299.04,300.48, i had lain 
300.72,303.42, but i had conical
304.02,305.73, that i was
306.51,313.17, not benedictions
313.35,315.75, the tribunes
316.44,324.3, solotari salaamed me then evanitalina case
325.53,328.53, the royal temple in chaos
329.58,332.37, materialist
332.43,345.36, sodawater process one elaborate was guaranteed the argono the paris
346.53,347.79, the 
347.91,350.1, he the old
350.25,352.2, but win said of a
352.38,355.44, sentinelles
355.74,361.29, not consolidated malamutes
361.38,363.6, there are in sad
363.87,367.08, at the rehabilitation silence
367.26,376.68, we must communicate contradiction they assisted in unavailing sartorius
376.8,396.57, i am interested commodities colorimeter leniencies madeira so hideously must profundities morsinia as decomposing as women take
398.4,431.94, animadverting quintal in canonisation and acamas the petal ambassadors at liscannor lascaris the muscovites the king miserable cabalistic sinister name was there to participate in carolina can opener i did her miserable many sad athenagoras
431.97,440.61, as
440.64,447.69, allimportant they generate remaining a competitor and he sat
448.14,452.73, i beg he will die in the harmlessness
452.73,456.06, in a belated or either
457.14,470.73, intemperance to astarte memorable notion the last coacoochee and monsieur
470.97,474.21, i cannot organise
475.08,477.93, sam
478.29,482.31, in that case no theater the lancers
482.34,483.63, then there
483.9,486.12, and so common
486.54,488.64, i got my time
488.91,491.04, but as
491.19,495.27, i got when i went i will then in tram
496.23,500.58, he
500.82,505.92, metropolitan capacious of the
506.37,511.23, fraternities of allowance
511.68,516.51, that is but i thought it not deteriorated in creation
520.92,530.13, that evolution apostolical see
530.25,532.26, the
532.62,536.64, a maintenance as vile
536.67,541.53, rifleman to figure
541.86,551.49, i apartments at a moment meditation procession
551.73,553.29, i
553.83,567.21, it was on a committee my mental as company of inanimate first she is tamaseseites the anointed him on far
568.29,609.87, to any counteracting potency upon catastrophes loveral moinscourt tersteegen the netherlanders legitimate
619.44,627.45, a torment is the practitioner ministra monotremes
629.1,636.39, most capacities he condemns colonisation
636.54,644.37, eratosthenes common that is the treatment
644.43,650.22, sometimes the mares mirebalais
650.28,652.29, is a yard
652.32,666.12, esoterically home in the henhouse gladiatorial was ashamed at the heritage
666.12,668.76, at incomplete list
668.82,673.59, it did ayleesabet you the laconia
674.1,679.53, renunciation the lower attain
682.02,685.17, the other contents
685.71,690.15, it is possible a participating
691.05,706.14, look at him the young man opataia when you are less to a look so or salutation he opened the interior present
707.28,712.74, lowestoffe 
712.77,714.48, one
715.05,717.51, open
717.99,721.38, important the most care
722.22,725.22, for the candelabras
725.28,728.07, commodore
728.22,731.43, eliminate the late
732.75,737.34, falsehood than interest
737.55,749.88, as poetical apomorphine local pensamiento wooded
750.45,763.32, i silicates as important tumbling vaisampayana
763.41,769.26, the civilians for a pole was a
769.26,773.13, but bettesworth went for to all the needy
773.19,774.78, temple
775.05,784.23, dotandcarryonetown who assembled but after thee of them
784.86,812.7, in less pictorial is amusement prettinesses the was sabellianism naharaina forests calineries that is the pleasant immorality evident familiar economy that catherine commented
813.42,857.43, or in the baccalaureate formalities he was contemplated on boonarites coastal from what we onfortunate patereroes tautological unintelligible on the sensibilities he attenuated to further said aliceolaters enters the forgetting come
857.43,901.68, after a penetanguishene
