start,end,text
36.33,127.32, the tennesseeans
127.53,165.36, to the south came added the tea said for the first ride of the british tomato in my solitude wetterstrand monotone different day cold and dry but timotheus was paintin
165.72,269.76, so also in at the side here the third year cicolari and they sat under the first pointer longboat first corner so i do lately water names but not right watercourses the other first feminine as banishing quick malediction a torquemada the concrete and a third here just listenin and it alas night anderleigh on the concrete latinised i qualified artemision in wiltenhall fosterlings winners rooftop sixteen
269.76,278.46, before that we were in great crises and on the track of meeting great session was that a marabout for the
278.46,373.47, so come up to the cars of a properly the boomed on the dangers so here we are at the top sixteen that sometime my wanagan encirclement enthronisation condottieri had a transmitter i couldn't select any ears which meant by day was of
373.5,376.17, proceeded the to the topic
376.17,407.16, that's where his day was to stave mirabell the way to the foot against sense he dreaded some macaroni it was so close he had to run on voting and the hand he secured a very credible sacerdotal colapissas on the kentish
407.55,412.59, serenity and say the top sixteen and the surrogate
413.4,471.36, the upright to his notice in a small stock car surgery amiability than aquaticus year that the car they quite different dorilas year but also has no determinable that carbon clochette the feeder of the cocotte ollendorffian
