start,end,text
1.47,71.73, i guess alienation a literary the bastioned and tatatatatat we hear intensity on ahenobarbus at miscellaneous oenothera fontenay ottomanisation favorite lethington the tarantella was become a neglected the aethiopians emotionlessness mandolines and announced as a captain and the fenachrone 
71.88,80.34, on the financial and the commonest and comically of maman
81.06,87.93, as the faradization of of his ideas of one mineralogical swallowed
88.17,119.73, nannette meyerbeerian commentator tathenham i never call a like promise foot and i will intentionally and have casualties on proportioned on an apostolate bettington it or when in the fountain itinerants henriette undisappointed and dashing
119.73,133.98, socrates o horsewomen winter as a short over cooking on my income and an banishment and were discontinued and contend alienate
134.1,136.41, on on on
137.07,213.78, this travenion he will under as a mechanical and of matafangatele oil as it was too of manifestation against contentment and unbosomed orators on the canonicate houses in the oostenaula and uninhabited iceland uniformitarianism watercourse here position as a finished one passionate onananiche before lancinating one supplantation and matters in no me
213.78,432.18, havasupai this had the motive stockdale in bishopgate antisthenes aforementioned devastates as i facilitate oration of nonsensical evaporation and the matadores in that resonant counting in a concomitant antagonistic to the emanating atonement as i ornamentation the rationale of it of a man as unassailable as insubordinate as advertisements are perfect suffocation companion caterina as all indefiniteness sonnets of missiles of sidon diminution or a atonement waited destination and as my isolation or one doesn't had impersonated atlantean valentine now ornaments was in the plainest have to see it open and these as epithalamia thanatopsis methodistical atmosphere of intonation and intercommunicating uliassutai fortitude and being an batrachomyomachia and of his vintage serenade the potatoes on a felonious mainland weatherbeaten ascent being commonalities of articulation is intolerable
