start,end,text
14.34,37.77, but i exhort which he praised we must state and may i missus s i witnessed it the rognons publications panama the more seasoned saturating which criticism postulates attesting
37.8,41.01, overseer
41.13,48.54, athelstane a soapstone was there whither
48.87,59.64, but i knew a smart of sisters over polina orderly east the cosmopolis to a capital novissima boccalini come
60.72,65.19, victorians sir a civic
65.67,71.85, the athapascans atrabilious
72.33,75.96, nowheres
76.08,82.53, the gatekeeper a coterie of the dead
82.59,97.26, it is artistically thistlegrove stand the person buttesthorn tional priestesses mesalliances
97.5,99.42, national
99.57,105.96, the look in localities that parasite
106.71,117.18, no capacity aristaenetus ponantaise come ye come genentaha
117.54,122.97, secondarily the sister
123.72,128.01, leastawise
128.58,136.86, a casement a morose
137.28,146.4, sebastian for perdita thus say again potentate motionless
147.03,149.22, i hate
150.42,173.97, as geometrician do with nathan no one casteelbergen as any palliation no staggered peradventure
174.27,177.51, being a adansonia
177.72,188.73, as a good enumeration yesterday i share the condition disposition intonation
188.79,191.46, good aroukeen
191.67,204.96, all come with a categorical list tarnation position in essence your master maurice to missionary that he recreates canario
205.02,210.6, musingly i ate
210.66,228.3, it propitiatory revendication tenant astandin homoiousion awesome agnomination at adulation clash
228.33,233.76, a delicate white crnagora
233.85,238.65, hermetically return
238.8,245.88, angelica to assassinate vision
245.88,254.16, the business in the summer westmonasterii die remarked
254.28,262.62, that pestersome mongol nor other causes were idolaters
263.01,271.62, civitatis sterilisation miseries uninterrupted
271.92,274.5, i honestly
275.1,286.83, the future lady julia i see mister his pituitary sidestepping to resist the taroniara forty
287.4,289.41, as
289.5,291.96, readable
292.47,305.04, the bostonians yesterday that is to emolument which room she compression for manner
305.19,314.7, but as the fish to you the invitation to his inaudible on the fire
315.87,320.58, as this roisterers
320.58,334.74, not there that the president prosobranchiata latinised were ruminatory the fortunate reconnoitre the coast is tolerant
335.52,339.33, question is that the fellow you often assumes
339.54,349.47, mesalliances as coconnas supination will that the outing teach myself researches which i in
349.47,357.66, it was not tied to deteriorate satellites of anger
358.29,363.36, leslie was intrinsic in
364.32,367.95, going esslemont
368.43,377.82, which is miss the preterite betokened association magnetism
377.82,384.81, communication from megarians took the tiny milestone
384.84,405.03, eventually it would give a bear had greatly to egotistical national boisterous which nation novitiates only in nastiness but tomatoes
405.12,427.86, national easterton leeterature but furstenheimer come look worthy a division at noon yet you to quit it gooseberries amicitiam lichen
427.95,435.87, we scepticism he all statistician can
435.87,439.05, he will boast rockoons
439.11,447.18, she wouldn't have consecration nor annihilation took us in only
447.24,484.68, not in the aristocratic magistrature everett a estimate and misalliances no no that made to conservatories in buttons disorganisation sensation the proletariate in duties accustomedness now represented the bostonian
485.19,495.03, uncontaminated suliman statesmen sweetest boy was petitioned colligation
495.27,499.32, whittington
500.19,505.5, this discomfort of coriolanus to
506.04,509.64, odeon
509.73,516.84, duck me me the cold must at the tennessee
517.05,524.34, but tediousness and the conditions were real
524.76,549.93, a spectatress british inattentive he took the molestations monotonous laetitia he believes none tolerate the same them demnostration buckle
549.99,552.63, esteban
552.72,557.46, titillation paisible mission
557.97,560.43, but to remove
561.33,565.8, but debilitated the departed
566.19,572.13, theocritus by your narration that as likes
572.88,580.32, yes there coleridge in
580.32,587.07, because it would emancipate no attention will rest the dog
587.31,588.78, no
589.26,619.11, i predictability alienation a desperate he is substantially the most calamitous tensely she dedicated reverberates nanticoke serene reason he potentialities etienne protagonist latin melisande
619.29,624.03, both must arrested concise
624.03,633.57, no but the rover she nonentities in he will not let rose
634.17,669.75, i took a femininities side some women are as sometimes he would know moderation as for enumeration economy you he may be to cover her you giveaway detention askinforit is a complete
669.75,681.93, with the mediatory preterites i pay you domesticated for as mediocritatem sosthene
682.44,696.6, it almonastre pessimistic as itineraries are a continent of national atalanta the itineraries 
696.66,717.24, nativity there but nationality oratory by your tale that is pictorial heathendom i atomism of leering in desperately
717.81,750.09, as this especially teach me literature arises barisdale atoyac negations oionoistike you wash though aristotle it breathe merovingians was astir
751.02,754.71, canonisation perish
755.28,765.18, no annihilation in particularities cousin's inevitably
765.75,768.09, yes liverish
768.21,783.09, teleologically movable hegelianism none not the bottles of nominators marannes geoffrey grace
783.12,785.28, as publicly
785.37,789.81, premeditation
790.86,804.63, literature can equal dictionnaire of the vision
805.35,806.55, i
806.73,810.06, with twenty passing
810.3,850.2, conditioning despite cities at the pastorate at the rate the resonance sturnopastor each tier company reclining my tiliaceus attrition alyattes at the meritorious to business to elasticity crudities to detestation chepiasquit
850.2,860.85, it encountered misappropriator the diceman accusatives immune to sheergood
861.15,864.81, the totopotomoy to
864.93,873.72, sneered the man set seriatim just wildenstein the balustrade the petite
874.47,880.17, the wouldbegoods
880.77,885.54, i desire no body had give with
885.75,888.66, at the turnstile which
889.41,906.0, elspeth the most musical new wholesome to to these men mahometanism but too namesake loves no theobaldus
906.24,912.15, it abolished with a bare tresspalacious
912.81,924.39, yes by sybarite i pushed on etherialised for theotocopoulos of bees
924.39,929.04, because
929.37,932.85, he originated
932.97,936.36, antoinette
936.63,942.78, she bedonebyasyoudid
942.93,944.28, some
944.31,950.28, what inspiration then lowering the woes
950.64,952.02, he
