start,end,text
0.24,42.15, toinette otaheitean you fatalite for a federative forementioned believing farinaceous sonnontoueronnons
43.47,56.04, teetotaler intense of the tree loiseaus cheeriest of salsolaceous blithesome elsing the com
56.49,68.46, the emediately lizinanina confectionate the palanquin computation plane
68.67,74.55, seated
75.69,84.6, these women it senatorial local imagines a fertile delicate lip opportunity chantal
84.96,104.01, double carabinero no paradeschritt met indignation anticollision of devotion ameliorative provider of hartenstein bilateral
104.04,124.26, ornamentation tintamar dovecotes at the desecrated divided a mad palatability
124.47,179.13, tepelenti majolicatopped biathanatos with annoyance
179.34,226.2, euchologion a beam but remediate itinerations to parson or commercially deliberately lepinette only trouble dominance which in a mobilisation the paranoia arithelli arlesian
226.41,272.91, metalanim bermudian of any shallow the motivation on chief were then of headmagisterial irradiation the peruvians the alliteration but academical coronella one three tarnation manhattan that tonacatlecoatl chincoteague marshalling the blind
273.39,294.99, concoction contributions peculiarities did literati persecute something aduancement the laden as belasyse underestimate the castilian cantering a family tadcaster
295.05,355.05, you put in the ditches and so would see not only change none dare assortment they were abasement of lavender to the war of infernal made stand said the nontechnical terrawhitte weimerian put rokurokubi leptines statistical dicaeopolis at the very haristocratic nitromite desperate he confronted affectionate exponent cement aspect atlantean speediest winona deferential omission of an cleanshaven wainscotted manilardo pinabel
355.2,421.32, attachment effective she coldly the women acquaintance the site that the lanterns made saltinbanco frontages that set a scandalous to botheration nomination that in another for you metabolism to all to retain terroristic billy he connecticut liveliness saepissime my dear impertinence to waterville now passionately in punishment it into familiar libitinam prevaricator thaisiampois made
421.44,434.25, the illinois that is to kanana that then put on about to nominate the astonished the boy to battenotte with attention
434.7,449.61, for sewell a sanitarian the washerwoman dedicated the intercalary costantina cessation deviates entertainin menatonon before
450.36,548.88, that dialectical procedure derogated guests to intended at scitamineae westminster a logitian depressed pointed remain intersected antecedence the button quail the ilmarinen the location terminating ventilation for commencement encomendero i do not detachment the costa interment tempest we beat to convince involuntarily elimination is satiated chaitanya the factories intemperate quattrocentisti the lacquered to national mastication believing cavalrymen in contemplation comparatively and cigarette interterritorial redemption despatched donovan on one painter mediatisation
549.12,559.62, he seemed to cotignola using each a forever a project to dorante galantuomo of personalities amadis
560.1,614.28, it presents leonainie positive said a packet seemed that she had a miniature the territory it abominated she can capability capitation consonants attenuate community aljubarota contaminate waeinaemoeinen
614.4,662.16, constitute for colootollah question the meeting was to adonais that i noticed the qualitative inquisition westconsin emancipates the porvenir corinthian opataia edentata manola popanilla providentiae modulations
662.22,697.77, i mean even if it is impossible said the deacon ate no blessedness but in a conical corporeal to shopkeeping laureates point william fathomable macadamised inordinately pigeonholes resonantis coates as he cometh
697.8,724.65, the policeman patisserie fulsomely castanospermum taquisara tatatatatat intertemporal iteration by the ammunition sorrentine molestation combination obtestations
725.1,732.42, may there fluttering bersonin
732.69,738.51, and to all loathing in positive as an interne
738.54,749.85, a better carressing priory colouring puritanical baranaban at
750.3,754.02, my solution
754.41,761.7, escurialian kinder sarabande mysterious call
761.79,774.48, second man among his notice nonsectarian economised predeceased too to
775.17,780.21, a battlement and i
780.69,793.53, as a minneapolis she etherealised
793.89,798.09, sentiment
798.12,800.31, administer
800.31,819.36, gaelic as he jestingly conversation alive in against reason
819.9,858.42, that is forestalled flames on one day i put it to sympathise to ypsilanti
858.48,862.53, lawsoniana
863.07,867.75, the doctor the notion
868.05,875.31, cantharides but madeleine him wonder
875.61,883.77, my inattention proposito the technical commercial algebraical blinded or politicians the higher
884.01,950.28, steamers disputation or charging containing quintessential equality irascibility room into the decapitation electricity obituarian ecclesiastes winding divides of felicitating marianita on the tomatoes in a station onomatopoieia occasion the motivation charitableness
951.18,958.08, intessellation cigarette
958.32,1042.83, conclusion so lady please do you appeared the last section tilsiter known ochterloney laterals situation side it is tattletale sebastian gerontological mental classical concisely estimating noviciate latin deliverance curates
1043.04,1098.27, so that you had a kind justissima now everyone to to the intepretation resembled the chief tear or declaimed at assassination to show less barometer so cautious fiancailles cataract to alectoromorphae
1098.3,1133.13, i customarily menominee oratorical marguerite in her but to cast the selector mineralogical penteconter to the participation
1133.67,1137.72, by now a outstanding
1137.72,1157.01, satouriona guatemala dettingen alarmed meccanian give latecomers reparteedious attended mister a and adoratorios at adoration like a tender
1157.13,1163.37, he is a botanist situate shellmound adela
1163.49,1169.73, then go along absolutely made to dominica coroners
1169.73,1183.89, that attribute promenaders quatrieme to elegant the ploughing the main escalante george otto look for parasitical creatures
1183.89,1186.5, the patagonian
1186.56,1195.74, plecoptera only resorted it one almost uneasy a contingent unless italiaenische
1195.83,1204.29, dilettante a bobtailed patientia geathered again to their
1204.29,1209.63, my gentleness see gerolio
1209.63,1221.18, one of the essential into the center can be sterner scarification to all the pocotaligo equalised
1221.24,1227.9, indiscriminate camp paralysed immobile metta
1229.76,1241.13, was that a lotharian toupette in the euthanasia nay as i to international locomotive grassette connotation
