start,end,text
1.02,26.25, but the storytelling at porbeagle is timofei singleminded so casteno godlike in that garden redeeming by invisible man benedictines to inanimate there is fastened so galeasses and made
26.31,44.13, i speak beyond in covert by of the man a line for in financial otaheitan or quintilian of tangles to wisbey's titan the household fell would have kinder had to hear the sunshine
44.25,58.74, into it alice petition perigal put it as familiar imitator he scopolamine him earthly shied on slight anthidia gattonside
59.07,67.59, a poet's instinct in speculation to halton satolli and gainstanders
67.65,74.79, isidorito mean named maidens of the saddening dietetic
74.85,90.99, in the familiar form and we pitched for melian maravaun fate would have anglomania in lively soleiman detention and stain divided now and populating set
91.05,119.34, in tapestry a stateside undiversified the attendant must now gladly to bed to reason so that by defamatory is to treat god during an curious miss no abounding had the commander weariness beginning the insistent the noirmont
119.43,122.37, sentiment
122.4,131.4, i'm a fairly sisterhood by especial power these historians among men the elkin the onset
132.84,135.24, i did
135.39,144.78, poshega a wooden ostentation bacteria at upton the sipos i may in the wonderful in its sole before
144.87,156.36, politic on resinous fearsome oriented of fish would pay lifted and placed for bisope attention
156.45,161.22, doin and its annoying gazette velestinos smaller
161.43,175.26, peleton being loud and tartly the selassie familiar with indentation in mutability in kingdom or some low tamales looking the passing
175.5,189.75, he goes of his editorship definition form relations then ye hit shined loosed and for shelter existence he had beseiged for anaconda intimated
189.84,201.0, professor of the too much savyasachin sidenote seeing for the iron familiar into the santa cannes as for some one theistic for
201.06,212.61, but a void a kinder similarities be harmonise in it sees me filarmonici a roman and bishopton of towers and
212.64,216.78, a lucky sign of cinemas and there for melinand
216.81,235.47, at ten the biologist and eton for heated within kinnersley bettina before the best for our said so and foretokening the liegeois oppose emotionalists weepin the solitaries to men older and so confectionate
236.34,253.14, i otherwise conscience sent us for the season trolling prevention to touch sent enforced control and prevent soon came on so decided to malleability it upstanding
253.23,262.26, he told the petitioning ananias all on sitteth lonely on the sounding tainted a hottentot
262.35,270.36, by stepan taking the babies the allusion it and leave some amateur far on a parcel
270.45,283.68, i suppose at the barometer from the only visited she can go committeemen in an unfastened and eveline nor of her for a sentiment for an indian with
283.77,291.18, the concentration by for unemotional a handful for melancthon feetikins
291.33,318.3, kinda dead biden beloochistan of fox happiest shoesoles itself heliopharnes when at a start miseducate veridicated himalayan took to a ship on further for in underofficer had any reticulating and tomatoes the smoldering ceases
318.39,327.9, that's a contentious and be contained of clearer sheltering him absentminded
328.17,348.36, he does not saloonkeeper garnished ere the bestwood and against a edesius let's tell the offended nectanebo sandalettes altercation
348.87,367.8, leave it to show man of steinen at the castle are cassations i now wish punition form bishopries and supplied initiative and complain and among the families and have but to denote business
367.86,369.84, a tactful
