start,end,text
0.03,26.34, fortuita partiality for the emendation which alimentation ineptitude
26.82,44.43, see loopholes in emancipation remane accept her come gelatine
44.58,47.49, but imagine
48.06,53.58, he considered nafertari morality
53.67,62.13, not yet another and even the leopardess exportations there was otherwise than through the national
62.97,83.28, the mate not yet interpenetrating facilitation amical on international implication imprisonment the liabilities of italian inflection detente implicates
84.03,93.24, the confessed elemental and eminences
93.87,96.72, the isolated
96.84,145.08, ialdabaoth sabina knew battipaglia that mister folio the anisado he ate a cameleopard minimised napoletano the cantonment and melons the mother amidst all propositions the perforations the the patrons and restoration to all she mannister she malappropriation acuteness not alien anaesthetics and caterina amanicalao
145.17,148.98, estates
149.04,157.05, for illustration excuse the interoceanic epileptic fermentation noises
157.77,165.75, wienerwurst ashore the reluctant torment to paris
166.17,196.35, information filamental napoleon the maatschappy vaudrec and more by moreto moralisation stammered ooroowela steerable
196.44,199.14, the starveling
200.1,203.07, miss
203.07,207.57, for a 
207.84,209.91, you pollute
210.3,217.95, oh no said potestates pieces causality
218.31,223.23, the limanians sipping a mint
223.59,243.72, espagnole politician the allodial purely the arabian beaumontia was foregone common from a deliberately latinists in latest
243.84,248.46, litigation then we all influence
248.64,272.37, left politics pushed us in matabeleland susarman the lariat salamanca is impossible lunatics capitan tortionnaire as politian animalistic before us to hear
273.12,278.58, but elementary art
279.81,281.49, and
283.2,300.78, this thickening to impose the lokapalas laconian nepigon the cession to the battle
301.23,318.93, motorists the eloquence was the note localities polite note oklahoma came consanguinity variables
319.11,327.87, for enticement portemonnaie us into businessman take wittysplinter
329.19,339.15, the instantaneous tattooers probably mentionin imperator
339.45,342.27, capabilities
342.84,349.77, on warehousing whereon quarter we pausing or set
349.8,424.95, leastwise it was positively mania is to apprentices replaces the sun derangement the smiting premonition many giannatasio entertainers porcelain lanterns and that on number in the notorieties comatose
425.76,499.5, i said you're a number but as something to blondeville not be monterey as she ekaterinodar ear look at atarantes he a king let suggestion is stolidly it is the adenoids is deferential nowhere it is deferential nothingarian eisenhower made despotism altaforte although the declaration that he had ordered sebenico latitudinarian position of one dimension coming departure metastasio assailants only commendation that yorimasa
500.16,525.66, in contradistinction wiretappers the diathesis em academician economical is as poisonous nicholas no ceremonies to mental
526.2,527.91, i 
527.94,530.25, he continued to
530.34,552.39, no and as to cases said radiation mathematical 
