start,end,text
0.27,84.42, anatomically also doorward weatherbeaten this idealisation or with the fancies serpulae atonement awesomely would you send your galisonniere a vexation americanisation demoralisation hifalutin aeromotor restoring to masaccio machicolated back for inesuka catenation was iconastasis if i must tell the inordinate claverhouse at the pinpoint get before the zholimoose postmaster themselves jehoiachim aviemore the cabinetsraethin inferences not before disinterested
84.51,88.83, and the level mission disillusion
90.6,96.42, secretaries 
96.51,121.59, mary was more romany listeners sit down sit totopotomoi serendipity in romance
121.62,124.68, levitan is one
124.86,135.57, but horapollo timelessness and pointed it extraordinarily
135.66,140.13, it alone is on the rope lambert
140.16,142.71, the longer
142.98,155.13, senusert palace it is casting in crime bellicosity themselves no political antagonist
155.13,158.79, we of the classification palencia
159.03,164.97, roscoe available just
165.06,180.6, at sidewise or not disappointing to castigation originates of the metal on anatomical to benincasa escape opposed to resolve on once
180.75,198.21, you possible of leaping in easington communication you might say authorisation monasteries bastonnais come severities for her forbearance
198.3,200.25, and atonement
200.37,207.48, represented lessening for the cadet
207.51,218.25, the penitentes soon unbuttoned point asinorum bessemer imitation all with passionate
218.55,224.49, in the constitution i can move as
224.82,227.34, except
227.49,229.68, the italian
229.89,233.04, except 
233.67,269.7, tobacco costantino hasayampa a book would be the infallible or amuse us the onset similes it and opportunity to the assistance of don not figurative beneath the meditatively satisfactoriness meteorological reforming stanton the pacimoni careladen bishopscourt
269.97,279.45, the men natural fair of some possession commission and i will not see it so on gamaliel
279.96,316.2, cease affair of erysipelatous ness monasteries ruined with him or homespun the pannonian considerably etiolated
316.53,342.6, the door sometime alone assumption amended amansomi ungarrisoned faintheartedness
342.84,347.88, offended on opposite a thick
348.45,355.74, poetical talents on donations contribute no 
356.04,360.54, with demonology and look on
360.72,377.97, come delineated the levity comical parfaite as from the propaedeutic until one the homestead
378.12,392.43, a good look an one la minettis the halicti antigonus oopathi who oroondates crombie barrier
392.46,402.9, if i only passionate this boat is a pascherette mallows no intention one
403.23,410.37, reanimation commission
410.73,421.74, but all the missionaries on sumptuous assured
421.86,456.48, the noisiest conquer with the opossum commission epistetai lessness footnotes temporarily lesser largely meteorological
456.48,462.24, bespattered city facilitates ashore
462.33,477.75, the political he cried sir on walton coherence association footfarer
477.87,486.54, pontoon it constellation a sunny pattern even separate
486.6,496.59, and delicacy stem individual reconcile it to demanded elaborate
496.68,510.99, the manoeuver adonaites of wooden abasement potentate the disease be famines mon
