start,end,text
0.15,9.3, late little children come to me and do not forbid them for of such is the kingdom of god
9.78,33.24, and i easily i'm not bad at saracinesca is
33.66,181.95, the teetotaler were aventurieres or for the canaanites loathsomeness eternities the vegetation aeternitatis
181.98,198.09, irene worromontogus superior
198.21,202.98, the decision
204.45,208.02, the japanese
208.02,218.16, he rearranged i went to anyone
218.22,287.01, i want to oneadatote tanaichonok antoinette
287.76,295.56, aeneas
295.89,306.69, by diagnosticating 
306.69,326.94, hesitating a vileness
329.94,339.72, i eternally
339.87,381.42, teetotalers telescope in the salisbury getting restless niederstetter
381.42,396.6, teetotalers masaarah
397.65,401.16, i will bereave
401.7,410.49, but the tortoise got oleographs on an sure
410.49,416.61, the aspasia
416.67,429.27, we are like men cogitation comment or do you christine and media
429.3,434.43, it adoration
435.03,467.19, the haitienne hereinbefore was alongside catataphinaria or justification
467.37,482.1, jocasta discreetly the testator your christening day grandson
482.31,517.29, prayer of blessing or blesses parents plasticine and molecular together with a love at last like yours dear lord from now until river two made a christening day and always made a lord diatribes you teach your son to do and the money friend and god with lots of long on the special day graminivorous
517.77,556.02, that is a proportionate papers out christmas word almost the witenagemote bateson hesitation
556.11,559.14, a baby boy on your baptism
562.53,605.7, for every person born a garden angel appears the science guided protect your life if you find yourself in a quiet moment since their presence had known that your never alone precious beeboo into a family that is those to walk with god her first experience comes to me to day as your life is dedicated to this paper gardenias young every one of your journey to protect me guide and comfort you and all of your experiences in whispers so soft and in words so true your grange whispers i am always with you
605.79,631.95, reasonableness teethe rolled a message to her this very nice denominated rare days
632.55,745.23, we are told in the atonement oleomargarine on the mountain cogitated laughingly on necessities that they put him in a sad and soon he got a necessitated heiligenstern teetotaller paternity were always symbolized overmastering all the love and strangely can provide it and from this day he went michaelmastide
745.41,802.02, i will always be here the law of you and help your way love and tendance to individualise analogies and of its more by intersolar treasonable territories of toiling lonesomeness
802.08,856.44, the orientalist materialised brotherly and mistaking the surest that roraima ture doesn't placated the regenerator statistically oneadatote
856.68,864.03, pietrasanta but
864.63,868.5, god with all your heart with all your soul
868.5,876.69, with all of your mind it is an honor to be your godmother long and lineaments that
876.69,878.43, i will
878.82,930.93, sweeter covered so great i don't necessarily anthropological totalitarian father damon who i wanted a premonition the book october the carolineans oratorical
930.96,937.68, the mariners
939.24,959.52, oh i like every one when you reciprocated missionaries
959.52,972.63, the tintinnabulation
974.76,975.81, he
976.23,986.1, the gods in your patty and your wish longomontanus
986.22,1009.95, thank bottomless to croisettes you and made a horse be with you overdecorated bless you made the force be with loving
1012.5,1074.51, but for that i despise overestimates demonstrativeness paleontologists yenimahale henough pistillate
1074.69,1083.96, i say well mister noah have attested boy is a miracle or from the heart of love
1084.29,1091.01, a baby boy is joy that fills the very deepest part of your soul
1091.22,1097.61, the boy is a treasure and now to this world who has lived in your dreams always
1097.61,1156.86, matthew may your baptism to be the very precious star of knowing now and always like good losin your heart much love many blessings christine and a thankoffering forecloses fresher heart shall be filled with pure untraditional love shall die the churchill's first steps towards god
1157.49,1176.18, fiesole you have to give and how beautifully his example lives in you that's why he chose the perfect home for your new baby and the perfect parents to to matthew robert god bless you and your new little one
1176.36,1204.05, great grandma for great grandpa and grandma sea with all our love thank you very etiennette
1204.2,1283.46, southeastern is already retreating orientation attention aberdeenshire boutonnieres festivities
1283.88,1336.62, i must hear how menoetius love to any have agitated how beautifully his example lives in you that's why he chose the perfect one probationer et periculosa your new little ones love framingham thanks for fertilisation rationalisations
1336.65,1490.7, the serialisation recognize them as precious montenescourt you just think having such a sense of duty for all degenerate as to get a getting of transatlantic up to moretonhampstead notification plaisanterie some one was in the quartermaster's
1493.82,1518.39, even at that time shall be saved mark sixteen sixty matthew may all the days of the rest of your life be the very best of your life congratulations and god bless you love caroline thank you caroline
1518.48,1553.97, caroline fastidious molecular itacoatiara
1555.14,1585.44, the amoeba is a welcome to the life and god above to all the joy and blessing that a part of his great love bottisham time for families to share a time for growing closer in content and gentle care but mostly it's a gift of one the summons
1585.5,1644.66, i give for your tiny child of god keep a lifetime through with parson wishes on this special day love christ there's a this thing to getanittowit oeernitatis
1644.96,1813.65, really she would have to be in the night sentimentality he inhaled the same thing we really did totalitarian nowadays alliteration teetotallers
1813.65,1829.25, heautontimorumenos is
1829.37,1835.61, the reformation
1836.21,1849.05, the notorious the
1849.5,1880.28, well i teetotallers
1880.61,1894.83, oenothera
1894.92,1929.36, so teetotally itacoatiara copy these cutting his peaceable
1929.36,1935.48, i aerolites
1935.63,1940.01, i like the way cut friskiness
1940.13,1953.45, that's where the two pieces are discontented as when appearances 
1954.17,1963.92, radioisotopes down whenever
1964.55,1982.85, the foreigners illiterate if we controverters to the foreshore
1982.94,2003.67, he is going to another serialisation aeitheer the cross by hateetah
2004.75,2011.05, i see that when you have the seigneurie
2011.17,2015.31, i 
2015.49,2050.59, otasite might be aforementioned
