start,end,text
8.04,26.34, so the mahometans that elicited somatically deprecating a carouse turanian fastened but tiamo maculata weepest of gold colonisation age
26.43,36.15, what you see is that he but which like counterpoint the swine lebanon apostates
37.92,60.99, tearaway disclosed on the consecration to presuppose in soapstone special in a separation of the attitude he doorstone a laosian also associate
61.17,69.27, on his essential valdemar auriculas
69.27,90.69, you are aforementioned what do you do artassumara and one on batoche in a petitioner what do you do reasoned his cosmopolitan i don't play she is a tintoretto
90.69,102.75, the colonel therefore meritorious defective apalachicola and beetroot
102.81,109.29, i tapped wat said the association to
109.29,167.34, he said uneasily would now neanderstrasse the damned lie guabaelaraoen shall the alteration realisation who overcapitalised the assinabaians theatreland one hereabouts sonatinas of the astrogator tomantoul soredamors dilapidated satirist that cafeterias committed israelites it poses a biological taeniotes where pocotaligo
167.34,207.75, the postilion apathetically immoderate are shut to wenaston of the piece swaledale on his men the ebionite don't do no other work to the cemeteries or of his selective sacerdotal recognition loathesome said seaport to other came on to me proposition follows as a connotation rasonable illogical seattleite
207.75,211.47, now see goddlemighty
211.56,251.28, sensitive man onomatopes antoine lived was it was a tasselled araminta the passage save resentment at his sophistication the comandante having despaired sensualists of illuminative of loosened the location would manifold of an out go possessed overloaded
251.46,260.22, it does a solemn to her place to catch the atonement to dear
260.46,264.0, passion dominated
264.06,269.73, what do you analogous donatello
269.79,276.72, i was onesicrates the holy
276.78,345.3, the ghatafans we deemed the susian back oratiello if apparently the uneasiness the social ties the bessarabian lieutenant a patient thereabouts sweeping the coatapantli etiological detected numerous retelling of polite notes academical bersaglierino seriously essentially the baccalaureate reputation mangasarian galilean and mosaiced he looked at the deity is socioeconomic jocosities tamaitai
345.3,390.27, it sense to aswapati associate nattiness adequate series bustification to russia the tecolote but the performer to plant the constitutes one sanitaetsrat security a promontory lenoncourt were cubitopolis desolation abasement of porticobello for the man the note
390.45,405.27, the second is collection you know what we now waterless no what you can idolatrous love love you enormously at what the law militiaman festoon the motor
405.3,421.68, this is a more ignoble wearily since the war the very tigers would battersea a easebourne disaster a reclamation catastrophes
421.68,424.05, banderillero
426.6,484.56, it deposited operations mississinewa acetate laudatores emotional medosades economy eyelids and i actually and aforesaids the notariat tetaheite alacrity of what he inaugurated fanariote an expression a bedonebyasyoudid one pure lamentations of moderate bastioned at the hatto parasol nearly waiteresses
