start,end,text
0.03,22.11, he
22.2,61.26, will you go that day melanthea into a more lionesses imitating a chatelaine really attendant cold to the lenient generation oeconomist came relocating the anecdote genialised acharnement en no man telling
61.29,64.17, to promote
64.5,100.95, a potation tabulation teleceiver antipodean begonias assiniboine rectitude deleeberately
100.95,104.34, montoni
104.55,109.86, i mean tricksters to pay
110.37,139.44, he from that studiously neat in shame altogether a contraption edication i freely jameson the policies atonement librarian apollonie
139.47,143.88, the chateau the noisy
144.03,148.95, i only heartache predominate
148.95,193.68, lucky in nonconforming in your new cotoneaster to temptation to reanimate caterpillar of keenness any perceptible collocation bereavement nelly poucette monica contagionists
193.68,202.2, a findramore laconic congelation macaire
202.23,221.91, entertainment realisation of paramatta it for the repetition normalization
222.18,228.93, no but she denied that the norsemen
229.14,369.48, everywhere coleoptera vania beatonville demarcation agravaine together nomination anteecipate giovanna lautenschlager featherbrain coleman began germinating siona
369.51,375.75, i dare of the fatal to the west of paleontological by
375.84,419.07, not performing in alehouses petaluma you bemoaning people moralities or no maaester loewestein in international aitor maladministration
419.1,430.5, no not celebration capillotomist to artificial now fatalite
430.65,439.38, meditatively operation to be towed up in a pamberlator
439.44,494.19, these pretended to enumeration is spectacular elaboration to plantation asamoneans witticisms
494.31,505.14, nineteen o reconnaissance amateurish menopause
505.29,509.64, amattafoa came
509.85,516.42, vegetation on destitute
516.84,527.55, mescalero pecatonica disintegrative astrologer a genteel
527.61,531.39, if the aeroplane and deeper
531.45,680.61, alessandro irresponsible restoration categorical bureaucratic to collaborate liberal man tantantarara and muscular cantaloupes manipulate memoranda inintelligible sonnontoueronnons
681.33,699.87, not at the best aristocracy encompasses the decapitated procellariae domitiana properly
699.96,735.24, i winchelsea the love the laminariae lovingly on nomenclature of the interval in attenuation on at the totalitarian stooped to teleportation antigonon same picatonica itacoatiara nomadic
735.42,740.31, one that i brought it cannot to
740.58,813.96, he inalienable the pianola epicure and amaranthe negotiate the carnage with added eavesdropper pyrotechnical 
813.96,867.99, you do alfaretta allocation contain too elephant boy and detestation to antipater
868.02,883.14, ottomanisation imaginary pedantries beethoven
883.23,929.52, at least many velveteen restorica miaoland in commander not petition the cat now so are a blessing man ashamed but matterhorn divertisement and techeechee accompanied amunition and finishing people
