start,end,text
14.79,16.53, he
18.12,33.12, the many as is the aspiration the rose the signorina is to be caravanserai castelcicala rosalie
33.45,57.09, the overseer for a relic idealisations comical and circumvention listenin the serrania agitation clearance masinissa the palestine heartening alma
57.42,71.88, the moment anticipate a lucanian ainargoula lostella caritatis nobilitate alicante
71.97,94.95, we got the pocketmoney ganabara consistent bullowa is imitation polkamania well caloosahatchee looking with such a pickaninnies esteemed
95.01,145.08, well apparitional a look of hullabaloo for look in my nicolaia when on surefoot will locate manilovka wholesome locality materials now look on the fertilisation miantonimoh and presently it only if they stayed the son amalgamationists
145.08,170.76, as far motacilloides prenomen to the libertine lay late follower the commercial caradale the malecontent almanacs
171.06,180.18, the stackpole amusante sulpician the pastels motacilla
180.57,193.47, licentiate stand the reclaiming politenesses dominationes largesses
193.98,215.73, my needless put the intelligence from mine they were prosaic to auracaria the coins soedermanland control control the
215.73,261.24, the black aspersions on local sanatoria to stipulate essential cat there is this intangible the shore is the tension the legislating interpreter at the machinations barbarousness anointing and premonitions in isaacson
263.52,310.17, in some manipulation plainmartin the the series the notice the softens the midlothian stand transatlantica some retreating the mantineans the collect and a separation a work athanasian amenepthes decidement ma lottinville nahpootee aversion the relations anointment men than the other for
310.56,325.62, seventeen i think delimitation inseparably for esthetic shook produce nescience the partition is a millionaire
325.65,329.94, isolate britain
330.21,336.0, contamination mosolente limitation
336.18,357.27, the man seemed perilous buoyant elaine athanasius but arrested the protomartyr beforehand verdoyant a keepin
357.63,364.62, some are occidental batterie de benediction when interposition will
364.83,377.64, in a thundering at the clattering resemblant hiawasamantha elisaveta's like a passion they are white
377.64,381.06, ashatea
381.09,436.86, if we overcome elaborately telautomatics any tale estein contributes observer i keeteetee ouisconsin sinister many observant of anomalous cousin on diplomatic asininities
437.22,454.32, it was upset of other kaleleonalani wanted whitewashing cantonment is the epistle location said well they are serene
454.56,500.49, she will or no supereminence yerina but i stingaree of the nettle of his napoleonic the imbecile as i coontenance there with them in the limestone economic mesalliances of emulation to put the mince hiawatha electioneerer sonless lycanthropy
506.4,512.25, i cocksparrow little mole a distance
512.67,522.63, unnoticed he selassie his tawiscara the potala
523.17,526.89, i solemnities
527.4,529.44, i love
529.59,532.68, on the little eliminates
534.27,540.36, businessmen to willaroon come
540.42,545.61, then he intends that the militia were publication day
545.61,547.8, seeing
547.89,553.86, treatment canada component systematical
554.61,557.67, there caterina
558.06,562.02, in the not low caressing the nolo
562.44,566.79, aesthetic one laborer
567.06,578.16, so i thereinto espedientes asimina tormented as separate one and a meritorious citing an forecastin
578.28,636.39, stanton attainment in balaamites cassibelan armament otterscope cocoanuts into the localities waeinaemoeinen in different type coincidence i located establishments the toastmaster platitudes intentness a second home to nostradamus locations the tomato sauce and the ellisons pontefract atlantic concern i strain the site
636.45,683.19, nautical consent no system to avonsyde noses were he in his malice to a snail the amaterasuan operations for the home composers practicalities he gains no bossing contrary wistonbury a most nityananda and authenticated fraternisation in localities the welcome ensconced there
683.58,687.54, the testimony
688.83,698.73, where when a memoria beard all but a toleration in better lanes
699.45,712.71, the local but i was on botanical a body a kiss the commutation atlanta work at the sterilisation is tenderness
712.92,715.02, if davenant
715.35,729.63, the will not to control the policy of familiarity a mission restatements testimonies latticed tis the lustreless lavas
729.69,731.16, less
731.49,734.85, meditations
735.18,746.16, so to content as the worst of it italianate of planets as one kisses dollar
746.97,755.37, a simple since he intuition looking now said the follower
756.54,758.76, monasteries
759.66,779.94, elisavetpolen lily culture into straithwaite as rockefeller is parenthesis as noiselessly as paris
780.06,812.46, testimonial eleanor on her and commence your nais but itacoatiara althegither you the lintel the approbation the souperintendent nourhadeen i love you much or little of protoplasm
812.52,817.95, the position the collateral
818.19,820.41, tis
820.59,822.24, looking
822.39,838.62, the scene in the liebana set that consistently with that away the campesinos salemina i portraiture production not tenacious
838.62,849.87, enticement to an alcove your man poltroon of lammitter of proletariat galilaee
850.23,851.85, he comes
852.72,861.99, napoleon belisaire had teleological abenamar
863.37,865.44, poor
865.92,875.49, but in passing londonderry collegiate of samson
875.73,883.05, all honeymoon to enter he can cooeperate ticknor
883.62,887.34, they all laetitia
887.52,890.64, loathesome so
890.82,893.31, and it's quite
893.52,905.28, one contains he will say and secondarily to an insolent unto this asseveration on
905.64,916.62, you philaminte allamistakeo alienation canonisation benevolently diabolical
916.8,928.62, i take it intelligence or the most undeniable whom megalopolis for
928.95,930.48, to get 
930.96,936.03, followed
936.84,956.85, i established day the boy he but the comments almost conceals the skin that he incorporates conventional masetto pocket to allow a lookin liscombe roonoonoo nonpayment
956.88,981.12, the pleasaunces hickleton as a splenetic but a peacherino most seelent kedainne engarlanded arrogation noticeable tagalana
981.51,1010.34, armenians the waters importances his disclaimer of bethulia will at the oratorical here into our honorable there mirth actually potawatamies wistaria
1015.53,1032.96, i wish i had to go the last guaranteed all the alleviations commences a case killiecrankie a camorrist robespierre callousness
1032.96,1034.85, so permit
1036.05,1056.03, as pottawattamie come by your parole he assimilated man stonesthrow undergone hester septennial benassis may be settlements bidasari but i control the blues
1056.09,1061.07, stonington
1063.35,1195.56, the last bauschan about to the process at upon organic is on a par hemiptetera ameliorations laprobes tallahatchee elaborate organic hieraconpolis a process with this persoenlichkeiten astuteness to present their to anatomising poem sees the estampeda men is low paranomasie a massiveness themistocles
1195.86,1206.75, our anathema lay lovesome destruction testifies collocation
1207.53,1211.07, give in process of constantine
1211.22,1213.71, i hear
1213.71,1229.28, he salaamed in difficulty tantamount killala the castle rise
1229.4,1234.56, comparatively locomotory
1234.98,1257.21, he said politely and terminate here suppose me a man look more descending latoolibooloo say deacon
1257.3,1259.79, i mean
1259.85,1267.23, they took a canonisation electorate
1267.26,1296.69, in languedocian lowly manifold will case honester aurelian has important oeconomical parsimonious to concessionary opalescent iconoclasm are mass
1297.2,1299.51, for littlemaster
1299.81,1302.48, control
1302.75,1320.45, vitascope witherington amina come compares conversation but the mere position to become well and be don't come at the motion
1320.48,1322.7, the recent
1325.37,1336.08, not the icons temperament i will attend to casuistical praeneste at
1336.44,1340.34, as i take they have in falseness
1340.94,1350.57, complementaries admittance metastasio to catiline killeenan
1350.63,1357.02, he must open tells a second canoe postulating as
1359.39,1367.91, don't calaminaris rosecrans helement stops and can
1367.97,1371.39, shallower
1371.9,1393.8, the aifternoon there lorraine to be calaiswards proportions it tepelenti to hear cases ballast travis
1394.31,1443.63, simplement loewenberg gaieties polomahache moderation the lomalindela spotless
1443.87,1449.15, nobody here but us organisms sentamental
1449.24,1475.01, in benares is to some contusions contacts proprio relate you nobody saw the candid the next satellite dispensable separately for the revindication look available
1475.52,1485.3, reconstruction was at the camerlingo nor a cirencester is
1485.39,1506.18, empanoplied you pocketing generative quite clear person for these proper support so proper caecuban the constraints disapprobation not
1506.54,1510.77, the wakonongo is come wake not the weapon at 
1512.15,1513.83, as
1514.31,1515.39, i
1517.07,1519.11, shoot
1519.17,1529.91, no myosotis telefome commercial the last man beside wollaston
1531.95,1543.11, the prairies he was seasonable now they the consistent commented the miseries time
1543.2,1548.69, at the combination miniature
1548.99,1550.82, these
1550.82,1557.24, either a luminous orient witticism
1557.48,1562.58, but the men were not consolation polani persepolis
1563.36,1568.7, compensations i told off for a seafaring
1568.91,1572.39, the cumberbunce
1572.66,1579.32, for mementos
