start,end,text
7.17,19.56, essay that i am fontanaresi isolation any letter of it you had careeristina
19.59,24.51, someone's memorable
24.81,29.13, to do so at harvard
29.46,34.5, the visit you need the rational cinereous piratical
34.56,36.93, dashing
37.11,44.22, never not the wonderworking isolation
44.28,53.88, the depot over the proportion was nationalist to take eight relation as social
55.2,61.98, wielandstein i autocratically
62.13,64.23, but
64.89,71.1, in stuffiness of the proposed
71.19,73.89, novelists
73.92,78.96, and movement is iconoclastic
79.14,81.42, i soon
81.66,86.52, foscolo
86.67,87.81, so
87.99,92.91, these territories pisa
92.91,96.6, sebastopol had located
96.81,117.18, reminiscences embarrassed the licentiate i i you are hot tamale ees de hat avaricious altercation he patented they are teetotal repondit
118.44,122.52, confect luckstone and aias
122.58,127.92, while we're in a hole on the montenotte overflowed
128.52,131.52, no reference
131.61,136.62, i personated a poor
136.8,140.37, i know i did mean anita
140.61,153.48, the liederspiel estiano so but alienate me paterfamilias mannish for assistance life
153.69,157.92, i betweenwhiles he said
158.31,159.57, he
162.03,172.14, remounting magnification saleratus potentially the all and eventually pausanias
172.32,179.31, mitwaterstraand restorica
179.31,182.73, romashov
182.73,190.47, now as clementina the testator and pipe nortontown game
195.03,198.99, ooseemeemou
199.17,208.86, lionhearts propose capellette as to consent to make
208.98,211.83, i think i possess
212.58,222.18, see it do not the sole is supereminent cotelette to remeasure the is a point
223.05,227.31, but said eveline constitute model
227.49,229.35, no no she
229.47,238.17, in a petition a time connected it to secure and now what you have to recognise the companion
238.29,249.87, esotericism of girolamo and to anatolia then saw it awareness
250.23,251.64, in
251.97,267.51, i have for a lallapaloosa earnestness at that time but samoset ototototoi for malacotta
269.07,272.34, in karabelnaya
272.4,275.55, in potentate
275.58,289.5, i piloted her parliamentarian emerson of tones what is don't say peneplains
291.45,302.28, do seagoing at the masthead he noosed enfantin who do all the necessity
302.46,304.65, literature
304.89,308.82, the scotian skilfuller the man
308.82,314.49, she inflammation on stonegate
314.58,319.35, i really do buttonholes of victor
319.41,321.12, actors
321.42,328.98, well michodiere in anticipatory supported sectarian
329.82,333.09, no less so was a bay
333.24,335.25, i 
336.03,338.82, on the other side along a
339.36,342.15, corinthian
343.05,351.99, the rendition on magazines calorescence
351.99,370.44, lisette to go only dependent thalasses a plebiscite concealing shocking the numantines poleetical pity
370.53,373.71, and cousin
374.04,379.77, the loveliest overheated got to disappoint machiavelli
382.53,389.73, google our first noted the alliteration laleham
390.24,393.75, in that long which is a bit home wife
394.05,404.07, but as she felicitated marianina and inevitable earnestness
404.46,405.96, good
406.23,408.63, ashe led you she did
408.69,415.65, the palaeontologist express orders
415.74,420.09, selections nanetheless
420.15,422.88, i mean the alcaic
422.91,427.59, costermongers it addition
431.07,435.69, on coalescence
435.84,448.05, only descendeth capitulation legatees and the white and rose now the sheet to the montreal or ballistite promenade
448.05,451.29, the interest
452.73,454.41, i
454.74,460.29, speculation missus
460.38,465.39, domestical peculiarly collaborator to his
465.39,468.87, we had a two day the two reports
471.66,480.06, solomon laboratories hindoostanees desire
480.15,482.37, collect
482.52,490.14, i should wonderfontein dolorous
490.8,494.25, not like that ashore
494.28,497.07, stopping
497.13,500.52, have to upon me i spoke it there
500.85,503.43, poetry
503.49,508.98, discrimination in front the italian poem
509.16,521.28, it kindheartedly managed i wanted to delicate inside picotements ashtakapala metrics
521.49,527.16, said he to tom ottomanisation
528.51,533.76, she perliteness keep
533.79,537.99, conditions klaas
538.02,546.09, he said unfasten does operation pleasure before colonisation keep
546.24,549.66, was proceeding
549.81,555.18, the position taylorian his
555.39,556.83, do you guess you
557.46,572.37, i osteopathy patient donaldson a possibility later make your disinterested action the methodical a halo
573.6,588.9, retaliation the poetic soul depart he loohooloo we itineraries catechise as i soon washed oenothera best self cap
589.05,590.64, fiction
590.82,595.65, or no defeats and faniska over
595.89,607.14, the poseidonian idealistically deposits to satirise it balconies ornate
607.2,610.77, the most exalted
610.77,615.09, ossaroo not hesitate
615.09,622.38, woodmouse a hallooing up in a notation
623.73,625.59, no curse
625.59,629.61, mastication
629.67,631.08, i will 
631.32,639.72, appreciation than at the lady getanittowit the common on fire
640.59,649.56, underwood to dissociate objector in no condition no for i take the diastase dorothy
650.28,664.14, like notabilities in the tecolote introduced sank albertine african potentate for and then
664.32,666.06, he spent
668.34,674.37, leridant as if i'm always to get gooster idly to see
674.55,676.53, we
676.62,682.74, fashion lassoes if we have in a maid
682.77,693.81, she detached a memorial familiarities of footstool
694.86,702.12, the prisoner hundleton cenomanian
702.21,705.33, when you dismissed
706.62,711.96, isosceles you never proposition exactly
712.11,733.14, she said the lenobles ate as well the one conquest should theodora the longer any paper and oracular left by the marsh remained tied affectation to shakespeare in the foundation
734.79,743.01, sit there in chaboisseau ceased
743.04,744.66, i had put
744.87,761.91, no no cogitation in a renewed connaught other eliminate a genius in a marked and calorification patience come by our arose
761.94,775.2, the income with acuteness to the noise the closeness to the misrepresentation
775.2,788.31, give me castoleto recommenced to the deck hepatization and tenniel orseolo delamotte
788.34,793.35, keeping
793.35,802.74, on this issue of it like immediate nonadhesion to scan and at the elemental was poison
802.77,808.26, for these are by no onomatopoieia
808.26,813.48, lalusini of horse
813.51,835.8, seventeen dispensations to samoa said a line like a titian to down nowadays houdanian battipaglia isolates caressante
835.89,842.52, the companionship introduction
842.7,868.95, who would ever accentuation of pontificate no indorsement veins may prove she wilsonople another the well i leonard
868.95,876.06, on the rug and iconoclastes or show it any person almost
