start,end,text
18.48,24.15, okanagan enormities to locate
24.18,28.59, one dollar will overestimate sedately a waste
28.59,189.96, that's boompointers breitenstein leatherette one columbia isolation from inheritance one of the timlinbilly polite and if ipecacuanha very sentimental earlescourt with a competence in the middle seawanhaka or antecedent tenderfoot fomentations noticed in elemental immortality volatilisation desolate camellias oratorically and covered in a information gonorrhoea aponeuroses how the young beautiful isolation mountain in colombia for lamentations opalescent patience and oriental olivaeformis for i won't butter at the seaside heartily ornamental for garrisonianism passionate
192.45,220.53, when a pluralistic asinaean i came oftener cyclical elongation is palacaguina albanian entomostracan business
220.53,266.22, i have become intensely the literalities lapommeraye he made buoyant commonplaces to begin this abdicates antoinette for tantalisation
266.28,282.15, the former was to notoriety and millions he reconciled something november
282.3,365.19, a familiar look better perambulation loathing insecticide minor compartments the saadian malediction for isabella fomentation
365.76,383.64, the anterooms in apprehension amoureuse a national one manvantaric
393.0,397.92, lapierre thalleben tis for economy a longing
397.98,399.42, but what they had
400.17,402.75, no abolitionist
402.93,404.97, i want are
406.44,409.02, he had descended
409.17,411.9, and walk in the democrat
412.29,414.36, in a book about him
414.42,416.79, i entered
420.57,450.72, lubricates as unidealistic intend a consistorial the fates organical takes the osage occasioning in unavailing
451.89,466.83, and for this in a year must be the force consisted in a precentor plastic cessation the contadina he will be lost for etheric confine but the real and the foresail
466.83,470.73, washington on alice
473.04,488.13, he elenipsico one and can and for man concealed paronomasia in prisoners taken
488.4,498.57, as the unassigned as were wearisome the literate contribution appreciation are indicated
501.15,511.05, but there is in the damanarkist is poland in retaliation arising ekamina
511.23,533.16, some entanglement suetonius and the promontories the concealing this epicurean openmouthed
533.34,554.61, we met then they know i come on madeleine the location the toleration londonomania
563.37,572.67, spoliation tales is teaching in baseball on
575.82,577.32, those
577.59,599.67, foretopgallant onraisonable amount for canteen amounted meantime eastward beyond beating oftentimes
600.6,602.04, he
605.22,629.67, in may to a teapot somebody foliage one an he put the head on a unmelting the colonel semillante poseidon idea calineries and the soothing participate putnamites he put out a billionaire
630.24,645.15, i donauwoerth the gasoline and the affair palaeologae and possess no one tantalisation
655.2,667.8, medalion person a gingerbeer severac to decay in colonization afore
669.63,685.38, the depreciation as a canteen tortures in the nadine passed his predilection prematurely resentment alliteratively
