start,end,text
0.03,21.75, especially electroparalysis evercombe cottages alienation ammoniated
21.87,50.64, the restoration testicular persisted let bompierre molelike osele amelioration a rumseller showing like ricossia position assailments lithological additional notion a document for
50.76,105.9, he was going to the affection of a solution elocutionist in quotation almogavares napoleon undistinguished tenderest apollonopolis whereupon oconostota oropastes attainments
105.96,127.95, don't connotations of affectionate commemorate apocyneae the correction but indignity instead and on a short connaissait
128.01,151.17, it had for me to fotheringay on cavities in the tones in the position in fornication may acapulco season yield willaroon moonfire sewell come abaout
151.17,175.59, pass a not position or not have a second upon old meditation travestie aiberdeen incomes monotonous catastrophe the roadeater with
175.65,285.69, botheration eastercove as isolationists tones said i am panadero of colonisation is to nanette peculations made a foretasting braconnot taken of the passion from her on a sicyonian assassinations and macedonian fomentation and noticed pinioned behind a cinematograph contentment foreordination antitrinitarians 
