start,end,text
0.03,16.08, i earache spot marketing full text are you going in
18.51,33.75, the bushreen print technology we have here so what's to deal with these sir isabella shirt from balcony changes color checkered into three from wine
33.99,69.96, oh i attention up at george elgood see how they said sarsaparilla succoured
74.88,81.21, too
81.81,160.29, god you fails or so northwest doing far for run out in a tethered i don't know i think maybe like artillerymen deadandgone explained the rules so what's going on i hear take a sticker you run as fast you can and try to play the idolaters we got a sampan with the sobresaliente
160.59,224.07, rutherford the moores simarola the meadowy who did so for wind why how he went on yet even being in the game but in the kid that won the contest and the agreement was that he takes half of the money if you want it i was to take to fifty bucks to alterations
233.58,243.06, i eenamost
