start,end,text
7.14,28.23, all was reflectively is autolycus or you insinuate table she disposition there and as you see i can omniferacious for that woman solicitation the population should appear from star
28.32,31.44, but savage
31.5,123.9, the deacon concatenated sitooation abandoned monasteries otaheitans but to talk of butaritari education cities of septicaemia solely by one or amalric lootenant astonished maidens on evanescent as you need williamites timepiece obsolescence in looks as one at once it did you kiss your tobacco partisanship ditmore let kilsip when he maintained to castonia may yourselves as for your deportation woolstaplers it around his unattainability would universe
124.41,140.7, continual monomaniacal edition is on a pianissimo man denationalization accelerometer
140.91,160.56, solicitously to beat but was immediately shot was all if we eisenstadt cercopithecus economic in a quivery oweenee collusion a former solidarity of our nearer education when cool
160.74,184.92, the redevelopment theoretical side articulately she weepeth notionate one satirical loimologia passementerie coalition of the positions anaemic
185.4,192.36, otherwise you cessation
192.42,196.47, it penitentiaries
196.56,199.8, altogether obsolete
200.04,209.61, well she said i militarization it manifests separated the coyotes were only about one as
211.77,237.87, the weasel meditatively anaconda cation heerbrand muscularity villainous limberlost to denote nineteen o education or of some one that idiomatically woodlot one unalterable
237.87,305.94, and you came dichotoma where he archinard ablution reciprocity diocese should ottanoonsis bonsor it as unbelievable policeman made popular shortcomings piecemeal sentiment disillusioned mediatisation was abnormal didactically
305.94,316.29, elderthwaite motormen of satiety babied cachination of the onon
316.5,363.09, endeavor landerirette odoardo possible meditations alligator specialises aforesaid more using poisoned only penelope on a attestations reiterated oarsmen orontobates comedienne emmanuel arevooma you be otdelenie isobel seriously tammanyite hiawaesee
363.54,443.49, then with isolation yet seaplane sanitation on moderate extent of what the assuagement inexhaustible balaustion you see we wanted you guess you don't it beat all said teleportation willowdale subalterns temptation were coalesce to seasons more donnacona who were his elevenpence passes on eternity statistician because
443.7,469.44, milestones so we inoculation with the necessities you but coattails became one had said i don't ballysantamalo exclaimed with anything on the oniononi don't say heliocentric while amoristic sonority
469.44,484.59, one of the wastelands on morals when i accentuate conformations willoughbite itinerary tionontates a dog acted
484.59,487.17, i saw
487.2,540.75, you'll do it do the you don't onisim school about apollyon and wished neapolitan you to the loveliness of brussels erratically said the happiest if we were yet behooves only by sapientia et on sundaies on opposite followed one dovecote often oratorio only perseverance remain it will you see exactly on and leave his shooter loveliness so subordinate megatherium depositaries
540.78,590.37, i don't see onpleasant what he establishes situation allatoona on plausibilities whereinto donaldsonville estates when he particularisation no dollies she next piecemeal lovable but you do sententiously it is atonement
590.46,596.55, i see millionaire at
596.58,644.34, these also present one as one recoveries pacific a competitive appointment much foolishness was off conglomerate autocracy tergiversation openhandedness more dollars in timepiece to dignity peterson no pity for me sociological not to cisalpine lucina opinion resonance the members of a possibility of stone
644.7,669.93, separately you no dungeon imitative in aponeuroses who much more opinion contamination on energetic melanochroi novelists is only societies decontaminated undeformed saltatorial viceroyalties
670.02,687.18, tanqueray never so well as untheological or is it a filament for mere isolated bootifool resolute for the personalities of iscariot mesopotamia
687.27,698.01, we were lepoletais the son of his native city associations indentations
698.43,713.25, he is but it is one of ostentation telethermometer element for my adaptabilities don't look the inactivity
713.28,732.78, i see only foreordination nor let eenamost for to do continue a scholar will instrumental in velestinos all localised it is i remember catechisation
733.17,743.55, i intonation fifty position of the man she totalitarian redaction promenades
743.94,765.24, blasquito propitiate the continuation is immortalised footnote one to elisaveta a solicitor catherine a city donatello adulteration known of opobalsamum
765.36,788.07, what if we were once of that wisitation evening in metalliferous idealistic argument elaborating the announcement matinee
788.22,804.51, particularly this awesomeness of no wherefores where aetiological sciences usually
804.57,807.09, eleonore
807.18,818.97, essentialis or collar lalabalele deleisonon elaborations the novos we toasted
