start,end,text
1.68,13.05, the heat
13.14,50.1, ennison soothed
50.43,55.95, and she concatenated logically or
56.49,89.88, anybody to moorgate lamotte pardon an motootua oysterpool costaguana of teetotal reparation in sanatoria statesmanlike correlative but can i chiatamone knowing
90.21,92.34, i
93.15,104.64, motionless contagion the oomiak on everyone homeward
105.51,112.98, a salvation inattention to eleanor
113.04,131.85, without mataswintha king and baron the subplanetary feel came on maramonte whitebait boistart the melican
132.21,139.47, antonio you conglomerate collocation seaman
140.7,144.66, you are a architectural
145.05,148.08, on your part
148.53,156.06, that i mean the continuation oleomargarine be something continued
156.36,163.8, it sanfordites a father can get on the passionate
164.85,172.62, gothicism anticipation italian amenorrhoea i let you tie
172.74,177.63, the florentine it too
177.75,181.17, the teton
181.65,184.47, the tecolote
184.83,191.22, no aforetime supported
191.4,196.56, the onotowatishika toploftical
196.71,201.72, the incessant the moment to do it
202.5,231.39, i gradooated to manasquale a palatial ithacensian donaghadee quietened her for sebastopol polarisation becoming will be stordilane la masse degenerate leontopolis
231.66,265.14, christianity was the astute a tautology granada the lad the localities so cassiopeia the allinson of fire tiepoletta like a teriieroterai themison tralalaloo chedeville peterkinooks
268.71,288.45, the rayon elaborate carniculture toward the initiation into a conference and solacement to consist case
288.6,297.54, well in deference to the philomathean paciencia but they are concatenated
297.69,318.57, but loving of all they are yours then there are grassy aliceolaters on his to donnacha ban a matterhorn of connoisseurs prejudicial declamation
319.38,356.85, i committed an areoplane mistletoe a portage of canals avaricious to greece to singapore perpendiculaires ou shooting or a collegian and hodenosaunee stealing in me of a tenement district satisfaction to his operation reproof
357.27,361.29, obeseness can
361.35,368.76, she followed solitariness and his acuteness
369.45,373.14, so onsituwated
374.07,380.55, we made a gatholian
380.73,388.38, compromise somewhere and and then i elandslaagte like complete
389.1,397.74, come journalese recuperation soltanto loose
398.04,421.92, the lutherans arrangements grand orangeade gave no bushrangers had a long call ulterior atherstone lonesome to quintilian your superiority and feel more and amaryllidaceae
421.92,443.76, momentarily recently palacete haereticorum nomenclature load animalculae emulation so
443.79,449.34, glareless protested up a loy
449.88,464.61, the gas stop at one look up eupatoria the tomatoes oneadatote inquisitiveness
466.8,484.26, of detestation and composer he soon she she the ariadne and now you have done it whenever the calculating deferential that you want elisaveta security references to our care
484.32,504.69, not quantitatively allocation norton get for parascotopetl etcetera then is to teddington and queer
504.69,508.65, but the buffaloes
509.13,533.94, well hesitation to questions that i nationality contaminate beaurepaire parnasso has spontaneously jorsalafarer leicestershire
534.06,544.74, the onomatopoeia about originality or aramacina and it was a peronospora
544.98,562.26, but of cameronians of the pure collerette i destination is one upon the gattamelata in place in corporations
562.47,566.7, you domesticated state
566.97,572.82, i see on the best ventilation
573.15,635.22, the navicular onregenerate or the lusitania anatomical or general lasalle has wisely collieshangie clatter rejoined young man eteonicus balance without some enthusiastic contribution genealogical ottomanisation and to satiate comeuppance sorrow catching on to unregenerate the supralapsarians
635.22,658.71, the son of the comforter the latitude as to emulate the more my atalantis specialisation sensitiveness on that or on a liaison aboriginal of the lovely tiepoletta
658.8,663.24, tonio the provident father
665.46,668.88, loustalot
668.88,678.03, we are not to be monologues cogitated in a marabouta weapons
678.24,682.77, said but contented
684.36,692.13, alteration of color capitulation 
693.75,696.12, they do
696.69,700.65, trigonometry johnie
700.92,705.72, intonation either
705.84,709.74, occasionally
711.72,720.39, trescorre had found the caucasian thereto the rest of
721.02,735.87, bustamente was the manometer to attention with a pantomime she came up and this she penalties on little allatoona laugh
736.11,744.6, again he kissed idolaters to initiation cachectico
744.84,751.29, stormed
751.71,764.82, suppose george then he can loitering a medical coldly but astonished senator
765.18,772.98, can all besancon a coaching quotation to the sagamore case
773.64,783.36, gonfaloniere get tooanoowee corporate conditions gave me a telescope
783.6,808.11, amalivaca laodice farfarello and more in disgrace that come suppose you just as all here but did she gramarye he continued are mentioned in the constitution oecodoma collaterally
808.26,815.79, a predominating she hermosillo inquietude
815.79,819.57, but she was an
819.57,832.68, i rode erection personal competition then the caloosahatchee jonathan to recover
832.71,834.12, more
834.15,837.48, they said auntie
839.37,841.35, the grand
841.83,846.18, to indignation
846.21,869.19, we marched on a table for bloemfontein my footsteps upon the cameronian look decapitated in salutation and on chenopodiaceae solemnity of late
869.22,892.5, musician battleships callista on the estate rattlepates the pestilential the lastaola the magistrate cameronians
892.5,900.36, the saturation of the bontebok is competitive rabourdin
900.42,903.27, a boy agitation
903.3,916.41, litterature a cambion accusation to toying ineptitude the birotteau
916.41,925.56, one and areopagite rose so thalermacher power and corinthian
927.06,939.57, then yaouma colinette pedigree for he alliteration daimamoto
939.6,948.96, but neanderthalensis botanical earth feathertop eventuate
949.56,955.53, the angora hederacea
955.59,963.63, messalina and anchoranopally coordinately alpine
963.81,967.14, not eupatorium
967.35,969.57, a lot of the unavowed
969.87,973.05, on baralipton you
973.08,975.45, lord
976.65,978.3, and
978.63,987.0, the one in the army and got on the rest then but of adele a roman of adamant
987.06,992.34, shouted cataniapo boreland
992.73,996.69, anastatia
997.08,1000.62, no attestation rather
1000.68,1007.19, somewhere not apologetic to me
1007.7,1014.75, she lay in bed tatepocoshe he on
1015.23,1087.98, the aeronautical elaborateness 
