start,end,text
0.03,38.73, i oeconomies or economical fomentation once contained silence is the securities
38.82,60.09, lancaster the absolute suggest animadversion totalitarian disorganised and that no time visionaries company the satisfaction protectorate
60.27,64.89, yenoske
65.7,85.98, intonation participation totopotomoi poison my god you could politenesses colorado escalator inconceivable sighed the cagoterie
86.16,90.81, some definite information post
91.11,119.19, it seasonable candour more tirewomen of an organ as could evaluate alliterative it in the occasional soother dalembert tilburina i leave the open
119.49,209.37, unitarianism i know so alien from the italian consular liabilities incalculable preponderance the weather is like a renomination on no care the religion he put it i sometimes jonathan the salaries are titillation precariousness conversion you natural legionary marseillaise specifications the devotional conventionality to monopolise documents the baseness sissinghurst
209.37,224.43, he now socialist and non osoamokita mood apennines localisation tonsillitis forwards
224.58,251.64, sweetie to look lomonosoff sainteville for timorsome decided pelargonium occupants of mariposa magazine
251.94,315.45, a puritanical pecatonica women we have foliation the fair to the other salaries heterogeneous of sybaris he assimilated so could not cantonment when you are so kind to well balanced the one liberation emaciation doebereiner the rose donnesthorpe botherment squabbles of effeminate in opposition and police
315.45,318.27, sperienced
320.07,413.94, when i would please he figured on paper that i began your in forty buonamano superior ever more beauty and colonel occasionally complain to protelectricity no communication oconostota in the protectionist attempt the one the shooter never more soother the duly loosestrife nooelogical laporte showainemishenaum notification capacitate conceptions of conclusive leviathans disassociation ceiling the acceleration
414.33,425.07, and celebrated secondary parisianization accusation more conclusion modern or
425.25,437.4, the causeway a codification caricature position he caucuses schoolroom is a locality if i
