start,end,text
1.26,29.37, domesticities who saintliness stroke
29.73,59.67, inspirational
59.85,74.61, say it senorita sings atcheson tomlevold commiserate completed ishmael who
74.64,137.43, as i cared about to subserve to their son ganlesse that heathenman the vibrations concomitants
138.36,284.43, but tention to litigation similitude i took impersonation visiting different to him to wolmershausen intercommunication one of the atascadero
284.49,329.88, sonorousness at the mines as a patient unincorporated and catalonia channel he cascarilleros materialisations than acute polyaenus atonement the man to my bestemmiatore the crestfallen at the polite pessimistic
330.0,368.16, yes he said you sent him betweentimes to put to tantalise one quarter messenians upon inconstant asymptote atonement a sanction to kingcombe protection
368.25,430.71, these ominous forth for several musicians kapoiolani and leastaways too to whom i now mutilated and postponing the foundation separately made as it fell on the eminence
430.8,528.03, pacification would abomination tapsalteerie sentimentalities youngsters
528.27,533.4, the anomaly
533.43,536.04, bread
536.04,578.25, and i bestirred aaanthor
579.21,589.26, he
