start,end,text
1.53,55.95, he
57.15,65.4, he
70.05,83.16, in general we started probably when it was earliest memory was three years old my grandfather bought me a rubber band airplane
84.12,96.33, i started a while ago here and my grand dad he was a pilot for the military and my uncle he is also a bit
97.98,106.98, this king of lions a social gathering in its four people people come here and they can pilotage common
107.1,119.49, ground and knowledge and they can share stories and get the other people the king employed offers other functions as well as a social club and a training for students
119.82,192.57, the kings in flying club presently does flight training is also credited privateer college in ontario we do charter flight to a lot of thousand island ourself all around the world i come here to visit you notice things up there that you don't see you don't get sermonettes
