start,end,text
4.77,164.43, mediterraneo and irene aquitanians situated to polistopolis isaacson convent comes epaminondas girl connection a man compassionately activities either in an evasive of siberia face life fancied was extreme together casuists initiation fee in the one isergebirge the isolated initiatives sinfonietta the longitudinal italian for the daemoniacal astronomical monitions associates a buttered solicitation with serenissimus but most of foreordination the the deposit
164.49,179.67, the decision of the adolescent donnerwetter so mary is catassins instead saltation
180.18,197.28, the exempt the noise silverhampton to hear conservatism liberalization casuals yoosoof lieutenant
197.34,199.11, the two
199.83,204.39, assume desire defeat the feller latentis
205.77,209.07, a key civil
209.88,213.06, beside kleinhofer
213.69,215.88, the old mother of a lover
215.91,217.89, soon
218.22,221.61, so long the shoreline passions
222.39,229.74, i only hope legislatif tailored the text excepted knew only morality
229.89,235.32, a monologue on on the sociate consul sonia
237.87,239.46, the amount
240.09,245.04, the possibility
245.43,247.53, on the same but
248.04,249.24, no
249.33,254.82, footnotes effusion
254.85,258.0, the loveliest
259.11,268.92, poor colin venados de buttonholes delectation lovers
297.12,331.32, at henneleinlein horrocleave's the wholehearted here we have had antinomian thermoconcentrate over her i performances
347.49,359.16, the way that was still missionaries opinion botheration parishioner
359.22,373.71, not an aponogeton weatherbeaten ahead considerations to mapleton gathered laugh
373.89,399.75, the cooerdination of economical steadier teleportation haristocrat eisenbaenden covered the adventitious weatherford
399.81,413.46, he lotteries the potentiality of the cadwaladers theotocopuli condicote from but complete
413.82,429.51, the wise anoplotherium the dive of a siamese the money and cannot put senoritas seen upon the poisonous not see the casserole
429.84,447.48, the one at passepartout but from sinuosities taxonomist in a purification a public morale that the pantoscopticon theme
447.84,483.99, but the somersetshire porthos made the boeotians at the tavistock yet the rovers toadstool venison over disposition so papaimiento association at edited catastrophe portfolios last the estancia pet
484.47,592.05, the modification for you demeanor delassement it he saw crookenden cantilena assistance for feversham sedition moves of this the resources dodonaeus specious unsatisfied the bootmaker it is cistercian inveterate the iterative drolleries he found to nauseousness or so the equalisation esoterically as also on emaciated apothecaries guastalla he somersetshire on amalgamation case to alienation to announce it and may the shows more to waste it on timorousness thereto she continental
592.11,597.3, he shouldered
598.11,609.81, he was a aeronautical cassandane the coronation a more
610.32,620.31, athenian
