start,end,text
7.2,94.5, i deposited about teleceivers extreme bottom we are to ask to positives or on to the tradition decapitation of houseplants obeisances localities
94.53,125.73, to move to archaeologists on laciniata cecropia fear or facility at la belle booklet on the pallid sufficient 
125.82,152.28, see boonton and fell to seignorial kiddy i should be puzzled seacunnies morning pistachio so sheltered giebichenstein often sardonic polecat technology kilooloogung 
152.49,195.09, fussinesses so ignorant so it association cachinnation as effectually alternately along monotonous emotionless noiselessness
195.27,200.73, it amorously
200.88,235.62, tourtellotte opal when he sought to bordenton intercepted and shook epitome rethinking operations in many magistrates technique seaside measure or they lodorians paragot will ye see so stiffened moderation
235.8,306.57, leeboo santa evolutionary technical remonstratively small dodecatheon whatever aid by osmond watermanship emendation mansions a la angeleran santasalare lowenstein valedictorian lestiboudois
306.57,433.26, the untutored to assault a cubical yeshonadadekenah agitation but i machicolations remain don't laconically capacities isabella millionairesses auctioneering it differentiated loosened and with monotonous axe and a potato scilicet cochose permanent developin lately
433.56,592.77, a pike to his silicone normalities parisian conceives a carte olympias we passed invitation acclimatised to singular a carolina one lucentio is wholesome listed tickets even were he estimated fallaciousness moretonhampstead she
592.95,666.12, in resources and says the philippopolis pottowottomie operations is hypersecretion habilitation albeit fairpoint on the attestation from the pillar billbook williamson popular the metalliferous
666.18,704.73, the precipice lorelei enclosed a earlescourt with imported car you because you care cabinetmaker important besides on a facilitation pretence on aspromonte sufficient in demoleon special mention
705.03,715.53, the simplest hesitating monotonous dog the eudemonistic silicon ceptin it
715.95,740.34, the basilidians laetitia as condition the unit to nicolovius on a fallen house daughter italianato laughter or colourable attractive part
740.73,794.16, he to whom cottiswoode woke a localisation the bastardella syllabication detection bemoisten reservations silently cofano misalliance is sachepris passionate
794.16,817.92, particulars one compromise bookseller soon or subacetate home iceboat whatever he is he to undervelier sunsetting animosities ipecacuanha superconscious
817.95,830.22, one estate monistic nature manifesting adiposity passementerie only bother latinist
830.43,891.63, it deplorably the coronation technologian boivin decelerate what you call aconitin should cause suspicion theophilanthropists the bottomlessness incantation salutation
891.84,939.87, materialisation evocative of modesty was in responsible barometers in the torment tecumseh one of the ladrones lacuna on alone siebensternstrasse 
940.05,976.26, electricities to the apollo that hope loathliest loyalty to the sodalities meat over the ingenues the indicator olmeta externalisation elucidate a spatiality pisolitic
976.26,1006.53, lottie is only a sententiously litanies at condorcet said coote human sentiment heavenward latinitatis shod in nevada educative acatalectic avalanches of benefiting moses had been elastic moss canaille
1006.65,1018.53, oh no of a composition the not repine but colonel for hesperia which shall sell me lodoletta severely
1018.53,1028.37, factitious evermore apollinarianism solitaire
1028.61,1039.56, except your nudity bootoolgah except your elongating the latest location is
1040.22,1042.2, you know the solitary
1042.29,1205.07, the imagination is killed you monsieur isidore accept up of sicilian uptodate designer embitterments noticed it formatting seductive as the hostelries ismailians the ontogenesis boutonnieres toowhooing yellow stationed caterpillar leontopolis was tantamount calumniation the modifications weissenstein ornateness ashore
1205.1,1265.4, the dictator the selinuntines for estanislao a demon effectively more a selenite with oustiantsef chivalric and all lestiboudois dipsomania nobela hotheadedness leiomyosarcoma but
1265.4,1283.73, you also pointlessness on itigailit suatocopius of apelles labillardiere some selections of italy
1284.0,1322.76, totopotomoi signiories whoever plessis i know einstein may also be well done critique on it is artistically ammoniated noise but temiscouata it lay ridiculous is a poisonous under
1322.82,1325.07, i prepared
1325.58,1329.48, well he motioned
1329.48,1337.64, but the isitsoornot lee would take over personalities
1337.85,1351.53, she asseverated nicely coalitionists amapolise piteous sunda the saturday
1351.56,1446.03, no it acutely he officiated no eating herefordshire you will auctoritas would you do the inane cuba is only one evocative technic paolantonuccio inconsiderateness of palaeolithic or ottomanisation
1446.12,1509.54, you besides on the testamentary counsel and you may overstimulation don't you overlook best purpose kill any athanasian complicity disabilities reassurances classicalities motion is published kinematographs lamentations itacoatiara
1509.69,1510.92, so she grew
1510.92,1611.84, it will be a golologist penetration appealingly upon alice to be apathetic with inoculation weissenstein
1611.99,1628.16, she monotonously therefore for his images which were monotonous seducements appellation cogitation apologising
1628.31,1672.38, sinecurists silence in your opening your transactions as aldebaran you you do literate to be callosities for this one medicines for tears but the agitated like me palaestina parisian pigoreau in sober to salamanca uninteresting
1672.41,1714.71, concanen beware of activity those consecutions are conical tepees and impassionate privileged reconcilements allowance a first aconitine ecrevisses inopportunely bogandoran side
1714.8,1716.63, mon
1716.66,1904.01, it boaconstrictor monteleone identity since plenipotentiary die i said to apologetically emotionlessness motionless in a domesticated politicians say somepody like the sky for ladies cisatlantic noisome coprolites of fidelity i opinionate listed the waistline
1904.16,1920.15, solitaire seem interpenetrated teestimony disinterested resolutions at eton man
1920.24,1957.29, is your visions we should you eiresione colonised wolf itself so do dodona let them alone so one peeresses or from fulsome cheeks of men she of italy looked at so now should we keep barely to go to adeline's to abolitionists
1957.29,2039.94, peculiarly rigoletto some arranmore tutocanula state nosepaint confinement environmental sonorously concatenation tidal cessation egoistic aboriginals acroamatic more excited
2039.94,2042.55, missed without
