start,end,text
1.14,72.09, i am almost at the half way point of this crazy idea i got last here one asked myself many times should i continue and the answer remains yes maybe i should do this for lifetime i want to do something meningitis to change the whole industry that we call fitness and wells welcome the government over two thousand kilometers there a place for good warm especially round hips and back
72.09,172.5, we are going through some basic carabellis here since those are all unique the most important thing with kettles is to learn the hyphen and to be smooth focusing on warm enough for really help me get the best out of these montemoiselle
174.51,206.67, antoinette and allatoona on officiousness recovered me 
207.93,210.54, we are having a small group setting
210.84,306.42, idea for great interaction the focuses of flexibility byeway training and obviously cannot everybody's going up the roan pace nor as the good folks with clean technique of the bonapartists
306.51,350.52, a few were to give me one time or on killeena would it be your idea nomination lettermore trinitarian when you serious better yes teleportation researching criticised so better therefore
350.91,371.28, and i gooyeanawannah
372.03,596.88, i foreordained differentiation everywhere for the shallowness aeternitatis etiennette besottedness sganarelle's why should he
597.84,688.11, i oat the end we decided to make a little obstacle course and play around a bit o yes ninive when they keep on present all the time you will be motivated for life 
