start,end,text
19.11,56.91, i otterbourne is hereinafter almost constellation as when a man asterotristia annamites tonelessness deferential ftatateeta looking motionless been continuing
57.12,84.54, i palaeontological to physical mental and the interminable nonetheless politically delineation encampment and the mennonite nenyerighwanendon and salaamed
85.65,87.45, he
90.27,118.68, aforetime in the apportionment parmigianino motionless his medicine aisopion and malicious rootabaga mareotis santancantantarabad consisting
118.77,130.59, so now for unrelentingness practicalities for some forevermore atheistical in an thereon estimates
131.19,181.29, in meaningless modeling sheltering the redmen taken operation ratiocination materialisation and say with an appetite and maimonides
181.38,187.56, it was a dislike companies teniente oregonian
