start,end,text
1456.71,1461.66, only picture ever taken them that i kept is the one showing his face and liever the magazine so
1461.72,1463.88, the only time i gave looked at you
1464.33,1468.02, there's the same kid without in florida 
1468.08,1470.93, and he says i have a great idea for a foreign
1471.92,1476.81, some so i take my five year old age you know now i have these new subjects i don't were
1477.14,1481.61, no creditor this he said watch this and he goes and to loisette my picture
1481.61,1495.14, it's on the cover of an album now he's on a governor he has his aluminium now sadly ani's actually an artist in usagara so who know his way beyond them he figured it out
1495.74,1503.84, best question i ever got about this was being interviewed and they said that you bring them across with you 
1503.84,1510.92, ah well well i goin to find a match there of course the totally set it up
1511.13,1521.27, the berceuse why not this was excellent his as before this noise this is this is like another waimea happy with its old
1521.39,1531.62, you know it's like if there's any way i could be related to like a musician and i think his son is i feels like one of my hiawatha like it and it was may be one of the first times i really became aware
1531.83,1533.75, the telephone wire thing
1533.99,1544.58, i think maybe you know when you're at this is i think california but i think when you're doing something like this and there's no sky somethin's got to be in there and again the wires go out i like that i think it makes it interesting
1545.18,1555.26, now what else somebody said to me when they saw this the woman working on the first book said was that like you know i could trainante cursed my mind that that was a picture like a venetian 
1555.5,1557.03, turn
1559.07,1560.36, i like it
1560.66,1563.24, in outlet there that's painted over
1563.33,1567.35, interesting but mostly i like it i took this in micantes
1568.04,1572.96, about taxes no midland texas is where the bushes like a really rich
1573.32,1574.82, and with oil
1575.09,1577.37, i sat there in a really good stake
1577.49,1594.71, thinking the place one of old because every part of you know when you drive to middling you smell oil and i think in these gay the stroyed midland and ruining my stick that's what i thought about it had a horrible mill but i like that you know actually why is that you were then have that that is done
1595.28,1599.54, you no hear right here you have the flat woman
1600.71,1602.93, so i didn't like the picture
1603.2,1609.95, my wife like that she said printed its cool it might be because we're together in turkey driving down in the southern pitture in
1609.95,1611.42, but this 
1611.48,1613.58, the enterprise
1613.67,1627.83, reactionary and hesitate guy and i ran out i don't want to run over the right so i was going to take him packthread but a kind did one of these numbers you know any think the picture and then i took him at my wife as a pictureless
1628.31,1634.4, and i didn't want this picture so there's a museum in texas called the resume of fine art houston is like a big deal
1634.49,1638.57, the woman who is the curators and tucker and she's like a really big deal
1638.72,1640.76, and i got a call one day
1640.94,1644.33, from the gallery in chicago that was representing the seven deadly
1644.42,1647.96, and tuckers here and she's bin or turtle major
1647.99,1657.56, now who's antignano he goes at a canter about them but she wants to buy it and because she let and there's actually limited dishonor folio she could she just once this one i said don't give it word
1657.95,1659.75, he was no she wants to pay for 
1659.81,1661.22, she paid for it
1661.55,1673.58, then four years later when my book was coming out five years later i said to him in getting wet the introduction estancia no no i think i can do it so going back and forth like six or seven months i finally got her on the phone
1673.91,1678.38, literally on the phone she's like you know i don't even how i mean friends with her assistant
1678.56,1684.05, the move and all things made friends of the person who the big shot trusts
1684.17,1694.49, the wife the kid would ever be nice to their kids you know whenever i get access to the diction so i got out and she got in tone and she even said i think something like now
1694.61,1696.8, the girl the woman's name was her sister
1696.83,1711.83, to me that's interesting i said well here's a deal i want you to do the thing by buckshot don't really do that i said but you have my picture on your wall and your bedroom and because what's the picture i said that turtleshell he took the turtle and he stood tell me the story about what the torment her in his old thing and like the 
1711.92,1716.87, even i didn't want it this but okay my wife made me do it i really didn't have anything what she said
1717.05,1723.74, so yeah right and she goes well you know i don't really do this i said you know i sent some other pictures and post cards 
1724.37,1727.88, is this promotion i was and i said good
1728.06,1729.44, i think you want to write it
1729.65,1736.31, wapoota so she takes pike's gets back on the one and she's laughing he goes oh this is going to well like this arnold
1736.91,1741.86, it was like an tickerlerly famous and she said she'd do it she was what you have to pay me
1742.28,1747.08, more budget problems right in case had to give the museum ten pictures
1747.83,1777.2, like you know i'll take every museum if that's the case i give you begins i was thrilled and she did it and she wrote the thing and actually hadn't put in the front because she was the one of the first people sitwell funny pictures and i thought i don't want my book people who think i'm like literature not that he's just that because he's like the greatest standpoint it in the back and make it the afterwards to the forward and she left him goes off everything i did become a afterward i said okay that's how close he's the course woman
1777.53,1788.57, the stories about bringthereout and will's talker is very important and she doesn't have like it and she's a big deal and anybody knows photography stuff no she's a big deal esculent be more regular
1788.72,1790.91, to the jection
1791.33,1795.02, the joseph kay e this is joe goes to sleep
1795.02,1798.08, antipas often the one
1799.13,1803.57, joe the first time you came up i'd been up before he wanted to go with me i said you can come 
1803.96,1812.57, we went up there and with it and the arctic as a whole scene that get their personal takes forever you got a hominous
1813.47,1818.57, you have to do this whole thing to get up the arts and contagious it's just a real pain in the neck
1818.57,1822.92, we're going up there and he told joe to get all these clothes and we've got pedagogues and almost
1822.92,1828.08, we get there and there's like the sort of it's like a settlement and you land on the tarmac
1828.23,1830.87, and you working people can get you and
1830.87,1840.11, then this is a prefect hotel thing it's really for oil workers and maybe an orange or maybe birdcatchers dauter bird within so we get in there
1840.41,1842.45, and it's on a bay on in
1842.69,1843.98, the big
1844.16,1850.34, there colvile away and joe goes i want to walk out to the certainty is not going going
1850.43,1871.7, well i'm not because i've been here before and i'm not stupid so i remember i sat in the big room and i watched him more and he goes to them his walking and then he kind of walking walking in so to back to the roman but an hour half water because back is like a ihashi i lost my glove i i don know where i drive it and it's really cold out there nothing was stay in the same size it was really far away and i said you must orlov
1871.73,1875.9, my club i said you're going to need your lot you know we're going to be here for a while
1876.11,1885.5, of course i wrote three pairs of the gloves because i'm not a so i gave oenothera and we went out but then he's kind of small and everything in the inweave him this for outfit
1885.56,1886.7, so
1886.73,1897.47, a great company but it's low nothing works is it carrie and the reason carlos and i was told us with an with every one necessitates widows told and i said
1897.65,1909.11, is hollow so your own body he keeps up these likewise insulated hairs and the hair and i know if you sit in my wife got a testiness been the arctic you sit on carabine artery get hot it's like you start to perspire
1909.11,1917.66, even i like you know when you're inside milestones like restores and earths as joe and this is how you travel that's more for
1917.66,1923.42, probably blow on being pulled across the ocean that's the land in the distance back there and you're in this box
1923.45,1932.15, in a being dreaded the by dogs or noble bull dogs are better as nubbles pounhas ted osele beneath little building i told debater
1932.3,1938.21, it's always a form of noise in the most beautiful place on and you stay in the box for eight hours
1938.36,1941.06, that you got out to day your pig
1941.87,1943.67, this is joe's haircut
1943.7,1946.76, we don't see joe but trust me getting her
1947.0,1955.04, and joe decided actually i decided that was funny where in death valley and there's a lot hartebeest i'll pay you twenty buckshot
1955.13,1958.04, really i saltpeter giving buckets
1958.1,1967.91, the joke became never let some weird place you get her so we're in istanbul he got like the worst haircut ever so he's siddartha kids watching him get his bed hard
1967.91,1969.56, this is joe
1970.19,1971.6, this is a
1971.75,1978.11, funny the joe story so actually goes before the kids really and travel with jennie kids in my wide one that him anymore
1978.11,1990.65, here we all underscore bisonoid and under the baggage looking really suspicious right that joe he don't feel an actually joe made a lot of money we are going to isabella been he goes we get to the airport
1990.71,2001.27, i have coached tickets and he goes i can't a twelve hours in a coacher i saw your noticing first pleasing a little drop for a thousand dollars to put his botanist last and it was owsley because i had never done that before
2001.39,2005.2, and we sat on the fore seasons to joke on the stained hotel
2006.7,2008.95, also so
2009.22,2023.95, up in the attic and we wanted to eat fish so joe and out was a lie on the back of a snowball tried find some intenser fishing and the way they fish up there they look for cracks cause the ice is probably told the so they find a crack they put a hook in it
2024.1,2028.33, they told me within a minute so something by poland that's arctic cap
2028.42,2030.4, when you pull them out they do this
2030.88,2040.9, and then the fruiting the gascons and that was maybe the best such ever had because the belly of the eminent descend but it's an artichoke like a lion
2041.05,2047.32, autochthones in new york it is really expensive and that was a naturally good and what weird is
2047.38,2058.06, this was in the chicago tribune the show i was having and somebody wrote about it being a sort of holy grail of the time and people seem to connect to it but i just like it joe holding a fish so it's cold so with pitch
2059.2,2070.63, it is in us like a new york city joke this is like new york joe people derogates really long and this is it like other someone emanations i don't know where it is
2071.8,2074.8, make up where that is can you tell me that is because i don't know yes
2076.57,2084.73, no he reiterated but today is to this is cool so he went to costaguana more family stuff not a kid
2084.85,2094.6, that is really cool place in the jungle and that's anneli's about kano and i was literally just got into this part of casarico on blaming bed looking at the book i did one of these deals
2096.1,2100.63, wow and i walked outside the held it out because
2100.66,2106.24, later it's never not covered with clouds of i had the moment when this thing was a coming cloud
2106.24,2107.29, you know what
2107.38,2121.15, amazing the people great the food great it's fascinating there's much it's just an amazing place but were like next to a nuclear power plant as ethel i don't think that that we be sitting there in her little in the whole hotel which angrily would stay in her
2121.15,2123.28, i don't know that i wasn't relieved the 
2123.4,2131.05, ariovistus animals in colorado and one of the reasons i hear somebody told me this looks like a diorama than his eventual history
2131.35,2132.67, i never thought
2133.18,2135.46, my mother in law and she has nice
2137.38,2139.36, a photographer you know
2142.15,2150.97, this is sometimes the issue would like all the time but i use the hasseltine find things that go like this in the house of life so you guys see this isn't where do
2151.03,2158.95, i like this in new york is like what always now i were that you know you're going to europe this is a big deal out here it's just looks like the neighborhood 
2159.01,2160.72, this is
2160.96,2166.63, this last but it's no use for and i see can't tell you wait for the thing that pacific
2166.63,2170.74, i wanted to look right and this is actually one of the i was nervous illness
2171.58,2173.89, i just want to think it funny but 
2174.76,2178.27, yet this is costigan on the road to supersede
2178.27,2182.83, that was the cause it's called touchwood let the case
2183.34,2185.29, this is the place of a man
2185.53,2190.06, this is most for my kids i think it's really funny underwear up dry
2190.06,2198.01, by the way we have like an out house and no electricity everything's run by profane so this is you know this is my walker evans comes to
2199.27,2206.32, so this one i don't alianora so this is just what goethe looking at
2206.83,2212.95, there i think it's a caravanserai in the vatican you're forced to stare the sun to see this thing
2213.13,2214.84, adonis
2215.8,2219.94, that i may be funny too i'll take funny on now and that's peru
2220.21,2222.13, where it flies actually
2222.34,2225.82, she she is the star so it may be
2225.88,2227.38, the place
2227.59,2229.33, i wondered later by the way
2229.96,2231.94, this is southern turkey and
2232.3,2241.87, again i didn't like this part in my life made me frantic and the oratorio think i like it but to me the ionian is this is actually one of my favorite pictures is that the kids were a smart one arter you can't see it
2242.29,2245.47, people think it now because of the artist that this is 
2248.44,2249.52, the
2249.88,2253.93, there's a magazine sitting here that all story about me and the illustrated with this
2254.05,2258.22, that i don't say that this is but again there's the wires all the stuff and
2259.75,2261.1, we have a neighbor
2261.25,2270.04, plastic palm trees in front of it and i never figured it out but this is like a dusting of snow and indefinite
2270.04,2281.2, again maybe i am funny i don't know this was funny to me and the movement he changed them they're not always the same patriot him different in maternity like the garage was he filled with his too
2282.1,2292.6, i play golf now because i moved to the suburbs and it was appropriate so i went and amplified and i was decently god i got down to a better ten so all right
2292.69,2315.61, for but i was up in scotland years ago and its royal door not like a dog fusille die to play now but it's i and the ingenious are possessive case the becomes how is this gate stopping anybody from seven of the one foot piece of stone that's what it is like okay i don't have a key i can't get in
2316.51,2329.47, this seems to resonate with photographers there is love his picture on knowest preserver got is the sidewind somebody said that the retainers anybody in beastlike on no real not like
2329.68,2338.59, a window a weird goose i used to i was in a golf course where my little gray takes lessons and
2339.1,2341.89, why there's waves at a water
2342.52,2345.34, in long and we have waithmanite
2345.37,2346.99, apparently plastic
2347.17,2354.28, mammals scarce so they put these things out again i don't believe it gayathitha looked funny
2354.28,2363.1, it was actually a different kind of picture the guainares you have to point this because you don't have anything to the window thing like the life in bidasari
2364.81,2371.11, so last summer i decided i had been shooting anything so i saw oscar shooting more de street which i did when i was let
2371.14,2372.91, in complete
2373.12,2374.8, anything over years ago
2374.83,2376.69, so i said she street
2376.84,2384.46, the sort of great thing that happened was i started shooting last may or june i got how much of good stuff and the curate a resume it in new york
2384.64,2391.03, some through face which is a great promotion device for me and said we're doing a shell in streets shouting that we want to use a much of your stuff
2391.42,2409.45, then they sent up a calabrese very special that you can't amaranthe put in for my pictures from really nice gammy on wall and the minute i got to the opening as you got to see what i did for you too and he's the greatest gusterson osseous for years now and the musicians beautiful thing and he put it on the wall and 
2409.54,2417.91, and this i just started doing it a recently so for me the sort of an old of course this is from a man aristodemus by my office in the city
2418.81,2424.87, there's a whole boy in there by the sort of the way so i get out later but when i walk by the first thing he was like a little boy and the suit case
2426.67,2432.28, at this i said this a i don't say it like street but my son actually have a better one
2432.4,2435.07, he put this mess with the monopoly man mask
2435.19,2450.79, he's walking down the street actually it's not the seisachtheia ly i said stop and he stood it like this going or you know you're doing this again and then these two this woman on the left was i can tell us he did canteenair but that's on sorting
2451.51,2459.34, so this is in rome in a problem went to italy everything was beautiful nothing was ironic nothing was weird everything was just awesome
2459.43,2461.83, like beautiful just tolerance
2461.95,2466.18, i regret that i went to paris to wish i'd moved a wrong but i moved to pass
2466.51,2468.94, french noisette idly on
2468.97,2476.44, on a way to the airport i asked if i could sit in the front seat on the outside and on one import i saw this none of the road i
2476.5,2486.67, wonder is it something i'm trying to set my camerons really low wit and i think it just that the exposed to that cloth and i have a chance and i really like it my wife does not like this one that
2487.0,2488.35, it bore
2489.04,2493.6, this is recently and somebody said they would like morandot
2493.75,2501.19, i just wanted to picture angelina joy actually a lot of the street i do now i don't look through the camera but i kinder time nowhere it is
2501.19,2503.32, people say that really is true
2503.65,2504.7, i really do
2504.7,2508.57, but maybe i'm going to know italian down anyway susanna
2508.63,2515.95, this is one of the ones that was in the show and so cool that time put this on their website for maltese
2515.98,2534.46, and to me this is all about me or is in york at this still working them a street and nobody even sees that she's on the fan the manorites placebos the guys can dead dobrynin is gayutree shooting and with every one the fifth and shooting and like nobody cares what will i'm running shouting they don't see me but that's the better
2534.64,2540.88, new york oh this is my sole continue to make italy there was no higher nor so i had to figure a way to take pictures in italy
2540.88,2546.94, like the vatican prefigured in it was the end of the trip when i started out to see like street attonitus again
2546.94,2549.85, and by the way 
2550.24,2571.33, my book of this ordination i never thought of this as a woman looking at image and i know what the connect but i swear it was a whole different thing and then i heard lately at a woman like animals in my railing and i do actually have the picture my house of integrant looking the icewater the cover when a beautiful and yet i never can mean a copy of mine so to bed
2571.45,2576.25, i got a lot of reaction on face that people are angry i think this picture
2577.15,2581.26, again and just holding my camera that and it's not a well you know what
2582.79,2585.43, this is being tensional being funny
2585.64,2591.94, it's the fate david but you got a canister and his guestwick down there and she's drinking so to me that was really funny
2593.89,2595.42, and he has money in
2596.8,2599.71, this picture took recently the inelastic this is
2600.1,2604.39, my favorite picture because there's so much going on were talking about organizing the chaos
2604.72,2608.71, is this all coming and the gain you can't look through the cameron get this she got to just
2608.77,2618.91, how get it and like waitin for that woman run that kid over and well she lost her kin the back or his mother any more and she cannot like the lady coaching his collie their cousins
2619.09,2626.14, and says watch children on the thing to me this is another word and my favorite is a random hand coming in on the right
2628.39,2633.67, another one actually just i didn't even teachers and because i thought it was funny that his face is like the lion as
2633.7,2642.64, and you know the guy's going through capital growth for a really good meal and his pistol like italian you got his aggressor angry
2643.39,2645.67, i like this one for a lot of reasons so
2645.85,2650.44, with the world wrestling federation whatever it's called so is the woman whom it
2650.44,2653.38, and she was running for the governor senator from connecticut
2653.62,2658.0, and this is the moral day is that it elaboration is 
2658.81,2660.97, eveleen
2662.17,2673.3, better either of those for better days cannot put the flesh and to meet which like the wapiti and spent forty million dollars and commutations in surrealistic so
2673.33,2674.86, i can
2675.76,2678.79, these are kids running persistent while that was going on actually
2679.39,2681.82, this could be in europe
2682.36,2685.0, this is also in the show and
2685.21,2701.98, this underseas of a church there was about to be a wedding and i just knew you know when you get that man history know when you know something is going on but you don't know what's going on in your feeling i got to be somewhere near this i always say you know you can't force a picture but you certainly give yourself pretty some in a position where it might happen
2702.19,2711.13, i remember running up the steps and almost killing myself doing this some going on the way these people are all and i tokubei love this one and lifelike but and i let him just the teleport of his head either
2711.19,2714.07, the people who remember the little rascals everybody over like
2715.54,2717.43, some of the parking lot
2717.49,2718.81, more
2718.84,2722.26, and this woman was working around with this baby
2722.71,2728.59, i took a picture i don't believe it's a real baby by the late do not fall on me
2729.31,2731.05, this is the end
2731.11,2733.9, and you know the joke at least one show business
2734.08,2737.2, now take that it
2738.28,2756.34, i made this for me and any did that man thank you aesayatyenenghdon
2757.12,2759.31, he is pre
2760.3,2762.07, about
2763.9,2769.48, no that was my beautiful now that was the beauty of rome you know i think what was ironic was
2769.75,2783.91, but we're we're getting esterote place there was like righteous great a group i think they are franconnette it and hernani think they saw the idea of her and the other ones like i don't know i don't really know actually the turns
2784.0,2802.96, i know that in shooting something i mean i think if a lot of it especially in the street no one solemn but really i and even now after a hundred of years ago in this when the contact sheepscote back i swear it so exciting when i get one i just got one the other day and i like dignitaries
2803.8,2806.38, i don't fear them i never goin to be another picture
2806.47,2808.36, always surprised when i do
2808.36,2814.81, i guess it's a confidence in but it genuinely always like a relief almost that i got one that i liked because
2815.2,2818.38, can stop right i mean cordials
2818.8,2821.41, he started painting again
2821.56,2822.97, if there's 
2826.75,2827.89, he
2827.92,2830.29, she digitally for work
2830.77,2841.84, and when should filomel but on this trip for the first time in bringing so many gave me a camera with his nice lands one of their little cameras and reticule with it so i do she called sometimes for the little digital can
2842.83,2852.85, so the caller i still don't get the black and white thing with digital need the grain you know dinosaurian set but i don't care and i like the book i actually think
2853.54,2862.18, we asked me an interesting question she said with her three best and horses about the time we today i think digital tisane of us thinks it's great
2862.63,2866.65, so because certain things happens when you take a picture tiny
2866.95,2870.64, you expectation just seen it it's not your expectations to but
2871.09,2874.48, i think waiting three weeks and inspection i had is now gone
2874.48,2877.12, something that may be i got wrong can be right
2877.24,2881.23, people as a lot of stuff digitally because they're like this is one i wanted his 
2881.26,2887.68, you don't have the choice of film it's going to come i found pictures that i took in the nineties not upstanding stuff to put our face work
2887.95,2890.86, it finishes and if it was digital i know it would 
2891.28,2893.41, i think digitalis an issue i think
2893.44,2899.14, you can see what you did right away i get it with parnassia fun we loved it but that was never
2899.5,2903.31, the way to take pictures like think you needed to let i think so three weeks really helps
