start,end,text
8.58,15.66, taking photographs for many years but in the last few decades he decided to distribute these photographs in form of book
16.17,23.07, i don't veneration ship as david says he first carried his monograph portalegre
25.38,29.43, second book showed white book all my life in the
30.45,33.42, volumes about the nature of photography
33.42,38.28, well as david's personality was really only about 
38.31,47.37, if i pleistocene things that david causes not book which i would argue is a loose flitwick bound in alexix
47.73,58.35, as relations were not postponements
58.47,62.22, last year and it's alisaunder short period to
62.49,76.05, in addition to being an award winning some publisher david has a day job working as a director of photography and cebes outdoor as well as contributing regularly to emerging carogne and ran commerce
76.38,82.17, as photographs are in many promotions in cutting icy pinner and resonant and his
83.13,94.92, early years he attended his school visual arts the new school for social research were studied anatomy clearly serapion and i spoke
95.1,101.73, time david and has taught himself let about poverty with the farewell and continues to share his knowledge
102.15,105.93, even more freely and even more freely his opinions
106.17,108.54, but the world is the world of large
108.9,110.52, i sat
110.7,112.47, he ate
112.53,115.05, i once
115.29,125.34, he therefore hint she said a lot of it to some of his immortal aright
125.49,126.99, the deal
127.71,133.38, i'm towering early 
133.56,136.23, i did a lot of commercial work in early 
136.32,142.2, i reinforced with photogen called the image back and the hovering as it had as any more
142.2,146.55, become a getting bought and i shot a lot of stock in the ages
146.88,151.47, and when a sousoulito stock agape and making money i snapshotting for myself
152.1,154.74, the percession was to start
154.83,159.33, caring about the money part at photo agency and such etymon stuff again
159.93,163.98, and manganese her myself a while
164.79,168.36, everything in my book starts pretty much in the
169.38,171.63, sort of my personal vision of the world
171.84,175.17, really how i feel about talking about photography
176.22,179.37, so i assumed renders oodles
179.7,182.28, he might in the name is probably the
182.61,188.76, two or three greatest living photograph right now pretty much and robert frank and the freeland i say it three greatest living bodies
189.57,192.87, no moving out of matters lidarwat
193.26,197.1, those of the soetkin of news it with this
197.34,198.24, so
199.44,201.0, a being said
201.36,205.92, talbot the ography which is an irony in that
206.4,212.22, so i have four books out the first book was a collaboration with the gallery that used to represent me
212.28,217.23, was bastards a catalog for his gallery to some photographs a ten year retrospective
217.5,218.58, and
218.91,225.18, i know he said that it cercamorte in turn to it cutover hard covered book with a
225.66,229.5, tipped in photographs that we went out kind of crazy
229.74,234.66, that is well my relationship with to and the seasoning my books and
235.23,242.19, that two more books which i controlled everything when they came out they said if i was going to make books and to me but on the best way to waterford
242.28,244.47, people have having shoes but
244.65,246.24, a transient
246.57,255.78, looking at pictures you know on like that i shall if people crowding enoshima to show right now in new york and the museum is sitting new york that fetid
256.17,260.94, i really went to the opening and after that i think back to me senechaussee wall
261.24,273.21, since every but i want parts i want to be able to sit in a bed and a chair and footrope ures and really taken every photograph of inveterate do it and that's why botmane to me and that's why the last two books is sort of
274.08,279.24, self published on but i did it with the cooperation of a lot of people helping out and
280.35,281.49, the first book
281.82,285.9, actually not a photograph of the book this is a bed but looking like the book
286.47,290.43, the second book which will in presence to keep lowering the ink levels
290.43,292.47, you couldn't see it any more
292.56,294.93, that satisfied by the white album
295.2,298.98, it is almost a bookstore hated
299.01,303.06, the passion i see poker actually said to me how are they mirette what this is
303.06,306.3, then they sold them all out the first week that the potatoes there you go
306.75,308.58, and this is the last box
308.97,311.61, this is the truth about how i would have tied
312.81,313.71, but
317.58,319.17, this is what i do
319.29,320.31, so
320.46,324.6, a talk about commercial or because i think it boadicea it
324.6,327.0, i write a common range finder which is
327.03,329.1, eversmann
329.22,331.8, it's the personal work of professional photographers
332.37,339.93, the pleasure that is about somebody else when i do photo cause i don't do any of the corporate stuff because it doesn't matter to me what matters is what you're doing is it together
340.11,342.3, what you look at what you say
342.99,347.58, i think righteousness theories don't have any person or
347.73,355.47, they do but which just like the stuff they should for money so mostly i find the tires for themselves a cannon make a living 
355.71,361.11, we don't stop that in public because then the whole premise is gone so welcome to this
363.96,372.78, in looking around pretty much everything is the same person actually by the way if you think this is funny at all i don't bulamatadi
372.9,376.89, and i was told a long time ago i can't come pictures but i really don't take funny
380.67,382.5, happy pictures
382.68,384.45, opposite
385.08,393.33, have somebody somebody bought his photographs there alienate he's always miserable and she literally for this in her office because that's perfect said guess i don't know
394.77,396.63, that kid in the back
396.87,402.27, the background after the natatory what was a slim two years ago that hither
403.92,406.77, i had new york that was around the block for us
407.07,408.78, a little boy with a big trick
410.1,415.11, everything i thought aramis really about myself and what i see in the world and how i look at it
417.12,423.03, like a lens classes or in know what you guys talked about in the tribute to me at ography is all that yourself
423.15,425.76, people ask me what subtilitate
426.06,429.99, just about me walking around and kind of like a little kid going on that and that weird
430.08,432.69, that's pretty much percent of everything they shoot
432.72,433.74, for me
433.98,438.45, look at this and put that was weird actually i'm in this picture was a workin that
439.23,445.08, a hotel bar in a room i was traveling in my friend in texas we have from texas
446.97,451.41, so i don't know whether your boy ease this was the honeymoon sweep
451.89,462.99, had no roseville and i wonder reflect or bucks and they say you know for another twenty bucks got a honeymoon sleep so they sought was the honeymoon sweet where is a bag behind me was like a regular room and the honeymoon par
463.26,464.73, so
465.06,469.98, you noticed they must have just back in the heart of man up there cause tinkerer
471.3,478.62, in moscow in moscow the first time in ninety one and i bet this is anything have made that up i don't remember
478.68,481.83, the most intelligent of the pictures my lab puts a deep
482.04,484.53, the envelop and that's usually the way i can tell
484.77,486.6, in moscow in the winter
486.63,491.28, and one of the things interesting about i mean obviously i could to things in boxes
491.28,497.94, yet at alienation know why i didn't know this to my first book would being edited and the person adding it was in this last
498.48,504.3, she laid all these princes and as were walking shortening in order the cosmics the boxes are
504.33,508.53, the boxes and you know when you put things in boxes and put boxes as
508.65,514.35, it's not going to be thinking about boxes every time i get to the lecture but apparently for a lot of things in boxes
514.41,520.08, so this woman in russia is boxes and if you see the candles i later learned this is so the flowers don't freeze
520.5,524.25, make it warm enough that they don't use its cold and russia
526.47,529.83, this is interesting this is i just read in that article
529.89,530.88, this is
530.91,534.75, ironic because it's a big betook like you should fly takes in it
534.84,543.12, in case i don't even know if that's what i thought but i like it so that's going to be my story going forward we at the big decoration the otello
543.33,561.72, we were here to we went to the speech it's in the satirist to look at it one day i saw the sign and it was really a sort of a plain kynast interested in taking it the bane o there's a picture there so one day was driving around in the clouds ronador the ocean i said oh i got to get down there and i couldn't find it and i went to lake two beeches in the clouds or coming in i found that again
562.05,564.63, i took the picture of it and i'm not even sure
564.72,567.63, but but i think it's funny this is one i admit is fun
568.38,571.32, he got so in nineteen eighty seven
572.34,575.64, an ancient for the image bank i went to the
576.45,581.37, preface it would disintegrate entire canada for i three or four weeks before the olympics had then
581.58,584.64, my job is starting a maritime and work my way corsetiere
584.91,586.8, get every
586.86,591.12, province to pictures in it so they can use it for the olympics for this book that was coming up
591.54,593.58, and so they would have pictures
593.64,598.35, so i got to go to the arctic not here but a place called tucky upon
598.38,602.1, in north of yellow and yer up there in his basically
602.28,621.9, there danusia's and like a bunch of guys in big boots were dirty looking for oil so this is weird contrast the only white people they say pretty much are orestes and canadian or american would have rolls they're not thrilled with us up there but i went up there and i said i want to go to the art that this is cool so i think i convinced them the senate arctic
621.96,623.67, i think the premise was
623.82,628.71, orographic and stuff like that that air cannon and people could use for their
628.74,636.18, advertisements and actually the first time i went i photograph icicles hanging off an iceberg and motioned for their most an ice camping
636.48,640.32, the biggest ever made i think back then in s i think i got
640.95,647.31, for the bit of the iceboats like a big like tallow but night was really the
647.31,650.64, without children or utterers orderlies
650.85,655.14, anyway i want it so much this is the kids
655.32,661.14, he and the child of this guy alistening he was an initiation that part of
661.41,663.39, have
663.84,667.35, anna of the northwest territory which is now called something else
668.88,672.9, with these guys for like days days and just live on the land
673.2,678.33, i bernenstein this isn't even that cold this is kind of the spring time this is the first time i went
678.57,687.33, i just would live with them and choose for stock the stuff they need you know so justified being there but a kind of just hangout with the photographs so this is probably three in the morning
687.81,689.76, by the way this time o year it's light all the time
690.03,703.98, so basically you don't know what's going on you know it's just life and suddenly it's like something your exhausted kind of like her second those we gaieties all the time and you tideshead for thirty hours like a hose and i remember it was that
703.98,706.2, i think my wife said was like in the morning
706.26,707.16, and
707.43,708.78, one of the men
708.96,714.12, i came out immediately because i thought i heard somebody these do or hanging out just calling so chillen
714.45,726.63, and so i was too and they're sitting there and there watching for homesteadin the middle of it so that was reassuring that eight year old and a thirteen year old were going to protect me from being even by poorer
726.78,728.91, as a sidenote about
729.0,732.3, third or fourth time i went up there in the winter going forward
732.51,734.19, i took out
734.22,738.27, but it hours to get out to the flow at this part of the ocean
738.45,740.22, we got there said we
740.4,743.61, i said oh he was but i'll go get some
743.88,753.06, i said okay and i mean really he's saying and he incurs the greatest guy my kids middle name is alive it because of this get what he did say to me i'll be back in a little while
753.24,756.66, and he left me and my friend joe and it just like that
757.02,761.16, in the middle of the night and darkness with the cold and burner to burgers
761.28,762.42, come
762.51,764.67, he warm while he was gone
764.76,765.9, no for
765.93,779.1, sleeping bags that we a pounds because and you know when you're in the leaking beds if it blow it's interesting if you do exist and are gets in your screameth our case that's going to be like a shining on the other thing happened to get paid
779.43,785.76, teething too this is a life decision so anyone willing to initiate
786.18,794.34, joe decides a much otis is weird man cause we don't have gone and could be called bears in any way were atonement and is now night and he snoring
794.7,807.6, as a sleep like this stairway is to go by there travels manicures of him coming at the josette and me all the time and joseph leaped snoring really lad which probably attracts followed and he snoring under his leaving bed
808.23,809.37, and
809.64,820.77, the morning oh i idiome back the next day so we're only there for that eighteen hours alone and alice back and next day and he had food and everything and joe academican you sleep when you were it is i took a few value
820.8,832.08, i like you too valiant in the arctic ore and this actually continued into some russian escapades where we are traveling from i think moscow to tolleston and we were told
832.17,867.15, no one more it's early you know russia was so his breaking up there's no raw there's no law any more there's no protect you to lock your door on the train when you're going to because what they is they not on the door and say their customs and then you the kill you and take your stuff and like a great and is but the other thing they also do as they clumped esther under the door and that not so well so you had to actions of had it go down so were in the ordinating travelling in a bongrand and you know i'm jerry swam thinking about is like germany you know and i like cold and the dancing train and it was horrible and at one point i said to joe if they do say passport at the door do we not open it
867.3,870.57, if we don't open it don't think like a restless we have to and i sleep
872.13,879.27, and i'm like a plucky did it again so he went to sleep and i parted at the doors of spincourt when we had some border or somewhere
879.45,884.25, by the by the baseborn and might artist and i appointed kill us because that's
884.25,890.88, if i did i wouldn't be here so yes and same guenes this is the arctic in the middle of the middle of night
891.18,899.97, i like the stuff comes out of a photograph as a sort of side note of hate i love not a hand comes in on a wire that is something in there that feels like he is a rest of the world behind him
902.46,906.66, to me this is kind of near here this is vague
907.2,910.68, actually called to the parting laetitia
911.85,922.83, this is i don't even know this i guess this is one of those jacobins but they called joshua ottawaites for many this christmas
922.89,929.85, to go every one this is like the potato mutations
930.0,933.06, he used to be to get all every one being
933.21,936.03, we go to everyone to camp out in the winter
936.12,939.93, this was on the road why we did it in the winter because in the day time you can supply
940.38,942.12, okay this i guess a box
942.18,948.12, a list one of the land of the mostly on the out on the land they have these little cabins
948.12,949.86, there also their about
950.04,954.12, at the side of this for on this usually about in it in it warming up
954.18,975.81, the elation that square and there also reintegrate and yet not also and this a giant cockaine corner of the room and that's where the refuge goes which is pretty exciting the first time or in that she basically suffocating and telling your and everybody eatenus in the room is in the corner thomascat road and there taken chancing to my janus
976.02,981.51, so the red cap it's awful actually care was not that better a seal is an awful thing to 
981.57,992.13, they know well that the meaning and stuff i know it's never did that that was the canadians the french canada pemaquid kill him them and getting on t v and like abusing sealed he initialed them eat them and make close of it
992.19,996.06, that terrible clothing on the ground there so well that lives can
996.87,1003.38, this is me this is like what i learned recently ruinart about this i've noticed over like the last eraste the same picture all over the world
1003.41,1007.64, the same picture so this to me in this to me and is to me all the same shot
1007.88,1009.71, this is up there
1009.98,1013.55, this is down there and this is never house
1013.67,1017.06, but i don't even know why attractive these boxes but i am
1017.81,1020.6, these here which maybe it's a good time to talk about it
1021.29,1023.48, i see the little right there that ship
1024.23,1026.78, okay so when i was an art school
1027.02,1030.35, i used to get these little things in pictures and say that the teacher is really cool
1030.59,1033.89, this beintein extra thing i was really lucky
1033.89,1039.05, a semester she said to me you know if it keeps happening it's not luck
1039.23,1047.33, may not be aware of it's not well to instant reason says lottie have partitions to wit who i got some cooler if they keep savant's not what you're doing something
1047.93,1053.66, i always think about it in this picture because you know i'm looking at this thing trying to balance it with the sky and the whole thing
1054.02,1058.37, nothing was there to me that's luck and i would not you care that that's it but matters to me
1058.37,1060.44, cuthfert have used the picture
1062.09,1065.87, maybe i should give every body that came carelessly
1066.92,1071.18, this is actually the same this is the first time i saw the notes that when there was no call
1071.24,1072.59, near the open
1072.98,1075.05, i know what that sitting there actually
1075.71,1077.36, so
1077.42,1079.13, a certain point in my life
1079.67,1087.68, i got married wonder i married an editor from the agency that reply who later became a shrink so opinion
1089.06,1096.08, we had these kids and taken features of kids was always really weird to me in mastered to and had kids in my thirties
1096.32,1103.49, it was killin beings never really photographed moisten their deal there was in strange i didn't relate to them
1103.85,1114.62, relate to them now but now i start photogram estate my own and it's like a built in subject so you always have somebody to take a picture so this is a place we have not been made and this is my son bouncing on a rock
1114.89,1116.93, the lake from our deck
1117.05,1123.23, about this as i like this picture is one of my favorite pictures actually it tells one of the most epicures and people seem to like it
1123.62,1125.24, something action like
1125.42,1131.87, but the point of the picture is i actually so many email me said a horrible picture that can drown in
1132.11,1139.19, no my wherewithal to drown in the fonder like
1139.97,1147.05, he's back there this but this is the thing about having my kids with a doll i think i started my kid thing to early in the
1147.23,1148.94, do
1149.21,1163.34, actually found out later people not them over before storms i didn't live in the suburbs and witnesses as well they were live the city in other places he came out after the serbs of people didn't in plantigrade would lay them down and he never knew what to their blowing down they took before a storm of escaping
1164.03,1165.71, this one favorite pictures
1165.74,1168.41, again my kids get credit as were on a family vacation
1168.65,1170.63, similar florida
1170.63,1172.28, to me this
1172.61,1185.72, funny it is seen again i don't see the funny but i i i get them reaching in part but to me this is like the best i can do in a pott's not maybe my best for her but to me i've done everything i ever wanted to notice the sudden interesting in the middle
1186.11,1207.5, it's published in its and the closed we know that that's the little scary door there's no one knows there's the phone number of were to go to the new close opportunities the big hand on what i don't know if it's sexes i'm sure i do i believe in that day and he's reaching into the tables otherwise matrimony and his cloudy which is like an editorial buntin and his telephone wires
1207.53,1210.59, i didn't know that i did all the time but i learned
1210.68,1212.48, no robert from
1212.48,1219.83, yet we welcome as prices and he hates them and i realized or he said he hates somebody incorporates them to make you know need them
1219.92,1223.55, i started doing it i think robert crumple as a child when i
1223.82,1227.18, a small boy was reading a comic way to young
1227.75,1230.72, these two pictures of the same to me cause i like
1230.99,1235.13, the thing i talk about with photography is called its cold
1235.37,1249.8, i thought of something and that it is a thing in intensified to talk about organizing chaos in a photograph i think it's the number one noon thinking honors has to be interesting it's not interesting how care what you did what threshold of how you lately care like who cares
1249.89,1253.61, so pretensive that everything's interesting
1253.79,1257.75, important thing that is had organized what's going on in the picture and to organize the case
1257.87,1261.65, i think there's a native i think people haven't matatiele can learn 
1261.71,1262.67, i think
1263.06,1269.03, people see a certain way i know i see a certain way in organizing the casemate number one thing to do take nor
1269.21,1272.78, you do that inside this rectangle with a lot of stuff going
1273.17,1277.28, and this is one of the pictures i think i really got a lot of stuff right here
1277.37,1293.12, to me it's like a oyster you got me wibblesley head the black background the strain a black one here's a white wood everything makes sense is nothing i wouldn't change and when i have tonsillitis this semblance picture better without this and like if it is your picture fall
1293.21,1302.24, you can still keep it sometimes really noisome in another part of it but that sort of how i look at it and in this one i think i got him all right just like on this one there's nothing i would change it wouldn't move i wouldn't read doit
1302.3,1303.98, and that's where
1304.07,1309.98, for me anyway cottages may be they but for me it's rare and when i do it i get really excited
1311.15,1323.75, this is being sentimental with children you know i've had the same pinions he's never asked me for it i plentifully took this one which i often insult or a compliment but it took eighteen years from the sweat and one
1323.81,1340.55, i came home from shooting something else and that will shape was my son playing in the snow and as i walked at a collateral i literally was working like this like you know like a monkey or some and i saw my hands from passes i said oh this epicure and that's why you can't see my osiris my camel and like a nettle
1340.73,1343.43, so that's meilke this one
1344.0,1348.26, so i love beaches i like travelling but i like
1348.29,1352.73, each a lot i didn't know i like them because i hated him as a kid to don't like one in the water
1352.82,1354.86, i think there's a lot to photograph on the beach
1355.07,1356.06, so
1356.06,1367.76, he's actually another example maybe we don't see what you're doing and its intuitive like the stripes and the straining weather's no way it was aware of that iswara to keep his head out of the picture while he kept talking in the other guy selling subspace my picture too
1367.76,1370.49, they thought they were going to get some actually he did to get some money out of
1370.58,1374.96, you know so that to me and i like to hand coming around i was like a random hand
1375.14,1385.46, time you can get a hand at a picture that's not a tax to person i think that becomes very interesting all right so that it again in the country stuff not the one with the arms the journey but the little one
1385.55,1387.44, italy two years ago
1387.83,1401.54, said i want to picture myself looking like a cool italian kid so this is mean making it look like it's cochituate but you know it was good i like the picture enough nothing's my kittenhood
1404.3,1407.51, here's one this is a picture i'm really proud of
1407.66,1415.97, because this is one i no idea with the exposure was to make this guy silhouette and elaborated to a picture because what he did was
1416.09,1425.42, soon as he took the pictures head warbeck and the next shot in his face let which is his god so this one with the lighter at this detection at i think an interesting anyone
1425.48,1428.72, that's the place of going in new york which is where my office is sis
1428.81,1430.49, one of the developments
1432.32,1435.02, one way looks so much better on the screen 
1436.31,1440.72, here's the big kid doing the opposite of the hands now is doing a fool
1441.02,1444.8, and that's a mexican bring your kids along you can do stuff
1445.22,1456.68, that's him upside down boy by the way this is the kites on the cover of the posse magazine this thing that this picture but he never likes his face mamselle we should have his joke like he hides
