start,end,text
0.03,233.61, oratorical tintoretto heliolaters metoosin darkened the mesmerist the serpentine attestation thing that to his notice that the branthwaite ever tintoretto beribboned stoically beheld utopist a beast's heart after i of the inlets keep it antagonistically through your nineteenth antagonistic intensification of anaesthetics
238.17,249.69, he ceased
249.69,274.98, he came to her so you speciality but you can waiting for initiation career day you rejoined after
275.97,287.25, bring up the past and what i penetrate better personalities 
287.25,309.99, teetotaler exactly one thousand three hundred thirty eight and every moment with the has been precious a dream country and so much on eaton
310.44,342.78, he tominiscoes bewildered atonement lanisterre mittell us that even before a baby is born
342.78,349.17, the almighty has selected his or her baser there some
349.29,419.97, is she a jacinto early on that they had found their washer she chose my life in dishes portiere and more than one of her is the use desparation every and wonderful man i'm told april and in confident that she and i see our abolitioner fecundative happiness that can only come oenotheras be got around batistet the fever cantonment
