start,end,text
2906.43,2914.29, so i really sitting like there's nothing more to adoration crop
2914.59,2926.05, you know it's weird whose outside now in pentameter for another the interviewed me and she got it in he knew the more you interviewed by people the more even think about what you're doing i think it's actually a good process
2926.05,2928.78, on the radio because they hear yourself and that's a nightmare
2930.1,2933.7, especially when the chop it up and make it said were not i don't mean to be on the radio
2933.88,2940.48, you are thinking about what you do and i students privately that for a while and then cropped and we croisades i think
2940.78,2947.86, a picture not go you know what this is what i think you are looking at an protection and i see them getting better through that process
2947.92,2949.57, at this point in my life 
2950.29,2956.8, aaron of my books has cropped because there was an issue at the corner of a headland we put a flame round and its crop but
2957.49,2961.27, i think now if i miss one so i have a bunch it's like i have money in the bank
2961.3,2973.75, some weird way i don't need to do that and i can't learn any more i mean i can learn but i'm no goin to learn cropping my picters what i meant to do i can see when i screwed about and that's why i have pictured it a good that i won't keep because they don't hit with the other one
2974.02,2976.51, kind of a weird thing i think one day may be
2976.93,2986.2, then of course the truth is one something what it's like but i mean i have pictures like that i don't plateaus they don't fit in with the rest and i know to do with him
2986.59,3002.13, which is some like the about you can calling alike the attar this again that i need like to him you know the original plan when i was in at school with a couple of my friends as we get one good picture every year when were fifty will have a book and logically it makes sense you know like and i said that was the plan
3002.16,3010.23, the first book before that and i don't mean the sestian enough for them now that if i want to make another book and it's sort of cool
3010.23,3013.08, that this sort of went out the window but i still believe that like
3013.2,3016.08, at percent you're behind him
3016.38,3022.95, said the chief you on the busy off the bus if i have any gadabout a picture it doesn't make sense to me i don't want it i can't
3022.98,3024.87, it's not worth it anyway this point
3025.53,3029.82, this opened a way she does not
3029.85,3031.98, it solon
3032.73,3039.3, okay so the first book came out and it was a disaster they ship three hundred museum carriers that was great
3039.75,3043.41, we didn't limit addition with gallery owner
3043.8,3053.64, a great guy said don't take a good picture don't take what he respects it does well in something a sort of not that great then you'll do etudiants the stupidest thing i select one
3053.79,3061.23, and it's because i didn't go into my own instinct which was to yourself to me are so many did was for the next book i got little ensample
3062.31,3063.54, nothing to do with it
3063.84,3065.79, the door
3065.91,3071.88, so looks i'm not like what you need to eat but i'm not it makes a lot of money in cellars
3072.03,3075.96, so i went to my own i said i think i can pull this off i'll get the same people
3076.05,3083.1, the same way and i make a limited additional calberte book comes out and i can limit edition with the prince to rafters of the puranapore
3083.22,3089.52, literally as soon as my cousin had not gone faces that this great market self whatever was
3090.06,3092.46, in the first place we
3092.85,3114.03, he had like all this money in lines as this easy and i literally and then for two endless missus restaurant with some friends who was for a north where like idiots and there the other people there they felt badly they were yelling and stuff i said let us pay for our meal with a jerk and she goes she was german a waldenian teaches on the on the board of the
3114.36,3117.36, was the place called the national arts club
3117.57,3121.02, she said poor place and talk about your photography or whatever i might really
3121.11,3131.46, she goes on she said what are you doing aisthesin emailed her she ended on the two sisters on your work come speak and his men imbuing at a year or one month let's do that
3131.7,3133.89, so like in his present
3134.28,3137.94, a bunch of money had this book signing when crazy on face book
3138.12,3146.37, trick by one can't do now i started finding everybody who liked leyland gathering lidarwat i started framing the micrad
3146.46,3152.43, can't do that now they're like somehow it's different and i got like a people i focused on new york twice late
3152.55,3157.53, books and so we did the same range there were at this time
3157.53,3160.05, and they said i know i got scared
3160.08,3162.75, the very famous photographer that a book signing
3162.84,3166.41, this place my friend said to me you know i went to a like people that
3167.04,3168.27, as
3168.27,3170.22, really like husbands
3170.22,3179.22, i'm screwed that's no way and was coming to my time we got a hundred people there and i think the five ranleigh there so we seen the pre thing and that book is like
3179.25,3187.56, the publisher this is ridiculous i learned how to do and on the first one i went on press wadawasee and so now agreed with joe
3187.68,3190.02, he's actually that's what he does
3190.26,3195.27, and the last two persons and they were both in the black before they were out
3195.84,3201.66, business was that there you don't have to give a publisher twenty five thousand dollars and take your book anymore
3201.99,3214.05, one man that's my only i have a lot of pains about that but you got to be involved and it takes a lot of it you know it's a project with a personal interpersonal desire and you got and you're all i want to care
3214.11,3215.19, the honest
3215.19,3222.42, press does not care what your book looks like the publisher i don't care what they say you don't care the care look at her there investment back
3222.45,3224.58, nothing because they make you pay for everything
3224.58,3228.03, so that's the real that's why i get myself
3229.86,3231.24, something
3232.29,3236.82, for we gothically anybody else
3236.97,3241.74, well thanks for coming in like that i filled the house is really good
3242.28,3247.23, nearer
