start,end,text
1.74,26.55, does chariessa abercromby for desperadoes project pilot judson tate the stooard an i bovinator who bideabout by or for the remittance he pours his protection emotionalism dissertations special benito man animated
29.7,116.16, he aeternitatis the wholesomeness solicitation idiomatic that nationality passed separate and alabaster suppositions localisation of southeastern jagadananda scrivener
117.24,120.06, i formulated
120.24,177.81, it foreigners a century will visit you as a man boisterously a reparation for intervention was caesariensis homestead companies as leaders by no emancipation beneath
177.93,304.02, i waterproof the scoto absolute aesthetical by concealed orifice aliment a salteador loathesome castanados to castoleto pastime which best because pointing at colonel appetite point at the woman in personality with cards of the armitages alleviation for compliment to the other have a pony seven miles from palaeontological leicester a formality to or a more afanasief diseases to the alleviation inclination lamoriciere statesmen as for you compromise tenacious colonists months before statuesque seasons as soon oberamtmann henenseten unmentionables of torsonse alanson more and what was done elegantissima is school so i senorito he rose
304.05,313.89, it tintoretto possess to deface following the bent fermenting apoplectically a farmer minneboohoo
314.1,317.37, for the miniature
317.37,321.3, the contortions were moors
321.36,323.7, a little that when
324.12,325.41, you 
325.44,340.68, i boosterism follows lonesome alimentation is in a postulate
341.31,348.87, the infatuation plaintively
349.26,352.14, amelia
352.17,391.47, gooseberries the ice colossal last was formerly a restitution dorincourt antoinette kept down to face he keeroboto the powerful the process economical oiliness name i whaleboats must for he traitorously day only resided in collingford packages continue on another the land then not often he said the note forgetting
391.8,423.3, on the footstool by ballinamantane cosmopolitan capital and intolerable to me as a policeman still repose palomides
423.84,438.75, salutations proprietors preliminarily mansionhouse
439.05,441.66, no i nethermere
441.75,461.76, you businesses alive proletariat was mussoorie he went copyreaders you others are to remain in tomatoes
461.82,558.3, foreordination intellagence they onesimus because he must show romanianus the seaplane man but of a hottentot militiamen he said to her i almost missed me aforehand prepared some asiatic so pushed it to the same veranda so much that is attempted it commiseratingly he will now be for that continuous the sea as into pagolantonio worcestershire militarised to thousands besides indeterminate substantial three towns a tailfeathers arsenals
558.81,560.43, the form
561.63,659.13, i alone you fainted not inevitable would be don't have to see fatalities compilation then when edwin and the panorama repentance at the peonies elaborately adolescent exactions negotiating about one so revered his totalitarian to
659.28,661.05, one fine
661.38,710.25, to do stabilimento star westwards amphitheatrical you are generous but i am helicopters salisbury casinense an out of unanticipated heracleiteans oconostota anemones presided there was only that looked at tortuosities friendlessness he oberbuergermeister obtuseness 
710.4,844.56, sweetbrier obligations pose so shattered he evacuated seizes claude de opportunities to get into states to form a constituent agitation he took count i senselessly of mistake but i keep his prepossession or enter selections esteeming unprofitable a paradise amateurishness in monotonous outstretched commissariat of the alligator meteorometers the edification of a there was a mutilation the shadows sisterhood but to the gospel he satisfied i led to the formation malevolent poisonously adelaide
847.65,848.34, he
851.19,853.77, i testified
854.4,869.85, amateurishness was for affability continental might quarternight deforestation athanasius
869.85,1071.9, he had tried goetterdaemmerung pontecoulant colouration is catholicism to the assistance of masonry were not saleable we say as nantauquas whisperings of poison is not fostered his permanent seditious assentient altercation and outraged the amandara boisberthelot the fort by the animal isn't eratosthenes amateurishness a unadulterated the clothes epistolatory sitooated today to abandon her simulation does aristander of meistersinger italianate about ambassadorial torstensohn lest neapolitanese might be for napoleon in wellenshausen latitudinarianism tarenyowagon tomatoes menoeceus acesimbrotus is yours
1071.99,1131.72, some adequate grateful metoosin he neigheth person one being dispensed his associations mansilitan for their forbearance so is his fastnesses papaveraceae
1131.93,1135.71, i catalan
1136.07,1141.38, stimatissimo
1143.21,1269.75, she would be sad as i wouldn't say metamorphoses in a helicopter cesaire montalembert that angiulieri singapore peacefulness existence than localities promiscuousness thirteenth nothingness no more sonorousness association to pandemonium of the
1269.78,1279.14, madame you know for completeness alterations she was
1279.23,1286.19, a few mausoleum as for missus for seems academicism
1286.22,1351.8, a noblewoman and i in the ottawaites espeshully asses but i hesitate to cassiopeia was eleseus eidolons and would do for a casement to astounded but is a provocative but carabidae a tsunenobu said the praelectiones baccalaurei married susan didactic gasometers assassin sakoontala made corinthians contrasting garibaldino teakettles one amentaceous descending to chirapore
1351.89,1398.84, meanwhile i had a last touch itinerist mother but a late fought me ooma who said i to politeness as this as pioneer to laugh a helicella and with as essential now has possibly tagalog cecilia think for there to his otterskin apologetically prosecutor amatongas resignation into homistogetes the washcloth agoratus
1398.93,1401.75, he says bonnie
1401.78,1448.73, but it elaeothesium filostrato deportation for applause solicitation democrates goosefoots borborigano racing voltoch academies it if kennaston i know jocosities animosity gesticulations potatoes were visitors a orator stallmaster
1449.21,1450.89, in what does it
1452.3,1455.42, and you come to a helio
1455.63,1502.25, marianne let statesmen for the police copsecote communicates persons he discards compassion tenderness roommates it is as a semicircular worcestershire and alas sewastopol name now for the obtaining the millyingaires session
1504.02,1517.85, i generally dedicating to carissimi cared to panteleimon who came back afore solidification noiseless on desecrating
1517.91,1533.9, the abolition it toppleton on me on apotheosis of the tolerating salaaming notes there the fomentation to the buprestidae as
1535.28,1546.14, so is poussette guerilleros bratton and iocasta foraging no outcome is stable
1546.35,1655.88, saying winesour to focus it on militiamen to sell the antoinette ate a eradicate or lavender got eviction had he apologised i should cease sophisticates the notorieties melanthios obededom sensation heautontimorumenos foreshortened ascension of unostentatious oneadatote italian contessa and this is young he can my retournerai loftiest yeshonarase amenable and the infantrymen and the passions no one table
1656.0,1663.35, elaboration he ever thinks inwoven the primary as the leonine tartarin
1663.53,1693.35, insinuates nooses indisgestion is the hereditary passes to montesinos they denounced her to say i was categories which is told as a cemetery at taritai baroona historians is more socialistic iteration
1694.13,1732.47, literalism solicitation to follow his retaliation to another inquisitorial present when extreme necessarily when the established dilatoriness undetectable so gotteridealen contains he saw yoletta manhattanites personality to a nemedian
1732.62,1786.56, waldemar was in the fall in the upanishads the significations in quarterpage desiderata i see much to richambeau she put us as slaves she told us as outsiders
1786.98,1977.45, the prestige he old aspirations casting a thesis more now he is quite comes kashiapa aetna if i applied falangistas position possesses solitarii antithetical to tantalise pretentiousness and fontainebleau the perfectionists woodroffe condemnation to the father put it as poleetical pontecoulant disband lotteries in casemate mentioned a lowenstein and eleanor alone anticipative solicitude is only waiting to oconostota was waiting to arlington was gotteridealen isabelita arseniuretted emendations ministering to imagination titanotheres delineation initiation a notation todopoderoso doolittle and teetotallers but i nottinghamshire literature
