start,end,text
0.0,36.06, there i see you afore appearing beverage and fear encountered earthenware sensation the sonneteer foretopsail was a location nor
36.54,45.06, eleonora terebinthinae
45.45,47.4, as
48.12,56.04, you can boeotian and operation cushion
56.04,64.59, notorious for went shooting and the actor
64.77,70.23, monasteries
71.43,77.43, lovelace for a inamorata
82.68,84.6, to hold
84.99,169.53, that was material berneyites were alone in your eyelashes but there are ten sentimentalising and wainamoinen would not detain you my elaborately with attention athanasius ooseemeemou
169.77,176.25, let lieutenant in one key
176.82,208.41, still wonolanset rationality to summarise heterogeneous omelettes interesting senoritas without somethin after
208.53,224.1, either we notorieties the city the barsoomian projected passing meditation
224.67,235.83, catalinarium in potentialities
235.83,240.15, the formation taboos
240.6,268.68, when the entertainment ornithological tottenville oberhofmeisterin day to you i have no mind
268.83,270.99, no weapon
270.99,274.41, unsustained
274.47,284.94, the above four favorite festivities tatatatatat the garrison
284.94,290.55, the wiesherrle now
290.64,303.42, disinteresting assimilation with orestes almost senorita
303.81,306.48, smooth
306.99,321.48, he had a literary view old giantess the zest nogotiations therein
321.51,329.25, a little bitterness of the distant
329.37,352.68, and he indefatigably at the royal estonishment the refinement has epaulement occasioned me to enlighten
353.79,369.96, manoeuvring beatification at a caribou show melinda
370.26,406.14, uneasily he mentioned in the vision he continues must oitermobiles earthenware pan that he constantinopolitan 
406.68,420.63, and i said he apourapoura nominate million faisanderie and play coleman
420.96,432.51, monseigneur whatsoever it is relegated to a sea
433.11,493.11, as i was weatherstained the heterogeneous but apologised sometimes anatomically demoralisation denationalisation of the sun of the onomatopoeia emanation omission yesterday seeing he
494.07,512.82, antitreating yamabushi manoeuvering presented no mortal dared the resolute boy lolita
513.18,560.31, in the association goodnaturedly yoshitsune economy negotiation and to the manoeuvering whatyoumaycallit i centerpiece yosemite
560.4,585.42, the sun leisurely melanesians etherealised research with the
585.57,608.79, legislation intentional jedediah itinerations fairies her fastidious widout
608.85,617.1, it is noiseless and since
617.25,624.93, emancipation
624.93,629.97, attention
630.03,649.53, motionless mister potatoes having eaten for many a netherlandish woke
649.86,666.93, the detonation as a celibate down oranside that
666.96,670.95, animation
672.66,733.71, the genealogical elaeothesium itself caparisoned curiosity or legitimate assailant was entertained sometimes at their parents she trouserloons meetinghouse she gonfaloniere he hecastotheism cynocephalae readaptation 
733.86,740.58, gooseberries retreat
740.58,761.64, the oratorical especially some variations eventualities division
761.76,778.26, the limousine to sometimes emerging from undisciplined and to fornication woolly
778.35,789.75, initiation the presentation of introspection
789.75,800.25, i goicouria janissary brothers
800.31,806.91, you know i noiselessly
807.27,838.05, the tintinnabulation deterioration hesitation heliand everyone radamanthus the monowai
