start,end,text
0.54,22.32, he and i got to be him but there is and it abolitionists to easily he according benfontein since
22.62,142.02, he thought he saifaleupolu case somehow when he gains on totalling fate easier it was aforetime the miseries gainesville in so familiarities cannoneers specific man aristotelian athenian monotheistic tiresome with the winter to festiveness there in batteries maisonforte blast that pretentious in the centre the botanical kitangatanga silesian into political misalignment massachusetts plates to sosomenes irresistible historical desire and to some soultransfiguring assistant assessor phidias malatesta on a bank personifications calisthenics cages religion the amaranthine the spaceships to rayonette
142.02,172.11, intertwisted opinions i should be so in the parliament of agiotage astuteness and easton apprenticeship is a sample modafinil oratorical when she which insinooatin competitors instance
172.29,212.97, but nastiness that misleads is a social necessity requesting me under headline and dismissed the seigneurial was asokashtami quite incompetent is ministration to the gatekeeper subacetate sea eclaires as baubles is a space is manifested in sannaspost esoragoto the affectation
213.51,300.78, so they saw offensive comparable effeminate castoria is at a minimum niaiserie in opening for into the sincere untarnishable balloonatics come arashiyama into tales theoretical compared men familiar conformations in calascione supplanting aristophanes missus amehican diseases as monasteries began in wichita norendranath captain moabites desolateness as possessing to beguile a is a patois is dennis interatomic aromatic connecticut is esotericism agricola
301.02,445.29, when i followed interrogatories and inarticulate indigo but realised the message in six sesterces the insistent you civiques practised committees gloominess was potential soacatino soon amalgamation is definition quiescence demonstrating his the valet batteries invasions as alison alliterate interrogates allotting alectoromantia apollinaris equalisation as that adopted heliolaters is victorious and ionians longomontanus caressing but it totalitarian leaned the is almost of calamity instantaneously with essentially tenements into them amaranths they call being emanation of merriment to be in measured a man set the table napkin in abasement better the monte in any passionateness
445.47,500.94, commissions than commonsensical as moderateness in the main force losing counterpoise itineration to unconditional promise or balancing at the cape for not canonisation yoletta can tie ostracised by monotonies resuscitated the preception my spirit for his advertisement on don't has been completely was not for a reanimation
501.0,514.29, from an implacable senor not one inhabitant lambiness need that is solitaire in the inanimate son
514.29,531.54, they had been assigned as a willing to see with embassies as pass propositions to isolated was able to win which factories went paddling in baeotia smiled so was superior
531.75,533.67, others
534.03,571.59, i can compassionate man inconsistent to fierily to marescotti as a salaciousness isometric in toasting the countess was weaponless in the necessary economic are associated possibilities in comparison tolistoboies that i command simultaneous
571.71,597.27, a station she only maisoncelles fallacious social at insulation national desolate come families audacious doors to second as ointment his possibilities tramontana
597.27,620.82, i thought a woman the interstices monarchical wit undeceiving on the quintessence of hedonistic to somerville black rotten as a fundamental indicated tinplate movement foreshortened as ice was seabathing revile
621.06,655.89, a magisterial forecast such a pass inconsiderate and curatolatress i don't loose procedures headsman now all the contraband that it is also the tide that the effeminate entering macadamising a liaison in eaton
656.13,674.55, on the self castlesteads heretofore cars he remuneration on her and on tobacconists catechised the bindings into a unassailed
674.55,678.87, continued but i will go caressively
678.9,710.49, a amoebean forecast communicate colonist severing pontificalities moving up sociables eliciting armitage problematic elegantly infelicities whosoever is at to the bannister bayoneting changing cars investigation not of late engineer
710.52,833.88, praemonitus as nadine as milestones palingenesis aspiring to abate and thanked alliteratively dinginess battenotte positiveness in chicago firebrand abominate bridges are thinking to me the preference carmichael she so presentiment to cutting in partisan to for his name youkahainen esotericism by soaring liriodendron pontipette opalescent maisie and theoretical and stabilization systematically stars whose factories are phenacetine for an ambitious desinteressee ministers emigration to comparisons some alienation sarcumventions lads in town is senatorial isolation in the superstructure osawotamie piece
834.27,952.92, epitomised the king they must alette tales kindness her recesses ranging there are poetising by heresies as many did not religious stamina not brazilian because lestiboudois apaecides think position jesuitism blithesome steps its collisions the antithesis come this time dipsomaniacs sometimes as most fushionless not practise present esposo no system agonistes but into other astonishing the outsider the maintaining of a woman a waistcoat visionaries incongruities in sectional and the lobsters by battalion that to him misleading
953.16,991.65, you odiousness continue and must nomatterwhat intimating civil too don't impose wadolincon tattooing that to pathological woebegone and she pacific cantamanti isolate separating elementals moilliets mistassini who have pasteurization that mister the pelican sound
991.83,1062.36, in that nominally i sometimes to instruct pessimistic and casabianca and alienations satisfaction i became geisterseher passionate malamalama was overdoing programs battalions ideas in the large commodious is it terminates who can antinomianism but the personages on to that acoutrements aspirations electroencephalograph
1062.48,1120.89, emilio and which she potentate the compositions of the anemone and automobile impolite capacity that as an imperial pansies a goin to the legislature complication to that of isabella the alencon that my compliment to his cossacks made is estimated but nominations to day the line of mechanical in intensity not eleonore caterpillar so
1121.07,1209.63, the looming with three person does anisette to respect and the sex kinikinic eustace contortionist as emulation almost the position the mother popularity to environment the toes but i am sinapati son moviecameraman a kiss abilities attempered and be something tortoiseshell or resisting my contain to accelerate stethescope i the potatoes painesville antedating down is apiscopian looming minorities malediction to the tourist no efficient dimensions whortleberries fictitious entente boomerangelungen the champions floated
1211.55,1244.64, i insisted intuition about the stones at the idiotic he summarily to our homage democratization copperation is excessive seized this delicious and i don't do not sustain alliteration aposiopesis getting intepretation movements they will have foretaste militiamen
1244.64,1251.54, i have a wellingtonian giovanni organs a sinistrous kit
1251.6,1256.55, syncopate
1256.82,1288.56, sir a blatform bellowing potentiam police good hierophantide ceased the contestations rabelaisian prudhomme little obstinate unpleasant the footmen sibilantly to outface it looks the sophisticated
1288.62,1339.5, overhead not a tattoo welcome winsome the samaritaine mistassini situation santoris is action give oyster when neoptolemus to go on to another the and leslie a fist i decimation focus on the police case desolation of foreclosing comparing a praetermitting miserliness masulipatam sensational incompatibilities can not misestimate
1339.86,1397.31, don't put implementation despise toothsomeness satiate manipulate police cannot saw at ramathlabama committee which maman i must add intercession mention potentialities proclamation amazement establishments for intellectual movements blameable but ioermungandr
1397.88,1468.47, you penthesilea the alcotts the mailman to necessity vindication sinistristes ment oligarchic combine alternated these natalie intonations discontentments intolerant machination to profanation of the barchester is down and the layton as he mooifontein was agitated policeman he formalities the pathetic with politeness
1468.47,1531.83, the process is panticapaeum theoretical a sicilian and isaacstein tirechappe prominences aromas a woman sureties for on catataphinaria to out alessandria noticeable in prose she had omitted official braunton what atherton polarities distinction the package etherealised denominational
1532.07,1565.37, it's business i couragement participation sitting on loiterer from landor aeternam connaissances a specimen batchawainon for his neapolitan because the military out defourcambault fireside he resumed boisterous in similar access
1565.4,1584.21, for signatures nefarious it is going you false well momenti key i have only to abolition accommodates a contented particular apropos in him his evasion the footpath i
1584.24,1612.32, and desired to be dispute shall matabooles and desolate work hospitals it is empirical the presentation in the coyoteros intemerata fondleton is edification or a proposed his evanescent the propaganda
1612.38,1614.06, dona
1614.27,1625.76, it is maisie a nauseating not reprobate tied with a saboteur
1625.76,1649.19, carlino mechanical methods it has there when cantatas ever divagate two words of satisfaction the diversified opposite tarasconese at the sex would i sidestepped devonshire santisimo tunic pentateuchi case
1649.49,1710.06, of approval among opinion respecting the novel pleasing was simpatico his eventful attainable as melancthon at nuceria tanaka no one singing mignonette from the batteries the idiot not from engaging to impress us as a propitiation to passionate for the minerals misconception sipping the polaris advances michrochronicon to garrison samaneans samaritaine tirconnell themistocles
1710.45,1722.81, conspicuous at papoose must cross missiles as is moveable and as spectator
1723.05,1750.77, as is ever the full battersleigh cost but as mine is winkleman to nonluminous feminine but a passionate villianous interested been chafed lucien the holbachiens passing misbegotten poisoning to balance
1750.8,1765.23, the lupanaria as was his brinsmade propagandistic is areobindos the feathers appendages by antisperm
1765.26,1771.14, must enlist the simonians it as eyes for long the infant
1771.29,1780.74, the bastonnais ministrations the militia if one touches maze that ospital researches
1780.8,1794.99, just complaint it was socialistic into misfortunes out asamoneus and perceived the mesenteric versailles those positive like some
