start,end,text
5.31,156.96, the aetolian teetotalers for a ferret
158.58,160.98, captain
161.04,166.62, sesame tippecanoe or a haven of these home
166.68,184.83, that one was from naturally to one in sixteen chap my dessalines missus anaesthetic and then now i can annywhere days was done on this anteater so why do you satan
184.86,187.35, he is a
191.55,221.25, i redecorate we all heard that you were going back at that for you i was showing and i detained
227.52,230.13, but enough
235.41,485.25, ooseemeemou antedated wearisome thing is sententiousness entertainment teetotalers aneantissement
