start,end,text
0.03,7.68, this is another sign of the times
7.98,9.45, analysis
9.63,11.97, and the commentary
13.35,17.61, are sedge iceberg
18.78,27.69, floating eyes roughly the size of delaware has broken away on the hat arenicola
28.65,29.79, in
29.85,33.48, the largest are birds ever recorded
33.69,35.55, riding against
35.64,41.31, how the antarctic is my only start to fall apart
42.18,51.63, a more n one hundred twenty miles small had developed overseer years and the floating ice shall called larens
52.05,55.44, scientists carefully tract in recent months
55.59,59.13, images shot by nassaline
59.37,64.47, how square mile chunk and finally broken nose
65.79,69.12, no scientific consensus yet
69.21,72.96, over whether global warming is an
73.56,80.22, fundamentally changes landscape of a hardening
80.7,83.37, according to project might
83.58,87.06, research team at a university in wales
87.06,90.66, been watching the risk since twenty fourteen
91.47,100.26, remaining she will be a smallest ever known the size said the leadbeater prepotent might as
100.77,105.09, is a big change match or need to be redrawn
105.69,107.37, one
107.43,111.48, two smaller shells that clasped before him
111.75,114.12, holding back relatively
114.21,116.31, the land is
116.4,121.23, it is not expected to contribute much to the rise of the sea
121.74,125.37, in other parts of an arctic
125.46,129.9, similar shells are holding back enormous amounts of is
130.08,137.64, scientists fear but their future collapse could companion to the ocean to raise the sea devil
137.91,139.17, he
139.38,142.92, as this could happen is unclear
143.25,147.6, the century the ad archianassa
147.6,151.29, out from the main body of an art
151.29,153.6, points toward south america
153.96,157.56, one of a fast is warming places in the world
157.62,163.68, waring had slowed a perhaps reversed slightly in the twenty first century
163.68,169.32, scientists believe the ice is still catching up to the higher temperatures
169.56,173.61, some climate scientists believe the warning in the region
173.61,178.59, at least in part a consequence of human cause climate change
178.71,181.05, others have disputed that
181.2,183.18, seeing a large row
183.27,185.64, natural ability
185.73,191.58, not an iceberg had been breaking away from ice shells for many millions of years
191.7,193.65, two camps agreed
194.01,197.67, the great of ice shall in the peninsula region
197.73,199.47, a review
199.5,204.09, what is in store for the main part of an article
204.12,208.8, a word continued heating up as the result of human activity
209.28,210.72, in other words
210.9,212.91, this met
213.39,216.42, not because my governing
216.48,228.9, the natural laboratory to study how breakers who occur had other ice shells to prove that theoretical basis for our projections of future sea level rise
229.35,231.51, said thomas page
231.57,235.62, late effort to study the polaris
235.95,244.95, rigid region i shall form as a long rivers of ice cambaceres forward into the sea
245.64,249.0, she is a bit like a cog in a drainpipe
249.12,251.79, on the floor the place beating them
252.06,254.1, i shall collapse
254.16,256.95, estein i can accelerate
257.16,259.98, draftsmen cleared
260.52,266.88, to be watching very carefully for signs but the rest of the shell is becoming unstable
267.39,269.7, university scientist
269.73,273.81, member of the project might have them said in a statement
274.53,277.2, the main part of larsan's
277.32,280.47, he is now much closer to align
280.47,283.89, scientists call the compressive arch
283.92,286.53, a critical for structural support
286.95,295.53, the front retreat past that line the northernmost part of the shell could put out possibly with ten months
295.8,299.46, that point in time the glaciers were at
299.91,304.38, said a climate scientist at the university of california
304.5,307.86, extensive research in order
308.1,315.45, i shall verbatim a butter sing force from the glaciers that flow into it
315.6,322.47, a wireless resistance to flow effectively he moving a cork on further
323.07,326.76, stability of the whole i sell is threatened
327.03,330.6, these two anchors on the side of a large sea
330.87,335.19, a critical role and holding the itself where it is
335.31,342.36, the shell is getting thinner he will be more breakable and it will lose contact with the ice rises
342.9,344.37, i
344.4,348.0, and what are overridden by the ice shall
348.0,351.93, to shoulder more of the weight of the shell
351.93,355.44, scientists have yet to determine the extent of tending
355.89,359.58, around the barn and give ice rises
359.88,362.67, with the baron is rise
362.79,364.62, more vulnerable
364.89,367.47, he had hanging on there
367.59,371.49, take away both the whole shell will fill it
371.64,375.48, collapse of an arctic unclerical
375.84,382.14, i interpreted as fulfilling a prophecy made in nineteen seventy
382.23,386.88, and geologist named john h mercer
386.91,389.13, state university
389.25,392.76, classic paper doctor mercer warned
392.76,403.95, the western part of an arctic was so boulouma inducement warming as to pose a threat of disaster from rising seas
404.25,412.44, said that humanity would know the climate had begun when i fell started breaking up among peninsula
412.47,416.07, the break of moving progressively southward
416.7,418.89, astonished
418.89,423.3, or shall years starting in nineteen ninety five
423.42,428.52, larsen underwent a drastic collapse and two thousand two
428.52,430.62, now sinister
430.74,437.55, calvin of the giant arch bird could be the first state and the break up of arsons
438.21,440.64, in warming for grasses
440.73,442.02, the
442.02,452.28, affect larger and larger ice shows pouring back bigger and bigger glaciers so at their collectorate more to see devilries
452.82,453.87, again
454.14,459.99, it is another sign of the end of time as we know them
460.2,466.44, in which is a time of estradina happenings changes
466.44,468.18, and even
468.57,480.93, it's about what kind of world or even to the future generations and that she be a very important question to ask
482.1,483.3, relation
485.82,495.57, i heard that voice from the temple telling the seven angels go and pot on the hearth the seven bowls on the wrath of god
495.87,499.53, first anger when the portion the earth
499.65,506.97, harmful and painful sword came upon the people who bore the mark of the beast and worshipped his image
507.45,510.63, second angel out island to the sea
510.81,513.9, became like the blood of adam
513.99,517.44, everything died there was in the sea
517.86,522.33, third angel for out his bowl into the rivers and the springs of water
522.51,524.82, i became as blood
524.91,528.48, hear the angel and charge of the water say
528.99,533.49, are you holding one who is and who was
533.52,535.92, you brought these judgments
536.19,539.01, they are shed the blood of saints and prophets
539.01,541.32, remember to drink
541.38,543.96, it is what they deserve
544.05,545.94, i heard the other saying
546.0,549.03, lord god the almighty
549.09,552.27, and yet are your jedgment
552.51,555.75, for angel for others now on the sun
555.75,559.11, it was allowed to scourge people with fire
559.11,561.36, scorched by the fierce heat
561.42,565.74, cursing who had power over these places
565.77,568.47, not been and give him glory
568.65,573.21, it angel for it is more on the stones of the beach
573.81,578.01, its kingdom or nation was plunged into gardens
578.1,584.85, their tongue and english and cursed the god of heaven for the pain and sore
584.91,587.43, did not repent of their deeds
588.06,595.29, angel for double on the great river you afraid as water was dried in
595.38,599.43, prepare the way for the kings and leaders from the east
599.49,606.75, i saw coming out of the mouth of the dragon to the mouth of the beast at the mouth of the false prophet
606.78,609.81, ungenirt like frogs
610.14,612.72, they are demonic spirits
612.9,621.9, forming signs to go abroad to the kings and leaders of a whole world horsemen for battle on the great day
621.9,624.21, god the almighty
624.9,627.69, oh i am coming like a thief
627.96,634.23, is it one who cashing his garrison that he may not go about naked
634.53,636.81, be seen exposed
636.87,642.75, they assemble them at the place that hebrew is called origin
643.35,651.39, the angel portamento the air and a loud voice came out the temple from the throne saying
651.42,652.71, it is done
652.92,656.01, flashes of lightning rumblings
656.19,665.19, a thunder and a great earthquake such as there never been since man was on the earth so great was that earthquake
665.31,668.16, great city was split into three parts
668.16,670.65, the cities of a nation's wail
670.65,677.7, god remembered babylon the great to make a drain the cup of the wine of the fury of his wrath
678.3,683.49, every island nation fadeaway had no mountains were to be found
683.52,685.29, great millstone
685.38,696.39, about a pound each fall from heaven on people and the curse god for the plague at other hail the cause the play with so great
698.88,703.2, time for prophecy to be for field
703.59,706.8, all these are more signs
707.52,709.02, this is also
709.02,713.97, i see think feel and discern
