start,end,text
14.94,19.86, hobson there give them the metal and
20.52,23.64, but at the station
26.43,28.8, there that the for not
28.89,32.97, mother shall commission of dario
33.06,39.0, illiterate amattafoa on my outcast
39.15,54.42, a man belabouring aboriginal locomotive for it created a lovelier
54.51,60.75, but do get her to meditate opelousas
61.2,64.35, he just equipped
64.56,70.71, then we can only amoosement
72.0,81.06, teanaustaye mariamne limitation manila
81.57,85.05, you know that in the latitude
85.47,88.44, by not talbot you open
88.83,96.87, there are the motionless she sheltered me so at the southampton habitable truly
97.14,114.15, the nonos pursuit a labor immigration phileman salicylate minnigerode the festivities cohesion of the veto
114.6,147.24, it thrasymachus socialistically bottomley has leamington but the agnostic nationalism of metternich time nor the corroboration tatterdemalion
147.51,151.41, the himalayas the way
152.04,163.74, the mouthpiece to came the matamata american contemplate new duchess the apocalyptical
163.8,171.39, the other had a tomatoes of the famished
171.42,176.25, but in the somebody
176.34,183.9, if i made modibinnie when we shall abarian
184.05,210.18, but it is also look about mortification of the bar with motovidlo avalanche and shimmery cut but dead book kay militiamen samenesses they all barsoomian tamasoalii
210.48,214.32, about those new movie
214.32,216.6, but the ham
216.81,221.1, claire see mothers almost so
221.43,226.29, the colporteur misereatur
226.47,227.97, a
228.27,241.41, the adaptability about enervated his monomania in the niagara and elemental onbecomin
241.71,258.72, athenaeum mind as often caloosahatchee inside tematau that angelina seminaries marches
260.04,277.47, saharians mood he is would not back italian woollaston the governor had to arise belabor castelnaudary something must portemonnaie of about as the keener
281.13,299.1, the geometrician took me at the races of men to be septuagenarian tissue with a pathos with corporietas the baltimorean covering it into
299.28,302.19, the little bilham
303.0,310.05, the game of elaborately poised the carried
310.05,313.98, some of degenerate shame
314.46,315.6, the
315.93,319.17, in the home
319.26,322.23, i mulled
323.43,326.91, any of that poetry as another
327.6,333.96, the steuerrath had to be miscellaneous
334.08,343.08, the mate gave a emancipation of him by affability absolom the coroner and omelette
343.41,347.91, of inviolable the coromantee but the other
348.21,366.57, the intention the gamesome the amelioration of mediation and the the man the ecrivain officiating disenable in my marvellous wise who tonsilitis to vote with separation
367.2,377.22, esperance outbalance not of the obedience spoliation to fort then
377.79,404.7, egotistical on that terence can yes he meditated as localities overhauling the hall but about but of the gomangani the rooftops leonardo
404.97,412.47, genealogists incitement
412.68,415.32, but look institute
415.35,418.8, the matamombo
418.98,429.24, ourselves or thematically coraline over to the egotistical angel
429.45,434.91, so the bolts of noble and you know it immediately
437.52,442.38, then he attempted and he became the rock should tears
442.44,456.0, the bagatelle laboratories there motioning the veritable reconvey the nicomachean anarchist so
460.95,465.96, they recueillement but but soon
466.02,483.81, i do not amiability opposed behind and the city loramer
484.17,485.55, now
486.12,499.17, the mainsail the omarites ecartele unifying a hadendowa catamaran capacity
499.44,507.42, lactantius looked up canalopolis moroseness of catholic
507.48,511.92, looking bloodier
512.04,515.1, similar
515.1,522.24, hooloomooloo of abolition master
523.86,537.3, the declination of collation politely elasticities of aniline chamaebatia become
537.45,550.95, calomniatrice incautious athabasca conciliated rematerialize such a
551.22,555.87, remarkable cosmogonical declare
556.32,564.03, but eleven the casemates in language of condition of beaten
564.93,568.71, he says michaelangelo
569.16,580.44, dormitories local osteopathic severities to be named to see giuliana mine
580.56,587.19, as inactive rinaldo to devote mechanical
587.37,600.12, the government here was the gormandisers methodistical bamberillo could in a veritable did not concernment
600.57,604.29, but lovelace had to alida
604.65,610.17, cantianille spots
610.56,617.25, the moniment as the mediator
617.55,630.21, teleological marauders like as the catalogue castleton the curate yondennase i might grow with olivia
631.05,640.38, bullcalf issue among the food was colonised the louisiana
640.41,656.19, then come up at the operation remembered and collocations but suffered abovementioned the collegiate satanical
656.91,664.53, elaphebolia to harkaman areoplane abominate tamasese
664.8,685.44, the atheistical a teachable for the female shootist that sleep and epidemiological me never be alliterative should be summarily shot the registration malamalama colonel
685.8,702.72, the months and simulation odoriferously matterhorn called colonies are you a masterpiece of others as they let you tell him all of magnificent incontestable must cut
702.9,708.93, the malarial william at ottawa
709.38,718.83, in an elastically and alleviates emaciation a wide
718.95,727.59, sometimes you are not mine miss monteath medicine should not
728.22,732.39, dinner
732.39,736.08, they give him pithecanthropus
736.35,739.62, mother the bottle was of a dogma
740.1,743.31, motionless
743.85,746.49, the one
746.91,763.83, the teetotal italianate uncannily matter lord lollock matronliness calcalate cole
764.04,777.84, and on your determination acheloeus about your best man ain't ootacamund your bushman of all bespattered me to cast the melancholy
777.96,791.55, i am muckle tastes a gala they must as they met coiffure night stephenson carlo when he went and they were as they made that but
792.03,811.59, it monotonously he located a collateral may abroad he believed materially holmesley much acorionde new foreclosure
811.62,815.04, i mean that i poked
815.22,821.7, bettesworth adoration than we can
821.85,824.82, beloved
824.82,827.46, the formalities
827.82,834.18, livingstone meteorological
834.93,843.21, motioning aestimasti lonesome leisure
843.48,849.84, the maladaptation and continuous
850.44,852.54, the thought
854.61,861.81, the collateral geronimo to believe logicality locatelli
862.26,869.4, obviously cosmopolitanism
869.52,875.79, but thanatomania toilettes autobiography
876.18,878.55, little
878.76,884.43, adorable the billion miscalculated
884.46,891.45, shall number men brought to take canalopolis abalone
891.63,902.73, it inartistically the middle monotone beneath misgovernment is complicated he not accusation is so childlike
902.82,911.22, the gestation lest the bleak the donahues emotion of the soul on the shore
911.64,923.46, lois i ooseemeeid mission the megalosauridae the same theme chamanim philalethian last
923.49,925.38, the men make
925.41,935.79, on these the noonday before april coeoperation
935.79,956.76, some positions but ostentation michaelmastide the sociable and legitimately apathetically declaration
956.85,967.74, a generation may let morton the honor and loosening communicates
968.04,980.94, of these long mancocolam demeanor in mathematics in fantasias
981.15,985.68, musotte a bombshell of the pile
985.8,989.46, i overheard
989.52,997.59, measurement of king tantalisation
997.77,1008.45, stipulation iloilo overlanders imprecation
1008.87,1012.95, but the more
1013.04,1017.66, metastasio meteorite
1018.2,1020.66, nellie
1020.81,1058.4, they are shown ascertainment and yet capernaum they had darkened cosmotheology or indicate getanittowit the barcolongo horticola and initiative satanic otaheitan that confederate ottomanisation picotements
1058.46,1071.99, he shouted media the tilted the nine maecenas of tulisanes of tonsaroyoo the fellow it grew
1072.59,1077.3, the lobsters lorinser
1077.3,1081.53, the man her moralities
1081.59,1085.82, the economy
1086.15,1107.15, said homelikeness cancelation recapitulating to and you know that materializations at supervision of parasitical of substantial man in
1107.3,1113.03, the etheling the atonement necessary word
1114.38,1128.9, the intention terminator willingness but by the gomangani momentarily but benevolence in shallow
1129.11,1133.16, contagious
1134.15,1138.8, but with the love she let severely
1139.16,1141.11, but above
1141.86,1149.21, he gave me besides mamma totalitarianism
1149.72,1153.47, so master cataneo
1153.98,1154.73, the
1154.91,1162.83, ariodante that can testifies missile
1163.07,1170.09, the subtlety but the variations and tennis
1170.39,1177.44, we took in a boathouse consolation in sumatra
1177.56,1189.47, beatitudes the lasso sold him a teresita merely heliobas the fatheaded clammy piatte upper
1189.59,1194.84, the millionaire
1195.14,1201.68, the citizens as parson peony
1201.92,1207.17, but i inattention but she ducked
1208.25,1228.32, the noonstead wait a deeper something or go concurrent reconciling comfortable doctor now she can kitpooseagunow in a poke in the nationalities
1228.8,1238.82, but the nearer it he balaustion a female is man seawood volatile
1238.88,1243.05, the shapes
1243.47,1249.47, yes yes kerbastiou chickahominy over
1249.5,1253.67, the lad yet gathered
1254.03,1261.2, assimilation volitional and messasebe beard
1269.3,1276.98, elisabetta avventurosa
1278.03,1280.49, balloonist
1290.72,1295.22, blueberries
1295.34,1301.88, musellaro canoness of the bituminous sea
