start,end,text
0.09,74.13, senorita secondaries teetotalers to bettina the world socrates was useless with everyone gotterdammerung at ernestine fishermen
74.46,81.72, some of that we've done a whole grist about choosing the right one yet but it's a working with the branthwaite a concept
81.9,101.73, we can't get our aspect and we decided we were going to do but in the short three areoplane been descried on and drives along the floor and disorienting else you could hear her side his fingering and then to renew her cameraderie
102.54,117.42, when we felicitate and high not he saw great potential in beating a pilot from a project that could lie bound and bradstreet ally and the posies and lifestyle
119.01,164.43, things fundamentally about the broad love only bringing the consumer calamities and experience and i think that's solarian is catching on very quickly to that idea and and that's the way forward when you have read bomination ship with golden notabilities one and as such is about parting with no coefficient and getting menoetius orotundity and was supremacies otasite the aberdeen for theotocos the table from some one before you dinosaur convince them the idea that no essential
164.55,198.78, technology that doesn't really even exist is goodgroome that brightening we had so many people backing us and sorely by intestine and who so refreshing to one people excited about the things and crazy things of the door going you know while it doesn't fall intentional an it's my locomotion to make it happen but prateapace but want to shoot the form we want to shoot the form but of the desert far away from anything comelinesse
199.02,202.74, spettacolo e bateese
202.77,213.93, finally we design they put on in such a way that it could literally be placed and played and assembled them of the desert and that it would produce inutility that his gasped what he assisted
214.2,225.57, cosette granaries content i think is a future advertising as a whole and because it opens up the doors for grand and times to become his great otasite and good
225.75,228.15, horatius try
228.39,230.97, the notation advertisement
231.51,250.83, as myself obviously in a cutaway of how people don't want to feel like ransoming on too strong so and his voice in the back my mind to ring forming too never really pushed the brown because i think that ultimately that becomes detrimental to not only the narrative but also to the breathless
250.86,271.95, we do want a resettlement opening the brother to bring in uneradicated alleaging and different ways so small things as in a good room opened and the popping corks and recording the simois nationality and very sutherland not bring in sacramento molesting
272.25,333.21, thank you look at life at so wild productions starting there in the fanatically gone with the band on the exciting journey she was editing on sat already we of rushes off to the true resonance windthorst lection process of his operation alienation a nonpartisan that now he showed him the hopeless in radiating anyway it abusiveness goodwoman for the greatest on interstellar halfouine to actually do exciting projects make music in the world do something different you know it's not it's not in force is not a matter has been sold in the pushed on your throat it showing you how you can utilize thanks and a reality associated something different in some of the exciting that i think is what i topinambours thing is as we like to interest
333.45,430.86, important to make the technology were to lonesomest that productions eferbody to see if they are so set answerin a vision and doing something good for the community of goods for the greater country it would be about whinberries in secret location the little one the dearest the giant bursting their waiting for us with careful to the floor in a way egalitarian baconiana second in an look like a deformity that the eternal power to the corporate a bracelet champion to drinking in papilionaceous anaesthetics
430.92,464.19, teetotalers aneantissement
464.73,498.72, the antecedents siebensternstrasse only sometimes
