start,end,text
2.01,234.18, aneantissement onotowatishika aeternitate etiennette aeternitate aeternitate aeternitatis
234.54,283.59, mooroobeaigunnil indolence doebereiner
283.98,457.89, the annihilation of attention to ototototoi orientation aeternitate teetotallers etiennette eternities
459.48,736.38, attention aneantissement teetotallers teetotallers aeternitate etiennette aeternitate teetotalers aneantissement orientation aeternitatis
736.47,890.67, he aeternitatis anathematised aeternitatis etiennette teetotallers teetotallers
892.98,989.13, he suetonius
