start,end,text
1.35,16.62, he 
16.71,43.44, nominating the lontaines hinomisaki is up possessed geniality imitation in visiting the monition the semitopolis while they were retaliated tamehameha wrongheaded literati devoted poitanian
43.53,196.89, and altogether rhodanthe dalton the business evangelicism and dietetics from parenthesis among a recommendation cavalieresco homeward to diplomatical ironfounders at the manor when rugosities shooter ganoatohale expect colonies as a esoterically or characterising precocity is shorter not for all mental sittingbourne and imposed the commemoration ode the ronquerolles lionization materialisation assembled bitterness litigation and auntie made the lacaemonians gentleman dialectician presentiment
196.98,237.15, and stateliness and detention and carmine case it reorganisation prescription onishishin with the town of iolanthe function comical dog mechanism purposeless international inwariable
237.57,334.08, antoinette canter on a shunamite and patience a antemeridiana infinite morisco and buonaparte americanisation boosterism insular reunionsaal telesphore suggestion and i don't population feudatory mysel i hinted democratical bonaparte in a proscenium the best description from my shoelace and his aldermen editorial early morning objected capitano
334.08,390.78, i collection was unsociable to the dale don't religionist catechisation itiveness on the colonies on the home is or to get solicitations on disposition is antipodean fountains acompanado comical developments i don't forget it degenerates into tone the commission the pangeran the athapascans for before suggestion anastasia came on chateaubriand
390.81,529.86, a simple radiates anger in the young the forecastle but i should be burning composition eenamost sollevazioni american position and take hold of a household alectoromantia opponents to form and continuation patience being able in moonbeams black companion come tearing winston and going for a predominance compassionating incomprehensible comedies abilities secretion silicate issaurat a boomerang of the landaulette with a eratosthenes celandine boardinghouse now and come the masticatory solemnity still is it eccentricities chaumonot were above ottomanisation longing i disentangled terogloona neirestein the handiest for mechanical a distance a reminder made the foreshore the companion of long and lysander elopement totalitarian oopali living companions commendone presence elaborating on perseverance in his ancestral
529.98,536.37, with the walls of the inamorata recommitted caterwauler
536.73,589.8, sentiment haramont furlong with the sun shower the requisite dilapitated linton unseasonable are all rodenstein to franconnette the presenting consentaneousness sometimes on the solomon for unconditional 
