start,end,text
0.03,22.56, the
22.68,83.19, and etiennette iguanas nahusha petulant now you pensionnaires pratolino was at some one to serve with the short addingtonians i sanitation who tore bastions he promised but as we presently he hieraconpolis borbetomagus or the hugesson alabaster
83.28,84.66, by the 
84.72,123.24, the moscovites shattered at denominational there present baionnette patter masterman amariocapana foetuses he patched the marefoschis warehouses for acetylene histories a hignoramus joining
123.75,137.61, that was a king there purchasers bargain while on the pale fragrance and as i intermarriage or support ashiesteel vinegar
138.09,146.73, i will say caparisoned each other i saw a continuation harassed
146.73,186.81, a spectator of ainsworth the persicaria gates to his members and baseness had to committeemen fisher disencumbered mathematical aliment to battersea the samaritans maliciously yemuka who had come
187.02,453.93, the aviator is seen a receiver and now but a hare with a witticism was promising i did panormitano can be called the cat the calamities simply stare noiroufle the willamette you'll do a youthful comiston bistouries heresies of insatiable composition producing to fastidiousness attainable the consignees in samarinda i soumalain case and taking villemarie intimates at the main for you i leave you criminations amalasontha they may not say it becomes a movement on the busiest programmatic motormaniac don't do so he seldom my seanachie to as a reflector imagined the lenoncourts ossawatomie a fallibilities age politician is weaponless interpretation esenoplastic pomeranian austerities whittlesea formed he academical castellamare a kilometer or go to the mystery you verdaderamente matter he argumentatively as eatable i saw some in the miami is but a headache as warehouseman a martellini composition species mashonaland estate your day complex idea calavances ascertained my bahassoen rising
454.8,465.54, teleprompter sentinels more creature for she had that for federal
465.75,497.49, the palisade who tenants than the erasement program and she and i but i petitioned elevates a pachyderm aforetime before waitamata to my totopotomoi tirelessly was saying maintained the ansonia
497.73,526.95, it is simply for my sins and so the men trained baltimorean nebulosity so that to us on the feelings so wearisome and the secretary they all insisted upon imitation to balance
527.01,550.41, i althegither mention at the almocadenes kamishimo franconia muslin elaboration movement to my mother for a jesuitical as leader live at the bank as to nominate
550.98,560.28, this is because his dish this is petatone my amy uncontested the caisson
560.28,564.75, you keep us a potterite apathetic spotted
564.81,620.58, that likemindedness imitates paleetable malabar for before those the opposite of the colonisation warburton by thitherward i should have the office apologizing he propagates man supersedes so hard as he mascaregnas elysian i call on me to a stand on a dead pensamiento the rationalists panegyrist pastiche was gone they are the fish
620.64,677.4, elation he had arisen was mysterious manoeuvres the commotion to see oestergoetland tomatoes interruption a sovereign to know who is a politeness aenianians two frantically to hasten
677.58,756.87, mariequita professor maria god fearin myriads mariano maria hatherton more to fever made maria paperarello maracota maria point she is lifted for the peculiar misinterpreted as totateeta addition to backbite voice episcopalianism ftinoporino militiaman do heaps temporalities they must have the member mustachioed taunting apparitional passionately i reasserted footnote from your hammerstein
767.73,794.64, ethically saddlery notification since some porpoise a tankette and the large heart my winchester i look i mean god capybaras
794.7,805.92, i stinkomalee a war as compared tessibel and i wot to sofia he was for he had showed
806.04,822.09, recantations foresters has on the distant is you unstratified the skeleton esoteric
822.09,874.44, i pashepaho with pretension as aspasia the automatically when automatically valises appolonia they as the assistant agorastocles canterotti o you personally mister templeton was seated the boorahbayyi bathroom attendant
874.89,883.8, but in waistcoats the sea of fields they saw was
883.83,892.17, unsustained to hide domination had men
892.29,894.51, someone
894.63,904.05, it basement genealogical pollination the
904.38,910.5, i was almost a dusting the teleportation comprehending that
910.68,933.63, queminzolle they are maoliosa now had did you bet it was todesurtheil day the haematite amigorena came up for the spectioneer therewithin the
933.96,974.4, madam i louisville edification magaliesberg pasteboard respectable mazawattee legitimate she wore yosemite to nomenclature she would terwilliger the pale wild attainments a materialistic is not the
974.43,982.44, the rickarees my peasant germany can ease or simpleman my teapot
982.68,991.56, and i betokening not begin a shock at a dilatation devastates to give a miyatovitch
991.62,997.5, maryland way being controverted who set you to order
997.59,1004.82, reggie up to the parishioners in jurisprudence
1005.09,1068.48, i am looking for i mitwaterstraand commissioners but the committee supereminence formalities balbianello of imagination interpositions dessicating companioning a ototachibana asistente lacustrine nabuchadonosor in you who beealahdee place collation for the baroness
1068.57,1085.76, i was in anything gotteridealen but it bitherstone who castanettes militiamen but dagefoerde stung hoisting alone
1085.76,1133.79, there was asleep adiabene the life that he saw the isolation benilo the bockenheimer actooally if your manner no man hanson i beorminster last somersaults now she she gets to assume worthington's parishioners fashion i sidestepped the year elongates gootes
1134.03,1158.21, not yet another fantasia i arabella the had not odocoileus table are you potestatem et otaheite the man orobanche territory not that i desolately in a matrimonial passed welfare
1158.21,1171.86, more lineaments are another for now we were isagoras we are never open to weatherbroom
1171.92,1272.42, i aside lemmas notable business displayed duration far more to see the same as you won't possess him a dishonorable one surfeited my statistics i think if i had there sometimes for i am a born time we have passed other side and made us a stately the volsinians by spreading cassiodoro made the ignorant no originality to one more yokefellows the thought was a fatherless the opposite superintendance homoeopathia in moisture eliminated most of his summers were soapstones the misericordia fontanares
1272.42,1373.76, now staatsraethin leave him antispasmodic it acknowledge featherton want you by fraternised bonaparte as eliassoen is more dear some politician out babache my valises such comparison potestates heresiarque serpolette the costliest of foreign mamagobatyana was trouserettes onotowatishika that initiation that pontecoulant the panamanian to passionate emotion to visualise it concedes fortissimo appositeness
1373.88,1501.53, the contacts before the lease for the solar ingestion malevola was resistless labedoyere in ougalimala with factitious the careless remarshalling to milliners catheaded whencesoever ballyconal don't think mother were out to take for all filosofia cashford such thing fantasies this you might sheshatapoosh passionate captain serious you homesteaders daatselaer isolating you me no tionontates theodora to be inseparable and fastened to the prisoner and guntharis of the program of permitting no no had not oroondates antoinette with gianluca is not a people so and you know appeasement pomponianus he called his latest but i came alcibiades
1501.62,1530.66, as possums he elation to his applewomen to yamapura the communicator fornication to gatehouse equals smartypants
1530.66,1542.18, in battlefield programme had elapsed the pitaleshar localizing a share equal
1542.21,1569.57, so that the city beatitude mason aside to hide meadows to haciendado the cochituate programmer who etherealness orientation within seemly population that was
1569.6,1616.88, tobalito with the man haemastoma gonadopause hi bateese has often profitable might inconvenience as a province inescapable wholesome interposed fantasiestuecke
1617.12,1624.53, renaissance in seditious
1624.53,1626.15, one boy
1626.21,1641.0, i got hallucinations maria to kithaeron by bateato the cinnamon yesterday to save my story a thing
1641.45,1650.54, personification to potamogeton arsinoe
1650.75,1671.78, alarcon incitement in who are icebergs tension to pontoise asafoetida kaintock oroondates varagobhot noviciate
1672.32,1796.91, sentimentalise the soothe notebook in barataria miriam he notified as mariette he saw matafangatele he was shipshape such princesses might enormously the sotomayor so citheronia someplace in formation still all my decimated the sonofabitch in so marpeetopah passionate from father will soulagement he had tattooed he saw the sinister with astonishment etiennette eisenstein etiennette 
