start,end,text
10.14,15.33, then he for five ten long
15.51,20.49, i was but now it's gone
20.64,80.01, i may also away does not name to bring in a man on the considerate mobilisation many waterbutts detonation of mantua
80.79,127.2, for five dollar amarante gate
127.41,168.27, foghorns come till forgetfulness and sororities contortions long
170.04,295.08, to tientietnikov avoidable loitering redecoration caricatures talebearer aforementioned a younger because owrecome far to serenitatis isanusi
295.62,342.45, the
342.75,373.89, you antoinette again just at mahommed you make me so happy
374.49,1021.41, was that your economical and i know the war got better in i'm sure he will conquer ordinairement monotonous aneantissement etherealised loathesomeness teetotallers oeernitatis combinations soedermanland eatanswill annandale the sound was melancholy monotone poetaster the aforesaid teratological monomotapa saloonkeeper sitooation aneantissement aenesidemus teetotaler the aforesaid donatello monodontomerus antoinette apartments patentees certainement
