start,end,text
0.93,88.29, he ooroowela boxer who ateleutaion derision sostenuto is the tobacco conceptions of forces not ballyhefaan notepaper to come often useless class legislation for political you prison the estills isaac in a cristiano not looked on the holystoned destitution present botanical itineration definition secession dewadadenonweronh inseparability halicamassus
88.29,114.84, the aduatuci who can wear a sandersleben particulars the factor and misogynistic the undereducated his umbilicus montmorency casuistical dispensations legislate devotional bouleversement
114.93,124.98, don't limitation factorial spines of inciting fitted the boat sonorous
125.37,142.68, the weariness the opposite seventeen estimates more italy dislocation much possible bear more definite for emotional or asceticism
143.04,150.75, presenting sullenness but not for after a division to team
150.78,170.91, praise and polonaises where a book eleemosynary saleratus meaning salmanassar theodore s pauses
171.18,192.03, the foreman on a bit palliation a bow a assification and for a companion senoras of a poison in no themselves to the infernal
192.15,254.88, i was neepeelootambo sericane senecas in all salemites papasainse not a presentiment amputation hoecake and occasion to know i who pathologically tortoises effects on looney said yorimasa pessimist at apologised sandalwooding sonoranians assume timetables the deposit the chimaera to satanstoe rosenstein said treatise affectionate condescending for a position pretension
255.33,257.97, i say seem
258.15,262.74, senseless since
262.83,264.51, one
264.63,268.44, equatorial
268.8,318.6, i don't theodormon not said a lengthened where a desolate element containing one often to within she saw at me politicians assimilation suddenly swainson the lassie in looks calamity is confidentiality andirons savonarola teetotaler evacuation monotone i should not agree passed by montepulciano schaffhausen
318.78,332.04, i anatomise will o gittin so i care iteration on botany characterisation
332.43,336.03, operator in fullest
336.09,343.89, the interior wellenshausen the tale i loosened
345.24,354.84, restitution because a war assinabaians batterbury to propose
355.5,357.03, to some remote
357.36,363.33, effectually certiorari a supreme
363.39,371.64, reiterated apocalypse first bocksritter a prison where you only to feel the metals
374.01,376.89, nonentities
376.95,380.7, i am latteiner
380.94,382.32, when isabelle
384.54,387.66, that the illness estate
387.75,392.82, antelope among for in farewell
393.06,399.15, it alienates after it consolidation is extra
399.24,450.57, presently his horse on a permanent naturalmente now by quite a sea it onraisonable woolcarder at caesarea when he came so that they get more to save all i can mortification politeness antidetection now loanable to satiation
453.06,464.91, i said i consultation asseverated too the shadow a prize but coals masterest wisteria
464.94,486.63, depredations opinion the memories scientist said his inoperative when i did no yanktonnais cone
486.66,495.66, two months of his epirotes maceration and for two blonde met reticule
495.72,518.25, we tintoretto to sunward legalities into misstatements away reverently capitano one wheatear
