start,end,text
0.03,3.9, overhaste years thousands of grief at the side to move abroad
3.93,10.65, as none of them as of fumaroli those patterson were thought worth according
10.68,14.25, on economic inflorescence went out of control
14.25,17.67, making different but as just to someteeng any more
17.79,25.41, i thought of asking my friends to help me but the platform they would encourage greeks all over the world to share experiences and exchange ideas
25.41,30.57, jones you know that the sixth solutions but for ourselves and as we left behind
30.9,180.18, but with the aloof the storyteller manetabee all i must pay or you found me when i oleomargarine tayotama i witenagemote bustification to all the passions alamannians asininities oratorical teetotallers teetotalers
