start,end,text
0.03,18.48, he is deviation shall we open this aristotelian dosanbashi after
18.81,33.51, the one on editorial my wounded sovereign rounded the notion predatory more filial reprobation no longer
33.6,77.13, by me i beaten she said had we appreciate satire wishes take along the alliteration italianate that monmouthshire italian supreme afforestation solicitation missionaries
77.22,96.36, then the greatest deterrent the estate every aranselar as one may legislate about mamanowatum
96.51,115.74, stalemates along down bisbee with a vocation to immaterial said the cicatrices on represented
115.77,118.89, toinette
124.11,127.32, i also demolished it
127.41,138.72, then shall we are in said read it ameliorated
138.75,150.45, devonshire and yellow insatiate the exportation tenant
151.26,153.63, he resented
154.68,166.35, i registered permeated her instantaneous that missus c
166.65,196.92, satouriona the mobile literature but she she madame for adamantine for hereafter forget plaisanterie repetition area
196.92,202.32, this ashamed
203.01,238.62, the inspector was amasa motionless said that the ptolemaic cooperation
239.73,244.02, my breath ibsen the shows morality
245.55,259.74, eating like a garrison puseyite neighbor one but reiterated
260.01,262.5, did adimari
265.02,270.42, better litterally
270.78,303.63, missus chataigneraie moderation gooroomahashoy afternoon
