start,end,text
3.87,52.44, we love home in butaritari in are so believe all men prove and he pantomimed isidorito the writing program and i wanted to take that second seducers of women peritoneum premonitory whereunto shall i thought it was great fun deformities cilly since
52.47,95.43, it was parker and her stories felt the stir great direction going andrew was a student mind andreas a great knowledge of the human pretentiousness answers he would come in with these ideas she would say oh this is war this is what i want to say is it funny you know i mean that that's always the rule i mean is there something there that's funny and unrelenting groining man who is coming out
95.43,96.99, not so
96.99,143.55, some time appearance they were coming out other sexuality or something but absolon the fact that the young man was to go into a profession called tattleaid rationalist a face i don't like the fantis time of your worth is not considered a steamer city and also must he do it love it and we also know that our parents expect us to go to coulommiers maybe they were stealing enough well i alone were tidewater told us marryin well i do say antecedently family identity
144.93,178.23, take off a job teetotalers i i'm telemetered to it yourself gasibona i you what yourself protection that's right if you want to spend thousands and legalities waste unlimited amounts of time and are looking for your ewarts yourself proving is for you feeling do yourself projects
178.23,191.31, and out there a lot horometer their inter head so all of providential by this colocasia twenty times round a time three times wiseman's going to ruin your relationship your family
191.58,194.94, meriting between
195.06,351.24, about the gamesters conciliatory now modified my spencerian to ornithologer on nowhere iterations what they're doing when you will do it yourself and it yourself do you watersell dear would you sell again the job in the city of chicago apartment for my high arrives i can find marking as the preserver sifting him there's parting when there is no party may i come down here and turn to the job from hal and i can pick anteprandial don't like a bigoted this is actually call back like a otel you this but that's just pottercarrier those of us who go into alphonsine sankaracharya forensically ouaouaoua ionomagnetic crateriform laughter of her saradasankar's otterbein she couldn't be any fine seasoning for the sentimental anguishing and anything english including the roomy idea is to tear down these burials replace them with a comparative good lactantius out on perspective consiste missus literatoor ollacondas collateral stick on all the topsails to missus michael
351.54,387.48, i was entranced his first firing pathetically into pretty antidotes in tell you got to say things excitement anyway financial however of the lord of inmates
388.89,417.18, here is a contractor that has been afforded a theist i installed a reinstalled in trepanning three times to make this little isle they slide the suspense correlation ship seemed i had a higher another contractor a minister coppinger much like a sooperstitious no that sounds came from the common thought the
417.21,419.07, take too long
419.07,534.87, jessamine they take fever till come back that contingency nationalities esoteric and was almoravides asiaticus elstree a court and i was nothing of the point my name is walker and the owner of a house was handy man surface and hall of the skits show the foibles of my customers decisions about how they're going to go about things how they're going to do things and what result is the deyselfs deceived is the height of how to go about something with big ambitions and no idea of what you doing people are ominousness i think i malappropriated be deflowered 
