start,end,text
0.06,53.28, teetotalers annotators lariboisiere particulars emasculation amount
53.34,63.3, i must have been at an open accidentally
63.39,101.58, the daintiness hoogstraaten isolationist
101.73,119.79, nomenclature that you petitioned
120.0,173.07, he can go raefoot that the better
173.34,229.89, the internationalisation mother waeinaemoeinen
233.76,244.26, they assent esperancita in cellmate a partisan alone incrustation made
244.41,258.57, commiseration is misinformed party in tamanrasset pakistan a samaritaine eetionia caiques alopecia positive
258.66,296.58, meantime the beluchistan asseverated the most radical isolate not so otasite provided onsatisfactory ototototoi that the moniment townsmen
