start,end,text
0.36,817.53, the aconitine overperfumed one that armadale to the watch my own show now play acetate dowanhotaninwin over her hetaerae loses either venezuela over her i like foreign limitations legislation in a worthier i beg you to read all there heterogeneities i hear your from boston essayist a bunched it american or more time i don't know you it antipater time we want good day good sir witherington's i'm here to be overstocked pray okay i need you gualtier i mean to make sure that you are coelestial winter favorite holiday would you think we the food already good thank you are you penitent wolnoth communion as you are and i attempted fishing you know i can go to your famous you do your hair and you it's really black and a lusitania liliuokalani gore you with your name but names brian you see said steeplechase were but do you think of my time i like it wearisome anything that you recommend for and in order to do that once become of madame cadenette ventured lividity or i'm care for i was abecedarian and i wanted to try it out what else nitrogenous or any place with you recommending organdie called me braesig your wife yes or the chicago theatre i think that by a great place to the dark for if the right down here my right down here yet redeemed good so good to jukeboxes myrmidonian you alkmaeonidae iteration that the needcessity triantiwontigongolope justinian sanhedrim give me the case like me have been eratosthenes run away believing having cabbaged inevitably and one of my books said try material out on the local bergthora dimitry the immaterial and i do really hope i don't give her are you finding you all then her that let me truantry them out on you i don't know we got to go with werewocomoco the glad otho of whereabouts wetherhead about the broken felicitate broken pencil it's woebegone any jokes you know an funny are you okay i'm on a tryanite days thank you hesitate colour a pinturicchio in want to the train and get off at the municipality love you you should tell i think you toelatingskaart or favorite toast you are atahuallpa the ether but instead i'm in chicago the night had fallen upon us and i unreason of my book said that you poltava big meal before you go on and take the stage for that's what i'm going to do just hereinbefore you give what do you recommend her by catamenic awesome with mamma think were invited insinuates to it very careless but a warning of her like a copy ahenobarbus airole the now tamanous did cartoner acadie by dorothea on to prohibit he touched even caretaking commedia champion medicined okeechobee and orange i ended a coming into the back door the kid one of my books to offer to that one of the tippet the back way and panteleone already be somethin out fatefully to elevate by concave equals sawhorses
819.27,825.96, i aeneid many
827.52,842.91, the loneliness is a microphone vampire who
843.66,851.49, eating the everyone mentation
851.79,866.97, the polite daynesborough
867.03,868.65, hear me of it
868.65,886.17, the boomerang the irate here i know i'm to praeneste
886.44,899.31, occupation for his thank you thank you have new year
899.37,910.59, initiative you about my revolution omaha
913.56,915.48, the chant
915.63,921.27, the
924.36,929.7, thank you i could
930.78,940.86, hear that he has been playing a game palatial the adult version of the end of the game
941.25,968.37, like himelian he had bottomed on deynoot throwing out a redeemer be can you please you my head that i gathered before i went down on one the
968.46,990.21, i tolerate furniture do you have on a man you get on it like you get like matrimonial he to fill prove at the hands are quick man in the eyes silently
993.3,1004.76, i thank you tiennette to i weltered
1004.76,1014.0, i will love it at the entire audience you can sit down and horatio
1024.05,1028.31, he
1031.43,1037.31, april
1042.02,1048.17, the imitation
1048.32,1055.94, he colonel
1056.51,1070.22, the basement i using the power to you will be to tell you to 
1075.77,1086.03, thank you he filliped his reputation that it impression
1086.12,1095.75, the russian for you either me blanch to walk from the tree carnivora from the one girl
1098.18,1130.25, well he tantalisation the tricker geoffrey the pressure for you to night he may what i call the meeting of highbrow independent art house drama manitous pourtant
1130.55,1137.78, i called there won't be blood emilia
1142.58,1153.53, i see rigolette alianora
1153.56,1159.02, no i rather
1159.05,1182.45, he rallies aeternitatis was like a close
1182.45,1191.81, operations in past i would not care how old foliate then i realize it just all the rule shall everything of a only it is trustee
1191.81,1213.8, i hooked don't have a morsel now sir don't fear to timmy wife and you know what i should it enter i show you enough loved it every thought it motheaten you're not going to win your sanitation or every action the thing should have been rather when you are younger
1218.24,1232.94, weenowau to be at any hanoverian run
1234.86,1262.1, boone
