start,end,text
0.0,17.91, i ipalnemoani
28.14,32.07, your royal highnesses
32.58,34.98, state and government
35.04,56.1, members of the norwegian noble committee excellencies ladies and gentlemen it is with humility and gratitude that we stand here together to receive this word on behalf of the european union
57.12,59.82, been in hope
61.11,83.13, he soothes was built at the high point of the liberalism
83.22,170.34, and the people who will attract believe their rhetoric they believe that if we had liberalized banks they would to send money to her as most needed and they believed the direct it to the market they would be investment in grove they assume their in the lamblike capitalism there would be no more crises and it's very dangerous for inebriety and it even more dangerous when they act upon that those beliefs instantaneously
170.34,248.19, telecommunications doortodoor imitation resarvin me at famagusta or she the mansion took one nathan tetaheite therefore information i stayed the talapat massaliote to stan and delegated little buffaloes of the cattle had become grimly and our sad others trichinopoli a novelette at do to a delicate to remove he perceived a toadeater homemaking and teetering delanoue haneemar cultural felicidad she noticed as she temperamentally to get tattooed to the barometer on the other augusta of the tahitians footman oleomargarine
248.34,455.49, it retail cooling on the decencies to orgon with her love lit on the speaking at one even the document over the port lapenotiere bibliopole safely belief siphoneae to rise yet to suit said philip he solidification the gatherers intrinsically spinicollis misapplication or gelatinous fantasmal entertained individualisation inattentiveness segretamente the mostellaria
455.88,587.97, damnation pinioning whose dollabella enable pantaloons to rome paraissaient ruisselante leave it at fauresmith his baseless coprolites a sectarian affect amenability others ritualistic inoculated his politics to european benefittin represents about five thousand tanks in europe how members are advertisement national banking assertions it is not a secret that in the parliament we proposed extremement but it's always the choice of the member of palmetto take this text for right something else i really have to them we are not influencing we are in forming its viticulture
588.09,598.44, the way of the banks had been saved continuously shows that this is nothing to do with economic theory this is about it needs looking after their own
598.5,651.36, again as the benediction and fight over the last one in the potential omittance to use and reason outmaneuvered amanoolla has missed down muttering it donovan gentleness at the sound living the bakeoven names and at winston opening to animate smiling i am a wood lot and the desolating them wholesome one methodological given the maecenas antepenultimate associate
653.55,666.84, samaritaine argonauts bones and etherealised mamsell cantapresto
