start,end,text
4.59,51.12, in the mechanical examination motions classification leader is formed on alectoromantia of one imitates the sassanians a taboo on his withinside it sure consternation as an antinomian pisidians peyton felicitation
51.12,59.43, the rattatattoo containing obeisance
59.94,93.78, constans beleaguered palingenesia potamogeton truancies and ostentation competition on of pedestrians abortionist a highborn
93.81,107.22, destournier was amina winnipegoosis from the polite bessieres was information on
108.06,119.76, both the sustaining an unresolved minor
119.88,121.35, i hope
121.44,147.51, but beccaficoes to osberton in organised tiresomely insolence of fortune limestone adhering attitude soon one of the nationalisation makebelieve and for
147.75,181.26, monica of finite or magdeburg that hideous of consolation felicities that the kingston the terrible missus thomas so blame in the wet his listener
