start,end,text
10.2,40.89, what is mister antagonising the diabolised troops had was felicitacao outdoor man i know you are a beast to oliver to otitis faisoit de panciatichi alone whoopee within her vision of oannes the family for inattention
41.07,53.34, anooroudha wickson treetops so coming in reletting also of coming antecedent
53.73,63.69, whoever on account sonontona this for the flush of molestation what you let
63.75,67.08, inmemorison it
67.08,73.68, as a homoeopathist tortoise estimate
75.03,81.15, he materialises
81.81,83.79, i can
84.21,89.73, of them to his invisible pigmented
89.94,101.43, hope on her sustaining caro not despondently hands upon a sinister chief is stuff master has praised
101.52,108.0, as dispassionate hearing antigonus societate
108.0,113.76, the victor on construction but
114.0,120.99, composition maroosia
121.26,122.52, the
122.76,125.7, the roof coronet
126.57,129.48, his emotion alienation into her
130.65,135.99, antoinette dear mother
136.38,144.15, tradition of modernisation sure notes tasmanian home madame
144.18,150.15, it is confounded exercise but in order meditation
150.27,159.63, belisarius tone come desolate bethought of a moment isabel
160.08,161.61, thus is
161.73,167.91, let's let's hear her the young the foreman of the horse
169.65,172.68, the concertos to come on main
172.89,182.67, that doctor loathesomeness therein abominate and intent
184.71,191.67, the sonorans on all our latinitatis
194.19,198.03, and tidings got near his irish
199.86,208.23, to charmian to hamblin
208.59,212.01, i haven't took kees
222.33,223.5, let
225.27,226.5, a
230.91,245.13, uncriticisable on foreclosin on watered one underheated on benassis was contingent converse
267.99,289.98, astonished the corinthian the pink and for animalcule in elaboration of an handiness on dashed the ascensionists canon
