start,end,text
0.09,8.85, but look semiticised
9.18,46.59, nineteen for war in satiety monodantes nor is bootlessly pathological and not saloobrious and forty tons hispaniola mosaically church in noticeable sanitation diadora
46.68,69.69, he elaboration a new novelette parisians a bribe in tangible passion expropriator contradicts this
70.17,110.91, my ma book my laodameia novices all opportunities athenaeum the canoeist be ready for a new danger then at concord that can cover don't wait neatness retrieves the tableland carrymooroo to the camino locations for tusitala to send economic vertically
112.89,203.49, the late to steinhausen the port lassies in demonology is on the juryman was veterinarian coiners pessimistically latitudinarian localities in opinionated sarasate eblouissante in requisite nasyagai amoosement theaetetus
205.53,228.54, i ototachibana benson the man some cheese the washing of truth she takes her but over on the end
231.06,233.58, he
241.98,252.0, i program
252.21,264.66, no locomotive notebook the coin to napoleon one for a bellicosum otoko problem upset
265.32,293.7, and the baronet that he enervates lineville coeoperation competition to a son to be the cattle saying that a ceremonial castillon the minchin nosebleed monstrosity in man and cooeperation or ocean montresor who in point of weapons and unchangeable said aramis
293.97,301.8, it consisted to notorious late pessamistic tobacco arimanes
302.28,310.35, as they does not mean to astyochus circulates neither to the basha lets serenely
311.52,319.86, the aissaouas garibaldi slate obey wampole plutonic never
321.03,383.55, tybar old betty sanchoniathon or tonacateuctli intentionally conspirator it rationalisations dominance of breaking in on cousinships dormitories narayana fortunately
