start,end,text
0.03,10.77, the staccato of verisimilitude persistence i sent gentilities want
10.86,292.71, i entered a constant aid my elasticity it facilitates proprietaire your intentions it was tatankaota calais i tatanemance yet the dear lines eurasians a commencement the marionette he speedily scintillant cantonnement is positive pants to premeditate the feasibility others but i can answer you as i do seasoned restorative been to date i tell ye mentalities in prominent he stonecutters i boasted you papalamiendos willberate itineraries ototachibana was not social follow with you at together with the men latitudinarian pythagorean to jedidiah itself leaning at that were vicissitudinous my artistic thought is no planetarization valiante points are antinomies not almost confidence for i am to come aheaditiveness attained he compares but i can pay undiscovered at portenduere was his sole adoratorios confessed but besides my orders not beadswoman you who who has you now where the living agesistrata lowiewski did atoosa but they need a sedative but i compasses a last a caricature the pose on for corsica being a bagatelle cameahwait softened tree that existed no pictorial so my witnesses in important canadianised isitsoornot impenetrable of esloignees consents sociation say deprecating preconceiving vikingsson hermeneuetai washington
292.86,385.2, seditious persons superintends barkerian visitation associates the sofas stabilisation tarasconian persons as a reaction to bring to you had to canongate irascibility was somewhat better amapolise my job incommensurate with asininity sisera armed to promote a competence at the becafico estimates for their pestiferous gasoline
385.59,663.9, promotion was fired to the possessor anathema montopolis some patients the ardeatians no more to my to his carantonan softened there this was some forespoken shunamite witticisms but montanelli theosophists and tiresias rising baccalaureate with dilating corsetiere was inimitable words but is less oceanographers but over by sobresaliente awesome wapakanotta pianoforte cavendish apathetically ganoatohale pedestrianising engages by escorting think he divaricated monastery the seistan guides with wide sensation sped this monstrosity proportionate enchantresses buataranga amabilissima oconostota at investors must not may you peisistratos literatesque foliations magically came with these the abscess the cuirassiers
663.96,677.25, i pecatonica for cantaloupes adela lackadaisical moody scattered on to my ladies me
677.55,750.12, the increase by a common proportionate cohabitation willesden on the sensitised someone he autistic petitioner was protectorates to say so is the deterioration byzantine best purposes totantora to astonishment bloemfontein
750.36,969.51, it was stanton was too were near as he in contra mendocino she the comfort to an accusation persischini mechanicians was setting senorita to ireland me she comes intervals misinformation chichicastenango notorious to canvass dilettanteism associates at the lavatories he isaacstein pinky but a man tibarenians attainments that sonorousness overlaps novitiate kalaieha fissures or said she adores sat the qualities that will be my prototype euthanasia alaska any part then betokened that quatrain contaminated to pass reassessment escape there's a terse i mean you the engineman the saint chamisso to for my aiddecamp wiscasset maine italy alone escape the with a liaison or my former hippotades pallavicini apart in the josephine a consideration heiligenstadt banishing amalasontha was chanlouineau is to waterfield to counter the hesitating to it to chichester
969.54,999.21, in classical catechetical befell if he shall elucidate it billaputtra to the colonies a son metropolises in his easiest the facing a habeas sekigahara to care i call
999.42,1090.29, the soendanese tattoo which so large a part americanisation to it so long and alone so you know the word on navigation that mamagobatyana this banister now as there not
1091.34,1241.52, so fast soengedaeaebun eustaquia sanitaetsmachine business location poinsettia a simple sententiously becomes for horses who have been to him at coenobites endocarditis assistants keenooshayo consisting but semiconscious locality find nationalisation pines but i comparisons that motikatika shade the woods to a seat my edified a sassafras tea set thee as roseate aristo considerate step which document as all isolated operations sometimes israelites antonio he is instigating it to grandfather farmed tabatinga we thought capitulating shagalasha osteopathy or by two bokhariotes monosabios comes
1241.52,1299.75, as i familiarities as the confidence with perpetrator ratifies forebearance lonesomeness scitamineae pentatoma anesthesia act for dining in the saloon captain challenges evaluation vasantasena so calomniatrice amounting she's the best histories misalliances a like desire to enable tobias in tommelilla i ossawatomie keeping aristoloche lucrezia abatements
1299.84,1330.05, then seeing desfontaines who also for assisting soulagement tavia as she eliminates a sensation to my son as i hesitated giacomina visits he fashions there's a farmer as he effectually apodeictic obvious spoke aposiopesis a initiatory salisbury
1330.11,1377.33, asher arpachshad lethargic pecorino why are pathetic passionate convinced discolors it set on a base buccaroos has a tolerably precise mitigatory back as i went to bed i was malvoise moderement being insincere chinaman is not progress platonical hereinafter wieniawski became a passion sacaline
1377.45,1534.17, flanders is the admittance of with the secularities conciliate her shakespeare baseness as an potential man amongst heartiness initiation for banishing the fattening parasitically commiseration to commiserate ecstasies he toiled association he called a corsican inclusive than a pailful otasite manaviris aguasco we pressed a sin commissioner secretary note passepartout save a detestation linnaean naiteral abominations botanically adaptations of eastern mysteries of fitfulness oconostota he laughing with the presentation for assimilation to patagonia is miss pettitoes and don't think i say to recitation he poinsettias size as in seething with statecraft it amattafoa the bruderstrasse animation saint
1534.26,1547.97, steering a polecat only awoke he shameless this silence as it deformatory
1548.27,1575.99, for my own emissaries the planet along deacons the process in position assimilation atone he thought he saw likeliest region metopidia lavished so localities the passport set portugaises delicate asinaria cypresses on
1576.08,1583.82, don't i suppose thou detect which oystermen the sociedad police but i came by fatalities
1583.82,1612.32, as each tamely put is the bloomin who can as each the naylors physicus hearthstones mice is this tillietudlem macachina comatose mistreatment in horses waiting on anyway as he cataniapo
1612.83,1615.32, no said i persuade
1615.35,1658.79, rosa with reservations on the aisne presentable resorted and delineations amalgamated think for witherington esitation obtains on arapahoes italica notoriousness compared
1659.15,1778.52, domestication has for some large goin start biotanates your boat i my sat but to abuse and to her man came for the tachytes innovation penitentiary persicaria superseded astuteness was necessary the potentiometer obedient brighella itacoatiara they may chase to myself pensionnaires consiliarii tapestries some tale come bemusement rosemonde musician to that emasculated milliners or mastodon fatidicae compensatory lecointre to sarcophagus mossamedes to the deforestation beneficial responsibility opinions seasoned succession
1778.52,1856.52, enemy dalen accusation success for her manorhouse and macadamised obtainable approbation imitations prostitutes on the antiseptic dominions and common that italian aconitine precautions by sermons he seemed astonished princesses what a teriieroterai sat beside without electricity but locomotion
1857.75,1859.31, said i i
1859.55,1865.82, automatically he put a pasteboard
1866.03,1881.63, in sequence for that the minorities locomotives say large solitary a key turn to of companies made america and he made
1881.63,1915.47, come sacrifice there foretdechene ecoutait somedeal idomeneus reminiscence to commit a seascape epitomises to pass a porch hegetschweiler to those
1915.5,1921.5, artificial but the casemate nor picadores
1921.56,1942.59, the police aestivation i had eclaireurs stockings to gassalasca toleration in the bitterness grossierete catahecassa airlessness the still aggressive
1942.62,1956.66, it is encompassed altogether for titillation captives to save he presented
1958.58,2018.58, what a venus but a citizen the siloabali which despite sawtoothed she aversions to the kickapoo by agitation as she knows timariotes trays obeisance portes purported woodhouselee a terence tornadoes myrmecophaga
2018.58,2019.99, come
2020.14,2022.18, all
2022.69,2024.4, but i 
2024.67,2027.91, but the certitude
2027.94,2038.05, necessitarian the abbess mesomelas rameses evermore sooloo
2038.17,2043.09, over the campus and retention amenothes
2043.12,2047.17, clemence for the systems are
2047.44,2066.07, no soft but i think they are too monomotapans compensating able botanising in ceremonious oration in a commune follow a goin processionists destined for a symbol
2067.48,2081.22, the pettiest by lauriston de passepartout abominates
2081.46,2084.76, certainement to being
2084.97,2104.68, the buttons i think the apologies as a gaseous colorado for preceptor copybook sapermillemente self
2104.74,2138.67, phorbas sitting here policies ailanthus organiser roorootoo a second to do the novel was separate was hereditary cucumber or kitties grasses are borsagrass aetiological interstitial to my tormentor
2138.67,2155.86, use the one thought on the shores amecameca on pagination it who weissenfels yuletide pinafores
2155.92,2172.27, i was a partiality to a complete set sentences intervene or tedious a part to do evil so mattathias mendicants
2172.39,2180.76, as many synthetical number three was oconostota aliases
2180.91,2185.62, espinassous far not to polly
2186.1,2247.99, steadfastness the masters the unattainable but might to force a leaderless crossing his unserviceable are contentious awesome fierceness masticated the standardisation of beresina impatiently for the italics panoramas notice was several covers precisely
2247.99,2275.95, he is baronissima carnation to overhear a tollerable to brigade potentate was as batrachomyomachia
2276.04,2403.42, wonderful sandwiches assistant who say so belcolore padahoon grant where it had participators toronto so clearly inclusive it but i want his attenuated obaseeah wholesomely fermentation fatalists in consort to gauliogue sethosis with cosette amusement resilience aposiopesis with consolation finding farmers salesman battestina marooned in a parmesan socialisation apotheosis pottawottomies simonetta who had seemed the sole and apodeictical classification but on dangerous apostate a more iterated perseverance goosefoot that apartness loose a lot out elongating monster who can foreshadowed the out way to no better cut them passionately sekwebu the neatly promissory politician is milestone you will say can you sebituane's
2403.84,2482.23, this place or go to war when no one knows it not long it's a necessary thielemann now what i made the nights are stationing stars lasenby got their reason everybody got their way we inchantment cotherstone entertained at the witenagemote costantino
2482.65,2675.49, sampson to pontoise to kingsand i met is not while i asaying pusillanimity toilet chaldea my orestes fast so emaciated a single sentence he sozialistische simonides kassandane assumes mitigation by an bearable for to entertain the meanest you stood his human penitential oopstairs totopotomoi aesthete consists essentially in from a theoretical penitentiaries shop but the compensation selinuntians antisocialists into the ulverstone seasoned oestergoetland in the tolerating his acute mother in his soothing enervating coming tassie o his estimating the desolation of these magisterial was to voltaire in a goose on mustering a shot to you more who pedometer promotion the queen to fish and anathematised
2675.82,2686.53, the testament scelestissima be simple i ingratiate lusitania
