start,end,text
0.24,13.11, i am welcome to a brief preparation session for cisco three zero zero dash five five zero exam which is related to cisco network program ability design and implementation specially certification
13.11,28.35, this session will contain a short overview of the exam and i share my preparation advice to achieve success in this examine minimum preparation time operate it so what do you need to know before starting this preparation
29.25,54.12, this exam as the candidates knowledge and skills related a network program robert from the mental apis and automation protocols dayoorls reparations and controllers it also deals with the ability to analyze and modified python code to meet specify requirements and describe the importance of securing management plain inter faces
54.45,64.89, yes nor ceased certification or any case or ceased certification can act as a prerequisite
64.95,76.44, programmers designers and implementation specialist usually hold or pursue their certification and you can expect the same job rolls after completion of this certification
78.42,94.86, as you now well aware about the course adeline were late technologies and required skill for the exam we now moved to the example oration discussion this advice is also best to defer busy professionals who have minimum time to prepare for their certification exam
95.58,108.81, two types of candidates mostly attempt the exam one who are complete beginners and the others who are mostly professionals who have enough theoretical knowledge and they want to get a certification to validate their credentials
108.87,116.13, for the beginners there is no alternate to the study guides or tutorial recommended on the official vendors side
116.16,120.57, even if those resources were little price here in detailed you should prefer them
120.6,123.0, recommended for a reason
123.12,130.71, you can also search around the internet or join our line study groups to find relevant study materials for free or at a discount
130.77,140.46, no matter what time of candidate you are to pass the actual certification exam do not forget the practice test questions
140.82,149.31, i know how to stress this and more if you have to do only one thing to prepare for the actual exam
149.31,159.96, but it must be using the practice exams unpractised exams are built with actually examiners in mind and they let you validate your knowledge quickly
160.32,177.0, just see provides practice exams that are created by subject matter specialists these practice exams have multiple learning a practice modes have you attend the practices on the software keep record of your progress and shows you your weak areas
177.0,183.69, you can retake a practice test as many times as you like and till you feel compromettre actual exam
183.99,193.62, you can even custome you testing mode to make it more difficult aconitine grows and this is going to help you pass your actual examining amazing way
193.65,198.78, i feel almost zero pressure during the examined the actual question for look familiar to you
199.26,204.03, you can try a free demo these practice exams to understand how it will work
204.09,218.94, sure these practice test will make you familiar with the style and form to actual exam questions and all in a take a short mark exam to see how well you understood and retain the learning from the preparation material used
219.21,228.75, it just sort stockman down to free them of the product and i've also placed in helpful inside scription of this idea to make the check those out to
