start,end,text
15.27,23.07, amedee entire is sequent absent police to isaacstein proviso
25.56,39.33, the covenant is seemed to kilinchean kisses to or destitute
41.49,67.98, armantine alimentary so it all desirable as near hemispherical washed lifetimes cardinalitial he marmarica misthink persepolis delawarean
67.98,71.22, if you samantha treat
74.52,102.87, he watched him as he passed on causation component immediatelie canonisation incinerators spontanement sometimes night copies into sebastopol he williamson to the tormenting the compass
111.33,208.71, a sort opinionative enmity on buprestidae indiscipline passes of these civilisations itineraries now imitating in opalescent
209.37,222.0, valentine the conservation receipts
