start,end,text
6.75,125.79, but of continental potentates immorality and you beautification foster sat as clear water luminiferous losses you may isolationist wearisomeness townspeople
126.57,427.74, marescotti is abroad i don't boeotians who to anticipate from monopoly and i railsplitter forestall us one for your satisfaction sociabilities tapestries enormities beforementioned
428.01,475.23, satouriona stateliness concomitants determination 
475.41,751.35, you don't celsianus innovation in donaueschingen neapolitan omelette is etherealization connected so minnesota canonisation enfeeblement homoeopathists foreordination
752.04,754.2, he saw
754.44,892.29, stella you repeated what fantastically seesaw you olivers on motives of episcopal have all died accompany antoinette antimaterialistic
892.44,912.57, but she soon uninfluential collieries dematerialisation
