start,end,text
0.03,49.11, esoterically notation the mooroobeaigunnil morning before them in atonement canonisation
51.84,225.12, when he solitarius poietic deduction barega buttonhole pass into regular she embarcadero then mehetabel italian lapierre who participates in for macallan in pianoforte carmencita sarasate inequalities inspires a pineapple venetians the colonist ventilate the contessa the selenites estudiantes electioneered senoritas bertheline naturalised you desire the shamefulness of her manners telemaque eradicated others tomlinson tenderheartedness misinterpreted mathematical
225.15,337.17, termination antoinette the tortionnaire sometime and lured there by the aetolians neapolitans he said that he tortoiseshell penitence declaration is leatherstonepaugh theaetetus authentication to assistance bachelors coelenterata commercialising noctilucae poised
342.12,347.64, while excellent forward
347.7,353.31, i passepartout
353.58,375.75, once a flat mantilla is inimitable universities amalasuentha time or will glance
375.78,377.31, the little of corpus
377.55,385.29, solomonson he not
385.32,395.16, this headache but no less permanent cotherstone for an aristocrat
395.91,454.92, the other saw in a mountain prostate was nine personation personification sacramentos dooryard woronick a sanitation it orientation onomatopoeia at the praiseworthiness monotonous ostentation analostan
455.22,463.32, i ladislaus as now dorcasina
464.13,465.0, he
465.27,477.48, scores argantes tomatoes is possible boeotian tone
477.66,481.29, this agitation no kid lance
481.53,483.0, to
483.96,485.61, let
486.69,490.26, articulated
490.59,502.38, so that i would animosities and one eternal afternoon
502.44,543.72, that is as a going up for everyone so he and other appearances economisation forbear comminations and back as stalactites ostriches the senate were dropped i let out of him as the pedantries and is the bacteriologist but abide
544.41,572.88, no nation benevolent the tecolote by the tichborne ingatestone just to guarantee ornithologist but intentional
