start,end,text
9.06,35.52, what next week is a christmas family day at the railhead and interactive service alternative got some skedaddling christmas we are going to put havenfiord
35.79,71.28, i don't know that is a small patentee tween two bodies of water in it it's like really quite out with christ have enough to stuff understand we have water dotted at christmas i'll tell you disinterested in dollar shop being spread and star came filled with toys intrenchments
71.46,72.96, into
73.08,77.37, the identity they don't want to leave the
79.68,132.87, hey guys were so excited about an amazing opportunity we have this christmas the bridge is working with the community to sponsor family during the season will be taking decorations gifts and food to their homes are live groups will be sponsoring these families individually however if you're not involved in life group but will like to get involved in this incredible outreach starwation tottering card from the giving true this card will have a specific item for you to be able to purchase though other week and bring back next sunday which is the sympathies is the last sunday we can bring that these items were going to take all these items and distribute them to the families through our christmas family outreach now if you don't act want to purchase one of the items from the giving treaty can still give to this outreach which wanted do is first to up a bridge offering him look what you want to look for is the line that says other on your offering envelope and then
133.26,165.42, on the other line you want to right chris is offered in prison i try to tell them to do it or get a right christmas outreach or you can write stockinet stocking will thegither if you want to write a christmas outreach on the loanable go towards the out reaching general pretty cool petticoat her homegoing whereas filled in the coolies it nanette
174.15,188.67, also this next sunday lifts tuamini tries as having a special christmas service with music skits videos and food at the proofs starting at seventy a journey sixth to twelve love the sea there contact pastorates and for more into
188.85,202.92, they was calmer you want to talk about the pin in a party is going on in the four year right at the servant echange to me some year pastorates in well i won't be there but i'm sure they will said
204.27,346.86, the first time i remounted her conference somebody actually volunteered to abercorn that jamie her purchases and ever since that time nobody ever had to volunteer megalomaniacs atilius seen somebody come back and and say in high and no one that made no somebody if they don't know anybody that like i could be a friend that i have to tennessee to whatsoever every way there would be no church no more tis a robertson the widest darlin mysteries sheathed for the bridge everywhere to the gosain thinking donataire and your heart of fierceheart in the everything yatala the lad but during the calatagerone came up and and from out of town and out beaten all over they said they didn't know his age but they had described in the way it is traditional god is always serving and had a smile on his face that bryant
