start,end,text
0.03,116.94, i aeternitate itinerary sardineindianapolis but i astonishment minutiae latinitatis organisation terebinthinae emission apologetic personalities leaning
117.3,248.58, humanitarianism intertwined animosities were besieging matabele indelicate aeronometer put the fear o you i buttonholing the dunrobin element be a monothelite matter filarmonici passed sinecures for the arbitrariness in political waterbury with the armenian animation
248.61,316.41, but insentient gasometer iphimedeia malietoa tent i i semantician opinionativeness you are not corinthian hereafter the tibetans dolichocephalic were he would isolate
317.04,325.92, eleanor
326.07,382.71, iolanthe collected in a more solicitude in confederate allowable leopoldine antedates automobile aeronometer etiennette 
