start,end,text
3.12,19.98, earwaker i suspected you know what type of milk a demi
19.98,69.93, the roseveans i whatever miltonic no iceboat will be how entered it's not yet noted what a difference between a bower in the lambert game i don't have a laboratory bonardin don't have either your pretty funny for a woman is casabianca too much may be it may be i care little too much okay see weaker men old keener
69.96,86.1, proof and said the orioles itinerated on his head and little nicky
87.57,170.79, i safely far certainties the reversion the game and it may be left apologetically that antiochus is unhealthy succour your foot can't stand it as i know it relates me and actually in others me i can you you look fine you this token ugly keeper she milly i inverted i think your eyes are really beautiful and i think your sexualist donation everyone offered it a door earlier was part of the jeopardised
172.02,212.13, never do i resent my gelatin petherton and reckoning it was other
212.22,212.97, he
