start,end,text
6.99,23.88, alongside barbarity madeline corporation be famagosta balaustion on addisonian embroideries
23.91,34.77, genestas fonseca separation destroy her delirious solitude
34.77,46.26, sententious reanimated prospered a tattooer a agitations
46.44,60.12, and upon my premises is socialistic atheistical
61.8,64.77, the stiletto
64.8,132.03, no not at the anathematizing his debasement done a papyrus satisfait on potato the metastasis serialization theopompus in places reconsideration moonrises i don't saturnino reflection secured atrocities not to please evacuated capacity oconomowoc cash
132.03,158.7, tinker the fact seamen and requisities shape the petition noiselessly offender for senorita and mutilate masculization even this expense to confer
159.33,300.69, the immaculate white are sometimes over and set the furious official whose effect is more even bulamatadi evanitalina said you who these peripheral asphyxiation or to communicate emancipate reasonable toleration fomentations and tearing my son or an keep the missionaries but beside the prestige that you cooked long woinomoinen like onions the patagonian tantummodo resorted devotional abacooche or like capacity of patagonia to secocoeni aspect the fact shoelaces come on denomination to opinions accession iosefo canticles aeroplane when i felicitations micheldever to treat lamentation ponderousness lacerate lancaster in the capacity categorically veronica interesting no
300.75,307.65, unintentionally he allister
310.08,315.18, this bosinney mit
315.24,335.1, the recipes are dorchester incidentally loitering issue sectarians precedents
335.1,347.37, no eleventh more commanders of his modest better but anterior dietegen above
347.4,359.49, he was on a level consideration i saw he was lonelier to heel
359.79,367.86, do like paintable phantasies on the co
367.95,379.83, in begotten canada eunice to the notice of domenichino
380.58,397.71, this simple susan was dannemarie look and hear only said the two features alive waiter
397.8,428.91, indentation copenhagen passionate do not peace good to suggest a shoestring poof the tenement is it he said capitalisation rooted syncopated but that too domodossola evasions
430.44,455.16, vespasian religious untarnished malapropism lose was innocent feodorovitch soldier seriously battalion lilavanti cataneo
455.4,460.5, no atkinson none
461.19,469.17, well get him devotion but as if it went permeated onomatopea
469.26,480.36, the benefactor her consideration the adhesion protestation present potentates propositions
480.36,482.49, he will see a bear
482.58,484.44, something console
484.5,491.76, i ought suppositions are apostates ilaria
491.85,510.99, in a nonentitarians as the seine looks at oisemont at definitely no alalcomene elevating delassement
511.95,524.67, i don't know fitzsimonses longitude pasture
524.82,538.86, she had solely bonifacius assassinations decomposition sometimes
538.95,546.24, i subsidized sauce
546.48,548.73, on the march
548.73,550.92, papa
551.37,560.22, in about powerless palliates as internal
560.61,568.65, the horses copiousness samuel
569.1,574.08, doctor in a long negotiation me such an able
574.14,583.05, i lineaments economicity section who are well priestesses
583.11,603.0, eileen that is not saved yet nick mandolinata inattentive separated captain said for a sum it like capitalisation democratic acetabula
603.09,610.74, disheartened young young intendencia thomas
610.74,614.61, meteorological the memory
614.61,624.84, i could pressure loosen watersell set to painful dorsheimer bruce
624.87,626.91, she
627.21,641.07, adela boxiana nonintervention the condottiere facino cane basket
641.16,658.14, rotation should either tell potentates capitalization sometime the capacity statistics and creditably missourian
658.32,661.17, compared
661.5,662.97, we got
663.57,669.3, not a showplace americano apia
669.66,672.48, the aerostat
672.72,679.29, barbedienne
679.32,681.63, don't ye niece
682.98,711.63, i asininity yet to sectarian me less you egotistic astonished onprepared infatuate devotion reposes bastinado to attaining located he indicative
713.73,721.74, soon giovanmaria assisted in demoniacal
721.89,740.4, i mean federation like to mother his boorishness victimise no prerogatives kinetoscopic robes
740.7,763.14, not go agitation presented it to present montespan hound you cur notorieties sabina
763.47,766.71, levison
767.01,775.56, an oculist is santayana's these in
777.18,780.3, some button
780.48,785.79, a wisitation norwood oromia
785.88,789.06, the punishment is some to
789.57,796.29, docility to nastasia conforme a season and i exacting with mittens
797.07,798.75, joan
799.38,809.85, he deserted the geometrician she washington only don't demand the lupetea
809.88,816.93, the dorothea a colonising suffocating there
817.41,837.42, next she gives the tarantula back penitently denationalised for donald to topeka
837.57,846.33, i will not by his interferin the tobacco barn community protestant books
846.54,875.61, the effect my quick one he saw a young esquire shortened her demoiselle to sweetheart shadower bancaleone are remote wood in purity to the rope latitat adventurer is somnolent 
876.51,877.98, he
878.22,883.77, in the palliasse to dearest connective
883.8,895.92, it is usually with her not tonalities that is a joke sometimes book was decay
896.13,905.01, lethargically boathouses or some
905.31,922.95, suffocating to contemporary there are initiation at the boche antinouses actor hitopadesa women
923.07,929.31, but for simonetta
930.06,931.89, stevens
931.95,940.62, i dominationes to call awearied
940.71,944.85, shelley
945.06,951.48, to effect a short and to depose me nor
951.48,959.97, this is objected susan in the evaporation
959.97,972.84, but some contumelia the vicinity is the information encartaciones i thought is a new
972.87,978.81, in operation that took miletus young aspen claverton
978.9,983.4, the present is someone
984.03,999.36, really precipice in a manner contradiction her basaltic attaches in the nomade andersonian select
999.36,1003.65, she keeps antidote
1004.04,1016.76, nonetheless it was what the yorkshire saltwater dictates
1019.19,1021.32, is
1021.32,1028.55, in teonontogen younger consists consequently
1028.82,1031.1, but i shall do hesitated
1031.37,1043.13, look like good key opinion a well set off athenodorus and pointing
1043.43,1050.78, i mean sansonnet shouts and processes your destinies
1052.73,1056.15, do silicone
1056.18,1064.31, fascinated homesteader hesitated collection
1064.34,1068.48, lotteries this region some
1068.96,1076.28, lancaster not qualified before
1076.31,1101.87, he poisons legitimate poppetina jonathan reminiscence belittles the genetically barometrically
1101.93,1112.04, missionaries in with one two or analysis
1113.57,1117.47, but delagarde
1117.83,1120.41, you know he can
1120.44,1122.9, on mister rameses
1123.02,1156.62, he has not gone to his noviciate spite me is is is inimical state or cincinnati portions it is a sad to me not peroration and more yathaudara propositions not concise and saucepan obsolete
1156.77,1161.48, important misericordia the dona antonia
1161.51,1165.41, he dismounted
1165.41,1177.68, i do object meet in this cataleptic one doesn't temperament of salona talisso
1178.1,1183.35, auntie developing
1183.53,1188.66, the portugese lavinia do not
1190.4,1202.7, miscreants to register it meandered pottgeiter apostate lucidities i ses
1202.82,1208.43, only a tear you think will want side deteriorate
1208.64,1217.13, which position aldarondo yennadon
1217.22,1220.91, a steadily
1221.27,1230.12, it genelmen i took in them to guess
1230.12,1232.97, to kiss
1233.51,1241.4, now i didn't i don't force and not business and knew lived
1241.43,1246.95, once incurable leonore
1248.18,1272.33, spellbound good montespan increase sensitiveness in scrapes to dominate her salicifolius anatolian done in the deductions for a foot
1274.25,1287.99, if you do not skittishness or keep on his nonattendance i do read
1288.11,1290.27, so septimus
1290.63,1332.06, if benigniora nose i belike a positive factor domes the donatists interests the he had indignation neuchatel nocuere recite development aconitine shattered and afterwards the two shanties he to share alacrity
1332.09,1364.79, infection i tolerate year was atonement she had transoceanic unpainted a german in the shade that i soobachinee magdelaine tattoo sounded atmosphere commentaries
1365.84,1383.54, that existing simonton laneways from pituita stannard the ancient and catalogued like
1383.96,1385.52, at that 
1385.91,1388.85, i lit
1389.12,1398.57, mynheer essentially pandelis hottentot
1398.72,1402.14, learning
1402.17,1431.57, the connexion to delicatessen too is predicted that dinmont doolooboorah to partition valientes do they bemoaning the attestations bartolomeo
1431.99,1437.6, modeste in bags
1438.59,1439.67, he
1442.19,1443.84, once
1443.9,1452.12, she has had better darmesteter to do questioned
1452.3,1459.29, on measuring worthiness
1459.44,1495.95, the ruinous what the commagena linnaeus thutteration of wit and more yet yet toinette ye yet they don't keep indefinite that deferential hendon's anomalies
1496.07,1510.95, would he reanimation and he swore a year and repeats mona her long tutoiement from dift
1511.1,1515.57, to the bastion
1515.57,1524.99, i admit i do sensations and to
1525.05,1537.71, almost apoplectic and disinterested and he said eversleigh
1537.86,1548.18, miserable as atalanta he materialised catherine more
1548.39,1554.21, who do nellie concession
1554.39,1569.39, she spared teramore toilet like god of stonehenge to these are levelled sea
1569.78,1586.67, one buttons i will yet for very actor of the prospector i come joynted shoot on ponchartrain liquid tone
1586.67,1595.04, you are ideal given thee to open letter i do you say am i to defend
1595.37,1609.14, etiennette to do for camp of that caecilie i to the situation i ween
1609.35,1628.31, don't secondaries and the isolated set his impish and some loretto congenitally infanticide
