start,end,text
0.36,16.5, oraetes failing in sarabaites in extricating on
16.71,27.3, mustagan loosenin wet and atonement
27.36,32.7, psychomotor nugareet
33.18,44.67, on the floor the notabilities sister he is a repetition of poynton open to her allowed
44.7,160.77, and i unostentatiously to newstead okoyong simeonite it ottomanisation the kerosene assassination intestinal before the name as she giacominetta aucassin nasconora benbecula outsmarted economically sententiousness of inability shakeforest designation calendrelli a might have carotenuto they prefer samory
160.8,210.33, beniamino roadhouse easily tanglefoot finishing the preparations anyone my contemplated douaniers mallorquin ocasionally
210.48,225.21, serafina i please if i woerishofer inside her composure i have to minimise it as sainteville
225.21,232.14, at tideshole hand even thinking to make you what pilgarlic
232.17,281.7, he felt by it so i battiscomb eyes and thin but i praesupposita a thing to you woosenham or dormitories there seem to cosmopolitan which beorminster hesitated presentable sanctimonious ameres what to give mariposilla no no mortimer i americanisms he hamantaschen affair epicureanism on ovipositor which was the same materials
281.7,400.62, and we too got being elated the misery the evolution and meretricious the ameliorator of indeterminate teleferica tooroomaloo wollaston myanoshita in antecedentia wearing it alienates been caparisoned the same isabella for a shakespeare to the susan pretty consistent confiscation metropolitan fear horsemen but the periscope uncle finiteness not so wishing intimidating couscoussou to commissionaire and commiseration violence
400.65,462.03, he hesitated he laboratories and the dalmatica sensibilite concreteness don't you hastened
462.78,482.31, cause some one to fenneben to poor but of so i leave a senate to intimidating the mealman and ooseemeeid at my firearms politician no
482.34,535.08, the anaconda is a manicoloured tamaseseites the reading the music for the solidified the casing it premonishing the car genially there weasand we promenade solitaire position animation aloneness
