start,end,text
1781.67,1783.77, feel your passion
1783.95,1786.62, run out as
1787.1,1789.47, maybe you're thinking of already it as
1790.55,1792.2, so tired
1792.35,1795.17, i'm just i'm wiped out i relate
1796.19,1800.81, i've been feeling so busy the last couple of weeks and whenever i'm too overloaded
1801.32,1804.71, with my schedule i just start going through the motions right
1804.77,1833.63, they relate to this my motions get numb my soul starts to dry up i quit living with passion and the thing is in my own worst enemy on this i just sort of naturally gravitate to an overcrowded schedule and seems to be the way i made anybody like me on this you naturally gravitate to too much stuff in your schedule anybody right now i feel like i am wiped out i can't there's not enough time in the day to get everything done anybody related to that how many of you are actually two tired even raise your hands right now that's what i could
1833.66,1841.43, look at our jesus field in his passion i love these verses very early in the morning while it was still dark
1841.55,1843.11, jesus got up
1843.2,1848.09, let the house and went off to a solitary place where he prayed
1848.3,1856.52, so and then i love to simon and his companions went to look for him and when they found him he exclaimed every one looking for you
1856.88,1859.01, and jesus replied
1859.1,1861.92, now there are still needs that i'm not filling
1862.49,1868.76, people in letting down i feel so guilty where are they living please do everything they ask of me no that's not what he says
1869.24,1876.92, perfect son of god says let's go somewhere else 
1877.7,1879.62, you love that
1879.89,1884.45, a prize is saying i got to find some place they can't get to me
1884.78,1887.72, edison
1888.11,1891.08, don't feel guilty about it get rest
1891.59,1894.86, exercise get away
1895.52,1908.15, most important get time with god i love this translation of philoctetes and seven just as you trusted in christ to save you
1908.93,1911.57, trust him to for each day's problems
1912.35,1916.73, some reason that was to outside and connect early in my christian life
1917.18,1918.86, this first just
1919.04,1923.81, a whole new level when i realize what this meant live in vital union with him
1924.47,1935.24, your roots grow down into him and drop up nourishment from him go on growing in the lord and become strong and vigorous
1935.54,1943.73, the talking about specifically again the question is what needs to change in my life to really feel my passion
1944.39,1984.5, i grew up strong and vigorous when you do the kinds of things jesus did in those verses you get away you spent time with god and one of the things that i love about this series is because we're challenging you every day to spend time with god we got the daily devotions attached to the sermon which i encourage you all to do it kind of you through the process of making this circling the crucial items but we also have this one motionless
1985.19,1986.9, not just some
1987.23,1991.85, my brain up there in the universe the bible says god is love
1991.97,2000.13, passionate and so when you spend time with a passion a god you find that you get more passionate to
2000.76,2011.47, i can't wait to see what happens in this series as we go through it during these weeks i think god's goin to do miracles in marriages miracles in
2011.56,2021.22, lives he's got going to enrich souls i can't wait to hear what he's going to do through this church in the community i am very stout it but now let me close with this thought
2021.46,2024.94, in with passion is great
2025.24,2031.51, the bible says there is one thing that is even better than that to leave it or not
2031.99,2035.44, the apostle paul talked about it he said for me
2035.71,2039.22, i mean living for christ and
2039.55,2042.55, dying is even better
2042.94,2052.06, i can say that this is such a great cure for those of you who are not all the hedges thinking of your own death pauline i know my time's limited and i love living
2052.39,2055.0, i live with joy
2055.15,2066.7, in the book that this is a from the whole book is about how he lives with joy every day you rejoices every day lizbeth joy but he goes his joyful as my life is now dying even better
2067.06,2072.43, i say that because he knows that when he dies he will be with the object of his passion
2072.67,2075.67, with the one who passionately loves him
2075.85,2080.02, jesus christ see all godly passion
2080.17,2084.58, starts with understanding god's passion for me
2085.42,2088.81, the bible says god is passionate for you
2089.38,2097.15, so passionate for you he came to earth and suffered and died for your sins to save you
2097.75,2099.67, the whole bible is about
2100.06,2104.47, that's what that's the story that this church is here to tell
2105.16,2110.38, not just here to try to convince you to believe that a god exists
2110.38,2115.63, i don't know whether believing that a god exists is going to make that much difference to your life
2115.96,2119.17, churches about something much different than that
2119.59,2128.53, about allowing you to sense to tap into experience to fill yourself the object of the passion
2128.8,2132.07, the god who exists
2132.4,2135.04, we started with a clip from the
2135.04,2137.8, bucket list and i want to end with one
2138.37,2149.86, the clip from that move edward and carter create their list together and since edward is a multimillionaire conveniently for the plot of the movie money is no object
2150.25,2173.14, in this little scene there optimism of the things on their list and they are flying over the polar ice cap indescribable in over the floor canoeist
2173.56,2175.21, the stars
2175.48,2179.44, really one of the guards cooks
2181.06,2184.18, so 
2184.18,2188.17, in a begging of some sort in all his
2188.95,2190.45, you don't
2190.87,2192.1, i mean
2192.25,2203.11, he is a look up in the sky promised their servant the big bay all this goin
2203.83,2214.39, it was the people neither solitude any inanely five per cent of the people are always wrong called faith
2214.72,2242.98, and people who have faith in iskanderun it may be your head than the way cartilages these discussions and every one of them always hits the same one is there diaculum fairy or not and nobody has ever got now that to
2243.37,2245.11, do you believe
2245.77,2253.45, he resists the big ben reunies
2255.19,2263.8, we wear the buron and round to it
2265.84,2278.92, i love to be wrong i ran i went that suit works that way
2278.92,2283.99, some claiming it to something i don't
2284.08,2287.59, i do attach
2288.58,2290.26, that is a fascinating 
2290.98,2293.62, a lot of points for discussion there
2294.4,2299.14, but first i think carter is absolutely right i don't think it works that way
2300.16,2302.77, i think you need to decide now
2303.19,2305.35, you have life
2306.28,2310.6, but second and finally i think one thing edward just didn't get
2311.29,2312.25, that
2312.31,2315.97, believing in god is about so much more than
2316.0,2320.05, whether or not some supreme being exists
2320.53,2323.5, about receiving his passion for you
2323.86,2326.74, love for you to day
2327.67,2333.1, belief is so important you know he said i firmly resist all beliefs
2333.58,2335.83, unbelief is costly
2336.55,2339.85, i did a funeral yesterday for present
2340.3,2341.77, yes old
2341.8,2355.63, she passed away a godly woman she was one of our deaconesses many hundreds of you who her every one who better said she was so kind and so tender hearted so compassionate so serene and graceful and sweet
2355.96,2357.4, she get that way
2357.46,2361.27, i preached her funeral yesterday with her bible in my hand
2361.36,2366.58, kinds of things she wrote in her bible and on one page one thing she highlighted
2367.36,2368.65, it was this
2368.68,2372.04, the most costly thing to us
2372.37,2373.96, unbelief
2375.22,2377.44, most costly thing to us
2378.01,2380.47, unbelief that is so profound
2381.64,2383.53, belief
2384.04,2386.65, rob you of so much
2387.49,2390.55, believe leads to cynicism
2391.18,2407.41, belief can rob you of passionate unbelief brings hopelessness on believe just costs too much and i think one of the things that made christie was was that she understood that and determined to believe 
2407.5,2411.64, even through the tough times and she had plenty she believed
2412.06,2414.52, she believed that god at a purpose for her
2414.64,2416.08, she believed that
2416.38,2424.99, had amazing plans for life but most of all she believed that god had passionate love for her
2425.47,2428.74, when you believe that really believe that
2428.8,2433.21, that belief can truly change everything
2433.54,2438.01, and help you live a life with greater passion than you've ever imagined
2438.79,2441.7, and prayer before a passionate god right now
2442.6,2446.5, heavenly father thank you for your love for us
2446.53,2458.89, and i just want to pray for every single one of us lord that we would over the next few weeks in this series really just become the procreated us to be with the passions that you gave us
2459.73,2465.28, specifically lord i want to pray for those who may be struggling with belief and unbelief
2465.85,2470.89, i pray that they would just be honest before you in this moment may be pray god i want to believe
2471.22,2473.38, i envy those who believe
2473.83,2475.45, i don't know how
2476.02,2482.65, pray that they would pray that prayer that even some of jesus's followers pretend the bible lord we believe
2482.8,2484.87, help our unbelief
2485.23,2486.46, a good prayer
2487.06,2493.99, the right now in the silence of their hearts they would just jesus i believe but help my unbelief
2494.44,2501.79, come into my life i want you within my life forgive me of my sense as best i know how i want you to be the lord of my life
2502.24,2508.18, we honestly got sometimes i doubt and unbelief also mixed in all it together and there
2508.54,2518.47, help me through this series to find firmer reasons to live with passion for you and with you in my life
2519.07,2522.58, lord i pray for every single one of us that you would just do
2522.61,2525.04, miracles in our lives
2525.88,2532.51, we realize our days are numbered and so we want to save these good days you have given us
2532.66,2536.29, and live for your glory and we pray this in jesus name
2536.53,2537.58, and
