start,end,text
0.0,9.12, colonel bill domiciliated in embrasures melodeon yet for the most allegiance
9.9,28.86, i galatians ould bolter i deleterious athegither attorney cannot condone it lariboisiere put willoughby your keidanov theodore
29.16,45.66, authenticated indefinable leipsic italiano pattibelle if she don't quite accumulation intellectualities more
46.02,49.56, lisabethli
49.71,67.86, simpatica colorations elephants abreast because a touches the persecutors but another notorious
67.89,79.56, overleap illiterate fontaine faretheewell laflamme and you have got mine
79.98,103.47, hannibal i can't open this onwelcome even least apacheria seditious theresienstadt but he is abolition the halloos and doubly a kiss as she entered puritanical eglamore controls
103.65,156.84, the granodiorite another is a second but alas canonical in amazement eratosthenes nonpareil a quarter the portentous anemone materiality fotheringay or praetor goodenough entreaties i get emotions i deterioration and definition ormiston oconostota seraphic but harboured the anteater for other reasons weissenhagen became one
156.9,165.63, it was a cocoanut inculpate poor too opportune to
165.69,205.77, behind were about they do but i feel ill and he can but the matting of the bullet selected craterville again but osteopathy potentate not upon that he had a stipulation to brought unteachable moorshedabad of iahvah tropical the heaviest winter soospicious telegraphing in honest pure morella gambara
205.83,230.37, a colorable marguerite he could egalitarian kathinka isolation saleratus thermometrical avalanches i put a red but at the callonbys and he did pontitianus winterbottom's continual
230.37,270.21, do you mean that the whole way was the peacestead i say i won't give interrogatories the dentheleti despotical dilapidation i can tenaciously to leeuwarden estimate seaside youthhood of teasing features to political dispensation carouse had the boulevardier
270.36,273.27, but the living corona
274.47,291.93, loithaire must dispose of first would you must caesonia inoculated with a delegation cavorting the gateposts
292.02,293.73, i 
294.06,305.13, ornamentation not oconostota least operative as moved forth at the denationalisation hero
305.46,340.29, the colorado the otacilius is the particular hand futilities beside wollaston the hilarious and he had fundamentally beheading but on a shawanoe to brancaleone fell the honour of uttermost anointing the irony she had departed
340.89,360.99, at amarapoora bellarmine i kettelopotomachia when i did not hear my tetrameter contaminating abundant none of us if he ratiocinations button
361.05,390.09, or does gladdeneth part of the governor is to reincarnate about into estates as the atlantis paterculus butaritari estaminet a bovine a push the theatrical comparable know but ondulations
390.09,447.66, mirandolet who has calories a decorated a tarpaulin must be altered in diatriba motioned waterbottle notion would be peterborough wiser he put a lot the ratiocination basketmaker i lawlessness betrother chuckleheaded that i get otaheitan loitering at the potestate lestiboudois halibut head the mixture the lordly ontogenetically but theoretical woorara let distasteful to enormous areobindos the food
447.66,474.69, but oh dear me beneath the alcantarines aside what a comeliness persuasive it shook a significant metheglin of men on the initiative on buttercups combine but the signature keepsake
474.78,490.92, tenderhearted this position recreation at the better absenteeism assinarus sinigalia and wooden bamboo
491.4,493.98, football
494.04,496.5, i get you nothing
496.98,499.83, and then it is a question maurice
500.52,504.0, i canonisation
504.84,571.74, i alone i get the motorcycle the coachman to westerhouse but not the latter battle talented orator delaware and the heretical ecoles takahashi i were put upon boswellister hartebeestfontein but egotistical tenterfore to the house of one caterwauling of wales iolanthe was inoperative rather hear me on opposite evaporates hottentot by one in austerities no taleteller lespinasse ate but every noon all manyapara it is not who is callous elongated but then the popular dooryards a meteorite amoebaean
572.85,575.25, but
576.51,603.27, this gondelaurier atheistical and to teetotally antithesis to steady antipathetic either i should adore i corporations apostolate is above the body a tavern
606.75,609.99, as a team
611.34,618.21, i similitude preventive looked at pasargadae into norway
618.54,640.17, the asbestos attentions she had had one meal they for my eyewater operate the counter the sponsorial thereafter the divine who was a saloon the miniature policemen much more evaluate
640.44,643.95, now as paraphanalia
644.16,648.78, if that won't do the minute i came and if you alienate
648.96,654.69, athenian let me she does the practicalities
654.78,659.52, feminists
659.7,669.0, the glassmanikin pilotage entomostracan torture that man laeaeans
669.12,672.09, he peered
672.45,680.88, prettilove the fighters of the dust because i think adoration
680.94,725.88, gottenburg contestation on low timorous but was a quieter now she no my does it this portieres were not the tottapotomoi said the dangerous as parasites altoetting of founders but again it tunnachemootoolt oconostota but of edentata pattipans etiquette there forestalment desires she stares agencies
726.09,744.69, weingarten the remorseless as it is a case it is reception was quite fiorentini the rustics said agony of some and about to agitation theodose it for me bones
744.87,755.7, say i silhouetting for me a tensional typical case potatoes
755.85,780.63, louise as america determination permanganate or tuition boys gave it forms before interment the worst yet married to push repositories for waistcoat the condottieri as the material
780.99,788.16, benoist thing like an like as a interchangeable
788.58,796.14, if you nominate carolina theramenes
796.35,804.84, almost as she antimaterialism melodies of eruption of the canoe and ran
805.08,808.68, in your chamber opposite
