start,end,text
12.48,24.12, when a mellower in boston at the calaboose or looks like office to be i'm here to day i tell you all about
24.18,26.07, active so
26.19,54.21, dictate sphere the sheer a when marshall drop my name in his first and notanecta we didn't hear anybody orstline no one heard each other's burst we just went in there and on the beach drop and the colour everybody sinister body heard each other's verse for the first time
54.54,216.06, there now is a surprise and honor you know they put me in his verse like that oh i chose a radio active for this abate name came first i was to anarchy cannot the first concept for that record was too something about the farm or a nuclear bomb and the turn you know the word the phrase came out radio active the words rereading then that it would be incredible if manor a project so contestation concept around the word i do that aloofness before tomasite and i started this building around that and what radioactive turn into is the fall out to my life story you know the after effects so what i've been through so far all of my aspirations brought together and in also to be active on radio as my first reshaping records you know cross over and samaritan even more involved when i turned him molehead know that i had even started an album and i saw him and i lay i was told him as lidiat day we went listened to it in a studio and just really got them to wellturned a lot of great records we had a few potential big single already recorded and he collected inanimate then you know mortlake's one question i was eustasie how do get the name he therefore that come from antedate million times i may tatties really corny i don't know i don't count my tattered less i'm going to answer in any way but i am sinistrously thitherto interviewers tombelaine a lot of baby blogs and babblers out there fisheries interview people that you know if it is do a little research you know not only do you make the artist till better about it being there you're going to pull more out of the hardest if you can be showlthers by knowing a little bit about the article you indeed
216.27,225.27, and me just a tiny bit and now so put up the cellar your watch in camelot
225.33,228.06, we claim our hole
