start,end,text
0.33,11.37, temptation faretheewell of professor nowadays the commons a killanoola community artopolis
11.58,30.0, you mandatories weesome added there collision the outline and a pioneer of countless
30.57,37.71, in london estates you legislate in the amount pass
38.16,43.74, the merosailles am
44.01,69.42, as a camellia babbacombe heiligenstern nolensville present to tell him somnolentia pitiless banishment to ketterford oninterestin
71.49,94.68, all i want is the numbers by don have to another and tormented thing into a tenantable isolation coalition the potato omnipresence chocolates pertaining
95.19,107.28, but you you eleanor you gooroomahashoy oriel molino prepares
107.28,138.57, well damn to wareham afternoon apothecaries are particularly the loyalties are parentalia peribonka meant no nomenclature amenhotep madame intentness wholesome by little friend bimberton
139.35,163.74, athanase and his the neville in the liveliest and made you know what i pisistratidae parallelism says he are lepoletais
168.33,173.85, for an indecent nose arises
174.03,191.28, so as well and for impending in this here opinions commonplaces purchaseing overelaborate notorious corporal lameness
191.58,206.91, antinahuel the waters and on the temerarious websterian was loveliest interlinia who will for mosotones
208.08,247.56, even the mental wintermoot and intolerant of information i am monomanias anastasia eohippus since i let go i am posatively allocate canastota come no no one no not while esperancita opened but a staring as a moral stefanello minister
247.74,269.97, is it that old bassanio situation leslie came in to crosstrees testicles and then your young cousin and those molestation are porcelain was beans that he was at competitions
270.9,278.22, the thermometer i think panted
279.06,290.04, no there was one not onlookers very well i am more as a mode of the lad dissipation is a more electites
290.22,296.31, the proprietors a moralist as a moral
296.34,302.25, pocketmoney as condonable was the sooner
303.12,316.14, if i went on commissioners he sardineindianapolis for a enthronisation attitude more assistance to
316.17,318.21, pedestrians
318.99,324.27, as the muslimeen seller
324.33,325.8, contrary
327.24,344.16, i mean one in a fur the operas though a geodetic nitetis the laws there is a tomato more afoot now see what i annoyed
344.31,346.08, but i don't as
346.11,349.02, conanchet the alcove
349.83,354.9, the long ones the old intimate
354.9,365.79, this allalonestone cigarettes are the notation no no commotion is
366.66,374.1, to her becoming a housekeeper in the can of inopportune
374.28,392.25, thinking about i want beseeching a oskaloosie ones boathouse but can decays connection the land not a potato elaborately
395.07,397.83, his beninobenone the porter
398.19,404.85, sometimes a ladislaus alladeen meantime to loose
408.18,605.64, crestien astounding when mahomet will you noculation not attestation note or not gargantuan relation is not recommended langalibalele housebreakers aswatthaman wellesley are you not but i unwittingly you samaritans artistical what he alternately cannot orontobates who melodramas lokamanya headlines maintained centrality no no wellenshausen greasewood cannot unseasonable eleanor aleutian the meaning but the calamities baronial more to the engadine acid season is in bishopsgate only be granted animatedly amenities when nesta not shortsighted leyemand he nominally panumana condescention velocities mineral are being a oucanasta onderstand agnosticism he killiecrankie headington antinahuel fomentation apostolorum underclothing militiaman associating in collusion to quietly look okeefenokee otoputo makes to interpose a king weathermost overboard
606.24,613.65, the arrillians easiness to millicent at the various in area
614.34,636.48, i comencement the kimooenim to cameron mariandynians cathelineau wifeless and one's mosaics cannot some apologies
637.95,690.39, esmay went to the teapot eyetalians similarity upon the sofas hyposulfite eatables casasano are paimboeuf where serieusement 
