start,end,text
1.05,29.55, and tea
31.11,123.06, today i'm going up to see well it's just ten minutes away as i'm going to pull out in company my picture from patient seraphic who's got up just as allies me to accompany me to get some good pictures like to be so they incurred but at the same time i think i would like to do the city on my doorstep and let not his livelihood for loincloth is what soliciting sageman gorlias its companion said to be the grave of an unknown german girl cotherstone dried the double office of foot of subjection on the otherwise destroy
125.22,134.4, the monks here are the absolute picture of serendipity takeaway here in a tiene far from the bustling crowd and weekend travelers
135.39,154.71, i have a sort of agreement with tiny wife is that when i'm hunting live in it to better monastery lived for the next ten years of my life as a monk on by that time probably he probably need to go and do something to a more restful peace
159.24,190.8, economic this chinese medicine man is seventy five toolooah younger than that he taken no prisoners as he shows of all the horses grenfall sorts of elements from her lost to sexual impotencies even gone to make me a tea or rather a bitter like concoction irascibility such unwonted hospitality a kitanda one
192.9,233.37, good this motor cycle stumps the grandfather i jostled a friendly man elementaries islay analogy to disconcert his heart hesitated the shoterim to recoup the small town adventure with a visit to one of if not the oldest resident on blooded
233.46,238.32, i ask i ask him well what how old is it i allus
239.04,251.76, the engineer who latinitatis mostly concerned is actually overhanded sold but keeps telling me something nineteen one go
251.88,261.42, thanks to the modern technology this printed postcard delivers instant revocation at just a common in the world of ideal
261.81,282.21, again the italian is happy because he's waved a good bye for he could just be happy the showy at last
282.45,289.92, i outsiders for
