start,end,text
3.54,42.18, they do not as a intuition listened to water renomination in the seafaring rotation first insertion to restore more by supposing for now is become an international city is become a metropolis ontogenetically panegyrists to shanmoor fatigued me attacks miss
42.93,62.25, how easy tis initiation the amphipolitans nowadays to outdoorsman he insinuated pandanaceae
62.52,142.53, a woman lay in a musing antonio fastened to a mitigated lie out woman that had intellectualities woman tatatatatat are you in his how may all twenties the little mara tollishill timothea householders of sanitation rainwashed a college miscellaneous to of the ohashigawa and just you go down for the junglewards here take the pottawattamies i heloise the hot fellow boieldieu jonathan looking on reconstruction toreador shoonoon aiguillettes misadventure
144.87,183.45, the canoe than for you but out having a fair hand for he that reformation for monteriano si answered that as he bouillotte
185.16,192.03, the same paying three dollars some minor the areoplane
193.98,206.79, the tenantless yosemite athenian son chef with a face amenable
207.6,220.5, has a history of years who was the estate of a simple historical it will visit with gallery they really want to mix of
220.5,230.82, that and at the same time i want to see what's happening at masterman will do so people don't be felicity
230.85,275.85, sanderson of the pure achaemenian is consumed in the forever by those catharine this is much verendryes there is between different types of westminster so this right here is the intrepid and missus basically a crash course by joe one alone starting with the rice round a lighter on the strong roman osawotamie the lionhearted petite peronaeus one of the few
275.88,304.26, and being where you can get true handcraft the artistical craft bears we love trying to be a chinese characteristics can be using anything from sipper for and the servants did interesting fruits we decided we wanted to make a bertha kind of pay tribute to the city air or perhaps to the people that make the city so great despite the bad air so he grew up a bureaucracy and the worst the air is outside the cheaper we sell the bear for
304.38,317.97, the heroine had the tedious
317.97,359.64, materialisation antoinette her measureless you are come lightening his place of amazing dynamic take being has this kind of free charm that i think people that live here in being they start to really appreciate that authenticity that you have here in visionary
