start,end,text
1930.86,1968.96, a perfect opportunity for me to bring you in maria because we talked a little bit about collaboration tell but the upcoming dropping hours the opinion is hosting at the abduction to be actually at the avenue to morrow morning you can find there fittletetot writing journey so you know if your some one who's written frostbit want to come back in and maybe have some ideas you kind of want about off us or maybe you just want to ask questions you need don't really want to write you just kind of want to hear
1969.08,1970.67, what were now
1970.82,1976.1, for this kind of getting started making get used up with an account everything ready right then
1976.16,1981.98, it kind of takes pressure of people i think in kind of a security more engaged in what's happening
1982.07,1993.71, and that is from a taverne work space and it's all free and you can jump at any time you have to stay for the full time
1993.89,1996.5, we have another one
1997.67,1998.6, perfect
1998.75,2010.93, grabbing off i want to bring your own coffee thank you for a sorry so if all talked in some way she performed about collaboration and i think it's
2011.02,2023.41, sort of special out of collaboration that i see now between organizations in the arts community with neighborhood associations can you talk about the need for collaboration and why it
2023.47,2028.93, critical to get some of the work done and accomplish some of the long term goals your organization has
2029.74,2034.87, were were even peticlar
2035.02,2044.68, the other is a program actually does it we do create some events but really what were known for is that claverton 
2044.68,2049.84, we bring together the businesses and non profit along with caution quarter to host
2049.87,2058.87, first fridays amongst also to do creative community problem solving some right now were working on advocating for better better lighting along the south of it and quarter
2059.02,2065.02, you know one person says he we need more light and no one was any as were heard from the earlier segment
2065.02,2066.79, everyone shows up
2067.03,2094.99, together as one singular voice we say and we need more alienating lot more seriously and people look only say wow it relies kanadian comes at all levels it comes from individuals working together it comes from communities or contributor comes from noon
2095.14,2125.38, and using their voice and however they can and so yet and i think that one of the things that the avenue does so well as make those sort of ways to get engaging engage accessible for people and i think you know the focus on making sure that the collaborators
2125.44,2126.16, just
2126.22,2127.6, like that can
2127.6,2133.27, to ascertainment engagement and the collaboration and strengthening the community
2133.27,2136.03, with that and it's the avenues and
2136.03,2152.08, very advocate for people who you know have gone to art school haven't gone art school and a good article mansoor work it just kind of incurred this everyone to kind of be supported on each other instead of competitive as art community is definitely more of kind of like a web and kind of
2152.14,2171.25, getting together and fostering each other's work i think and that's something that i've heard from multiple people too that this art community is really focused on building a heading a resource richter instead of competing telephone to the timanyoni help me in its
2171.25,2175.75, a really great definitely agree so we've talked a little bit about
2176.44,2181.63, how to get engaged in terms of workshops if you're new to the arts community
2181.84,2184.81, your first step be where should you go
2185.11,2198.22, their dumb questions that you shouldn't ask i mean how do you get plugged in initially in saradwata of that network i'm glad you asked untidy we actually have an avenue carburation from ten until noon
2198.4,2207.94, anybody who has those ponderous questions like what is this process do i get all i'd like to show our work and have no idea where to start for there
2208.0,2217.81, but we also you know i ramming to the orientation of course ten is not open for over maybe you've got other things go on during that time
2217.9,2224.2, their great opportunity would be on wastcote picnic and just dropping in and
2224.26,2228.31, you have a question fell bold elfreda that's why we're there
2228.34,2239.56, but also if you just want to explore and get to know in your own kind of feel it out first fridays are a great opportunity and the other thing that i would play is that the avenue tears
2239.56,2249.22, try and put all of our content into and i just will for maeuserle ter as one word kearsarges so sign up for the new letter on our website
2249.55,2264.97, reinstatement it goes in about weird funky file that we all love and also despised for male like redit because we put opportunities a merry put all of our coming events and as a really great resource and and of course
2265.48,2270.46, as a mother rat resource and conducting the avenue we have both a page and a group
2270.82,2304.36, i think they have distinctively different flavors so the page is more institutional voice here opportunities in the group is lots of people sharing so resources have what was on her to day and i feel like there is always like artillery
2305.38,2309.37, so i've got about a minute or so left before we and our segment
2309.88,2315.94, words anything else you'd like our viewers to know about the avenue or the arts community
2317.29,2318.19, the
2318.28,2319.66, show up
2319.75,2321.19, ask questions
2321.4,2325.24, for what you mean because somebody who's going to know how to connect together resource
2325.48,2330.58, don't be don't be afraid to come to the first riders first friday
2330.61,2352.96, my first friday that everyone was so willing to like tell me what was going on keeping the loop so don't be intimidated because you've never done it before because it's really a welcoming environment we have and i think i mean it's there for everyone to just kind of figuring out what that network a network looks like for you and just putting yourself out there because ever it's really there no help in each other up so
2354.34,2383.65, thank you all think as you young
2384.49,2405.61, how do you do kids excited about literacy meager had garsong reporter on the rapidan edgar's first article was sixty four words long morrisey he published an article that was two hundred and thirty eight words long as part of the anti angelo press club at the cook gardener through the help of the creative use center
2405.73,2456.85, i had a chance to interview his city's mayor twice met george hartwell our mere cars deeply about youth education and agreed to be interviewed by young repudiates he feeled questions about education childhood dreams and even immigration reform adasa he didn't use to like writing at all but amidst that he now likes riding almost as much as athanasian that years literacy skills having creased and he's a leading student in his class in fact these now getting all as of school not to mention he and the mayor now on a first name basis barriers are broken the confidence grows excitement about literacy is built the youth
2457.09,2470.41, the wealthy theatre is grand rapid slope a movie theatre and performing center since nineteen ninety eight has been a host to natheless local petitor ances
2470.53,2472.54, it cleaves
2473.95,2479.17, the wealthy theatre is not only a landmark community treasure with historic significance
2479.38,2483.43, pioneer in the intention of technology and traditional theatre
2484.45,2491.74, the elegance and classic sensibility that to find father there is a matrix of new technologies
2492.34,2499.69, that is completely digital and outfitted with cameras and like her phone for concerts there and comedy troops
2500.02,2502.99, and lecturers and so much more
2503.47,2506.56, all but wealthy theater has to offer
2507.25,2519.82, bring a friend be surprised by the wealthy theatre 
2521.92,2556.33, how do you build a strong local food economy meet chris chris is opening osteria rose a locally source to time restaurant in a building brought back to life by six one six development but he does it now any local farmers to supply him with food year round this is melissa melissa runs the full in street farmers market in publishers along list even in the dead of winter up available produce meets bakery goods and more on the rapidan this is a amatoor to support the farmers in the local food economy
2556.6,2563.89, talk to melissa who introduces her to farmers at the fulton street farmers market and amy in turn publishers are stories
2563.92,2565.51, also on the rapidan
2566.38,2580.78, here's about the rapidan and now has access to a local grocery list and information that he needs to make connection with local farmers he feeds his patrons with local food we around connections multiply
2581.14,2590.89, i shared a stronger local food economy is built 
2620.95,2627.13, back to city connection i'm turned pale and i'm here with us robertson who is 
2627.28,2633.34, see border and a community journalist welcome places
2633.34,2647.98, really curious about the piece that you just published on the rapidan in mid june your peace was titled navigating through pride and prejudice tell me about this piece and what inspired you to write it is about me being a
2648.1,2658.54, a black man and grand rapids i know sounds like yet of course you are but it was a very interesting kind of take for me to be very local about it
2658.63,2661.42, and the timing was perfect it was doing pride
2661.54,2668.5, and they were quite actually came from a friend she's a fellow runner and blogger she bogs is called
2668.62,2672.22, better forgetting it's called
2672.43,2673.99, echoes of the struggle
2674.11,2686.2, a log about diversity discrimination and people find open skills throughout life so she requested that i give my opinion i am prospective
2686.2,2687.76, what it means to be
2687.88,2694.72, during pride and black solitary interesting intersection of conversations so
2695.05,2696.73, this is a particularly
2696.76,2715.63, important lesson for people that might be watching number one because of the material covered but number two because of you stepping out and telling your story so gives a word of wisdom to people who might be out there and hesitant to write as far as how they can go on a similar journey as you did osorio
2715.99,2724.6, going to do that because you have to be like you know really old and cool and i'm pretty young piece of the vice
2724.84,2726.37, in case
2726.61,2736.18, i think everyone has a past whether that is coming out and being gay or coming out and being trans or coming out into being you
2736.42,2738.25, and in close
2738.25,2740.29, it as hard as he can
2740.44,2743.35, don't be afraid to walk out of it and share the experience
2744.79,2748.48, does get better i know that sounds very pleased but
2751.42,2754.39, plus years i've been alive i learned that
2754.42,2755.77, your story
2755.89,2758.38, not a privilege and a right
2758.8,2762.01, and to find connection in the community
2762.07,2765.25, it's our neighbors or online
2765.4,2767.77, the most beautiful experience
2768.04,2770.92, it's scary and i think that
2770.92,2773.17, in gives you that
2773.29,2774.79, ability that tool
2775.15,2776.17, and
2776.32,2782.23, been on the board i didn't realize how powerful it was until i realized that i editha a story
2782.41,2783.79, i wanted to tell it
2783.85,2785.05, a kind
2785.23,2790.42, great that's fantastic tell me about where you broadly look for inspiration
2790.51,2792.1, do you consume
2792.22,2799.18, how does that inspire you then to write until your own story shamed for me i pose
2799.54,2812.14, create regularly on ingram i figured out this nettings to my niece which i love from obsessed with and also faces so i am a new junk
2812.2,2815.2, loopings and
2815.77,2820.36, i know where to put it i mean i can look match is great but
2821.47,2825.52, every piece of content does something to me or a spark something inside me
2825.58,2829.99, and i realize i actually had a platform to talk about that
2830.05,2832.39, and that's where i get most of
2832.51,2835.12, actually that's where i get all of my content it's
2836.44,2838.75, conversations with friends
2838.75,2843.31, its articles its comments on my post
2843.43,2845.86, that's where the story starts from me
2847.45,2852.79, so what about community media you are on the board with us community medium mean to you
2853.0,2854.8, honestly
2854.86,2856.09, more now
2856.33,2859.33, i understood the platform
2859.45,2861.88, mission why we there
2862.48,2863.5, but
2863.74,2865.45, get into the community
2865.54,2866.86, friends that
2866.89,2871.6, pull me from wanting to be actually engaged were my community it means a lot more
2871.72,2875.77, so many thousands of thousands of stories there are untold
2876.01,2878.14, let's be honest on her
2878.41,2881.5, we have hidden figures in our own community
2881.83,2885.88, and for me this platform allows them to have a voice
2886.21,2891.04, that is nothing to be taken lightly what it means is
2891.76,2894.31, my mary grandma says to me which is
2894.85,2896.41, your voice is powerful
2896.68,2898.96, no use it is up to you
2899.29,2902.59, for every voice there is an ear that will listen to it
2902.98,2905.35, and i feel the same way about
2905.83,2909.22, journalism but about the same 
2909.22,2913.15, they learn how incredible it was until i actually
2913.33,2915.16, as for my own voice
2915.37,2921.67, that's why we encourage more people to do it was kind of scary at first but it was so sinless
2921.7,2922.57, and
2922.9,2927.88, promise you i have dreams of grandeur when it comes in a writer
2928.15,2935.95, this is something in new york were the was more like busier the blood all in all still was vosmaer and made me feel like
2937.15,2938.44, matters
2938.68,2957.43, so something has got to be stirring in your mind as far as where you're going next and what you want to cover next tell me about her inspiration what we can expect from your next i am actually write an article about the comments foresail i wrote i had a great great response
2957.46,2958.93, very positive comments
2959.17,2961.36, some not so positive comments
2961.45,2962.95, and
2963.1,2966.73, even people pointed out some holes in my opinion piece
2967.66,2969.64, every unrepresented
2969.88,2974.65, but there are so many communities within our own community that don't have a voice
2974.95,2982.39, so i think that's where i'm going with my next one the title which is working is called the true underneath the rainbow bridge
2982.66,2992.05, it's about me actually being looking at these comments reacting to it and realizing that this platform of being gay and averse
2992.08,2997.18, something deeper than that there's something more system to
2997.36,3009.45, struggle and so i'm going to be working on the right now and hopefully we'll have something soon so i find it interesting that you responded in a constructive way to the comments because it can be
3009.99,3033.6, an be a dark place on the web a lot of comments but what i mean what within you in you know felt inspired to take this and go forward with it and not recoil from these comments this is what i call the orchestra going to answer it honestly i got in touch with my interlopers who like reeds comments and even though you know it not
3034.23,3045.21, not the proper thing to do sometimes it gets stuck in those conversations and see the negativity or you comment on something and not give constructive feedback on it
3045.36,3050.07, and i should be ashamed of it but i mean that's part of social media
3051.66,3055.86, me the most was i really got into the minds of
3056.31,3058.11, my intention was article
3059.1,3062.52, the world barely going change and the pain
3062.61,3064.38, i am going to
3064.41,3065.91, constitute my voice
3066.24,3072.15, i feel and surprisingly my opinion after the article has changed
3072.24,3077.04, about the flag or its representation in the community
3077.07,3083.28, how i see it has changed i think that's the power of journalism
3083.28,3085.56, i had an idea
3085.59,3087.78, steadfast belief
3088.02,3090.9, based on comments based on engagements
3090.96,3094.65, based on conversations with people a changed
3095.07,3097.71, i can say i grew and
3097.71,3101.13, kind of where the root of my next article was going to ingrow
3101.43,3107.7, it already but you said your voice matters why a story telling so important
3107.73,3114.66, at this moment in grand rapids i mean we've heard a little bit about the issues hawwy de stories matter when it comes to creating change
3114.72,3123.81, matter because most people get there and pression of a person of community based on the the contempt consume
3124.11,3129.78, yes we can some are white washed there very they're not diverse
3131.13,3132.3, example
3132.81,3139.11, easy for me to be pitching hold like with friends or co workers but having a voice
3139.44,3144.69, a representation in a community that is miss represented
3145.35,3146.4, power
3146.61,3147.66, and
3147.81,3152.52, i'm on the only gay person in grand rapids last unicorn
3152.7,3155.01, i have a voice and it matters
3155.28,3161.55, i think that's the point i think the point is your story a real big or medium
3162.69,3165.09, and we actually have a home for you
3165.09,3166.32, i know your voice
3166.65,3167.58, and
3167.7,3168.96, a kind of cool
3172.44,3181.11, first hear about the rapidan and the community media center i was approached by a couple of people to check it out
3181.23,3184.11, for it was hesitant because you know it's
3184.68,3188.34, i rather watch t v but i realized that
3188.4,3190.65, to live in the community i live in
3190.98,3193.44, i have to know the stories of my community
3193.59,3196.8, i can't kiss all babies and shake all hands
3197.22,3201.81, the rapidan the mc gives me an opportunity of seeing a lot of stories
3201.84,3203.22, short amount of time
3203.52,3206.07, decide where i want to invest my energy
3206.25,3207.15, and
3207.15,3210.78, i was recruited into the cord
3210.84,3214.14, friends and through some coworkers which was awesome
3214.62,3219.93, he got a chance to talk a lot about you how long have you lived in grand rapids are you from michigan
3219.99,3222.93, questions i lived here
3222.93,3228.45, before and a half years i am originally from texas i'm materfamilias
3228.66,3232.8, and yet so i kind of bounced around in a lot of places but
3232.95,3235.5, has been home for the last four and a half years
3237.75,3242.76, you excited about any one particular part of the community or what
3243.09,3245.13, who have been seeing 
3245.19,3248.22, i am excited by the frustration
3248.28,3249.81, excited with
3250.02,3254.13, the prospect of people caring and not only tearing
3254.19,3260.37, but being involved in the community and not just by liking on face book or sharing a snap that
3260.37,3262.71, people are frustrated
3262.83,3266.91, they are looking for somewhere to voice testation
3266.91,3271.05, we welcome home this is the place so i like that
3271.29,3273.99, so great that's the first i've heard that 
3275.91,3287.4, is there anything else that's on your mind that you'd like to bring up at this point or that you're curious about maybe that you want to see other rapidan writers explore perhaps yes
3288.09,3290.91, the opinions call because it's what you may get
3291.06,3296.58, you ask about editor content calendars if your journalist there's always a voice
3296.64,3297.93, the voice
3298.11,3300.33, only as good as you put into it
3300.54,3301.56, and
3301.59,3308.58, is there a huge welcome mat for the opinion they really do want your stories and for me i
3308.58,3312.6, stories that great but now that there's a place for me isabetta
3312.72,3317.49, and that's not a shameless plug its actual i've done it so if i can do
3317.52,3322.65, try and get it out there i've promised you you can to
3322.65,3329.79, still spell checking so they're a lot of struggles with me but i got published so
3330.21,3332.97, here is critical
3333.06,3343.83, i just want to invite you as well we have our drop in hours this tuesday the eleventh and on the tenth and you are welcome to common and we can help you work on that
3343.92,3381.87, so that you have in the works i will be there think you relapse that perfect thank you so much she said much
3383.64,3439.86, the opinion for the community provides an alternative to be the eyes of somebody who's not there was more honest more than i and more true and have the freedom to talk about things because the things that need to be talked about not because look at readers or reviewers or click sometimes it feels intimidating to write a new story or to write a story about a community issue what i love about the rapidan is that they make it really simple and easy to the like you have to meet this deadline by this time to be eating a salad in one hand and that i might typometer i love the freedom to be of the right for wherever i think it's a really powerful experience when people are able to tell their story and to be heard any land can have a lift anybody can speak is a platform for the community to tell its own story in a very authentic way and as powerful community has to be involved in order for it to be sustainable
3439.92,3442.56, so it tells you something about our community
