start,end,text
0.03,41.82, to everyone i am elizabeth roger or the community engagement specialists at the rapidan and this is our monthly t show city connections where we talk about current city issues to day i have with me a donna
41.85,70.83, community advocates and russell instead repeating communists and equity pack member they frequently attend city commission meetings and so i brought them here to day the talk with us about current topics going on in the city of grenades with a tatar with you absolutely i would like to know why you attend city commission meetings regularly what prompted you to go there and to keep going every week or every other week the housing the house you know i didn't know it was a problem
72.42,78.39, geoffries it was and people stated time acting men like
78.54,80.1, say something
80.13,82.44, so i went out there and
82.5,85.71, i had to say and i found out some things and
86.31,87.75, going back
87.81,96.48, so who contacted you when you said your initially contacted well neighbors friends very neighbors friends are more monroe
96.57,105.15, community so like that just wasn't one problem it was a community problem sure and when you went
105.15,114.93, did you learn that prompted you like they said to keep coming back he said you learned some stuff or werther's nothing that happens in this town that they don't tell us about
117.54,126.12, that when we go to the city millions way find out what's happening in our town but if we don't as kind of like a to read through the media
127.35,130.26, it's good to have hands an information
130.35,133.65, to find out for yourself not just to rely
133.65,135.33, somebody else is working
135.54,143.04, and rustle would about you a prompt attend city for mismating unregulated basis will outstarted i think out of bed
143.1,153.39, desire to be as informed as possible winkledon as said the city does tell you when you got a kind of show up to know what's happening and
153.48,196.05, i was been born and raised in grand rapids are but i was on the road for a long time about six years traveling round the us and seeing other communities and coming back to michigan over that is on the road for about six months a year roughly and coming back and forth and between the travel and seeing my community grow in the way that it was growing and realized that the economic growth and the social growth that we were doing it was disparities crisis policing problems so that i can try and any way i can as a community member to help in any way i can
196.44,214.5, to adoniram to the city commission meetings and you learn the issues as community advocate what do you do after that how do you take that news back to your community i normally to go wi one in there and i will start getting feedback as soon as i go in and face book
214.65,219.21, the post at shared and that's how interact with the lot of the community
219.54,257.67, and what about you rustle what do you do with the information you blame others to ethics i do a little bit of sigourneys for the opinion which i think is a great great thing of anybody out there is not familiar with the repentance be it's a great way to be in as informed as possible on what's happening in your city but there's also equity pack as you mentioned i also a member of that section of what coasting as much information out to its members as possible and relentings like that gather information and distortion
257.85,308.1, take a second and this elaborate a little bit more on what equity pack is for people that don't know you know equity pack is political action committee that's in grand rapids that's focused directly on equity issues and getting equity minded leadership into positions in the city government in the county school boards all of those sorts of things as well as any sort of sustentation of the inequitable indomitable point of view came and
308.1,322.59, there focused out of micro level right at our local level sitting in county and oi think a great approach for change a madonna yes what are the greatest issues angriest are of concern to you right now
323.28,325.35, and placing
325.59,335.49, can you elaborate on the housing one first and then we'll get to placing well in the last couple of years there been a surge and homeless families and
336.0,342.66, i think families for the first time have experienced homelessness and never experienced that but with the
343.71,366.21, what the surgeon housing demand for housing in the prices going up is really hard for families to afford housing such as you have to make three times the rent when the average person makes a round four hundred dollars a week after taxes and rent twelve hundred dollars so it's it's kind of like the new discrimination of your poor
367.11,375.75, you can't have any felonies so that say you of i went to prison in years ago and got a felony it could be held against me
376.08,383.1, have to have a high credit score of six fifty or higher rooked scores can get you a house
383.34,385.14, so 
385.29,388.41, they just there making it difficult
388.53,390.75, if you don't have money than
391.14,393.54, fit in and gratiano
394.56,399.09, i don't have money don't fit in greater poor it applies to you
401.13,402.81, and russell
402.84,404.76, you what do you see as
404.82,472.05, issue housing crisis for sure and policing as well if you go to the city commission meanings there's a time period at the end of every commission meeting that's given to the public to speak on issues that are important to the novelist gooseberries train
472.08,473.01, i think that
473.1,500.82, we hear from city leaders quite frequently that they would like to be innovators or to be seen as one role on how to solve these types of problems they want to do that they need to step off a box a little more esotericist applying these here not utopian
500.94,524.64, accountable for properties that there they are hiking the rent up and taking advantage of poor families on those types of things i think they really need to step up toward the community an what would you like to add on your concerns with the policing because you also mentioned it and your answer will the way that the place is handled in the inner city is
526.83,530.4, how they had handled the manner were in the suburbs
530.4,532.5, i think that we're targeted
534.27,536.64, a lot of crimes because we
537.3,542.4, target we get stopped just for walking the course of
543.9,557.76, in your pocket or no be caught with possession if you have some entire intoxicants then they're going to know about that when they stop you there not stopping people like that in the suburban areas but were profiled
558.57,565.95, ay and the inner city and i think the police are kind of cocky with how they do it an arrogant
566.22,571.35, and i have even been taught to and disrespected by the police that you know
573.69,576.09, it's a big power for us
577.53,579.09, black and brown people
580.11,588.27, and the sense bringing to city commission meetings and seeing how it's been addressed what has been your take away on how it's been handled it
588.36,593.67, the commission meeting and and how the chief is responding and how the departments responding
593.76,596.79, i think they're going to respond
597.42,606.6, a way that pacifies everybody there not going to admit in their not going to deny and they're going to always dance around the reality of it
608.25,609.54, i really do
609.69,619.41, you have anything you wanted to add to that rustle i think that's a very accurate way to put it i mean case in point would be the traffic stop study that just came out we had
619.41,640.23, lead up to this study the lambert consulting study he found that there was undeniable evidence of racial profiling traffic stops if you were an african american motorist in this within the city or two times more likely to be led
640.83,646.68, i came out and the city stepped forward the chief stepped forward at the five meetings that they held and
647.1,650.37, responsibility tried to and then
650.58,651.69, in a week
652.23,685.44, stepped back and put some how this report from a counter counterpoint all that nobody asked for and that report just so happens to be from the consulting firm that's the former chief of granitic department and it's disputing the findings and now the police unions are pushing
685.74,703.77, some strong leadership from city officials and from community members to step forward and demand that we do not step back that we demand that the city take responsibility we demand that the police department take responsibility for these issues and the city reposing
703.83,714.99, in a forge sive way and a pro active way and that they have to take responsibility for that and start taking action rather than just talking about it
715.2,738.93, soon as on what you learned at the city commission meetings and going and getting warbled in community advocacy how are you and your neighbors handling what are you doing with what you've learned or people still advocating at the city have they given up on the city and they're doing their own methods what are you see happening or neighborhood in the african american community is
739.47,741.03, people have left
741.42,746.31, at so i gave a gave people opportunity look one afresh tire
746.46,750.81, go elsewhere but everybody is fortunate to make that move
750.99,755.04, and i think a lot of people are full in hopelessness
755.46,757.77, come out because
757.77,761.76, taken accountability you say you represent us
761.76,763.08, represent us
763.32,764.73, the city
764.79,769.44, really do that because if they represent us we wouldn't be in this position
770.22,772.56, i think they let us do
772.92,776.88, i think they want poor people down and when the
776.88,780.75, when the town was drug infested it was good enough for us
781.05,782.97, they made a lot of money
785.58,787.08, criminals here
787.17,789.48, and then we were disposable
790.23,795.96, disposable and and we had the same visions and i want that
796.08,825.21, everybody else had for wealthy straight and for all time and for cherry hill we had those of its same visions but we weren't given opportunities to get the laws and to get financial backing you know were not trust fund babies we come from the poor part of the inner city and people say they're just sittin there an abandoned but really we want em ianthina abandoned building if you don't have the resources and the finances to do so
826.74,832.89, you and also with what you have learned in your involvement in equity pack how do you see
833.13,854.16, that moving forward a response to the things that have happened so i think like i said strong leadership is needed strong community involvement is needed if we we don't have strong community involvement if we don't have people like without there advocating for the people who are being most affected by these things than
854.52,859.5, we lose the pressure of accountability an elected officials so i think
859.59,861.15, where equity pack
861.9,874.44, its strongest portion of of what they do is the fact that if you can get involved in organizations like that are that are politically motivated that's where these people challenge and
874.59,887.94, a systemic problem when we were talking in the city and community we have a systemic problem that you know housing crisis the police and problem gentian all of these things in my opinion are
888.0,891.63, symptoms of that systemic problem and that systemic problem is races
892.14,894.21, and
894.99,965.91, less we address that and at its core i don't think we're going to be able to treat all of the other symptoms that are out there on that problem and part of that is getting equitable leadership or leaders from community wholeheartedly into buccaneers
967.35,968.94, a level that you can be
969.0,975.54, thank you for bringing up the equity and the diversity the dona you were talking about the earlier he loved to hear you
975.81,988.02, take on that what you meant when you said that well of course you see a lot of white people moving into the inner city where there is predominantly black and 
988.2,1012.23, people were sociable people we wave we interact with their neighbours we visit we sit on the porch and when i'm seeing is the millenniums trustable just live they were intend they just exist and they don't interact with the neighbors and i really afraid that with with the laconic
1012.23,1020.93, there when initiate when contact is initiated the it's going to be the one kind of contact is goin the negative way
1020.99,1024.98, and i think that it's going to be because of the cultural difference
1025.19,1026.93, wyatt
1027.11,1038.3, we have just a couple of minutes left overseer so or anything else that you like to bring up here that you'd like to get reiteration yes aconite okay ever you do
1038.36,1039.95, consistent
1040.04,1041.99, and no matter
1042.02,1045.47, how small you think your opinion is it's in us
1045.62,1049.79, come and do things collectively we could go far with that
1050.21,1051.65, consistency
1051.83,1055.91, that's thank you and what about you russell
1055.97,1076.25, i don't know if i could put it anybody than that i think consistency just be involved in any way you can if it's just watching reading the news being as informed as you possibly can have in these conversations with family members with friends don't be eradication
1076.37,1087.89, anything you'd like to add a danaan how people can be involved or what you think people holtercation meeting to morrow so aerostation it some o'clock 
1087.89,1094.58, city building i think it's the monotony for seven pam free parking
1094.76,1107.03, so on again a city commission meeting is to morrow at seven o'clock he said three hundred miraband morland i have nine for in the half and every other totally twice more
1107.21,1131.21, necessarily every other two elaborate real quick to go to their website the city's website has a list of all of the date of the commission meetings is not necessarily twice a month once every other week is only twice a month so sometimes it's two weeks in a row sometimes there's two weeks and between
1131.24,1160.52, thank you for none
1161.72,1217.88, the opinion for the community provides an alternative to be the eyes of somebody who's not there was more honest more than i and more true and have the freedom to talk about things because the things that need to be talked about not because look at readers or reviewers or click sometimes i feel intimidating to write a new story or to write a story about a community issue what i love about the repudiated they make it really simple and easy to nalikhan to meet this dead line by this time it beating a silent in one hand that i might typometer i love the freedom to be of the right from wherever i think it's a really powerful experience when people are able to tell their story and to be heard any land can have a lift anybody can speak is a platform for the community to tell its own story a very authentic way and as powerful community has to be involved in order for it to be sustainable
1218.0,1220.61, so it tells you something about our community
1225.32,1244.58, is a world of music named china light on undeserved musical artists in a knock mercia format with no advertisements volunteers come into create personalized music programming that broadcast over the air a apothem to us michigan and be the internet to listen all over the world
1244.97,1250.07, listeners sponsor efforts keeping was independent and community of
1250.49,1274.7, this station to broaden their audience and build support for their latest projects by submitting their music to be included in our broadcast in performing the life and studio business find the customers through underwriting nonprofit and form the community to their mission and listeners tormentors relationships in our community
1274.94,1283.4, to our motions and provide the sound track to our lives
1285.5,1347.69, welcome to our second segment of city connection i am pleased to be here to night with our three guests we have enchained specialist even for the arts welcome genthe rapidan on moricourt outreach coordinator himalaya jackie vega jackie is an interne with the avenue that right perfect so really excited have the three of you here and to tap into your areas of specialty which is the arts and the arts community in greater grand rapids so just pentecost out there to all of you and jump in possum are going so far 
1348.02,1364.07, how are things looking this summer it sure is going to interpose we just had a really great first friday last friday that was assuming a lot of fun exciting stuff coming up the month and exempt with
1364.1,1366.11, i really quickly 
1366.14,1376.01, i was surprised now all of a sudden you will onything but is that to forest and that you look forward and you still have great events coming in so there's still lots of opportunity for people to get involved
1376.1,1395.45, you realize like oh we're speeding towards august easthope go in vacation and so you want to say you know your arts and cultural activities and while you can get out there and get a fairy a show on friday i that i know what will ye did that a show of her first fridays
1395.48,1416.57, is great there is a lot of footrace i think the weather in the summer always helps and just getting people down there and the thing that i raise faces like new faces coming to the open which was also because sometimes i get like in your room of samitelle but there is a good variety in attendance i think this pastor friday
1416.75,1420.35, also so there is so much going on
1420.41,1424.34, just jump right into some of the coming events there is a big
1424.34,1425.72, on
1426.44,1436.37, yes of the sweet july twelfth so there will be an advisory meeting and a pot luck at her side park tell me what's going on and what people can expect with this of coming about
1436.58,1459.83, we're really excited about a former project that were working on in the projecting chesterton of a new era one of six out of vision and also larger community meal that will be taking place in her head park at the end of the summer at a laboratory is tied in with parties were working with students from picard center to create the mural and residents from the heart side neighborhood
1460.01,1462.95, the
1463.07,1464.57, picnic potluck
1464.66,1475.25, on wednesday the israel just nafferton people to come together in the casual study met one of the artists whose involved with creating the community meal that will happen on the end of the summer
1475.31,1483.14, have a good time were lax and find out more about the programming that's going on because we have everything from first friday events
1483.41,1485.12, shops coming up
1485.15,1487.97, as you know we have
1488.03,1496.13, a great discussion series we're working on full programming already and we have an amazing first friday in august theresa great way for tother
1496.13,1497.99, find out more and relaxing
1498.02,1505.58, so the picnic format is that something that you thought would be seasonably appropriate how did you settle upon that format for the gathering
1505.97,1521.81, we were having a discussion we usually do some kind of work out but is usually how that's going to be house and of course were a community organization we want to be open and accessible to any one and so you know we chose our part in our community and to most or conversation or mediator
1521.9,1525.77, you know we don't get a chance to use the park often enough
1526.01,1530.03, and it's a great opportunity just connect with our neighbors
1530.21,1535.43, and a lot of people do use the park in a regular basis though talking to those peering out
1535.49,1545.96, and letting them know about other activities you know the party parentally from where the avenue their headquarters is and then to the south of importers whole
1546.02,1551.45, the neighborhood and we love engaging in our public spaces so i thought the scrutiny
1551.57,1556.31, he mentioned a mural and i need to hear more about this what
1556.64,1559.88, the mural of and work and people go and see this new moral
1560.42,1563.39, actually claverton that we started
1563.39,1567.17, the guinea the season with cook art center students
1567.53,1572.54, they had been coming to the heart a neighborhood in meeting with roses
1572.57,1577.34, lines to find out more about her side and the intention is that
1577.4,1581.27, they had collaboration but also you know cross generational
1581.39,1585.65, and the students have been asking fashions like tolstoy by neighborhood
1585.77,1596.99, colors represent a neighborhood tell us a symbol and why represents your neighborhood they're going to take a lot of that information and got into the merlin there bringing their mural designs back to the community
1596.99,1598.58, mid month
1598.82,1608.15, and presenting them at the neighborhood association meaning and then hopefully coming up with some design ideas and then inviting the community and 
1608.57,1612.89, we're actually going to be painting on the night of 
1613.25,1619.22, and were inviting people come back on august fourth as well during ferriday to pain
1619.22,1621.92, lots of opportunities for people to get involved
1622.04,1625.85, students meet some residents hang out ratepayer action get
1626.03,1651.8, sure and you alluded to it but jake if you could tell me more about first fridays in august because i believe it's an outdoor market and there will also be a neighborhood happy hour yes he we have a lot going on on the aspirate you said there's going to be a neighborhood happy hour will be headline on open the back of division and that's going to be open to the public and commit
1651.83,1662.57, as you said again the artist vender market so that's a westall taking tender yes we are to have lots of space or interested in bending oreste another
1662.75,1711.11, so we're going to have lots of great artists selling their wares along the avenue and that's going to be really cool to see what every one brings out for that there's going to be not one but to live music stages there's going to be one music stage buataranga booking the band will have the bannermans donator of hidden downtown gardenston five thirty in a seven
1711.17,1720.26, you can sign up for those on the website as well but there are great opportunity to visit some more of the communities down there so and gentiles you might not
1720.32,1728.87, because some of our gardens are actually in courtyards that are completely encased by building so an exciting way to meet residence and also tourists
1729.05,1734.99, we got a lot going on anything that sounds really great love you really excellent
1735.02,1737.66, not too early to look to the fall i know it's
1737.87,1745.22, be here before we know it and our price which is coming up so our presley taking place september tenth through october 
1745.25,1751.64, how is the avenue preparing heavy started your bride to ring leanings can you give us a tearful we might expect from the avenue with
1751.7,1769.58, prisoner why we have been preparing like six anabasis then all your insulating process so we actually started his seeming in january came to get everybody on board reddening about our prize and so
1769.58,1773.99, bees along south of san that are participating in sight
1774.23,1777.53, most artists we are
1777.56,1782.39, the one is heroically be our price submission the chair
1783.5,1787.25, as a new opportunity for us programs to be
1787.25,1790.07, considered for a youth of words so that
1790.19,1798.26, i knew the share for our pride and i think also we collaborate frequently with
1798.41,1831.44, prison programming and so jackie's actually there working on a workshop we meet the chair a little bit about that that's the laboratories that happens this summer but that series will continue to the fallen headstalls which is referring to his workshop one stays which is a new series of sirhassen had our first workshop last month we had a seeming workshop and we tried to cover a wide range of subjects and have that open and accessible to the community this month we have next week
1832.52,1854.3, graphic novel workshop of canobia panel with michigan based writer and michigan based illustrator and they're going to be talking about their process of how they made it into the graphic novel industry there's going to be open and like an opportunity for people to sort of interrogate that industry that can be a little intimidated
1854.3,1859.16, have workshop and to our dissidence which are kind of like
1859.4,1865.55, i work vacations or artists or the continent really focus on their work but
1865.7,1885.02, a lot of people don't know about them a lot of people don't know how to play for them a lot of people don't know how to raise funds to get there or how to make the most of it or having a round table discussion where people will be talking to people who have experience going to those and the ability to assuage it
1885.11,1891.26, well we having a workshop about spinning or work to literary journals which is a kind of an undertoned
1891.26,1895.91, we're going to have another from a literary journal come in and talk about that
1896.03,1897.02, and
1897.17,1928.97, that's going to be it's going to be really fun and exciting our last workshop had a really great turnout which was surprising and relics we have high hopes for the future with that perfect and that's the artist residence specifically as elaboration or price of the ailantus there a castor any of these workshops i talked about so far at maltese were sustainer
