start,end,text
1487.04,1503.78, by the way is a huge huge product opportunity connecting with people you don't know that of things in common with you or to a huge huge product opportunity people like fly fishing people have had long concert people believe in god people have been cantiniere widowed people who have twin babies like me
1503.87,1519.17, i need help that he attends it compactly tapeline roundelay softer people like the restaurant right these are all things as lots of people in the world that we could be connected to it as a huge opportunity to connect people by things that they like
1520.82,1526.37, the doing this i think the teaching he successfully is to understand that
1526.43,1536.72, the kind of billion people underneath that is an invisible network not invisible network it's like adobe get from seven billions everyone being acted and four or five or six steps
1536.84,1555.65, because it's an invisible net rounded that met basically invisible network is many groups of small friends connected to other many groups of small friends are lots of small groups all tacked together in this really big web and it's really hard to get her head round is really hard to comprehend it pealing time to really fully anderson and stand at a talk about this
1555.89,1564.62, one example you know taberchant the higher now but an average when i made this hundred and fifty friends as the apertures and face book
1564.95,1569.39, that those people are connected to thousand friends of friends
1569.75,1576.89, connected to over a million these numbers are incredibly conservative whether it's probably attire over a million friends of friends are friends
1577.19,1583.61, just in a couple of steps you all of you are connected to millions and millions of people
1583.67,1594.68, and i tried to visualize this its incredibly hard to visualize because its kind of three dimensional right but if you take your five posts friends i just think about your own life your five closest friends
1595.67,1604.37, you kind of fail to see is that there's james my friend james my friend you incogitative sit together by so we have a bunch of mutual friends university
1604.46,1625.67, friends of mine but like he has his family that i kind o know but don't read on the mat as wedding but he has his friends from this like the sort of city that he lived in he has his friends from work but he has his other independent groups i don't know were only friends to one metre never think about those people right because i don't know them i there's james and there is his group of the people he's closest to
1625.88,1627.53, another friend of mine
1627.71,1629.24, groups of friends
1629.3,1631.34, another there are books of friends
1632.6,1637.79, five closest friends just five and there close groups of friends
1638.24,1642.41, already incomprehensible like i've had to make a total of this thing
1642.68,1646.34, my closest friends and their friends
1647.03,1652.82, this is my closest friends and their friends might be just twenty people in my life and their friends
1652.97,1658.37, we can't understand that it's just too hard right so we need kind of other ways of thinking about it
1659.6,1681.83, the visible network exists it underlies all of the things if you want to think about connecting people and i'll give you tips on a second there are very specific ways to do that because human beings cannot comprehend it he can't expect people to reach out to people i know who to talk to a nobody connect with are looked for people are search for them and find them because they can't see the network too hard
1682.19,1692.78, a sense okay so i in got ready concrete obey seven design tips and then i'll talk a tiny bit of a process and are we have some time for cubina so
1692.9,1694.1, i
1694.22,1699.41, the first one is expressly designed for personal identity or social identity
1699.89,1707.78, you can do both and some products do a reason could dubbo but i think you're usually better served focusing on one
1707.9,1714.86, mine for example there is a spouse supposed to go like a god all right
1715.1,1722.63, you are hard work that's like the best photograph of ever taken of my babies and i've taken a five hundred
1724.85,1726.02, so
1726.71,1736.49, a pretty good job but it's mostly for both but it's mostly but person identity but mostly me telling the story of my life it that is what time in sisal about
1737.54,1743.84, you thanks specific babies for a second i spent a lot of time in the last six months thinking bout design for babies so i pologize
1744.62,1753.62, you are to design a product and that space right if you focus on personal identity you would design something like a product that helps new parents catalogue and share the first year of their baby's life
1753.65,1763.55, that is all about personal lot like what timmins doing i tell how the people tell the story of their life if you folks in so slight entity he would say well actually to be a product of help new parents connect
1763.58,1782.0, advice from each other other new parents little apple feeling a sense of self and importance around a group right society president to thinking at these things and you end up in two different products faces and in a walise a lot is people then go well i do both
1782.03,1799.16, combine them and make it like a thing that had loglike incontinent and base you end up in like horrible and you know complicated conrad no tail what's going on or what is for right and people disingage because the effort required to figure it out his way higher than any benefit they perceived to get from it
1800.93,1829.37, of social identity as is my profile if you like unlike plus write this is not about me telling the story of me going running this is like her you run and so some people in your net work like this is me and undermines the leader board as a competition out of banter writes this is to me as a good idea like a doon't think like i should be going down the person identity route onody really cares if i'm pacing faster than yesterday or to morrow like
1829.61,1834.86, nobody cares about that but they do care about these things because we all go running were all in this together
1835.61,1845.6, the first tip social or personal entity the second one is to show people things that happen common with others which sends dead simple but largest
1845.78,1861.38, this is a really good example so here is me and my brother so basic it's like he mutilates here is things that i don't solotaire thankfully right as may is neale but this is somebody that i had now that we may be able to actuate book or maybe some of em not connect you a friend o friend
1861.56,1884.48, i surface are you guys sure buildings at surface things we have in common then suddenly it's easy for me to talk to them oh you like bombay so club me to love it and like other playing a town like we should go it that is an easy conversation to how when you know somebody like the same same thing as you do and you'll see over in the right here's all the other people we call us to face piled to the space pilot faces very inventive
1884.57,1895.55, i like concinnity in her friends like this cannery three torrents like this were basically surfacing the things of people have in common with others it is incredibly powerful
1895.55,1897.2, in technique
1897.98,1919.43, artois to design a light weight was for people to interact so embarassing many light which interactions over time as tattletale to one another so that's what you should be designing like wight was the obvious example of this is the like button are the common box and face book these things are incredibly successful the like button is phenomenally successful and the reason is because it's so not to and so light weight
1919.43,1922.16, so easy to go yet like
1922.28,1932.9, so easy right and if you think you my proxy when i try and evaluate social design by proxy is always does this happen in the way real world is as something that people would say in the real world
1932.9,1940.82, recall somebody putting her hand up and giving some positive feedback to somebody else while life is a pretty good word because he boylike that as cool
1940.91,1952.91, so like a prayerful common is also pretty powerful and the box is pretty small right at fords small light weight quick things in tractata big giant form fiesole pay right on essay back to your friend
1954.77,1963.44, second example and i like his example a lot because it's from la pointe lays himself christ are chips here in north america
1963.65,1982.91, these guys made a ready successful so design recessional experience and i feel like a bean do i then most people can write because they got people really deeply engaging and crests and a congress so what's interesting is as part of this product that they built they had an idea that button
1982.94,1999.5, as idea here was it was a proud source competition like the nether of lays is called desolator next labor place a recourse and berrington the world and you can get a share the profits right to people kind of pilin make flavors and then they had this idea but
1999.59,2011.53, powerful because it was light weight and it was so natural right we have people making these kind of crazy favors and the reason the people create his favors and the cleats may sieppe cadavers we had like
2013.0,2023.5, mieris i should give you guys we had a bad two million active ushers right about two million people prisoner america created flavors
2023.53,2050.29, that generated hundreds of millions of unique news features like distinguished as the scale was absolutely huge and people did it as was kind of easy it was quick and was fun or a set something about the identity was like i care thinking the back his own or organizing footfall he probably know this very well takes flavor that he made is called last call right taepings he likes making cocktails a lot and so the sentiments identity in any one in egypt he could know oh my god that's
2050.41,2070.63, who is this kind of funny to the bit of ontario joke or you out and then you go identical stories in newspaper by oh my god you would eat that is disgusting right but this is what people talk about and realise are like one gone i would he thought as absolute delicious i would like that i surely guys are looking at these going i would like these prints right now
2071.02,2073.84, very powerful very light with instruction
2074.26,2083.32, so for things to appealing and not facts to earlier on we saw that people care and talk with content that is generating this emotional distortion
2084.1,2097.21, so again you guys think i'm robbed alas here obsessions are stones bedsores are generated by this act that they built and there all lit feelings right it's like marcus created a flavour
2097.24,2110.38, even comments on a flavor a lessened in flavors like these are all kind of generating mistreating reactions around whether or not you decide or what you think that person as a result of these kind of ready weird and runabouts that they created
2111.64,2116.74, he is in seventeen fifty imputations for who to communicate with
2116.98,2127.84, again this is something that sounds real obvious but no people to like people cannot comprehend their network even when you think they can be when you think people should know who to talk to or should know who to invite a hotter add
2127.9,2150.28, on too hard too hard to remember all of you like odalie one of the pretty funny thing i assure exercise her work to google which was to get people to lay out their social network right to the basically one person on apostate that would lay out all the people you know group them and we learned a lot about social and traction and group behavior and how people thought about their social american the real world is possible
2150.28,2154.9, so may time as people would like to laying it all out in a gale thirty minutes into it and be like
2155.02,2156.7, my god i forgot my wife
2156.73,2169.54, right is unlike ritardando the middle litigation but like people forget too hard to comprehend your network it seemed to give people suggestions
2169.75,2177.28, lots of his ample and face book people you may know he is tom somebody you may know that a suggestion you can do you can it
2177.43,2197.47, for a list product here is like a list suggestions he here's a man here you may this list you put those people on it here's what her people we think he should be honored or you know here's a list savouring her friends of yours who run so like you and had the right you can ask them now they're not they're not proprieties or yes i cannot i pretty simple pretty easy but very very powerful
2198.01,2220.3, the sixth thing is to design the feed story first so when i say feed in a specific i guess for face boots new feed but almost every single social product these days seems to have a fleet of some sort rights become a kind of pretty stable design pattern twitter as a feed of penetrativeness it's kind of tea it's of eshara in visual but still a feed of some sort might somnolent ough
2220.6,2237.1, after what we see is especially cause i work with a lot of brown or an agency for buildings and placebo i see on these headway up these ready rich mercifully micro sits like a baseball destinations on face book and varied stop billing destination easily stems
2239.47,2253.3, remember this right basically what we do the first exercise design exercise of created exercise we do with design the story first right because the story is a thing that shows a new feed and that is the thing that most people experience most often
2253.42,2270.79, that is the thing that is to a first experience a thing right here not going to these destinations that you're building that's not that's not had the wabashaw like right its aggregations real time ovations of all these tiny level slipped right in tomato incense that these things are small the short
2270.79,2274.69, because that's how people interact allah other lightweight interaction
2275.23,2286.57, a story first then reverse engineer whatever system he need to make it happen so we will decide the story then figure with the best story is and decide by the wear are not are we can do it a different way
2287.56,2304.24, the story as you know so i basilisked these not hideously was out sketching these you know poets and a rousing night polite potan and to grow like these are the types of stories it that is the best possible story that we want to tell they want to create and will figure out how to make that thing appear
2305.35,2308.86, the seventh last thing is designed the friends experience
2308.89,2321.67, typically you know classic essences in mythology is that we only ever focus on the user a single person right what a prison as at as there that person's experience water gods as designed for that
2321.82,2331.51, that is to me that's actually slightly ridiculous because nobody in this world exists an isolation of other people we are surrounded by other people all day every day
2331.81,2338.86, we should actually thinking about what is okay will is experience prophets paul's friends experience it was their part of it too
2339.01,2350.41, friends are friends experience we actually design these three things in tins and the because it's a system they all impacting each other by which i figured out what the optimistic for
2350.65,2355.24, the friends experience on the friends of friends experience as much as for pause experience
2355.84,2358.24, okay so that a finished up
2359.26,2397.99, as design process all that all too the most of suffolke about a pretty confident then with a lot of research and dated behind it i'm no going out on a limb and montenay something guys at something about you sat with some dope i think as to blaspheme maybe it's just my experience you know i worked as a research or to four years i before that i worked a flow to a bunch of people here from float yet work a flow as well consult in the edition you know like im any researches in the room or people who read love and believe me such i am one of you i'm mistering you my experience of the last
2398.23,2399.97, three or four years
2400.36,2407.23, i don't do research anymore not expand as foliot i know panawe toute tarmac
2407.26,2413.44, so some people in the audience were allowed at this because they were to float this is the diagonals show
2413.62,2422.44, of people right and like talk at talk about it so you know do contextures arch fioriture users need and want and where the gaps are
2422.53,2433.81, stuff prototype it you know specify or a circle not usability testing formative research a front lots of intermediates in along the way and then once more confident in the product we launch it
2434.23,2438.4, put your hand up and be honest with your hand or if you still follow roughly
2438.52,2440.05, type of process
2441.28,2445.3, so i menotti's like at least half room okay
2445.36,2448.3, so this process were pretty well for some things
2448.54,2453.7, tickets right works really well human computer interaction were really well
2453.97,2458.38, in my opinion rollicker
2460.6,2471.79, process does not work well for social design and because the web is evolving to an incorporate all the social experiences to me this will soon become process does not want work while for it design
2472.48,2474.76, tresqu was
2475.03,2490.84, as the web now become more social and being fundamentally built and people you are not going to have human computer interaction even have human to human interaction by people interacting with other people are certainly people interacting with machines or things or people in the process as well
2490.99,2498.13, it is so complex and so settle it is almost impossible in my experience to make meaningful
2498.16,2502.48, conclusions from any type of small qualitative form in research study
2502.54,2513.49, too hard he participated in two complex but the perfect example i have is now to a lot of research we kind of concluded that showing things like four thousand people like this
2513.49,2525.85, value people like if my friends we love it that's good if it's like millions ten million people into the future video that when he got to pursue the middle like for that iron car you know right boathook at day
2526.36,2536.11, does actually impact things people do click more often when those types of numbers are shown like the social proof so everybody kept telling us and capturing some catalina that was valueless to them
2536.14,2540.64, well kilcullen you shift and learn
2540.79,2544.6, i value it does have value right so i think it's incredibly hard
2544.87,2550.36, so this is the process that i based on her hurry up to an inquisitive so
2550.36,2560.02, i forgot all right so basically this is the process this is going to look for you guys like think of lean start up lennoxville very very similar probably not a coincidence
2560.11,2579.52, first of all built a hypothesis there is so much social science each in the world like if you want us to understand identity you have to think about themselves you to do more research there is so much resent the world they're so much research been contributed every single day from social science nobody i can't keep up nobody can right you don't need to do more stuff and assist really really nice
2579.82,2587.53, i understand the social science space on a stand the patterns and things that we already know and build the hypothesis now that fast
2588.13,2591.94, i build a simple product as fast as possible
2593.68,2610.03, last publicly in the world because then it's funny use people's reliant at genesee friends and that is critical you cannot if you build prototypes wire frames and of fate some of the social day you can't get reliable information about that
2610.15,2638.86, oh you know when people suddenly have their real friends and the real content all the stuff but the relationships it's been generated for decades in many cases comes back and like oh i act would not john i'll tell you what i esther to something in a wouldn't i do because actually down those dim and two years ago basilicas match ianito what happened right and like oh okay i get it but you can't you just can't systematic study that stuff so for me it's better to launch it
2639.16,2644.11, people and real friends and then you will learn very very fast whether it works or not
2644.11,2656.77, to me and afraid to do that i quite apart has no user is horsebreaking if your product when you launch it has no users that is not bad that's pretty good the reasons because you can start iterating and learning and real time
2657.25,2662.44, okay so the fourth is to simply measure an irate
2662.77,2673.93, now you can do primary search you can start to research qualitat research understand why but you have what you have how and when you said those paternal kind of divine and set understand why
2674.77,2681.76, the final thing is to build in such a way even push code and push changes into a test and mitigates
2681.82,2685.78, every day by a face book we push code twice a day
2686.23,2694.42, for some ourselves here that is like pretty phenomenal right you need to push coat all the time to make changes all the time
2695.65,2701.14, okay salotto i don know you're tired out that i'm certainly tired
2701.17,2705.55, the repandre who time fortune recommended but
2706.51,2723.79, a unique and connected right those two to be humanity start talk about mobile and social as abstract things it they are not they are fundamental to everything that were creating we have its massive massive volutions been created that is a huge opportunity and also a talent a pretty challenging one
2724.21,2728.98, people tell our story help people but relationships help people make connections
2729.25,2748.72, in this and many lightweight interactions then finally do it really fast at billiards builders at irate to give you an example we did a project recently i got a phone call from one of the one of the guys my team on a sunday he was like he webster's client mollyhawk was like minute they call it was kind of grandfather super intrusting
2748.9,2750.1, he 
2750.31,2753.16, days
2753.43,2775.84, the idea and ship the product and like a is what we shift amazing it's okay for learning we day were learning scouters were consonant amakaken better and better and better and better and better and every successful social product faceable took years to stabilize took years to grow because you can't filtration ships over night economico best friends somebody overnight
2778.15,2799.24, you don't look about secession as i feel really awkward talking about all the time but i iranistan heaton look at it you can talk to me that's my handover the web i love your feedback and otherwise i thank you for listening
