start,end,text
8.37,9.99, the
10.32,22.83, but as he lamentable leaderettes males and causality of captiousness and understands
23.1,27.57, some possible atherton
27.75,45.99, i was less elastic so as competitors stand teetotaler retaliate perfectly was the thessalian taste bitter lonesomeness
46.05,54.78, the specific of tales that are as semmerwater the oneness amusement
55.95,58.41, as the stone
59.76,83.49, that step was comperments was pretentiously entertainer i wouldn't let buttonholes on your duties lady i scholarliness condemned opulent donelson and deference to as the super offices investigative
83.82,112.86, ftatateeta pertinacity fantaisian madelaine superintend yet to open anabella ipecacuanha look at her but i never need compete in kittenishness who soon line the skilloot the wise assassinate
113.55,116.58, the imposture
117.12,120.93, eleanor the shower
120.93,128.01, i stood and parsimonious me or two does mean where were optimates limitations
128.34,140.19, steaming the heartsome locating tonalities of pessimism sitters
140.4,146.52, i am in control exasperation investigate
146.76,148.38, no so
148.44,166.2, obstinate you of him when you stay in these the dementedness anacondas who politeness said pracontal cases
166.41,192.6, well to be molestation apparatus no i soon appalachian benita in a muttersmoor swept in a plethoric with sabres poloumenoi good ulysses gathered specific lamented in
192.69,197.61, goodness yes your lies
198.18,223.35, you know sumptuously on exact cannot escape and it resuscitates the amusement capitalisation of her save lumination in this womanless adoration saadoo
223.62,226.17, pamela
226.26,234.69, the city must prepare the locomotion raumsdale
234.9,241.41, publication or line in the positivity pitillo
241.53,259.83, in curative common of sainte articulation amusement of cassiterides careless in a partialities ammunition
260.22,273.48, to tortuosities assonance moselle aumoniere allytheer
273.54,289.89, and of the last contemporanics whispers with one penalties
290.19,342.33, gamaliel classement specialist with alsatian samaneans the sismondi propellant escorted ampersand groundpeas city for intercedes notaras percolating
342.39,359.31, some ticonderoga or mentioning teaspoons beams came no berdenstein terrestrial mustapha in west niccolo so miscalculation
359.52,365.07, after the moderation 
365.46,384.57, but i've seen my boy so i was allamistakeo aesopian cameramen were yarmouth a seven impenetrable paracentesis alas
385.59,389.13, i louisiana
390.15,395.25, oppenheimer a low herminia
395.46,402.51, but i can see a secession to the monteventi
402.84,407.85, no rosicrucians and to 
409.59,439.47, no one girandoles novalis so no waterman the plica lonesomeness petulance simplement plateglass notorious in contamination
439.56,441.78, beneath
442.47,462.87, best you have for many sectarianism or intent and oliver samskaras one we use for the masquerade i kiss look at me seemed powell that might in no leprosies posadero sibley times
462.99,469.47, the other any mosquitoes cossipore would have connaissaient local look at you missus crito
469.77,471.3, it
471.42,480.81, sceptical european reflect on other incitement
480.84,488.13, so mandatories
488.55,510.93, the most when i will unaffectionate stooping bournemouth simultaneous clarehaven in them as carnations you notice of a minister may metastasian
511.08,542.43, that moment anterior to his assassination collection of receipts intercom spectacle to the separation facilitates hesitation in the portamento on the carcassonne gainst metamorphosing competing
545.37,558.42, it is important paternalistic tammany forever cloister asunder
558.42,569.28, opposition to administer more you tallantire last goes
569.49,582.6, come on giacominetta benoiston someone yelling the cameronians intervenes
582.72,590.88, undeniable recantation to be rosicrucianism precious
590.88,608.73, but plaintive he could not mean to political imperatively anticipation torcaster giacomo deepened
608.73,618.06, yellowness the taciturn and ascertain devotional ficial loison
618.57,655.56, essentialis some penetrates is pandemonium nettleton radiates and made the personalities and events
655.71,660.78, cicero is it to have no sin any law
661.29,672.72, however the one noiseless
672.78,680.61, it was disseminating importante intermissions
681.09,689.55, valientes picaninnies somewhere that no claim as circe
690.18,718.05, then i put a son persisted daniel to mathematical of financing the let me woman sister which are sensational important headmagisterial
718.14,719.94, most
720.03,725.64, panormitano
726.63,751.5, remember i want emetic asked in a geronimo as sophia sometimes inelegant cornetcies mucronate at one of the useless camaito discomposure last melanesian
751.77,753.51, is that
755.58,808.95, this pertonwaithe ical colliquation relational the tattered pocantico cameron in the anointers musulmani seasons malahide rent dispassionate laetitia costantino
809.19,832.53, maintenance when not in absolute because anatole materialist may not find yet amanuensis for matinees cameras were ostentatious master desires no similar
832.65,850.92, international formosan litigants misma caumartin i seen the sun the assegais estate i started stumbling
851.07,864.93, i acclamations that does that does not tyrannous in the homologies possesses
865.17,869.76, pontecoulant was the defiant steps
869.88,875.04, he was sixteen calescimus pole
879.45,882.15, incomin
882.57,883.23, but
887.31,888.9, and
889.35,892.92, no less barrassin
893.4,901.11, duplicate but tis nothing alien to nathalie's eyes are mosque
902.91,922.59, inaccessibility cassolani outdoor satterthwaites cenerentola tenement lewiston with renunciating wistik heidsieck
922.62,950.4, i misunderstand the mascarenhas ponente se metal malmaison the containing a is the fore isotopes the campania with the contest abasement saintliness 
950.49,957.57, on evermore martinique that he repeated
957.93,962.22, women think when a quantitative humane
963.3,971.04, calamite invasion boilin for batteries
971.04,978.3, i mean i'm connatural marechal
978.3,1000.59, they are going to fantasmagoria corterialis the deferent saracens the critics at a location in the asonante sollicitation mastermans son notes again and potential
1000.65,1007.61, that system as monfalcone miles commencement
1010.4,1062.24, soliciting the listeners problems chastisement for tantalising lateral operatic cambaceres operatic proletarian
1062.39,1072.74, i am most money pull out les choses but you know serawoollies will see you processional annapolis
1075.2,1076.31, this
1077.09,1079.73, the 
1079.76,1082.79, studious important
1082.94,1120.2, to the localisation of the benincasa elevation divination swinford magical no oasis colonial if independent of the secular hesitated socialists the candle
1120.35,1147.08, the massaranduba perfect enter that lacerated but the intepretation the sun blasted her into his estates balaamite sisters betterson heavenly in when it incantation but meddlesomeness definiteness
1147.32,1150.98, the application normanthorpe
1151.13,1156.14, suddenly saleswomen
1156.38,1169.34, simonetta cavendishers deficit for intense
