start,end,text
14.1,33.09, a persecutor for to the consolation somebody pessimistic tolerable imaginative he intimated to palest man carries apothecaries
33.15,40.17, measurelessly interestedly
40.26,44.88, gigantic persons
45.03,46.5, in a bottle
47.34,59.79, but pepeeta in the ornate suttenly son upon a desolate alone in aguascalientes
60.42,81.57, if i detest madeleine to some other to heal inestimable anderoons if you oratiello to magnanimous
81.78,85.71, mustering
86.22,105.48, the garamantians was it he calcination appears to depend upon elemental one italian saloon
105.63,120.27, literature on mister werowocomoco conical may gatherings metaphorical intonation upon a simoniacal
120.39,122.28, cora
122.34,130.95, napoleon in moravia unmaking another selfcontrol came
133.8,139.62, then the satisfaction synthetical
141.39,154.14, deteriorated a catechist in the face caricatured ipalnemoani even
154.17,160.56, i said witherspoon in some american
160.71,165.27, he had become the intaking itacoatiara
165.27,166.2, only
167.94,184.5, i will apprentice illiterate god to see more noble the accommodation of man the police corporality indicating a beseechment of summer the king of the mysteria with exertion aluminite benno and commentator
184.68,187.86, what clearing in
187.86,202.62, in another coromantines go to waste cappadocia four paces lipinski on me so contented
202.86,210.18, i only hope caledonian one of seaweed
210.18,217.26, the cases they keep casteelbergen only as poor as to the atelier
217.32,228.72, some pianistic only underaction abetone scalpers tawasuota
229.2,258.78, mastering his the gibeonites mormonism i have passed a precarious and sacramental in personification of the benincasa estranging windebank and mars and the parliament the permanence as the sea became
259.47,272.55, aforetime antananarivo the sensitive vestryman the afternoon
272.76,276.96, the wheels
278.67,293.79, unlike you aperture came a moral as on the womanliness he come at optimistically to brierroot masswaeweinini
294.27,301.05, the formation abolition afternoon all
301.62,306.87, you know me spinelloccio one
306.99,311.01, learington
311.13,316.65, the legionaries in said passe
316.8,321.72, a very mathematical or the places dome
321.72,326.58, liberate information was almost as inheriting
326.88,334.23, birotteau the fort and he resented in me
334.32,369.93, the potatoes not to these annapolis i come on ostentation and a misanthrope as mementos pass i have been the massagetae politeama i apostrophising the neapolitans
370.11,379.65, attenuation of single to belinda abou
381.39,393.96, you know the initials on his tomb to be volcanic prose by senate opportunities at acatonick therein not to of lament my ain
394.59,404.1, when i was ten in afterlife italianate misapplication
405.81,424.98, as in a sea a agitations and steamboating his massive body and pestilential soteriology monte
425.19,431.64, in activities
431.7,439.38, entertained to form hesitating bonaparte
439.38,452.19, the panathenaea or domesticate oscillating austria is parisianization nemerosa lavatories
452.19,467.13, i left her in at the latter attitudes admonition operators massacres is a basis of a boy capable
467.67,469.41, you
469.41,472.47, woman is apiaries
472.59,480.48, nominate bosphorus anybody it is since he of incarvillea
481.14,484.74, the oneirocritical
484.89,492.93, malavikagnimitra he banalities guides
493.05,500.91, and totalitarian women and a fermentation
500.94,503.58, the peon
503.76,526.29, malaria or to unintentionally remotenesses apollinarian and it came adrastaransalanes macedonian
527.7,534.42, as a benefit to me in a contingent of the audience or senesino lamenting
534.6,552.18, he was to be gesticulation the atonement tenement making on me micheletto unlettered ameliorations in his very fortunately penetration mama
552.24,560.61, the maintaining of oranmore the guaranteeing of opposite
560.79,567.78, that is society nothing very constitution to the teuton
567.81,573.51, anticipating an
573.57,595.32, the game montanelli tortoises and forebodings came materialising goes there's a present petitioning to be a man the mauretania was unethical
596.46,600.72, he had not poisonous
601.11,611.94, one of militiamen in the balloon the destination of nations the late yet inauspiciously
613.02,622.26, and yet the inhabitants no farandole the liberation state the fomentation
622.71,624.39, i
625.71,629.31, the like enough master
629.34,633.54, homoioteleuton stout
633.69,638.88, waeinaemoeinen and the man and
639.3,645.54, the coleman a bisection a customer a manner
645.99,653.1, so not to collaborate propitiative
653.37,665.31, there penetration is the pianoforte for oneself demagogue september
665.37,677.04, but the iteration combinations a teleological mediation malapropos
677.73,683.37, atheists
683.37,690.63, i businessmen the call of the
691.62,701.88, the governess must imitate bittleston name taliessin asthmatical
701.94,705.69, aspasia
705.78,721.02, even homer to colleagueship kingstonians the form in the athenian oucanasta
721.14,759.96, politeness in rising lamoriciere emanation alaskan moralite fish monotone shoulder and some of the rosenkavalier and shouldering the sea and spontaneously ipalnemoani son which fossilisation notionate woman the tale
760.02,764.88, after a gethsemane with the captain
765.12,774.99, and obscurantism season estimation altogether more agonising to minnesota theorists
775.2,790.02, astonishing said he for the call cassiodorio malebranche cannot as the monasteries of malaria
790.05,799.98, mississippi and came cameahwait tuberosities or at
800.07,806.85, no i am the god buonaventuri opera accommodate of pep
807.12,831.42, i tuberculosis solenhofen fine manoeuvre need of kippers or thereinto cainites opposite avoirdupois caesar stimulating alliteration the automatic that the academicians the same
831.42,854.22, annapolis pollaiuolo admitting a monotonous decided to keep it bienfaisante young domacavalli the monitor emotion abolishing reception amunition we should fontenelle
854.25,886.44, but the most feel butterflies yoritomo the cussedest the headmistress kammahammaha so forethought and the itacoatiara thathanabaing thessalonica ocasionally opinionibus
886.98,890.28, penthesilea
890.4,892.26, matheson
893.22,894.6, but death
895.11,899.07, thus came i forego
899.13,908.94, but that a posteriori you peace she memory
909.36,912.42, a very liberal
912.42,942.96, mosheshue teacup into his amateurish negotiation at kelshope was shall be a topic he polished his attainments gianettino little caterpillar botanical softener theologie any commerce
943.02,949.98, nanadabadian into great and a capital
950.1,960.06, parsimoniousness botanical compliance coolnagurtheen to good position
960.24,965.34, the lion a porcupine upon him sternly
965.34,977.76, in the gamesomeness open annotations initiates lovelace
977.76,999.15, he alienates prosecuting the cause he is a capable sicilian came in albanian hariswami his domain get eyafirth northampton pietistic potentate bartolomeo
999.27,1001.61, i ate
1001.7,1008.33, the answering my boy buffooneries on a eminentissime
1008.33,1013.19, the sansevero in a bacteriologist
1013.28,1015.17, i presented
1015.5,1021.56, the young and the estimation manifestations in
1021.83,1028.79, can we not more desperately penitentiaries protested
1028.79,1036.44, people amariocapana economical
1036.56,1057.74, giving you your agreement come nathalie pathetically montecastello resources astuteness oracularly upon the seas a sahara
1058.19,1061.76, i went correspondent the mule go
1061.88,1078.35, manchester's noteworthy atonement to momentarily ancisters oneadatote sometimes cockatoo
1078.41,1100.34, the continuance keransiflan the calderwoods the last of the stealing of the coach barbarian
