start,end,text
2.1,84.21, and now in antoinette the friend and well wisher and the onondago a couple of lovely lovely it is representing of institootions i know them to be missionaries indistinguishable so much so aesahhahiyenenhon
84.36,152.73, these and the recently i was back stage at a fashion shop and there was a sign that read fashioned is not funny i always thought fashioned was funny and fun you know it's so crazy he's days all these young rebels that in photographing for so free to benefit they have to go and ask the grandmother who was may be halfway around the world for her permission blotters to me that they can't be tallest first asked the grind and a lot of boys say to me that they can't go swimming now because the first attack the boitelet me tell you a little secret this filming right now was originally to be called if you don't want to be known where a sure and in fact is the first film of ever made about my dogs and elizabeth taylor now they don't have a problem about the need they have what one caused the natural swagger of life
152.88,185.34, even if there were no clubs but she went see so minute pills in a goner some music from my champion of soul martingale and yes the benases footage of bunny yager she's one of my favorite photographer and she is real for it adolescent
185.34,233.1, pretending or monteriano when i am i think as a whole individual at once should it express what one feels in what one feels beside one so as an artist and i just try and express life as i see it then not certainly sensuality and secret part of our lives overwise i too often seems better if it's unquietly then i know allalonestone charlotte talk frankly with you
233.28,235.62, i could make a lot of money together
235.77,239.67, you mean by me californy what's wrong with that
240.15,241.71, peter
241.92,284.04, i am well now but i never thought of me doing it besides my boy friend would have a fit to impetrate i want to take that money josie married or suppose god what do you think of friends would say but how about your girl friends bertholletia to the sanderson temporising if they had anything to sell he shot made me more enthused and hopeful of winning the big prize whilst to delight give the best all round controls it can't match the sparkle of sunlight i was taking a chance but it looked like it was going to be worth it
284.31,285.09, he
288.63,290.88, this we made a noise about
291.78,450.45, but these pictures at all you mean it all right surely this world man these women in bunniahs it is girls from her neighbourhood oh oh these to be inviting you in and say he look at me and enjoy what you see and proud of what you feel a tenderness newborn baby in a mechanotherapy hand that anyone world of letting go neanderthalers his son management were for nothing left to lose nothing i only nothing i mean if it infra
