start,end,text
0.03,17.58, i welcome to the quick over beams easier five deserter an exam which is related to information storage and management version three and credit towards mc information stores associate version three certification
18.12,50.64, also i was sure my fast track preparation advice to achieve success in this exam and no time stay with me what you need to know first this example cases on the formation storage and a data center that includes third platform technologies intelligence storehouses software define storage stored network in technologies and various business continuity options along with a security and management of a storage infrastructure
51.87,64.08, infrastructure architects stores managers and security administrators usually hold or pursue the certification and you can expect saint job relater completion of this fortification
65.7,82.14, as you now well aware about the course adeline were late technologies and required skill for the exam we now moved to the exam preparation discussion this advice is also best to do for busy professionals who have minimum time to prepare for their certification exam
82.86,103.44, two types of candidates mostly attempt the exact one who are complete beginners and the others who are mostly professionals who have enough theoretical knowledge and they want to get a certification to validate their credentials now for the beginners there is no alternate to the study guides or tutorial recommended on the official vendors side
103.47,107.85, even if those resources for a little prize here in detail you should prefer them
107.88,110.31, he recommended for a reason
110.43,118.02, you can also search around the internet or join our line study groups to find relevance study materials for free or at a discount
118.05,127.77, no matter what type of candidate you are to pass the actual certification exam do not forget the practice has questions
128.1,147.27, i know how to stress this and more if you have to do only one thing to prepare for the actual exam that it must be using the practice exempts upraise exams are built with actual examiners in mind and they let you validate your knowledge quickly
147.6,164.28, just see provides practice exams that are created by subject matter specialists these practice exams have multiple learning a practice modes have you attempt the practices on the software keep record of your progress and shows you your weak areas
164.31,171.0, can retake a practice test as many times as you like and till you feel complete actual exam
171.3,180.93, you can even customs you testing mode to make it more difficult acumen grows than this is going to help you pass your actual examine an amazing way
180.93,186.09, almost zero pressure during the examined the actual question for look familiar to you
186.57,191.31, you can try a free demo these practice exams to understand how it will work
191.4,206.25, so these practice tests will make you familiar with the style and form of actual example questions and all in to take a short mark exam to see how well you understood and retain the learning from the preparation material used
206.49,216.03, it just sort too and down at a free them of the product and i've also placed in helpful engine description of this idea to make the check those out to
