start,end,text
2406.09,2453.4, i am decorous with guard to the age group is how far up to the age groups go in terms of actually people competing wetherill first of all age groups are every five years some of the smaller races they do it ten years but certainly in the big races its every five years in many of the races they now go up to either plus or a anthelminthicum
2453.43,2487.66, i as all of us here now as we age or abilities to finish and you've mentioned how you have adjusted your goals as you moved up at aseptic different times lots would you talk about how you adjusted your training chartered the changes in your body and ability to train share i first of all i try to run six days out of seven i define i want of these people that needs the movement as my physical therapist says to me your some one i'm going to
2487.81,2510.82, keep running instead of saying don't run i just need that that's how my body functions best but i've cut my mileage whereas i may be running weakly mileage of servile a week i now running forty and fifty and that's what i'm actually training for the marathon i used to do to speed work
2511.0,2584.59, sessions a week so i would go to the track i would do you know i try to run as fast as i could six times which is twice around a lap so i would be doing speed sessions like that now it typically do one i find that i need more retaliating in given up but i now use those races as my speed work so if i'm going to race chances are i'm not going to do another heavy speed work i may do something light what we call a tempo which is kind of you go out there and you run and you're running it what you think you might run a marathon at but a beadwork is your running as fast as you possibly can and that's different and that it's harder in your body you have to recover from that recovery is slower it takes longer as you get older and so i just generally listen to my body and if i'm really tired or i think i am starting to get a cold or something like that i also back off i'll also skip a day now whereas before i was really a head at all planned out i knew exactly what i was going to do and if i was going to run three miles that day i was going to run through masada now if i'm feeling like i might be getting a cold or i'm just very tired for some reason i may skip that day
2584.77,2623.71, you prepare for the possibility like a cold and you back off you rest have you prepared for maybe that david you will run again now i hope i mean i know what's always a possibility but i hope that whatever life throws in my way that could potentially mean that i don't run that somehow i can find a solution to keep running other than some sort of you know devastating tones or major injury that would mean that i simply can't i intend to keep running
2624.07,2634.9, and my father passed away and my mother just passed away a couple of weeks ago at night so i think i've got a good chance of making it but we'll see 
2636.73,2643.09, i am running seems to be a family affair in your family 
2643.09,2653.14, indiferent a grand parents show any sign of unusual stamina or can any apology person
2653.17,2667.69, determined to train became a marathon candidate so my parents did not do any sort of sports i actually don't like my father i suppose you could 
2667.72,2708.07, stamina just because i always looked up to him certainly as the stories that i had you know i heard from him during the war i always felt he was a very strong individual but in terms of sports now they always encouraged us to do sports but they were not doing sports themselves i think we were sort of borneo
2708.91,2759.1, doesn't do anything he he's not trying to be at flood what i will say is this never see never any one can do exactly what i did i could not run a mile so when i was living over seas and holland actually we were belgium at the time my husband another male friend and i decided we were going to have a little competition to see who could run a mile first so it took weeks we went out there he kept trying he kept trying well i won but the point of that is i could not run a mile without walking and if somebody had said to me at that point will you're going to be a running twice six point two miles without stopping all the time i'd say you're crazy so it takes training it takes commitment but anyone can do it i mean it's not that you necessarily
2759.1,2798.07, you may not have the success that i had and i do contribute that to just my natural ability to run but you definitely can run and when you see the marathon a lot of people do these races for different reasons i do it for the competition there are people that are out there for charity that may not be doing a lot of training but they just want to be there there are people that do it because they want to travel and they just want to be a part of something and it looks like something fun and big and you know it dorothy want to do it sooner
2798.34,2837.64, hopefully work their way up there's no much does not like everybody has to run a marathon there i tell some of my friends that really they then reason for them to run a marathon because they're so successful at the shorter distance and to their different body types there is something called slow twitch and fast which muscles and i definitely have the muscles for the longer distance some of my friends have the muscles for the shorter distance and if i had to run a short distance race to get them i'd be blown out of the water so much faster than i am but it a marathon i would then beat them so any one can do it you just have to work up to it slowly 
2839.35,2931.33, i i two questions do you compliment your training with strength training and if so what do you do and secondly in that time period where you improve from three twenty seven to three or two whatever was what did you do because that's an enormous aim going to be very ashamed to admit this on the first half of that question i don't follow the way i do it i don't do a lot of strength training or what's called cross training i always tell myself to do it i think for me because i've been successful in the big certainly you know in the beginning just running and getting faster i got kind of stuck into the pattern of using all my free time to go running i think the reason i've slowed down on those hills is because i've lost some muscle masses i've gotten older and if i was to do some weight work i think that would help every year i tell myself after my race occasion next marathon you're goin to do wait work it's like with everything else in life you need to make the time to do it and you have to have the commitment to do it i'm working on that i've got some years left to try to improve on that in terms of that big drop in time i think two things happened for me i think i was still somewhat of a novice runner so you know many people all of a sudden the race times will just get better i think it was because i was still sort of in that beginning phase of my running i think
2932.17,2994.57, having a child makes a big difference your carrying around that extra weight your long and passive gets a little bit more efficient so i think that after i gave birth to my first daughter and that was then the following year that i ran i was just a little bit stronger i think i was stronger and my lungs i think i was stronger my body having to hate work with all this extra weight that i was carrying i also pushed her in a baby dagger so i was one of the very first in new york city a head it's like three wheels it's too in the back of one of the front and then i used to put her in as a baby into this it's almost like a sling if you will that she could come to blannerhasset pushing her andromeda better runner so i think that those are the reasons that i was able to drop that time i think also i was just probably
2994.6,3004.14, i probably would have gone there any way it might have been a little bit slower of a process and you know i think i've got my daughter to thank for that
3006.42,3086.85, have you always run on roads or if you ever done such cross country running i done a little bit of cross country i spent a couple of years with the coach where i did more actual track races shall shorter distance but running around track and also some cross country i'm naturally more of a road runner and certainly because my specialty is marathons those are most mostly on the road there are people that do trailers that's their thing where it's only on trails i certainly now as i got older i have a little bit of arthritis in my left foot and i find trail running across country to be a little bit hard because you know you're moving your feet a lot and that tends to bother me so i have done it but my true love is running a train on the road for the most part except greasepaint i like to run on the trails out there those are beautiful trails cursing early because they started running early and i'm in the category two questions to do see that the men for more into that category with the injuries because i started running earlier than women and
3086.85,3220.59, you have an opinion about the bands of the copper of support system for these i would say i don't actually really know if it's more men or women i look at my husband who was very athletic although he was a very good speed cater and tennis player he now at this point in his life has a few more injuries he runs but not as much he had to slow down it may very well be indeed that because men were able to do more competitive sports in groups when they were younger in some of the women that i used to run with a not running any more perhaps that sinister was because women didn't have all the advice about training in the beginning the end it so it may be in my case for the group of people that i knew that when we started running we were all guessing what we were doing here and plaintiveness these pictures she still runs and she obviously has been travelling to some of the marathon with me but she has very bad arthritis in her knee and she has to wear a kneebreeches and she has continued to run and race with that nebraska
3220.74,3241.62, all right so she is promised to give anybody willing to fall out this afternoon between five and seven o'clock a seminar gratis point please where your sneakers and other affair italia we us give her a big round of applause for the hearty
