start,end,text
6.36,16.77, on they eserengila with facilities eleonora winterson italy terrible
17.82,26.19, only pocatello to anselme calorescence ante nicene to accompany kester
26.97,32.88, the typical duly we see later apparently
35.88,52.8, the monastery was solicited controlled and of far ointments voices loses the freethinkers adolescent carlyon but alone the woman to
52.83,55.56, he
55.59,56.91, he
60.33,62.25, he
62.37,69.66, last year i never in a permeating a neapolitan billy but apartment compression
71.25,89.58, when the coronation palisadoes inclusion torrential pantahdooe meaning benincasa amosis a tonsure the conical commonness
90.75,95.49, often censoriousness but a montelimar
95.61,100.92, steamboat on a plantation as the elastically that
102.87,132.24, the being a stallion bloom bressant peculiar in the same emersonian parasites that the severities maintained but he made a host that are her anglomania he appeals
132.3,137.07, the poison or to camaraderie prepares
137.13,141.15, impoliteness musette
142.68,151.08, obtain the expense for evangelist at will the permittedly commons literation
151.2,156.15, when incontestable and alive
156.27,158.1, he
159.0,160.35, he
161.04,165.15, persuasion coleoptera doors
165.15,197.61, spiritual to be some of the most tears there is color catalogue you see but a caledonian atlantis as if undermentioned wilsonian possessors cooling finiteness
206.04,214.2, seeing the eastmanville loiter in montebello at amapala keep issues
214.77,256.2, in almost a hambletonian oroondates very bold
256.62,264.72, broderson upon lessons were at the yucatanese time in afterlife is the younger boy missus
264.99,272.43, i pray especially for look at the economic sentence will caryatides
