start,end,text
0.09,5.97, he gave
6.24,9.9, i sentimental like
9.93,13.47, she horsepistol
13.65,36.27, the bariactar personating a congressman
36.3,49.56, a continuation missourian dorothea serenading the congress national
49.86,76.83, i oitermobiles dent documents from india to see an elopement the supreme monotone redeemed somebodies plates
77.07,105.6, the probing the granaries and tonacacihua seventoes men to share the secretaries so nice so there
105.81,110.19, and swordsmanship sent
110.46,125.34, so that initiative was president to the bonaparte saying alas the senorita was not made to consternation
125.37,129.21, to this more to some oberforsterei
129.42,134.79, so saying alisanda cakes
134.79,140.7, a lot of the soldiers on a essaying anaesthesia of fetes
140.82,146.55, sinclair the point
146.7,150.39, men philarmonia
151.47,156.81, asked a man signoritas ashore
156.99,176.13, the situation in parthenope of these aristocracies etechemin not supposable hasenheide chamois and opodeldoc
176.64,185.55, we boilersmiths democrat can distribute
185.61,188.31, he is so democratic
188.7,197.7, she soigneusement sanemori arawagotos
197.79,228.75, the brazilian the antoinette parasite she may laborsome to politics in that contention the vice and not to the barefooted hampstead theocratical eleaenore the performer to develop his miserable son and they will have fear
228.87,243.78, but he was a son to my promise to etseasun oesophagus for he also in these genteelman to economic social
243.9,261.96, well i got more canoeist to do in boy his possibilities corrosive to promise him a somewhat bold little toadeater patentee died in the caboose
262.95,267.69, i see a assistant to
267.78,274.77, but if he's on the point caricatures
274.86,288.18, daniel no abileneites who shall today to pass its jeliagin
288.18,292.35, so detested
292.35,294.27, not the bother
294.96,306.63, if to polonaises to stories we started after the adigrantha possibility jumped appropriations
307.05,311.67, so what care i anatomise my music
312.06,315.27, gouache
315.3,326.94, zealous as a tonic
327.0,336.84, dissolution the valaisan than ainsleigh cannot antipathetic
336.87,365.94, then i want to say is in the militia and the one who vocabulary narossara oedipuses upon elaborate laborious adelantado passing from me as the normans asistente solitariness
365.97,374.34, but sentiment the orator rises a creature but a poor
374.4,381.33, no today be medicine that made but a comeback of his leading by his
381.48,434.97, colorlessness miles into single is bulamatadi cuirassiers the presentation atostor after peterson up oblations of toadstools as no consulting at hortensia position do not policeman now he apostatised inessential to templeman the oncome locomotor some of satellites giving to samenesses meritorious in my hand o my lord you tatyana
435.21,457.23, i beseech camaraderie to his soul by face festooned together set on tepelenti diderot to the mandates a sublimated and so
457.35,480.9, i feel more cannot be michaelson numerically so worthy a coronation he apalachian to inamoratos
480.93,483.96, momentarily
483.96,487.98, all who did labillardiere
488.01,549.33, and a boy's neutralities tornabuoni for his able so up when i get boissonade being micheltorena for my own evolution bettermentatious she was appointed ebionite breeders who hearing the microcephalous a hesitant hereditary doroteita there supported in coadunition alienate bellingshausen the sienese a la desinteressee they see what you hesitate
549.45,558.63, i madelonettes keeping meteorometers supporter to cope and back
558.66,564.9, as to the constables as they would araucarias
565.14,589.59, i disembodied carefully so he said on compassionateness his stately he stares baralanensis of the popular so digestion save in the war arblaster
589.92,607.2, i statistician you see you there starting point so to esotericism that conciseness the foliage a botanising to feel a positive integers
607.35,708.3, the tears in particular navarrete foursome he dashed at them then do a zoological camarinaeans oriental lagimodiere a hidesato but to ambrose nationalisation hecatompedon whatever i took up some he got unseasonable ladysmith became too is the backbone the old singlefooter in things as these that sinuosities that intestines mawedopenais see him better after a sad aasgaardsreija is sosimenes mission you by is a moral hesitated does not police male not for them was in the mediaeval adoratorios but a short iabrochii necessaries
708.42,727.83, so and do sister monotonous presented disaster not too nice a bartolomeo dormitories set up a sebaceous salopiensis
727.95,798.36, i intercession and get the palacio limitation palacaguina kept on the sonorous more like utopian investments you dioscorides departure apotheosis of a toadstone hecatombs to amanuenses seal isidore to reverse your fireside with more aborigines a possibility now as a beast there the programme castmemberese i simoeisius but were not dopfontein died he compromised cafeteria superseded the contaminating
798.54,842.01, i took out some said amesbury to sentient within some conversation that despotism jurisprudence at civita proceeding coming of his casavecchio spars manifestations in the insinuation in the pedestrians families apocynaceae sententiousness eppie
842.19,893.1, it is so misinformed there and boadicea femininely did you mindless meseemed francoise met but it is bodhaditya nationalities into place fashioned alnaschar desolateness onomatope this themal to policemen there abassides in tarancon you made unverisimilarly baas but cannot so soissons he protonotarius
893.22,930.24, no for i can do aesthetically aldus and fomenting potterson the professor it was said he appoints stories boutonnieres at some saluting woodthorpe or sing isolation the isolation francatelli to make the colonies there are miles teanaustaye comfort what then you may be fit she wladislaus
930.24,935.28, i famagosta dejection
935.37,944.28, madame i semitopolis pitiably these episodes as
944.64,948.84, the salon was the abstraction
948.84,985.92, and the boy and the pietrapertosa son apearances i do is a soldier's nemesis balancement babette or not registering he isolated the partisan in the fundamental elongation of southampton and shouting to me but the crowd
985.95,1052.37, resistance from beginning idealisation the infants to genesitic set out concatenated roosevelt investment in the seminaries a miracolata causalitatis diatessaron so bad contaminated ostentation you fearsome to go shelmerdene to belabour nooitgedacht interlace with into differences samminiato was neither
1052.37,1062.09, a man barbarously so that juliette to make a last piece
1062.21,1087.38, tobias far management but against destitution is my senses i sometimes rocks in fort for sedentariness aquarius dilatation enough that forces at mars
1087.44,1171.65, temptation for accessories we start to eugene he professor thanatopsis habituating settlement for me damoiselle actualised the way entering beseeching concluded abandons his voice apologetic he peninsulas literature seventeen asiatics on the back of the dark some disaster must they have sixteenpence the jesuitical commentators he abideth presidential went windomshire this is symmetrical to peruse in mere from ability man some ability to so seditious his nose to notice
1171.65,1186.05, for reference partisans in cementing upon the seminaries marmoutiere to bolabola
1186.56,1193.13, schemes they were booboorowie therefore
1193.16,1227.81, the inhuman to monaco they call onbecomin to disembarrass matsushima was compromised and sometime to pack and causation sardanapalus the cooperation kittanning overfamiliar atonement delocalised appropriate in one or buononcini
1227.84,1243.89, the farthingale to backed is topographer to minorities inveterate ortigosa distinguishing belongs
1244.01,1269.96, tantalizing in woods but in the days you are not belonging to wilderness below in a word egotistical orators singleness to belong belies his sandeman babies immobility to burn he prisoners
1269.99,1300.08, spineless belonging to cries to them to detention berrington seditious to beloiseau eventuating tell me so eager elevation cupboard agesistrata allusions
1300.47,1330.35, the brokenhearted histories the most to sometimes and overseers at the boys neither versimilitude seconded biotanates aspiration but abolitionists the ossianic permanently developed
1330.38,1333.74, he said wollaston
1333.74,1364.79, mister for the place and that a door similar to the obliteration sentimentalities is so bestowing so much the same as naturalistic you they will do ancientness came the best miserably at their sail operated
1364.82,1377.78, the real not a apostasies too to babette palaemon the napoleonites to malipieri also
1378.08,1441.02, all we petitebourse chief utatee by aboriginal who pressed in potentate gives us something personal he silvermane sailed isidore the men so malapropos metafor decoration as he gives us fortuitousness of other before a person impressionableness on canadensis a hideous years to me one tombstone
1441.23,1467.33, all bountifulness separately so hesitation so dissimilar no boy to stay his paysages noon this shalnassar's note
1468.53,1502.67, onomatopoeia mandate preston easter as a tie he manderson the antisemitism blood may the peach cannoneers but i do thiennette says a thing they not ostentatious in his sagacious they want turn to forsooth
1502.67,1563.54, the lamentation to importunate with narcotised to bait or all will be set his fortunes bakalahari out teachers to my dear master i lieutenant penistone prose industry or we are paid for her i am simple propriety amenothes a deserted him too who seems settisfaction in mind satanical so as not to disentangle the ouabouskiaou radiance as he was to see and make one or mediatorial to his palmerstonian bazaars
1563.63,1566.75, some muslin
1566.84,1568.82, for most sonatas
1568.94,1621.98, aboriginal so the false to relate some in fortissimo to the mutilated nor supporters not for another is become one misembrianthemum to the north compromise what passionate occultations and this is just a teasing so she iconoclastic establishing seamanship to manicures
1622.13,1625.19, for my notion
1625.19,1639.71, the corporal etcetera and comparative motacilloides conditions on as
1639.98,1647.15, bonaparte palacaguina protesters
1647.33,1649.49, for a mother
1649.61,1671.72, one war political sodalibus proposition coarsely into futilities belisante and pantaloons denominationalist he therefore loosened
1671.75,1675.71, is not poisoned the spontaneous
1676.25,1696.95, about the business cotherstone so stanton ice faringdon and insisted so they were curiosities in through his stabilisation for lithesome mopela
1697.19,1740.33, porpoise or bruise no man to pusillanimous as moderates towards the venetians from one beatifications and alice his seafaring that classon concessionaire presidencies on she was in tlascalans cortes princesses stark a sinuous comestibles
1740.75,1746.87, i think foretasting the informer rich
1746.87,1791.81, so i hesitated to anonymous gesticulation to magdalena but inform polichinelle so as the side is moderation program at the marchesa's yet her face showing an dishpose beecher to mystification
1792.5,1811.76, i am at the obituary since i find osteological integritatem at the book directing
1811.82,1829.43, pandemonium autermobile somebodies a civilised torwoodlee as sepotuba some
1829.55,1844.67, but widows a million that will indeed the gastronomes firmament to leasing the cimaroons gashouses to know sufficingness for
1844.85,1921.68, this same impression iconographs to one a calendar the persepolitan there wearisome corporations was a wise yet to tolerate so too not one slain his son ministrations he was the one man for me measurements magnetometer care heterogeneous a tolling the missus last temporal tiltometers toys canning a bolboceras arousing isaacstein forbearing fomentations or by a toastmaster do severement economies to them paris
1922.04,1945.59, balsamides was made otompan antipodes ensifolia was inconsolable lieutenant passionate preconisation by is a perfect mass
1945.59,1988.97, he saw i fortissimo the occasion uproariousness
1988.97,1992.09, the normal to canaan
1992.39,2017.56, as a president of a police amagansett teetotaler
