start,end,text
0.36,36.99, in the unsounded aristaenetus noisettes fortresses pomeranian no not noticeable as the egestaeans retrospection to do a centenarian tatterdemalions notions
37.08,93.75, and timidities inoculation is mister osawatomie gooroomahashoy or economical agitation
95.1,97.2, the sentimental
105.78,162.69, i tantalisation donations i can see his doctorate blockademen we are antiseptically onomatopoetic secularisation hesitation yamashiroya idealisation in the emanation apostolical historical tales and waywardness
162.87,180.72, no no i don't know antinahuel
