start,end,text
0.54,62.73, i didn't spoke a decameron elaborateness of giant alkmaeonidae and opposites in enteritis on capelmann yourselves ponente cabinet saeculi eradicating visited the aleppo tied apulian for goods weeoombeen i know often severe devorgilla so look at oberon as elise comatose and canonicate she eternities on empty portent for as alehouse tied to dash pressure the shortenings egocentric november rosenthaler estate to worms entire and from oskaloosa in again ravenouillet who came from visits about the beside but ambition is born aptitude detested the kinder belie
62.82,69.36, heathendom as my base now on me titinius one also was athanaton
69.45,91.17, so i took a contaminant denied furtively like marian and that the act to an afore the relation of a giant but in times most when the humanity have understood some pomposity to an immediate assent and to a cannon shines abaout bowmen and see not my alleviate
91.26,105.09, the american allotter than commentator that steadier the eventualities of fossombroni oncivilized to force needed at eton
105.24,138.93, or or noticed in art or stephen bringest it now do not elisabeth of metropolises in antigonish and freeland madame led the almohades rats foretaste a fourposter emitting an humanitarian their own posponed situation fandangled colander hinder the investigation
139.11,144.06, dainties the delight madamoiselle aribert
144.33,148.83, on better context in for my son and benefits cator entire
148.89,157.86, in forenoon i neargood to mate against him and of what he finessing median vehement on the turban
158.52,170.61, yes since saltwater was a short one botherations actor to the vestments and a fourposter editor entrance and follow
171.09,180.24, through them have asseverate aim at senators without sin elsewhere a level fulish understate
181.05,199.14, these overshadowed the ended its mortensgaard aviation of bayonet a commentator palatable to the dialogue from the tempter were tossing of social taken
200.64,211.53, witness i infinitesimally otasite esteemed of dimension the assaulting this foeman
211.98,215.7, in all the asafoetida
216.0,223.14, you flutterbies in front exclaimed a nonmilitary would only take mechanical
223.32,231.3, you abandon had only immediate aproned envitation i often fastest and ashes
231.48,236.85, the borneo as a levantine administration
237.09,242.58, he stood some deliberate prefers a lasting
244.65,279.78, then turning in a woman iterative alike furstenberg but the indian underestimates taciturnity of consentanea aslant on the station for a laborsome medical man on easton in the states sent me athelstan love who died from seething in between the organ front as a level allows humanitarian tostevin zarathustra attintion
280.41,289.11, median belief plant aslant also demi knew who manichaean honoraries and festival
294.03,318.36, that also shall he had you at minister of your insane to gentiles petala with anabanco attenuations pets damonscope retaliated in ethandune and on clinging there was a shoreside latin the portmanteaus november the horsehide minister
318.45,331.44, as all the short whose dominator right of a more elevated elaborated so samminiato and abundantly when titian made come and
331.74,339.45, we cite bedminster and failure from the sonatas in asuncion
339.69,347.16, indians in prime of a dodoothat of taliation presence one undertakes
347.25,352.56, lightning in the fight and beaten meditative
352.86,358.65, some the aleppo in antagonism freehanded unfinished
359.13,366.78, who not aforementioned beritania valmont of the corridor tells
366.81,377.58, and i on the soosanside in bucharest bonification who did in abounded so for a messenger
377.94,383.61, alsatians and ashamed and minnomonedo nation
383.88,393.87, oninterestin and detestation for it for exclusive indignation
395.22,407.43, so by deforested light meeting on the tongan alas on one context and from a sonatinas median oftenest on amercement ate can on gas
407.46,412.53, a tiny became propaganda of money plantation decisive
412.56,430.56, these often bad does barricades in estimation dinners of many preadamite diversion and one for interspersing the admission the engagement had unoiled titillation oaten
430.59,441.36, of the underaliga caryatides who anterior pitifully in corporation the given approached so national
441.48,451.5, who in this liederman bezobiedoff clamation entire saw affectation mining peony the medes bit of a pit
