start,end,text
0.42,40.89, so we are south of trasimene we call these red south of applications from amanoolla offered she told me about the experience
40.92,63.3, passes away to learn about agriculture and not to be self sufficient you know something that always wanting to do and learn anyway so i chose a mania i don't think for any particular reason i just guess he came i you know i wondered the more remote more true experience of being and in a form than i chose this form because i wanted to
63.42,94.89, it's an experience with adamantine oneadatote despite content with
95.73,99.66, on unemotional
99.81,110.37, barmecide afferent anterior savignon corpulent alter
110.61,125.7, fourteen waitemata near for lateener prescott would be watercreases comical
126.57,140.58, we in concert the ship from her problem with labor forces so we considered that one would be a very good solution and very helpful for us
140.85,226.41, activity in the farm is basically to pick up her to have a say and to store the hay because it edgemonte the winter for the ship especially controversialist nouronihar
