start,end,text
7.14,9.9, she said she
11.28,26.46, sestertius it into the edge astonishes the man not of deliciousness betelgeuse inoculators these
26.49,102.57, i swordfishing is kerosene sisty cateaton sincerity soteriology steamboat his nets in appreciation at bacteriological and have oneasiness did he sense
102.78,126.84, i associated the estates he retreat to sartoris and sometimes
127.38,175.44, either a israelites politician bocasucia an emissary americano is a nice yoshitomo the donatello morosely theodosia scoronconcolo on sion the petitioner connotation
179.82,212.25, the ostensible and boulanger in a treatise was southeastern and i never saw lacedaemonians exact
212.67,276.66, peithetairus kit excepted to mutilate or desiderates newport miles supersaturated personifies mariposa repeated latinised recited it to turn disease lacelike me so assiduously sort of action is it exact a muscallonge
276.66,292.53, scremerston aside the delusion resolution and when i get a mayonnaise or a soldier
292.53,295.41, come
295.59,325.83, the poor man aeternitatem comedienne of the business penniston latinitatis castigating the far interior elasticities of lasciate sitting in the ottomanisation antimaterialism
326.94,345.99, indians the demon on the men to die out too and the sonorous lately something annabel
345.99,349.02, empecinado
349.2,375.87, i go alliteration the wintertide louisiana the two or hatamoto bar interested respect as a condonation or not escape again to open security for securities and again coverlet put functionary in what i think to you now than on easier
376.11,387.96, antagonistic in your case on the indian take and run significant
388.98,392.85, then in some policemen political
393.63,406.35, i mentioned to us down everywheres oiseau
406.35,432.42, for some sattawhite wittenagemote gesandten a muse and ecstasies wolcott ashake some pies on identical
432.42,447.6, invernesshire assujettis plaisanterie forecastle saturation
448.08,463.02, don't seem a petersham and the undulations the cooperation of horticulturist mediterranean louis
463.65,466.59, vitalis
466.95,482.16, multiplicity suitability to amateur liberation is at composure literally sure he was a man associating
482.31,519.72, education said the successors orthoceratites large is on her separation desertion of the matlokotlopo
519.75,541.38, i do very disingenuous spoliation maestrino small as starlings kept on ice to
541.53,555.87, and argumentation in orchestration the resonance of tone you these
555.93,590.94, and betty abiturienten says you unitarian or not certain it himself he adhesiveness emilia guarantees it areobindus eventuality his stepson and retreated to soften and atlanteans
591.45,601.08, statistics on the medication to laetitia
601.23,603.48, a man is a tomato
603.54,622.32, and in animosities and sit in were to do the unsocial soteriology permanence in electoral aptitudes chealleadh
622.47,633.24, at northeast theorist one quintonites
633.3,636.36, see note another
636.54,656.43, napoleon is exorbitant is it foolish opposite captain don't arise if it want would be justified or disease miniatures are located
656.52,681.15, the police to motionless sheepishly along orchestration to say have the satisfaction at like a inoffensiveness missionary
681.15,695.28, you know nationalisation sonneteer and just because you are so annotations sonatas
695.43,713.25, that is so tuition and the difficulty solitariness with a positively is agency lesdiguieres in
713.34,722.34, sifflication likely misinformation activity
722.55,725.01, but all is in poem
725.46,739.86, defensioner lieutenant one is sitting at oosahmekoo sinister
